reading from file /capture-test-traffic-pod.pcap0, link-type LINUX_SLL2 (Linux cooked v2), snapshot length 262144
Warning: interface names might be incorrect
14:03:56.870324 eth0  In  IP 192.168.147.2.10351 > 192.168.147.4.10351: UDP, length 109
14:03:56.870728 eth0  Out IP 192.168.147.4.10351 > 192.168.147.2.10351: UDP, length 20
14:03:56.944198 test-tra-5e312d P   IP 172.31.130.2 > 8.8.8.8: ICMP echo request, id 11, seq 1, length 64
14:03:56.944390 antrea-gw0 In  IP 172.31.130.2 > 8.8.8.8: ICMP echo request, id 11, seq 1, length 64
14:03:56.944413 eth0  Out IP 192.168.147.4 > 8.8.8.8: ICMP echo request, id 11, seq 1, length 64
14:03:56.959551 eth0  In  IP6 fe80::c822:8fff:fea8:da7f > fe80::b8f9:58ff:fee2:e3e1: ICMP6, neighbor solicitation, who has fe80::b8f9:58ff:fee2:e3e1, length 32
14:03:56.959585 eth0  Out IP6 fe80::b8f9:58ff:fee2:e3e1 > fe80::c822:8fff:fea8:da7f: ICMP6, neighbor advertisement, tgt is fe80::b8f9:58ff:fee2:e3e1, length 24
14:03:56.962776 eth0  In  IP 8.8.8.8 > 192.168.147.4: ICMP echo reply, id 11, seq 1, length 64
14:03:56.962782 antrea-gw0 Out IP 8.8.8.8 > 172.31.130.2: ICMP echo reply, id 11, seq 1, length 64
14:03:56.962793 test-tra-5e312d Out IP 8.8.8.8 > 172.31.130.2: ICMP echo reply, id 11, seq 1, length 64
14:03:57.009886 lo    In  IP6 ::1.52922 > ::1.10350: Flags [S], seq 1799881460, win 65476, options [mss 65476,sackOK,TS val 3622624842 ecr 0,nop,wscale 10], length 0
14:03:57.009929 lo    In  IP6 ::1.10350 > ::1.52922: Flags [S.], seq 2012291674, ack 1799881461, win 65464, options [mss 65476,sackOK,TS val 3622624842 ecr 3622624842,nop,wscale 10], length 0
14:03:57.009951 lo    In  IP6 ::1.52922 > ::1.10350: Flags [.], ack 1, win 64, options [nop,nop,TS val 3622624842 ecr 3622624842], length 0
14:03:57.011160 lo    In  IP6 ::1.52922 > ::1.10350: Flags [P.], seq 1:1516, ack 1, win 64, options [nop,nop,TS val 3622624843 ecr 3622624842], length 1515
14:03:57.011180 lo    In  IP6 ::1.10350 > ::1.52922: Flags [.], ack 1516, win 72, options [nop,nop,TS val 3622624844 ecr 3622624843], length 0
14:03:57.014726 lo    In  IP6 ::1.10350 > ::1.52922: Flags [P.], seq 1:3430, ack 1516, win 72, options [nop,nop,TS val 3622624847 ecr 3622624843], length 3429
14:03:57.014745 lo    In  IP6 ::1.52922 > ::1.10350: Flags [.], ack 3430, win 93, options [nop,nop,TS val 3622624847 ecr 3622624847], length 0
14:03:57.015087 lo    In  IP6 ::1.52922 > ::1.10350: Flags [P.], seq 1516:1610, ack 3430, win 93, options [nop,nop,TS val 3622624847 ecr 3622624847], length 94
14:03:57.015148 lo    In  IP6 ::1.52922 > ::1.10350: Flags [P.], seq 1610:1702, ack 3430, win 93, options [nop,nop,TS val 3622624848 ecr 3622624847], length 92
14:03:57.015203 lo    In  IP6 ::1.52922 > ::1.10350: Flags [P.], seq 1702:1774, ack 3430, win 93, options [nop,nop,TS val 3622624848 ecr 3622624847], length 72
14:03:57.015220 lo    In  IP6 ::1.10350 > ::1.52922: Flags [.], ack 1774, win 72, options [nop,nop,TS val 3622624848 ecr 3622624847], length 0
14:03:57.015656 lo    In  IP6 ::1.10350 > ::1.52922: Flags [P.], seq 3430:3491, ack 1774, win 72, options [nop,nop,TS val 3622624848 ecr 3622624847], length 61
14:03:57.015666 lo    In  IP6 ::1.10350 > ::1.52922: Flags [P.], seq 3491:3535, ack 1774, win 72, options [nop,nop,TS val 3622624848 ecr 3622624847], length 44
14:03:57.015782 lo    In  IP6 ::1.52922 > ::1.10350: Flags [.], ack 3535, win 93, options [nop,nop,TS val 3622624848 ecr 3622624848], length 0
14:03:57.015816 lo    In  IP6 ::1.52922 > ::1.10350: Flags [P.], seq 1774:1805, ack 3535, win 93, options [nop,nop,TS val 3622624848 ecr 3622624848], length 31
14:03:57.016412 lo    In  IP6 ::1.10350 > ::1.52922: Flags [P.], seq 3535:3574, ack 1805, win 72, options [nop,nop,TS val 3622624849 ecr 3622624848], length 39
14:03:57.016487 lo    In  IP6 ::1.10350 > ::1.52922: Flags [P.], seq 3574:3726, ack 1805, win 72, options [nop,nop,TS val 3622624849 ecr 3622624848], length 152
14:03:57.016495 lo    In  IP6 ::1.52922 > ::1.10350: Flags [.], ack 3726, win 95, options [nop,nop,TS val 3622624849 ecr 3622624849], length 0
14:03:57.016542 lo    In  IP6 ::1.10350 > ::1.52922: Flags [P.], seq 3726:3759, ack 1805, win 72, options [nop,nop,TS val 3622624849 ecr 3622624849], length 33
14:03:57.016562 lo    In  IP6 ::1.52922 > ::1.10350: Flags [P.], seq 1805:1829, ack 3759, win 95, options [nop,nop,TS val 3622624849 ecr 3622624849], length 24
14:03:57.016577 lo    In  IP6 ::1.52922 > ::1.10350: Flags [F.], seq 1829, ack 3759, win 95, options [nop,nop,TS val 3622624849 ecr 3622624849], length 0
14:03:57.016601 lo    In  IP6 ::1.10350 > ::1.52922: Flags [P.], seq 3759:3783, ack 1830, win 72, options [nop,nop,TS val 3622624849 ecr 3622624849], length 24
14:03:57.016614 lo    In  IP6 ::1.52922 > ::1.10350: Flags [R], seq 1799883290, win 0, length 0
14:03:57.133199 eth0  Out IP 192.168.147.4.57076 > 192.168.147.2.6443: Flags [P.], seq 4181456212:4181456278, ack 2070806232, win 96, options [nop,nop,TS val 1373563603 ecr 3877710065], length 66
14:03:57.133281 eth0  In  IP 192.168.147.2.6443 > 192.168.147.4.57076: Flags [.], ack 66, win 130, options [nop,nop,TS val 3877710505 ecr 1373563603], length 0
14:03:57.133321 eth0  Out IP 192.168.147.4.57076 > 192.168.147.2.6443: Flags [P.], seq 66:614, ack 1, win 96, options [nop,nop,TS val 1373563604 ecr 3877710505], length 548
14:03:57.133365 eth0  In  IP 192.168.147.2.6443 > 192.168.147.4.57076: Flags [.], ack 614, win 130, options [nop,nop,TS val 3877710505 ecr 1373563604], length 0
14:03:57.159507 eth0  In  IP 192.168.147.2.6443 > 192.168.147.4.57076: Flags [P.], seq 1:91, ack 614, win 130, options [nop,nop,TS val 3877710531 ecr 1373563604], length 90
14:03:57.159553 eth0  In  IP 192.168.147.2.6443 > 192.168.147.4.57076: Flags [P.], seq 91:639, ack 614, win 130, options [nop,nop,TS val 3877710531 ecr 1373563604], length 548
14:03:57.159610 eth0  Out IP 192.168.147.4.57076 > 192.168.147.2.6443: Flags [.], ack 639, win 96, options [nop,nop,TS val 1373563630 ecr 3877710531], length 0
14:03:57.159868 eth0  Out IP 192.168.147.4.57076 > 192.168.147.2.6443: Flags [P.], seq 614:649, ack 639, win 96, options [nop,nop,TS val 1373563630 ecr 3877710531], length 35
14:03:57.200481 eth0  In  IP 192.168.147.2.6443 > 192.168.147.4.57076: Flags [.], ack 649, win 130, options [nop,nop,TS val 3877710572 ecr 1373563630], length 0
14:03:57.404371 eth0  Out IP 192.168.147.4.10351 > 192.168.147.3.10351: UDP, length 102
14:03:57.404593 eth0  In  IP 192.168.147.3.10351 > 192.168.147.4.10351: UDP, length 20
14:03:57.944846 test-tra-5e312d P   IP 172.31.130.2 > 8.8.8.8: ICMP echo request, id 11, seq 2, length 64
14:03:57.944866 antrea-gw0 In  IP 172.31.130.2 > 8.8.8.8: ICMP echo request, id 11, seq 2, length 64
14:03:57.944891 eth0  Out IP 192.168.147.4 > 8.8.8.8: ICMP echo request, id 11, seq 2, length 64
14:03:57.965976 eth0  In  IP 8.8.8.8 > 192.168.147.4: ICMP echo reply, id 11, seq 2, length 64
14:03:57.965992 antrea-gw0 Out IP 8.8.8.8 > 172.31.130.2: ICMP echo reply, id 11, seq 2, length 64
14:03:57.966005 test-tra-5e312d Out IP 8.8.8.8 > 172.31.130.2: ICMP echo reply, id 11, seq 2, length 64
14:03:58.868227 eth0  In  IP 192.168.147.2.6443 > 192.168.147.4.57088: Flags [P.], seq 735881416:735881534, ack 3031522493, win 73, options [nop,nop,TS val 3877712239 ecr 1373562478], length 118
14:03:58.869229 eth0  In  IP 192.168.147.2.10351 > 192.168.147.4.10351: UDP, length 109
14:03:58.869544 eth0  Out IP 192.168.147.4.10351 > 192.168.147.2.10351: UDP, length 20
14:03:58.909501 eth0  Out IP 192.168.147.4.57088 > 192.168.147.2.6443: Flags [.], ack 118, win 95, options [nop,nop,TS val 1373565380 ecr 3877712239], length 0
14:03:58.945965 test-tra-5e312d P   IP 172.31.130.2 > 8.8.8.8: ICMP echo request, id 11, seq 3, length 64
14:03:58.945981 antrea-gw0 In  IP 172.31.130.2 > 8.8.8.8: ICMP echo request, id 11, seq 3, length 64
14:03:58.946001 eth0  Out IP 192.168.147.4 > 8.8.8.8: ICMP echo request, id 11, seq 3, length 64
14:03:58.967912 eth0  In  IP 8.8.8.8 > 192.168.147.4: ICMP echo reply, id 11, seq 3, length 64
14:03:58.967926 antrea-gw0 Out IP 8.8.8.8 > 172.31.130.2: ICMP echo reply, id 11, seq 3, length 64
14:03:58.967938 test-tra-5e312d Out IP 8.8.8.8 > 172.31.130.2: ICMP echo reply, id 11, seq 3, length 64
14:03:59.405167 eth0  Out IP 192.168.147.4.10351 > 192.168.147.2.10351: UDP, length 109
14:03:59.405473 eth0  In  IP 192.168.147.2.10351 > 192.168.147.4.10351: UDP, length 20
14:03:59.440935 eth0  In  IP 192.168.147.3.10351 > 192.168.147.4.10351: UDP, length 102
14:03:59.441383 eth0  Out IP 192.168.147.4.10351 > 192.168.147.3.10351: UDP, length 20
14:03:59.946733 test-tra-5e312d P   IP 172.31.130.2 > 8.8.8.8: ICMP echo request, id 11, seq 4, length 64
14:03:59.946755 antrea-gw0 In  IP 172.31.130.2 > 8.8.8.8: ICMP echo request, id 11, seq 4, length 64
14:03:59.946779 eth0  Out IP 192.168.147.4 > 8.8.8.8: ICMP echo request, id 11, seq 4, length 64
14:03:59.963702 eth0  In  IP 8.8.8.8 > 192.168.147.4: ICMP echo reply, id 11, seq 4, length 64
14:03:59.963719 antrea-gw0 Out IP 8.8.8.8 > 172.31.130.2: ICMP echo reply, id 11, seq 4, length 64
14:03:59.963734 test-tra-5e312d Out IP 8.8.8.8 > 172.31.130.2: ICMP echo reply, id 11, seq 4, length 64
14:04:00.405688 eth0  Out IP 192.168.147.4.10351 > 192.168.147.3.10351: UDP, length 102
14:04:00.406150 eth0  In  IP 192.168.147.3.10351 > 192.168.147.4.10351: UDP, length 20
14:04:00.542230 test-tra-5e312d M   IP6 fe80::8f2:c9ff:fea5:b060 > ff02::2: ICMP6, router solicitation, length 16
14:04:01.054463 antrea-gw0 Out ARP, Request who-has 172.31.130.2 tell 172.31.130.1, length 28
14:04:01.054993 test-tra-5e312d Out ARP, Request who-has 172.31.130.2 tell 172.31.130.1, length 28
14:04:01.055006 test-tra-5e312d P   ARP, Reply 172.31.130.2 is-at 0a:f2:c9:a5:b0:60, length 28
14:04:01.055076 antrea-gw0 In  ARP, Reply 172.31.130.2 is-at 0a:f2:c9:a5:b0:60, length 28
14:04:01.405112 eth0  Out IP 192.168.147.4.10351 > 192.168.147.2.10351: UDP, length 109
14:04:01.405597 eth0  In  IP 192.168.147.2.10351 > 192.168.147.4.10351: UDP, length 20
14:04:01.441176 eth0  In  IP 192.168.147.3.10351 > 192.168.147.4.10351: UDP, length 102
14:04:01.441611 eth0  Out IP 192.168.147.4.10351 > 192.168.147.3.10351: UDP, length 20
14:04:01.612486 lo    In  IP6 ::1.37400 > ::1.10350: Flags [S], seq 4131707131, win 65476, options [mss 65476,sackOK,TS val 3622629445 ecr 0,nop,wscale 10], length 0
14:04:01.612515 lo    In  IP6 ::1.10350 > ::1.37400: Flags [S.], seq 254796239, ack 4131707132, win 65464, options [mss 65476,sackOK,TS val 3622629445 ecr 3622629445,nop,wscale 10], length 0
14:04:01.612526 lo    In  IP6 ::1.37400 > ::1.10350: Flags [.], ack 1, win 64, options [nop,nop,TS val 3622629445 ecr 3622629445], length 0
14:04:01.613167 lo    In  IP6 ::1.37400 > ::1.10350: Flags [P.], seq 1:1516, ack 1, win 64, options [nop,nop,TS val 3622629446 ecr 3622629445], length 1515
14:04:01.613176 lo    In  IP6 ::1.10350 > ::1.37400: Flags [.], ack 1516, win 72, options [nop,nop,TS val 3622629446 ecr 3622629446], length 0
14:04:01.616243 lo    In  IP6 ::1.10350 > ::1.37400: Flags [P.], seq 1:3430, ack 1516, win 72, options [nop,nop,TS val 3622629449 ecr 3622629446], length 3429
14:04:01.616263 lo    In  IP6 ::1.37400 > ::1.10350: Flags [.], ack 3430, win 93, options [nop,nop,TS val 3622629449 ecr 3622629449], length 0
14:04:01.616840 lo    In  IP6 ::1.37400 > ::1.10350: Flags [P.], seq 1516:1610, ack 3430, win 93, options [nop,nop,TS val 3622629449 ecr 3622629449], length 94
14:04:01.617101 lo    In  IP6 ::1.10350 > ::1.37400: Flags [P.], seq 3430:3491, ack 1610, win 72, options [nop,nop,TS val 3622629449 ecr 3622629449], length 61
14:04:01.617170 lo    In  IP6 ::1.37400 > ::1.10350: Flags [P.], seq 1610:1702, ack 3491, win 93, options [nop,nop,TS val 3622629450 ecr 3622629449], length 92
14:04:01.617462 lo    In  IP6 ::1.10350 > ::1.37400: Flags [P.], seq 3491:3526, ack 1702, win 72, options [nop,nop,TS val 3622629450 ecr 3622629450], length 35
14:04:01.617517 lo    In  IP6 ::1.10350 > ::1.37400: Flags [P.], seq 3526:3557, ack 1702, win 72, options [nop,nop,TS val 3622629450 ecr 3622629450], length 31
14:04:01.617622 lo    In  IP6 ::1.37400 > ::1.10350: Flags [.], ack 3557, win 93, options [nop,nop,TS val 3622629450 ecr 3622629450], length 0
14:04:01.617671 lo    In  IP6 ::1.37400 > ::1.10350: Flags [P.], seq 1702:1773, ack 3557, win 93, options [nop,nop,TS val 3622629450 ecr 3622629450], length 71
14:04:01.618387 lo    In  IP6 ::1.37400 > ::1.10350: Flags [P.], seq 1773:1804, ack 3557, win 93, options [nop,nop,TS val 3622629451 ecr 3622629450], length 31
14:04:01.618417 lo    In  IP6 ::1.10350 > ::1.37400: Flags [.], ack 1804, win 72, options [nop,nop,TS val 3622629451 ecr 3622629450], length 0
14:04:01.618486 lo    In  IP6 ::1.10350 > ::1.37400: Flags [P.], seq 3557:3596, ack 1804, win 72, options [nop,nop,TS val 3622629451 ecr 3622629450], length 39
14:04:01.618620 lo    In  IP6 ::1.10350 > ::1.37400: Flags [P.], seq 3596:3749, ack 1804, win 72, options [nop,nop,TS val 3622629451 ecr 3622629450], length 153
14:04:01.618644 lo    In  IP6 ::1.10350 > ::1.37400: Flags [P.], seq 3749:3782, ack 1804, win 72, options [nop,nop,TS val 3622629451 ecr 3622629450], length 33
14:04:01.618671 lo    In  IP6 ::1.37400 > ::1.10350: Flags [.], ack 3782, win 95, options [nop,nop,TS val 3622629451 ecr 3622629451], length 0
14:04:01.618755 lo    In  IP6 ::1.37400 > ::1.10350: Flags [P.], seq 1804:1828, ack 3782, win 95, options [nop,nop,TS val 3622629451 ecr 3622629451], length 24
14:04:01.618783 lo    In  IP6 ::1.10350 > ::1.37400: Flags [P.], seq 3782:3806, ack 1828, win 72, options [nop,nop,TS val 3622629451 ecr 3622629451], length 24
14:04:01.618804 lo    In  IP6 ::1.10350 > ::1.37400: Flags [F.], seq 3806, ack 1828, win 72, options [nop,nop,TS val 3622629451 ecr 3622629451], length 0
14:04:01.619045 lo    In  IP6 ::1.37400 > ::1.10350: Flags [F.], seq 1828, ack 3807, win 95, options [nop,nop,TS val 3622629451 ecr 3622629451], length 0
14:04:01.619065 lo    In  IP6 ::1.10350 > ::1.37400: Flags [.], ack 1829, win 72, options [nop,nop,TS val 3622629451 ecr 3622629451], length 0
14:04:01.871379 eth0  In  IP 192.168.147.2.10351 > 192.168.147.4.10351: UDP, length 109
14:04:01.871613 eth0  Out IP 192.168.147.4.10351 > 192.168.147.2.10351: UDP, length 20
14:04:02.079646 eth0  Out IP6 fe80::b8f9:58ff:fee2:e3e1 > fe80::c822:8fff:fea8:da7f: ICMP6, neighbor solicitation, who has fe80::c822:8fff:fea8:da7f, length 32
14:04:02.079694 eth0  In  IP6 fe80::c822:8fff:fea8:da7f > fe80::b8f9:58ff:fee2:e3e1: ICMP6, neighbor advertisement, tgt is fe80::c822:8fff:fea8:da7f, length 24
14:04:02.090639 eth0  In  IP 192.168.147.2.52796 > 192.168.147.4.10250: Flags [S], seq 2734825571, win 64240, options [mss 1460,sackOK,TS val 3877715462 ecr 0,nop,wscale 10], length 0
14:04:02.090684 eth0  Out IP 192.168.147.4.10250 > 192.168.147.2.52796: Flags [S.], seq 3300871668, ack 2734825572, win 65160, options [mss 1460,sackOK,TS val 1373568561 ecr 3877715462,nop,wscale 10], length 0
14:04:02.090700 eth0  In  IP 192.168.147.2.52796 > 192.168.147.4.10250: Flags [.], ack 1, win 63, options [nop,nop,TS val 3877715462 ecr 1373568561], length 0
14:04:02.091835 eth0  In  IP 192.168.147.2.52796 > 192.168.147.4.10250: Flags [P.], seq 1:1495, ack 1, win 63, options [nop,nop,TS val 3877715463 ecr 1373568561], length 1494
14:04:02.091856 eth0  Out IP 192.168.147.4.10250 > 192.168.147.2.52796: Flags [.], ack 1495, win 67, options [nop,nop,TS val 1373568562 ecr 3877715463], length 0
14:04:02.095740 eth0  Out IP 192.168.147.4.10250 > 192.168.147.2.52796: Flags [P.], seq 1:3431, ack 1495, win 67, options [nop,nop,TS val 1373568566 ecr 3877715463], length 3430
14:04:02.095801 eth0  In  IP 192.168.147.2.52796 > 192.168.147.4.10250: Flags [.], ack 3431, win 70, options [nop,nop,TS val 3877715467 ecr 1373568566], length 0
14:04:02.106920 eth0  In  IP 192.168.147.2.52796 > 192.168.147.4.10250: Flags [P.], seq 1495:2706, ack 3431, win 70, options [nop,nop,TS val 3877715478 ecr 1373568566], length 1211
14:04:02.107711 eth0  In  IP 192.168.147.2.52796 > 192.168.147.4.10250: Flags [P.], seq 2706:3241, ack 3431, win 70, options [nop,nop,TS val 3877715479 ecr 1373568566], length 535
14:04:02.107728 eth0  Out IP 192.168.147.4.10250 > 192.168.147.2.52796: Flags [.], ack 3241, win 72, options [nop,nop,TS val 1373568578 ecr 3877715478], length 0
14:04:02.125473 eth0  Out IP 192.168.147.4.57076 > 192.168.147.2.6443: Flags [P.], seq 649:729, ack 639, win 96, options [nop,nop,TS val 1373568596 ecr 3877710572], length 80
14:04:02.125553 eth0  In  IP 192.168.147.2.6443 > 192.168.147.4.57076: Flags [.], ack 729, win 130, options [nop,nop,TS val 3877715497 ecr 1373568596], length 0
14:04:02.126185 eth0  Out IP 192.168.147.4.57076 > 192.168.147.2.6443: Flags [P.], seq 729:1110, ack 639, win 96, options [nop,nop,TS val 1373568597 ecr 3877715497], length 381
14:04:02.126197 eth0  In  IP 192.168.147.2.6443 > 192.168.147.4.57076: Flags [.], ack 1110, win 130, options [nop,nop,TS val 3877715498 ecr 1373568597], length 0
14:04:02.127015 eth0  In  IP 192.168.147.2.6443 > 192.168.147.4.57076: Flags [P.], seq 639:733, ack 1110, win 130, options [nop,nop,TS val 3877715498 ecr 1373568597], length 94
14:04:02.127345 eth0  In  IP 192.168.147.2.6443 > 192.168.147.4.57076: Flags [P.], seq 733:1528, ack 1110, win 130, options [nop,nop,TS val 3877715499 ecr 1373568597], length 795
14:04:02.127362 eth0  Out IP 192.168.147.4.57076 > 192.168.147.2.6443: Flags [.], ack 1528, win 96, options [nop,nop,TS val 1373568598 ecr 3877715498], length 0
14:04:02.129101 lo    In  IP 127.0.0.1.51720 > 127.0.0.1.36645: Flags [S], seq 1602794533, win 65495, options [mss 65495,sackOK,TS val 257517531 ecr 0,nop,wscale 10], length 0
14:04:02.129112 lo    In  IP 127.0.0.1.36645 > 127.0.0.1.51720: Flags [S.], seq 467892805, ack 1602794534, win 65483, options [mss 65495,sackOK,TS val 257517531 ecr 257517531,nop,wscale 10], length 0
14:04:02.129116 lo    In  IP 127.0.0.1.51720 > 127.0.0.1.36645: Flags [.], ack 1, win 64, options [nop,nop,TS val 257517531 ecr 257517531], length 0
14:04:02.129172 lo    In  IP 127.0.0.1.51720 > 127.0.0.1.36645: Flags [P.], seq 1:410, ack 1, win 64, options [nop,nop,TS val 257517532 ecr 257517531], length 409
14:04:02.129175 lo    In  IP 127.0.0.1.36645 > 127.0.0.1.51720: Flags [.], ack 410, win 64, options [nop,nop,TS val 257517532 ecr 257517532], length 0
14:04:02.130142 lo    In  IP 127.0.0.1.36645 > 127.0.0.1.51720: Flags [P.], seq 1:160, ack 410, win 64, options [nop,nop,TS val 257517533 ecr 257517532], length 159
14:04:02.130146 lo    In  IP 127.0.0.1.51720 > 127.0.0.1.36645: Flags [.], ack 160, win 64, options [nop,nop,TS val 257517533 ecr 257517533], length 0
14:04:02.130266 eth0  Out IP 192.168.147.4.10250 > 192.168.147.2.52796: Flags [P.], seq 3431:3612, ack 3241, win 72, options [nop,nop,TS val 1373568601 ecr 3877715478], length 181
14:04:02.131218 eth0  In  IP 192.168.147.2.52796 > 192.168.147.4.10250: Flags [P.], seq 3241:3265, ack 3612, win 73, options [nop,nop,TS val 3877715503 ecr 1373568601], length 24
14:04:02.131234 lo    In  IP 127.0.0.1.51720 > 127.0.0.1.36645: Flags [P.], seq 410:412, ack 160, win 64, options [nop,nop,TS val 257517534 ecr 257517533], length 2
14:04:02.131252 eth0  In  IP 192.168.147.2.52796 > 192.168.147.4.10250: Flags [P.], seq 3265:3289, ack 3612, win 73, options [nop,nop,TS val 3877715503 ecr 1373568601], length 24
14:04:02.131334 eth0  Out IP 192.168.147.4.10250 > 192.168.147.2.52796: Flags [.], ack 3289, win 72, options [nop,nop,TS val 1373568602 ecr 3877715503], length 0
14:04:02.131364 lo    In  IP 127.0.0.1.51720 > 127.0.0.1.36645: Flags [P.], seq 412:414, ack 160, win 64, options [nop,nop,TS val 257517534 ecr 257517533], length 2
14:04:02.131374 lo    In  IP 127.0.0.1.36645 > 127.0.0.1.51720: Flags [.], ack 414, win 64, options [nop,nop,TS val 257517534 ecr 257517534], length 0
14:04:02.131382 eth0  In  IP 192.168.147.2.52796 > 192.168.147.4.10250: Flags [P.], seq 3289:3315, ack 3612, win 73, options [nop,nop,TS val 3877715503 ecr 1373568602], length 26
14:04:02.131390 lo    In  IP 127.0.0.1.51720 > 127.0.0.1.36645: Flags [P.], seq 414:418, ack 160, win 64, options [nop,nop,TS val 257517534 ecr 257517534], length 4
14:04:02.131414 eth0  In  IP 192.168.147.2.52796 > 192.168.147.4.10250: Flags [P.], seq 3315:3341, ack 3612, win 73, options [nop,nop,TS val 3877715503 ecr 1373568602], length 26
14:04:02.131418 eth0  Out IP 192.168.147.4.10250 > 192.168.147.2.52796: Flags [.], ack 3341, win 72, options [nop,nop,TS val 1373568602 ecr 3877715503], length 0
14:04:02.131423 lo    In  IP 127.0.0.1.51720 > 127.0.0.1.36645: Flags [P.], seq 418:422, ack 160, win 64, options [nop,nop,TS val 257517534 ecr 257517534], length 4
14:04:02.131426 lo    In  IP 127.0.0.1.36645 > 127.0.0.1.51720: Flags [.], ack 422, win 64, options [nop,nop,TS val 257517534 ecr 257517534], length 0
14:04:02.131433 eth0  In  IP 192.168.147.2.52796 > 192.168.147.4.10250: Flags [P.], seq 3341:3367, ack 3612, win 73, options [nop,nop,TS val 3877715503 ecr 1373568602], length 26
14:04:02.131437 lo    In  IP 127.0.0.1.51720 > 127.0.0.1.36645: Flags [P.], seq 422:426, ack 160, win 64, options [nop,nop,TS val 257517534 ecr 257517534], length 4
14:04:02.131451 eth0  In  IP 192.168.147.2.52796 > 192.168.147.4.10250: Flags [P.], seq 3367:3390, ack 3612, win 73, options [nop,nop,TS val 3877715503 ecr 1373568602], length 23
14:04:02.131454 eth0  Out IP 192.168.147.4.10250 > 192.168.147.2.52796: Flags [.], ack 3390, win 72, options [nop,nop,TS val 1373568602 ecr 3877715503], length 0
14:04:02.131456 lo    In  IP 127.0.0.1.51720 > 127.0.0.1.36645: Flags [P.], seq 426:427, ack 160, win 64, options [nop,nop,TS val 257517534 ecr 257517534], length 1
14:04:02.131459 lo    In  IP 127.0.0.1.36645 > 127.0.0.1.51720: Flags [.], ack 427, win 64, options [nop,nop,TS val 257517534 ecr 257517534], length 0
14:04:02.131465 eth0  In  IP 192.168.147.2.52796 > 192.168.147.4.10250: Flags [P.], seq 3390:3413, ack 3612, win 73, options [nop,nop,TS val 3877715503 ecr 1373568602], length 23
14:04:02.131468 lo    In  IP 127.0.0.1.51720 > 127.0.0.1.36645: Flags [P.], seq 427:428, ack 160, win 64, options [nop,nop,TS val 257517534 ecr 257517534], length 1
14:04:02.131491 eth0  In  IP 192.168.147.2.52796 > 192.168.147.4.10250: Flags [P.], seq 3413:3466, ack 3612, win 73, options [nop,nop,TS val 3877715503 ecr 1373568602], length 53
14:04:02.131495 eth0  Out IP 192.168.147.4.10250 > 192.168.147.2.52796: Flags [.], ack 3466, win 72, options [nop,nop,TS val 1373568602 ecr 3877715503], length 0
14:04:02.131499 lo    In  IP 127.0.0.1.51720 > 127.0.0.1.36645: Flags [P.], seq 428:459, ack 160, win 64, options [nop,nop,TS val 257517534 ecr 257517534], length 31
14:04:02.131501 lo    In  IP 127.0.0.1.36645 > 127.0.0.1.51720: Flags [.], ack 459, win 64, options [nop,nop,TS val 257517534 ecr 257517534], length 0
14:04:02.131809 lo    In  IP 127.0.0.1.36645 > 127.0.0.1.51720: Flags [P.], seq 160:162, ack 459, win 64, options [nop,nop,TS val 257517534 ecr 257517534], length 2
14:04:02.131824 eth0  Out IP 192.168.147.4.10250 > 192.168.147.2.52796: Flags [P.], seq 3612:3636, ack 3466, win 72, options [nop,nop,TS val 1373568602 ecr 3877715503], length 24
14:04:02.131843 lo    In  IP 127.0.0.1.36645 > 127.0.0.1.51720: Flags [P.], seq 162:164, ack 459, win 64, options [nop,nop,TS val 257517534 ecr 257517534], length 2
14:04:02.131846 lo    In  IP 127.0.0.1.36645 > 127.0.0.1.51720: Flags [P.], seq 164:168, ack 459, win 64, options [nop,nop,TS val 257517534 ecr 257517534], length 4
14:04:02.131848 lo    In  IP 127.0.0.1.36645 > 127.0.0.1.51720: Flags [P.], seq 168:172, ack 459, win 64, options [nop,nop,TS val 257517534 ecr 257517534], length 4
14:04:02.131850 lo    In  IP 127.0.0.1.36645 > 127.0.0.1.51720: Flags [P.], seq 172:188, ack 459, win 64, options [nop,nop,TS val 257517534 ecr 257517534], length 16
14:04:02.131887 lo    In  IP 127.0.0.1.51720 > 127.0.0.1.36645: Flags [.], ack 188, win 64, options [nop,nop,TS val 257517534 ecr 257517534], length 0
14:04:02.131892 eth0  Out IP 192.168.147.4.10250 > 192.168.147.2.52796: Flags [P.], seq 3636:3684, ack 3466, win 72, options [nop,nop,TS val 1373568602 ecr 3877715503], length 48
14:04:02.131911 eth0  In  IP 192.168.147.2.52796 > 192.168.147.4.10250: Flags [.], ack 3684, win 73, options [nop,nop,TS val 3877715503 ecr 1373568602], length 0
14:04:02.132024 eth0  In  IP 192.168.147.2.52796 > 192.168.147.4.10250: Flags [P.], seq 3466:3490, ack 3684, win 73, options [nop,nop,TS val 3877715503 ecr 1373568602], length 24
14:04:02.132036 lo    In  IP 127.0.0.1.51720 > 127.0.0.1.36645: Flags [P.], seq 459:461, ack 188, win 64, options [nop,nop,TS val 257517534 ecr 257517534], length 2
14:04:02.132043 eth0  In  IP 192.168.147.2.52796 > 192.168.147.4.10250: Flags [P.], seq 3490:3514, ack 3684, win 73, options [nop,nop,TS val 3877715503 ecr 1373568602], length 24
14:04:02.132045 eth0  In  IP 192.168.147.2.52796 > 192.168.147.4.10250: Flags [P.], seq 3514:3540, ack 3684, win 73, options [nop,nop,TS val 3877715503 ecr 1373568602], length 26
14:04:02.132048 eth0  In  IP 192.168.147.2.52796 > 192.168.147.4.10250: Flags [P.], seq 3540:3566, ack 3684, win 73, options [nop,nop,TS val 3877715503 ecr 1373568602], length 26
14:04:02.132050 eth0  In  IP 192.168.147.2.52796 > 192.168.147.4.10250: Flags [P.], seq 3566:3592, ack 3684, win 73, options [nop,nop,TS val 3877715503 ecr 1373568602], length 26
14:04:02.132052 eth0  In  IP 192.168.147.2.52796 > 192.168.147.4.10250: Flags [P.], seq 3592:3615, ack 3684, win 73, options [nop,nop,TS val 3877715503 ecr 1373568602], length 23
14:04:02.132054 eth0  In  IP 192.168.147.2.52796 > 192.168.147.4.10250: Flags [P.], seq 3615:3638, ack 3684, win 73, options [nop,nop,TS val 3877715503 ecr 1373568602], length 23
14:04:02.132056 eth0  In  IP 192.168.147.2.52796 > 192.168.147.4.10250: Flags [P.], seq 3638:3675, ack 3684, win 73, options [nop,nop,TS val 3877715503 ecr 1373568602], length 37
14:04:02.132075 eth0  Out IP 192.168.147.4.10250 > 192.168.147.2.52796: Flags [.], ack 3675, win 72, options [nop,nop,TS val 1373568602 ecr 3877715503], length 0
14:04:02.132080 lo    In  IP 127.0.0.1.51720 > 127.0.0.1.36645: Flags [P.], seq 461:463, ack 188, win 64, options [nop,nop,TS val 257517534 ecr 257517534], length 2
14:04:02.132084 lo    In  IP 127.0.0.1.36645 > 127.0.0.1.51720: Flags [.], ack 463, win 64, options [nop,nop,TS val 257517534 ecr 257517534], length 0
14:04:02.132088 lo    In  IP 127.0.0.1.51720 > 127.0.0.1.36645: Flags [P.], seq 463:467, ack 188, win 64, options [nop,nop,TS val 257517534 ecr 257517534], length 4
14:04:02.132095 lo    In  IP 127.0.0.1.51720 > 127.0.0.1.36645: Flags [P.], seq 467:471, ack 188, win 64, options [nop,nop,TS val 257517534 ecr 257517534], length 4
14:04:02.132097 lo    In  IP 127.0.0.1.36645 > 127.0.0.1.51720: Flags [.], ack 471, win 64, options [nop,nop,TS val 257517534 ecr 257517534], length 0
14:04:02.132100 lo    In  IP 127.0.0.1.51720 > 127.0.0.1.36645: Flags [P.], seq 471:475, ack 188, win 64, options [nop,nop,TS val 257517534 ecr 257517534], length 4
14:04:02.132105 lo    In  IP 127.0.0.1.51720 > 127.0.0.1.36645: Flags [P.], seq 475:476, ack 188, win 64, options [nop,nop,TS val 257517534 ecr 257517534], length 1
14:04:02.132107 lo    In  IP 127.0.0.1.36645 > 127.0.0.1.51720: Flags [.], ack 476, win 64, options [nop,nop,TS val 257517534 ecr 257517534], length 0
14:04:02.132110 lo    In  IP 127.0.0.1.51720 > 127.0.0.1.36645: Flags [P.], seq 476:477, ack 188, win 64, options [nop,nop,TS val 257517534 ecr 257517534], length 1
14:04:02.132115 lo    In  IP 127.0.0.1.51720 > 127.0.0.1.36645: Flags [P.], seq 477:492, ack 188, win 64, options [nop,nop,TS val 257517534 ecr 257517534], length 15
14:04:02.132117 lo    In  IP 127.0.0.1.36645 > 127.0.0.1.51720: Flags [.], ack 492, win 64, options [nop,nop,TS val 257517534 ecr 257517534], length 0
14:04:02.132146 lo    In  IP 127.0.0.1.36645 > 127.0.0.1.51720: Flags [P.], seq 188:190, ack 492, win 64, options [nop,nop,TS val 257517535 ecr 257517534], length 2
14:04:02.132151 eth0  Out IP 192.168.147.4.10250 > 192.168.147.2.52796: Flags [P.], seq 3684:3708, ack 3675, win 72, options [nop,nop,TS val 1373568603 ecr 3877715503], length 24
14:04:02.132165 lo    In  IP 127.0.0.1.36645 > 127.0.0.1.51720: Flags [P.], seq 190:192, ack 492, win 64, options [nop,nop,TS val 257517535 ecr 257517534], length 2
14:04:02.132168 lo    In  IP 127.0.0.1.51720 > 127.0.0.1.36645: Flags [.], ack 192, win 64, options [nop,nop,TS val 257517535 ecr 257517535], length 0
14:04:02.132170 eth0  Out IP 192.168.147.4.10250 > 192.168.147.2.52796: Flags [P.], seq 3708:3732, ack 3675, win 72, options [nop,nop,TS val 1373568603 ecr 3877715503], length 24
14:04:02.132174 eth0  In  IP 192.168.147.2.52796 > 192.168.147.4.10250: Flags [.], ack 3732, win 73, options [nop,nop,TS val 3877715504 ecr 1373568603], length 0
14:04:02.132180 lo    In  IP 127.0.0.1.36645 > 127.0.0.1.51720: Flags [P.], seq 192:196, ack 492, win 64, options [nop,nop,TS val 257517535 ecr 257517535], length 4
14:04:02.132181 lo    In  IP 127.0.0.1.36645 > 127.0.0.1.51720: Flags [P.], seq 196:200, ack 492, win 64, options [nop,nop,TS val 257517535 ecr 257517535], length 4
14:04:02.132183 lo    In  IP 127.0.0.1.36645 > 127.0.0.1.51720: Flags [P.], seq 200:208, ack 492, win 64, options [nop,nop,TS val 257517535 ecr 257517535], length 8
14:04:02.132193 lo    In  IP 127.0.0.1.51720 > 127.0.0.1.36645: Flags [.], ack 208, win 64, options [nop,nop,TS val 257517535 ecr 257517535], length 0
14:04:02.132195 eth0  Out IP 192.168.147.4.10250 > 192.168.147.2.52796: Flags [P.], seq 3732:3770, ack 3675, win 72, options [nop,nop,TS val 1373568603 ecr 3877715504], length 38
14:04:02.132222 eth0  In  IP 192.168.147.2.52796 > 192.168.147.4.10250: Flags [P.], seq 3675:3699, ack 3770, win 73, options [nop,nop,TS val 3877715504 ecr 1373568603], length 24
14:04:02.132227 lo    In  IP 127.0.0.1.51720 > 127.0.0.1.36645: Flags [P.], seq 492:494, ack 208, win 64, options [nop,nop,TS val 257517535 ecr 257517535], length 2
14:04:02.132236 eth0  In  IP 192.168.147.2.52796 > 192.168.147.4.10250: Flags [P.], seq 3699:3723, ack 3770, win 73, options [nop,nop,TS val 3877715504 ecr 1373568603], length 24
14:04:02.132241 eth0  Out IP 192.168.147.4.10250 > 192.168.147.2.52796: Flags [.], ack 3723, win 72, options [nop,nop,TS val 1373568603 ecr 3877715504], length 0
14:04:02.132245 lo    In  IP 127.0.0.1.51720 > 127.0.0.1.36645: Flags [P.], seq 494:496, ack 208, win 64, options [nop,nop,TS val 257517535 ecr 257517535], length 2
14:04:02.132252 eth0  In  IP 192.168.147.2.52796 > 192.168.147.4.10250: Flags [P.], seq 3723:3749, ack 3770, win 73, options [nop,nop,TS val 3877715504 ecr 1373568603], length 26
14:04:02.132253 lo    In  IP 127.0.0.1.36645 > 127.0.0.1.51720: Flags [.], ack 496, win 64, options [nop,nop,TS val 257517535 ecr 257517535], length 0
14:04:02.132255 eth0  In  IP 192.168.147.2.52796 > 192.168.147.4.10250: Flags [P.], seq 3749:3775, ack 3770, win 73, options [nop,nop,TS val 3877715504 ecr 1373568603], length 26
14:04:02.132257 eth0  In  IP 192.168.147.2.52796 > 192.168.147.4.10250: Flags [P.], seq 3775:3801, ack 3770, win 73, options [nop,nop,TS val 3877715504 ecr 1373568603], length 26
14:04:02.132259 eth0  In  IP 192.168.147.2.52796 > 192.168.147.4.10250: Flags [P.], seq 3801:3824, ack 3770, win 73, options [nop,nop,TS val 3877715504 ecr 1373568603], length 23
14:04:02.132261 eth0  In  IP 192.168.147.2.52796 > 192.168.147.4.10250: Flags [P.], seq 3824:3847, ack 3770, win 73, options [nop,nop,TS val 3877715504 ecr 1373568603], length 23
14:04:02.132263 eth0  In  IP 192.168.147.2.52796 > 192.168.147.4.10250: Flags [P.], seq 3847:3880, ack 3770, win 73, options [nop,nop,TS val 3877715504 ecr 1373568603], length 33
14:04:02.132270 eth0  Out IP 192.168.147.4.10250 > 192.168.147.2.52796: Flags [.], ack 3880, win 72, options [nop,nop,TS val 1373568603 ecr 3877715504], length 0
14:04:02.132273 lo    In  IP 127.0.0.1.51720 > 127.0.0.1.36645: Flags [P.], seq 496:500, ack 208, win 64, options [nop,nop,TS val 257517535 ecr 257517535], length 4
14:04:02.132276 lo    In  IP 127.0.0.1.51720 > 127.0.0.1.36645: Flags [P.], seq 500:504, ack 208, win 64, options [nop,nop,TS val 257517535 ecr 257517535], length 4
14:04:02.132277 lo    In  IP 127.0.0.1.51720 > 127.0.0.1.36645: Flags [P.], seq 504:508, ack 208, win 64, options [nop,nop,TS val 257517535 ecr 257517535], length 4
14:04:02.132278 lo    In  IP 127.0.0.1.51720 > 127.0.0.1.36645: Flags [P.], seq 508:509, ack 208, win 64, options [nop,nop,TS val 257517535 ecr 257517535], length 1
14:04:02.132280 lo    In  IP 127.0.0.1.51720 > 127.0.0.1.36645: Flags [P.], seq 509:510, ack 208, win 64, options [nop,nop,TS val 257517535 ecr 257517535], length 1
14:04:02.132281 lo    In  IP 127.0.0.1.51720 > 127.0.0.1.36645: Flags [P.], seq 510:521, ack 208, win 64, options [nop,nop,TS val 257517535 ecr 257517535], length 11
14:04:02.132286 lo    In  IP 127.0.0.1.36645 > 127.0.0.1.51720: Flags [.], ack 521, win 64, options [nop,nop,TS val 257517535 ecr 257517535], length 0
14:04:02.132297 lo    In  IP 127.0.0.1.36645 > 127.0.0.1.51720: Flags [P.], seq 208:210, ack 521, win 64, options [nop,nop,TS val 257517535 ecr 257517535], length 2
14:04:02.132299 lo    In  IP 127.0.0.1.36645 > 127.0.0.1.51720: Flags [P.], seq 210:212, ack 521, win 64, options [nop,nop,TS val 257517535 ecr 257517535], length 2
14:04:02.132301 lo    In  IP 127.0.0.1.36645 > 127.0.0.1.51720: Flags [P.], seq 212:216, ack 521, win 64, options [nop,nop,TS val 257517535 ecr 257517535], length 4
14:04:02.132302 lo    In  IP 127.0.0.1.36645 > 127.0.0.1.51720: Flags [P.], seq 216:220, ack 521, win 64, options [nop,nop,TS val 257517535 ecr 257517535], length 4
14:04:02.132307 lo    In  IP 127.0.0.1.36645 > 127.0.0.1.51720: Flags [P.], seq 220:228, ack 521, win 64, options [nop,nop,TS val 257517535 ecr 257517535], length 8
14:04:02.132394 lo    In  IP 127.0.0.1.51720 > 127.0.0.1.36645: Flags [.], ack 228, win 64, options [nop,nop,TS val 257517535 ecr 257517535], length 0
14:04:02.132399 eth0  Out IP 192.168.147.4.10250 > 192.168.147.2.52796: Flags [P.], seq 3770:3812, ack 3880, win 72, options [nop,nop,TS val 1373568603 ecr 3877715504], length 42
14:04:02.152838 lo    In  IP 127.0.0.1.36645 > 127.0.0.1.51720: Flags [P.], seq 228:232, ack 521, win 64, options [nop,nop,TS val 257517555 ecr 257517535], length 4
14:04:02.152864 eth0  Out IP 192.168.147.4.10250 > 192.168.147.2.52796: Flags [P.], seq 3812:3838, ack 3880, win 72, options [nop,nop,TS val 1373568623 ecr 3877715504], length 26
14:04:02.152883 lo    In  IP 127.0.0.1.36645 > 127.0.0.1.51720: Flags [P.], seq 232:236, ack 521, win 64, options [nop,nop,TS val 257517555 ecr 257517535], length 4
14:04:02.152885 lo    In  IP 127.0.0.1.36645 > 127.0.0.1.51720: Flags [P.], seq 236:310, ack 521, win 64, options [nop,nop,TS val 257517555 ecr 257517535], length 74
14:04:02.152902 lo    In  IP 127.0.0.1.36645 > 127.0.0.1.51720: Flags [P.], seq 310:314, ack 521, win 64, options [nop,nop,TS val 257517555 ecr 257517535], length 4
14:04:02.152906 lo    In  IP 127.0.0.1.36645 > 127.0.0.1.51720: Flags [P.], seq 314:318, ack 521, win 64, options [nop,nop,TS val 257517555 ecr 257517535], length 4
14:04:02.152917 lo    In  IP 127.0.0.1.36645 > 127.0.0.1.51720: Flags [P.], seq 318:322, ack 521, win 64, options [nop,nop,TS val 257517555 ecr 257517535], length 4
14:04:02.152919 lo    In  IP 127.0.0.1.36645 > 127.0.0.1.51720: Flags [P.], seq 322:326, ack 521, win 64, options [nop,nop,TS val 257517555 ecr 257517535], length 4
14:04:02.152943 lo    In  IP 127.0.0.1.51720 > 127.0.0.1.36645: Flags [.], ack 326, win 64, options [nop,nop,TS val 257517555 ecr 257517555], length 0
14:04:02.152948 eth0  Out IP 192.168.147.4.10250 > 192.168.147.2.52796: Flags [P.], seq 3838:3954, ack 3880, win 72, options [nop,nop,TS val 1373568623 ecr 3877715504], length 116
14:04:02.153181 eth0  In  IP 192.168.147.2.52796 > 192.168.147.4.10250: Flags [.], ack 3954, win 73, options [nop,nop,TS val 3877715525 ecr 1373568603], length 0
14:04:02.157287 lo    In  IP 127.0.0.1.36645 > 127.0.0.1.51720: Flags [P.], seq 326:330, ack 521, win 64, options [nop,nop,TS val 257517560 ecr 257517555], length 4
14:04:02.157298 lo    In  IP 127.0.0.1.36645 > 127.0.0.1.51720: Flags [P.], seq 330:334, ack 521, win 64, options [nop,nop,TS val 257517560 ecr 257517555], length 4
14:04:02.157303 lo    In  IP 127.0.0.1.36645 > 127.0.0.1.51720: Flags [P.], seq 334:368, ack 521, win 64, options [nop,nop,TS val 257517560 ecr 257517555], length 34
14:04:02.157320 lo    In  IP 127.0.0.1.36645 > 127.0.0.1.51720: Flags [P.], seq 368:370, ack 521, win 64, options [nop,nop,TS val 257517560 ecr 257517555], length 2
14:04:02.157326 lo    In  IP 127.0.0.1.36645 > 127.0.0.1.51720: Flags [P.], seq 370:372, ack 521, win 64, options [nop,nop,TS val 257517560 ecr 257517555], length 2
14:04:02.157333 lo    In  IP 127.0.0.1.36645 > 127.0.0.1.51720: Flags [P.], seq 372:376, ack 521, win 64, options [nop,nop,TS val 257517560 ecr 257517555], length 4
14:04:02.157338 lo    In  IP 127.0.0.1.36645 > 127.0.0.1.51720: Flags [P.], seq 376:380, ack 521, win 64, options [nop,nop,TS val 257517560 ecr 257517555], length 4
14:04:02.157340 lo    In  IP 127.0.0.1.36645 > 127.0.0.1.51720: Flags [P.], seq 380:384, ack 521, win 64, options [nop,nop,TS val 257517560 ecr 257517555], length 4
14:04:02.157343 lo    In  IP 127.0.0.1.51720 > 127.0.0.1.36645: Flags [.], ack 380, win 64, options [nop,nop,TS val 257517560 ecr 257517560], length 0
14:04:02.157346 lo    In  IP 127.0.0.1.36645 > 127.0.0.1.51720: Flags [P.], seq 384:386, ack 521, win 64, options [nop,nop,TS val 257517560 ecr 257517555], length 2
14:04:02.157348 lo    In  IP 127.0.0.1.36645 > 127.0.0.1.51720: Flags [P.], seq 386:388, ack 521, win 64, options [nop,nop,TS val 257517560 ecr 257517560], length 2
14:04:02.157350 lo    In  IP 127.0.0.1.36645 > 127.0.0.1.51720: Flags [P.], seq 388:392, ack 521, win 64, options [nop,nop,TS val 257517560 ecr 257517560], length 4
14:04:02.157351 lo    In  IP 127.0.0.1.36645 > 127.0.0.1.51720: Flags [P.], seq 392:396, ack 521, win 64, options [nop,nop,TS val 257517560 ecr 257517560], length 4
14:04:02.157352 lo    In  IP 127.0.0.1.36645 > 127.0.0.1.51720: Flags [P.], seq 396:400, ack 521, win 64, options [nop,nop,TS val 257517560 ecr 257517560], length 4
14:04:02.157355 eth0  Out IP 192.168.147.4.10250 > 192.168.147.2.52796: Flags [P.], seq 3954:4030, ack 3880, win 72, options [nop,nop,TS val 1373568628 ecr 3877715525], length 76
14:04:02.157400 lo    In  IP 127.0.0.1.51720 > 127.0.0.1.36645: Flags [.], ack 400, win 64, options [nop,nop,TS val 257517560 ecr 257517560], length 0
14:04:02.157406 eth0  Out IP 192.168.147.4.10250 > 192.168.147.2.52796: Flags [P.], seq 4030:4072, ack 3880, win 72, options [nop,nop,TS val 1373568628 ecr 3877715525], length 42
14:04:02.157426 eth0  In  IP 192.168.147.2.52796 > 192.168.147.4.10250: Flags [.], ack 4072, win 73, options [nop,nop,TS val 3877715529 ecr 1373568628], length 0
14:04:02.157766 lo    In  IP 127.0.0.1.36645 > 127.0.0.1.51720: Flags [F.], seq 400, ack 521, win 64, options [nop,nop,TS val 257517560 ecr 257517560], length 0
14:04:02.157786 eth0  In  IP 192.168.147.2.52796 > 192.168.147.4.10250: Flags [P.], seq 3880:3904, ack 4072, win 73, options [nop,nop,TS val 3877715529 ecr 1373568628], length 24
14:04:02.157797 eth0  Out IP 192.168.147.4.10250 > 192.168.147.2.52796: Flags [P.], seq 4072:4096, ack 3904, win 72, options [nop,nop,TS val 1373568628 ecr 3877715529], length 24
14:04:02.157812 eth0  Out IP 192.168.147.4.10250 > 192.168.147.2.52796: Flags [R.], seq 4096, ack 3904, win 72, options [nop,nop,TS val 1373568628 ecr 3877715529], length 0
14:04:02.157862 lo    In  IP 127.0.0.1.51720 > 127.0.0.1.36645: Flags [F.], seq 521, ack 401, win 64, options [nop,nop,TS val 257517560 ecr 257517560], length 0
