08:59:46.950467 eth0  Out IP 192.168.147.2.10351 > 192.168.147.4.10351: UDP, length 20
08:59:46.950727 eth0  In  IP 192.168.147.4.10351 > 192.168.147.2.10351: UDP, length 20
08:59:47.951694 eth0  Out IP 192.168.147.2.10351 > 192.168.147.3.10351: UDP, length 109
08:59:47.952443 eth0  In  IP 192.168.147.3.10351 > 192.168.147.2.10351: UDP, length 20
08:59:48.022625 eth0  In  IP 192.168.147.3.10351 > 192.168.147.2.10351: UDP, length 109
08:59:48.023287 eth0  Out IP 192.168.147.2.10351 > 192.168.147.3.10351: UDP, length 20
08:59:48.035295 eth0  In  IP 192.168.147.3.6443 > 192.168.147.2.14054: Flags [P.], seq 1013638707:1013638864, ack 2224843972, win 116, options [nop,nop,TS val 2850021929 ecr 2267090051], length 157
08:59:48.075803 eth0  Out IP 192.168.147.2.14054 > 192.168.147.3.6443: Flags [.], ack 157, win 151, options [nop,nop,TS val 2267092094 ecr 2850021929], length 0
08:59:48.607331 lo    In  IP6 ::1.33116 > ::1.10350: Flags [S], seq 1712038847, win 65476, options [mss 65476,sackOK,TS val 3605920844 ecr 0,nop,wscale 10], length 0
08:59:48.607369 lo    In  IP6 ::1.10350 > ::1.33116: Flags [S.], seq 680529702, ack 1712038848, win 65464, options [mss 65476,sackOK,TS val 3605920844 ecr 3605920844,nop,wscale 10], length 0
08:59:48.607392 lo    In  IP6 ::1.33116 > ::1.10350: Flags [.], ack 1, win 64, options [nop,nop,TS val 3605920844 ecr 3605920844], length 0
08:59:48.608836 lo    In  IP6 ::1.33116 > ::1.10350: Flags [P.], seq 1:1516, ack 1, win 64, options [nop,nop,TS val 3605920846 ecr 3605920844], length 1515
08:59:48.608861 lo    In  IP6 ::1.10350 > ::1.33116: Flags [.], ack 1516, win 72, options [nop,nop,TS val 3605920846 ecr 3605920846], length 0
08:59:48.615819 lo    In  IP6 ::1.10350 > ::1.33116: Flags [P.], seq 1:3430, ack 1516, win 72, options [nop,nop,TS val 3605920853 ecr 3605920846], length 3429
08:59:48.615857 lo    In  IP6 ::1.33116 > ::1.10350: Flags [.], ack 3430, win 93, options [nop,nop,TS val 3605920853 ecr 3605920853], length 0
08:59:48.616943 lo    In  IP6 ::1.33116 > ::1.10350: Flags [P.], seq 1516:1610, ack 3430, win 93, options [nop,nop,TS val 3605920854 ecr 3605920853], length 94
08:59:48.617476 lo    In  IP6 ::1.33116 > ::1.10350: Flags [P.], seq 1610:1702, ack 3430, win 93, options [nop,nop,TS val 3605920854 ecr 3605920853], length 92
08:59:48.617576 lo    In  IP6 ::1.10350 > ::1.33116: Flags [.], ack 1702, win 72, options [nop,nop,TS val 3605920854 ecr 3605920854], length 0
08:59:48.617895 lo    In  IP6 ::1.10350 > ::1.33116: Flags [P.], seq 3430:3491, ack 1702, win 72, options [nop,nop,TS val 3605920855 ecr 3605920854], length 61
08:59:48.617965 lo    In  IP6 ::1.10350 > ::1.33116: Flags [P.], seq 3491:3535, ack 1702, win 72, options [nop,nop,TS val 3605920855 ecr 3605920854], length 44
08:59:48.618217 lo    In  IP6 ::1.33116 > ::1.10350: Flags [P.], seq 1702:1773, ack 3535, win 93, options [nop,nop,TS val 3605920855 ecr 3605920855], length 71
08:59:48.618294 lo    In  IP6 ::1.33116 > ::1.10350: Flags [P.], seq 1773:1804, ack 3535, win 93, options [nop,nop,TS val 3605920855 ecr 3605920855], length 31
08:59:48.618491 lo    In  IP6 ::1.10350 > ::1.33116: Flags [.], ack 1804, win 72, options [nop,nop,TS val 3605920855 ecr 3605920855], length 0
08:59:48.619638 lo    In  IP6 ::1.10350 > ::1.33116: Flags [P.], seq 3535:3574, ack 1804, win 72, options [nop,nop,TS val 3605920856 ecr 3605920855], length 39
08:59:48.619800 lo    In  IP6 ::1.10350 > ::1.33116: Flags [P.], seq 3574:3726, ack 1804, win 72, options [nop,nop,TS val 3605920857 ecr 3605920855], length 152
08:59:48.619811 lo    In  IP6 ::1.33116 > ::1.10350: Flags [.], ack 3726, win 95, options [nop,nop,TS val 3605920857 ecr 3605920856], length 0
08:59:48.619906 lo    In  IP6 ::1.10350 > ::1.33116: Flags [P.], seq 3726:3759, ack 1804, win 72, options [nop,nop,TS val 3605920857 ecr 3605920857], length 33
08:59:48.620050 lo    In  IP6 ::1.33116 > ::1.10350: Flags [P.], seq 1804:1828, ack 3759, win 95, options [nop,nop,TS val 3605920857 ecr 3605920857], length 24
08:59:48.620079 lo    In  IP6 ::1.10350 > ::1.33116: Flags [P.], seq 3759:3783, ack 1828, win 72, options [nop,nop,TS val 3605920857 ecr 3605920857], length 24
08:59:48.620125 lo    In  IP6 ::1.10350 > ::1.33116: Flags [F.], seq 3783, ack 1828, win 72, options [nop,nop,TS val 3605920857 ecr 3605920857], length 0
08:59:48.620176 lo    In  IP6 ::1.33116 > ::1.10350: Flags [F.], seq 1828, ack 3784, win 95, options [nop,nop,TS val 3605920857 ecr 3605920857], length 0
08:59:48.620195 lo    In  IP6 ::1.10350 > ::1.33116: Flags [.], ack 1829, win 72, options [nop,nop,TS val 3605920857 ecr 3605920857], length 0
08:59:48.626078 lo    In  IP6 ::1.33124 > ::1.10350: Flags [S], seq 1738647968, win 65476, options [mss 65476,sackOK,TS val 3605920863 ecr 0,nop,wscale 10], length 0
08:59:48.626122 lo    In  IP6 ::1.10350 > ::1.33124: Flags [S.], seq 2188886049, ack 1738647969, win 65464, options [mss 65476,sackOK,TS val 3605920863 ecr 3605920863,nop,wscale 10], length 0
08:59:48.626135 lo    In  IP6 ::1.33124 > ::1.10350: Flags [.], ack 1, win 64, options [nop,nop,TS val 3605920863 ecr 3605920863], length 0
08:59:48.627091 lo    In  IP6 ::1.33124 > ::1.10350: Flags [P.], seq 1:1516, ack 1, win 64, options [nop,nop,TS val 3605920864 ecr 3605920863], length 1515
08:59:48.627102 lo    In  IP6 ::1.10350 > ::1.33124: Flags [.], ack 1516, win 72, options [nop,nop,TS val 3605920864 ecr 3605920864], length 0
08:59:48.630455 lo    In  IP6 ::1.10350 > ::1.33124: Flags [P.], seq 1:3430, ack 1516, win 72, options [nop,nop,TS val 3605920867 ecr 3605920864], length 3429
08:59:48.630463 lo    In  IP6 ::1.33124 > ::1.10350: Flags [.], ack 3430, win 93, options [nop,nop,TS val 3605920867 ecr 3605920867], length 0
08:59:48.631076 lo    In  IP6 ::1.33124 > ::1.10350: Flags [P.], seq 1516:1610, ack 3430, win 93, options [nop,nop,TS val 3605920868 ecr 3605920867], length 94
08:59:48.631129 lo    In  IP6 ::1.33124 > ::1.10350: Flags [P.], seq 1610:1702, ack 3430, win 93, options [nop,nop,TS val 3605920868 ecr 3605920867], length 92
08:59:48.631212 lo    In  IP6 ::1.33124 > ::1.10350: Flags [P.], seq 1702:1774, ack 3430, win 93, options [nop,nop,TS val 3605920868 ecr 3605920867], length 72
08:59:48.631274 lo    In  IP6 ::1.10350 > ::1.33124: Flags [.], ack 1774, win 72, options [nop,nop,TS val 3605920868 ecr 3605920868], length 0
08:59:48.631312 lo    In  IP6 ::1.10350 > ::1.33124: Flags [P.], seq 3430:3491, ack 1774, win 72, options [nop,nop,TS val 3605920868 ecr 3605920868], length 61
08:59:48.631349 lo    In  IP6 ::1.10350 > ::1.33124: Flags [P.], seq 3491:3535, ack 1774, win 72, options [nop,nop,TS val 3605920868 ecr 3605920868], length 44
08:59:48.631399 lo    In  IP6 ::1.33124 > ::1.10350: Flags [.], ack 3535, win 93, options [nop,nop,TS val 3605920868 ecr 3605920868], length 0
08:59:48.631439 lo    In  IP6 ::1.33124 > ::1.10350: Flags [P.], seq 1774:1805, ack 3535, win 93, options [nop,nop,TS val 3605920868 ecr 3605920868], length 31
08:59:48.631882 lo    In  IP6 ::1.10350 > ::1.33124: Flags [P.], seq 3535:3574, ack 1805, win 72, options [nop,nop,TS val 3605920869 ecr 3605920868], length 39
08:59:48.632059 lo    In  IP6 ::1.10350 > ::1.33124: Flags [P.], seq 3574:3726, ack 1805, win 72, options [nop,nop,TS val 3605920869 ecr 3605920868], length 152
08:59:48.632097 lo    In  IP6 ::1.33124 > ::1.10350: Flags [.], ack 3726, win 95, options [nop,nop,TS val 3605920869 ecr 3605920869], length 0
08:59:48.632107 lo    In  IP6 ::1.10350 > ::1.33124: Flags [P.], seq 3726:3759, ack 1805, win 72, options [nop,nop,TS val 3605920869 ecr 3605920869], length 33
08:59:48.632153 lo    In  IP6 ::1.33124 > ::1.10350: Flags [P.], seq 1805:1829, ack 3759, win 95, options [nop,nop,TS val 3605920869 ecr 3605920869], length 24
08:59:48.632199 lo    In  IP6 ::1.10350 > ::1.33124: Flags [P.], seq 3759:3783, ack 1829, win 72, options [nop,nop,TS val 3605920869 ecr 3605920869], length 24
08:59:48.632216 lo    In  IP6 ::1.10350 > ::1.33124: Flags [F.], seq 3783, ack 1829, win 72, options [nop,nop,TS val 3605920869 ecr 3605920869], length 0
08:59:48.632296 lo    In  IP6 ::1.33124 > ::1.10350: Flags [F.], seq 1829, ack 3784, win 95, options [nop,nop,TS val 3605920869 ecr 3605920869], length 0
08:59:48.632308 lo    In  IP6 ::1.10350 > ::1.33124: Flags [.], ack 1830, win 72, options [nop,nop,TS val 3605920869 ecr 3605920869], length 0
08:59:48.950079 eth0  In  IP 192.168.147.4.10351 > 192.168.147.2.10351: UDP, length 102
08:59:48.950090 eth0  Out IP 192.168.147.2.10351 > 192.168.147.3.10351: UDP, length 109
08:59:48.950440 eth0  In  IP 192.168.147.3.10351 > 192.168.147.2.10351: UDP, length 20
08:59:48.950483 eth0  Out IP 192.168.147.2.10351 > 192.168.147.4.10351: UDP, length 20
08:59:49.958964 eth0  Out IP 192.168.147.2.10351 > 192.168.147.4.10351: UDP, length 102
08:59:49.959455 eth0  In  IP 192.168.147.4.10351 > 192.168.147.2.10351: UDP, length 20
08:59:50.022348 eth0  In  IP 192.168.147.3.10351 > 192.168.147.2.10351: UDP, length 109
08:59:50.023267 eth0  Out IP 192.168.147.2.10351 > 192.168.147.3.10351: UDP, length 20
08:59:50.890363 eth0  In  IP 192.168.147.3.6443 > 192.168.147.2.47744: Flags [P.], seq 4230722533:4230722669, ack 1964659420, win 73, options [nop,nop,TS val 2850024784 ecr 2319642683], length 136
08:59:50.890464 eth0  Out IP 192.168.147.2.47744 > 192.168.147.3.6443: Flags [.], ack 136, win 95, options [nop,nop,TS val 2319646748 ecr 2850024784], length 0
08:59:50.950384 eth0  Out IP 192.168.147.2.10351 > 192.168.147.4.10351: UDP, length 102
08:59:50.951056 eth0  In  IP 192.168.147.4.10351 > 192.168.147.2.10351: UDP, length 20
08:59:51.023077 eth0  In  IP 192.168.147.3.10351 > 192.168.147.2.10351: UDP, length 109
08:59:51.023625 eth0  Out IP 192.168.147.2.10351 > 192.168.147.3.10351: UDP, length 20
08:59:51.948774 eth0  In  IP 192.168.147.4.10351 > 192.168.147.2.10351: UDP, length 102
08:59:51.949036 eth0  Out IP 192.168.147.2.10351 > 192.168.147.4.10351: UDP, length 20
08:59:51.950574 eth0  Out IP 192.168.147.2.10351 > 192.168.147.3.10351: UDP, length 109
08:59:51.950715 eth0  In  IP 192.168.147.3.10351 > 192.168.147.2.10351: UDP, length 20
08:59:52.223273 eth0  In  IP 192.168.147.3.6443 > 192.168.147.2.14054: Flags [P.], seq 157:311, ack 1, win 116, options [nop,nop,TS val 2850026117 ecr 2267092094], length 154
08:59:52.223435 eth0  Out IP 192.168.147.2.14054 > 192.168.147.3.6443: Flags [.], ack 311, win 151, options [nop,nop,TS val 2267096241 ecr 2850026117], length 0
08:59:52.950581 eth0  Out IP 192.168.147.2.10351 > 192.168.147.4.10351: UDP, length 102
08:59:52.950670 eth0  In  IP 192.168.147.4.10351 > 192.168.147.2.10351: UDP, length 102
08:59:52.951201 eth0  In  IP 192.168.147.4.10351 > 192.168.147.2.10351: UDP, length 20
08:59:52.951406 eth0  Out IP 192.168.147.2.10351 > 192.168.147.4.10351: UDP, length 20
08:59:52.958185 eth0  Out IP 192.168.147.2.47734 > 192.168.147.3.6443: Flags [P.], seq 3896822689:3896822729, ack 1438557696, win 107, options [nop,nop,TS val 2319648816 ecr 2850018104], length 40
08:59:52.958971 eth0  Out IP 192.168.147.2.47734 > 192.168.147.3.6443: Flags [P.], seq 40:590, ack 1, win 107, options [nop,nop,TS val 2319648817 ecr 2850018104], length 550
08:59:52.959271 eth0  In  IP 192.168.147.3.6443 > 192.168.147.2.47734: Flags [.], ack 590, win 73, options [nop,nop,TS val 2850026853 ecr 2319648816], length 0
08:59:52.969565 eth0  In  IP 192.168.147.3.6443 > 192.168.147.2.47734: Flags [P.], seq 1:91, ack 590, win 73, options [nop,nop,TS val 2850026863 ecr 2319648816], length 90
08:59:52.969595 eth0  Out IP 192.168.147.2.47734 > 192.168.147.3.6443: Flags [.], ack 91, win 107, options [nop,nop,TS val 2319648827 ecr 2850026863], length 0
08:59:52.969643 eth0  In  IP 192.168.147.3.6443 > 192.168.147.2.47734: Flags [P.], seq 91:641, ack 590, win 73, options [nop,nop,TS val 2850026863 ecr 2319648827], length 550
08:59:52.969648 eth0  Out IP 192.168.147.2.47734 > 192.168.147.3.6443: Flags [.], ack 641, win 107, options [nop,nop,TS val 2319648827 ecr 2850026863], length 0
08:59:53.398188 eth0  Out IP 192.168.147.2.53376 > 192.168.147.3.10351: Flags [S], seq 4185595125, win 64240, options [mss 1460,sackOK,TS val 2319649256 ecr 0,nop,wscale 10], length 0
08:59:53.398364 eth0  In  IP 192.168.147.3.10351 > 192.168.147.2.53376: Flags [S.], seq 3826274752, ack 4185595126, win 65160, options [mss 1460,sackOK,TS val 2850027292 ecr 2319649256,nop,wscale 10], length 0
08:59:53.398394 eth0  Out IP 192.168.147.2.53376 > 192.168.147.3.10351: Flags [.], ack 1, win 63, options [nop,nop,TS val 2319649256 ecr 2850027292], length 0
08:59:53.399351 eth0  Out IP 192.168.147.2.53376 > 192.168.147.3.10351: Flags [P.], seq 1:238, ack 1, win 63, options [nop,nop,TS val 2319649257 ecr 2850027292], length 237
08:59:53.399401 eth0  In  IP 192.168.147.3.10351 > 192.168.147.2.53376: Flags [.], ack 238, win 64, options [nop,nop,TS val 2850027293 ecr 2319649257], length 0
08:59:53.400318 eth0  In  IP 192.168.147.3.10351 > 192.168.147.2.53376: Flags [P.], seq 1:238, ack 238, win 64, options [nop,nop,TS val 2850027294 ecr 2319649257], length 237
08:59:53.400499 eth0  Out IP 192.168.147.2.53376 > 192.168.147.3.10351: Flags [.], ack 238, win 63, options [nop,nop,TS val 2319649258 ecr 2850027294], length 0
08:59:53.400614 eth0  In  IP 192.168.147.3.10351 > 192.168.147.2.53376: Flags [F.], seq 238, ack 238, win 64, options [nop,nop,TS val 2850027294 ecr 2319649258], length 0
08:59:53.401145 eth0  Out IP 192.168.147.2.53376 > 192.168.147.3.10351: Flags [F.], seq 238, ack 239, win 63, options [nop,nop,TS val 2319649259 ecr 2850027294], length 0
08:59:53.401184 eth0  In  IP 192.168.147.3.10351 > 192.168.147.2.53376: Flags [.], ack 239, win 64, options [nop,nop,TS val 2850027295 ecr 2319649259], length 0
08:59:53.951040 eth0  Out IP 192.168.147.2.10351 > 192.168.147.3.10351: UDP, length 109
08:59:53.952006 eth0  In  IP 192.168.147.3.10351 > 192.168.147.2.10351: UDP, length 20
08:59:54.022278 eth0  In  IP 192.168.147.3.10351 > 192.168.147.2.10351: UDP, length 109
08:59:54.023044 eth0  Out IP 192.168.147.2.10351 > 192.168.147.3.10351: UDP, length 20
08:59:54.951221 eth0  In  IP 192.168.147.4.10351 > 192.168.147.2.10351: UDP, length 102
08:59:54.952022 eth0  Out IP 192.168.147.2.10351 > 192.168.147.3.10351: UDP, length 109
08:59:54.952270 eth0  Out IP 192.168.147.2.10351 > 192.168.147.4.10351: UDP, length 20
08:59:54.954487 eth0  In  IP 192.168.147.3.10351 > 192.168.147.2.10351: UDP, length 20
08:59:55.951221 eth0  Out IP 192.168.147.2.10351 > 192.168.147.4.10351: UDP, length 102
08:59:55.951440 eth0  In  IP 192.168.147.4.10351 > 192.168.147.2.10351: UDP, length 20
08:59:56.022409 eth0  In  IP 192.168.147.3.10351 > 192.168.147.2.10351: UDP, length 109
08:59:56.022950 eth0  Out IP 192.168.147.2.10351 > 192.168.147.3.10351: UDP, length 20
08:59:56.156267 eth0  Out IP 192.168.147.2.56724 > 192.168.147.3.10349: Flags [P.], seq 3341065728:3341065767, ack 1604875310, win 73, options [nop,nop,TS val 2319652014 ecr 2850000048], length 39
08:59:56.156597 eth0  In  IP 192.168.147.3.10349 > 192.168.147.2.56724: Flags [P.], seq 1:40, ack 39, win 72, options [nop,nop,TS val 2850030050 ecr 2319652014], length 39
08:59:56.156621 eth0  Out IP 192.168.147.2.56724 > 192.168.147.3.10349: Flags [.], ack 40, win 73, options [nop,nop,TS val 2319652014 ecr 2850030050], length 0
08:59:56.164795 eth0  In  IP 192.168.147.3.6443 > 192.168.147.2.14054: Flags [P.], seq 311:410, ack 1, win 116, options [nop,nop,TS val 2850030058 ecr 2267096241], length 99
08:59:56.164860 eth0  Out IP 192.168.147.2.14054 > 192.168.147.3.6443: Flags [.], ack 410, win 151, options [nop,nop,TS val 2267100183 ecr 2850030058], length 0
08:59:56.165292 eth0  In  IP 192.168.147.3.6443 > 192.168.147.2.47734: Flags [P.], seq 641:740, ack 590, win 73, options [nop,nop,TS val 2850030059 ecr 2319648827], length 99
08:59:56.165337 eth0  Out IP 192.168.147.2.47734 > 192.168.147.3.6443: Flags [.], ack 740, win 107, options [nop,nop,TS val 2319652023 ecr 2850030059], length 0
08:59:56.165644 eth0  Out IP 192.168.147.2.47734 > 192.168.147.3.6443: Flags [P.], seq 590:625, ack 740, win 107, options [nop,nop,TS val 2319652023 ecr 2850030059], length 35
08:59:56.206319 eth0  In  IP 192.168.147.3.6443 > 192.168.147.2.47734: Flags [.], ack 625, win 73, options [nop,nop,TS val 2850030100 ecr 2319652023], length 0
08:59:56.950743 eth0  Out IP 192.168.147.2.10351 > 192.168.147.3.10351: UDP, length 109
08:59:56.951378 eth0  In  IP 192.168.147.3.10351 > 192.168.147.2.10351: UDP, length 20
08:59:57.950321 eth0  Out IP 192.168.147.2.10351 > 192.168.147.4.10351: UDP, length 102
08:59:57.950837 eth0  In  IP 192.168.147.4.10351 > 192.168.147.2.10351: UDP, length 20
08:59:58.066972 eth0  In  IP 192.168.147.3.6443 > 192.168.147.2.14054: Flags [P.], seq 410:532, ack 1, win 116, options [nop,nop,TS val 2850031961 ecr 2267100183], length 122
08:59:58.067007 eth0  Out IP 192.168.147.2.14054 > 192.168.147.3.6443: Flags [.], ack 532, win 151, options [nop,nop,TS val 2267102085 ecr 2850031961], length 0
08:59:58.607411 lo    In  IP6 ::1.52886 > ::1.10350: Flags [S], seq 2715189939, win 65476, options [mss 65476,sackOK,TS val 3605930844 ecr 0,nop,wscale 10], length 0
08:59:58.607448 lo    In  IP6 ::1.10350 > ::1.52886: Flags [S.], seq 3289599467, ack 2715189940, win 65464, options [mss 65476,sackOK,TS val 3605930844 ecr 3605930844,nop,wscale 10], length 0
08:59:58.607466 lo    In  IP6 ::1.52886 > ::1.10350: Flags [.], ack 1, win 64, options [nop,nop,TS val 3605930844 ecr 3605930844], length 0
08:59:58.608863 lo    In  IP6 ::1.52886 > ::1.10350: Flags [P.], seq 1:1516, ack 1, win 64, options [nop,nop,TS val 3605930846 ecr 3605930844], length 1515
08:59:58.608915 lo    In  IP6 ::1.10350 > ::1.52886: Flags [.], ack 1516, win 72, options [nop,nop,TS val 3605930846 ecr 3605930846], length 0
08:59:58.616461 lo    In  IP6 ::1.10350 > ::1.52886: Flags [P.], seq 1:3430, ack 1516, win 72, options [nop,nop,TS val 3605930853 ecr 3605930846], length 3429
08:59:58.616480 lo    In  IP6 ::1.52886 > ::1.10350: Flags [.], ack 3430, win 93, options [nop,nop,TS val 3605930853 ecr 3605930853], length 0
08:59:58.617315 lo    In  IP6 ::1.52886 > ::1.10350: Flags [P.], seq 1516:1610, ack 3430, win 93, options [nop,nop,TS val 3605930854 ecr 3605930853], length 94
08:59:58.617628 lo    In  IP6 ::1.10350 > ::1.52886: Flags [P.], seq 3430:3491, ack 1610, win 72, options [nop,nop,TS val 3605930854 ecr 3605930854], length 61
08:59:58.617703 lo    In  IP6 ::1.52886 > ::1.10350: Flags [P.], seq 1610:1702, ack 3491, win 93, options [nop,nop,TS val 3605930854 ecr 3605930854], length 92
08:59:58.617819 lo    In  IP6 ::1.10350 > ::1.52886: Flags [P.], seq 3491:3526, ack 1702, win 72, options [nop,nop,TS val 3605930855 ecr 3605930854], length 35
08:59:58.617902 lo    In  IP6 ::1.10350 > ::1.52886: Flags [P.], seq 3526:3557, ack 1702, win 72, options [nop,nop,TS val 3605930855 ecr 3605930854], length 31
08:59:58.618132 lo    In  IP6 ::1.52886 > ::1.10350: Flags [.], ack 3557, win 93, options [nop,nop,TS val 3605930855 ecr 3605930855], length 0
08:59:58.618155 lo    In  IP6 ::1.52886 > ::1.10350: Flags [P.], seq 1702:1773, ack 3557, win 93, options [nop,nop,TS val 3605930855 ecr 3605930855], length 71
08:59:58.618359 lo    In  IP6 ::1.52886 > ::1.10350: Flags [P.], seq 1773:1804, ack 3557, win 93, options [nop,nop,TS val 3605930855 ecr 3605930855], length 31
08:59:58.618537 lo    In  IP6 ::1.10350 > ::1.52886: Flags [.], ack 1804, win 72, options [nop,nop,TS val 3605930855 ecr 3605930855], length 0
08:59:58.624900 lo    In  IP6 ::1.10350 > ::1.52886: Flags [P.], seq 3557:3596, ack 1804, win 72, options [nop,nop,TS val 3605930862 ecr 3605930855], length 39
08:59:58.625456 lo    In  IP6 ::1.52918 > ::1.10350: Flags [S], seq 2183692403, win 65476, options [mss 65476,sackOK,TS val 3605930862 ecr 0,nop,wscale 10], length 0
08:59:58.625475 lo    In  IP6 ::1.10350 > ::1.52918: Flags [S.], seq 3638611105, ack 2183692404, win 65464, options [mss 65476,sackOK,TS val 3605930862 ecr 3605930862,nop,wscale 10], length 0
08:59:58.625485 lo    In  IP6 ::1.52918 > ::1.10350: Flags [.], ack 1, win 64, options [nop,nop,TS val 3605930862 ecr 3605930862], length 0
08:59:58.625705 lo    In  IP6 ::1.10350 > ::1.52886: Flags [P.], seq 3596:3747, ack 1804, win 72, options [nop,nop,TS val 3605930862 ecr 3605930855], length 151
08:59:58.625788 lo    In  IP6 ::1.10350 > ::1.52886: Flags [P.], seq 3747:3780, ack 1804, win 72, options [nop,nop,TS val 3605930863 ecr 3605930855], length 33
08:59:58.625889 lo    In  IP6 ::1.52886 > ::1.10350: Flags [.], ack 3780, win 95, options [nop,nop,TS val 3605930863 ecr 3605930862], length 0
08:59:58.626073 lo    In  IP6 ::1.52886 > ::1.10350: Flags [P.], seq 1804:1828, ack 3780, win 95, options [nop,nop,TS val 3605930863 ecr 3605930862], length 24
08:59:58.626139 lo    In  IP6 ::1.52886 > ::1.10350: Flags [F.], seq 1828, ack 3780, win 95, options [nop,nop,TS val 3605930863 ecr 3605930862], length 0
08:59:58.626223 lo    In  IP6 ::1.10350 > ::1.52886: Flags [P.], seq 3780:3804, ack 1829, win 72, options [nop,nop,TS val 3605930863 ecr 3605930863], length 24
08:59:58.626240 lo    In  IP6 ::1.52886 > ::1.10350: Flags [R], seq 2715191768, win 0, length 0
08:59:58.626280 lo    In  IP6 ::1.52918 > ::1.10350: Flags [P.], seq 1:1516, ack 1, win 64, options [nop,nop,TS val 3605930863 ecr 3605930862], length 1515
08:59:58.626292 lo    In  IP6 ::1.10350 > ::1.52918: Flags [.], ack 1516, win 72, options [nop,nop,TS val 3605930863 ecr 3605930863], length 0
08:59:58.629740 lo    In  IP6 ::1.10350 > ::1.52918: Flags [P.], seq 1:3430, ack 1516, win 72, options [nop,nop,TS val 3605930866 ecr 3605930863], length 3429
08:59:58.629749 lo    In  IP6 ::1.52918 > ::1.10350: Flags [.], ack 3430, win 93, options [nop,nop,TS val 3605930866 ecr 3605930866], length 0
08:59:58.630286 lo    In  IP6 ::1.52918 > ::1.10350: Flags [P.], seq 1516:1610, ack 3430, win 93, options [nop,nop,TS val 3605930867 ecr 3605930866], length 94
08:59:58.630344 lo    In  IP6 ::1.52918 > ::1.10350: Flags [P.], seq 1610:1702, ack 3430, win 93, options [nop,nop,TS val 3605930867 ecr 3605930866], length 92
08:59:58.630404 lo    In  IP6 ::1.10350 > ::1.52918: Flags [.], ack 1702, win 72, options [nop,nop,TS val 3605930867 ecr 3605930867], length 0
08:59:58.630434 lo    In  IP6 ::1.52918 > ::1.10350: Flags [P.], seq 1702:1774, ack 3430, win 93, options [nop,nop,TS val 3605930867 ecr 3605930867], length 72
08:59:58.630580 lo    In  IP6 ::1.10350 > ::1.52918: Flags [P.], seq 3430:3491, ack 1774, win 72, options [nop,nop,TS val 3605930867 ecr 3605930867], length 61
08:59:58.630601 lo    In  IP6 ::1.10350 > ::1.52918: Flags [P.], seq 3491:3535, ack 1774, win 72, options [nop,nop,TS val 3605930867 ecr 3605930867], length 44
08:59:58.630624 lo    In  IP6 ::1.52918 > ::1.10350: Flags [.], ack 3535, win 93, options [nop,nop,TS val 3605930867 ecr 3605930867], length 0
08:59:58.630656 lo    In  IP6 ::1.52918 > ::1.10350: Flags [P.], seq 1774:1805, ack 3535, win 93, options [nop,nop,TS val 3605930867 ecr 3605930867], length 31
08:59:58.631048 lo    In  IP6 ::1.10350 > ::1.52918: Flags [P.], seq 3535:3574, ack 1805, win 72, options [nop,nop,TS val 3605930868 ecr 3605930867], length 39
08:59:58.631113 lo    In  IP6 ::1.10350 > ::1.52918: Flags [P.], seq 3574:3726, ack 1805, win 72, options [nop,nop,TS val 3605930868 ecr 3605930867], length 152
08:59:58.631120 lo    In  IP6 ::1.52918 > ::1.10350: Flags [.], ack 3726, win 95, options [nop,nop,TS val 3605930868 ecr 3605930868], length 0
08:59:58.631129 lo    In  IP6 ::1.10350 > ::1.52918: Flags [P.], seq 3726:3759, ack 1805, win 72, options [nop,nop,TS val 3605930868 ecr 3605930868], length 33
08:59:58.631329 lo    In  IP6 ::1.52918 > ::1.10350: Flags [P.], seq 1805:1829, ack 3759, win 95, options [nop,nop,TS val 3605930868 ecr 3605930868], length 24
08:59:58.631390 lo    In  IP6 ::1.10350 > ::1.52918: Flags [P.], seq 3759:3783, ack 1829, win 72, options [nop,nop,TS val 3605930868 ecr 3605930868], length 24
08:59:58.631405 lo    In  IP6 ::1.10350 > ::1.52918: Flags [F.], seq 3783, ack 1829, win 72, options [nop,nop,TS val 3605930868 ecr 3605930868], length 0
08:59:58.631472 lo    In  IP6 ::1.52918 > ::1.10350: Flags [F.], seq 1829, ack 3784, win 95, options [nop,nop,TS val 3605930868 ecr 3605930868], length 0
08:59:58.631481 lo    In  IP6 ::1.10350 > ::1.52918: Flags [.], ack 1830, win 72, options [nop,nop,TS val 3605930868 ecr 3605930868], length 0
08:59:58.949109 eth0  In  IP 192.168.147.4.10351 > 192.168.147.2.10351: UDP, length 102
08:59:58.949282 eth0  Out IP 192.168.147.2.10351 > 192.168.147.4.10351: UDP, length 20
08:59:58.950729 eth0  Out IP 192.168.147.2.10351 > 192.168.147.4.10351: UDP, length 102
08:59:58.950855 eth0  In  IP 192.168.147.4.10351 > 192.168.147.2.10351: UDP, length 20
08:59:59.022364 eth0  In  IP 192.168.147.3.10351 > 192.168.147.2.10351: UDP, length 109
08:59:59.022868 eth0  Out IP 192.168.147.2.10351 > 192.168.147.3.10351: UDP, length 20
08:59:59.950578 eth0  Out IP 192.168.147.2.10351 > 192.168.147.3.10351: UDP, length 109
08:59:59.951024 eth0  In  IP 192.168.147.3.10351 > 192.168.147.2.10351: UDP, length 20
09:00:00.923666 eth0  Out IP 192.168.147.2.12380 > 192.168.147.3.6443: Flags [P.], seq 3671071025:3671071064, ack 2742336511, win 110, options [nop,nop,TS val 2267104941 ecr 2850004809], length 39
09:00:00.924059 eth0  In  IP 192.168.147.3.6443 > 192.168.147.2.12380: Flags [P.], seq 1:40, ack 39, win 71, options [nop,nop,TS val 2850034818 ecr 2267104941], length 39
09:00:00.924096 eth0  Out IP 192.168.147.2.12380 > 192.168.147.3.6443: Flags [.], ack 40, win 110, options [nop,nop,TS val 2267104942 ecr 2850034818], length 0
09:00:00.949665 eth0  In  IP 192.168.147.4.10351 > 192.168.147.2.10351: UDP, length 102
09:00:00.950127 eth0  Out IP 192.168.147.2.10351 > 192.168.147.3.10351: UDP, length 109
09:00:00.950942 eth0  In  IP 192.168.147.3.10351 > 192.168.147.2.10351: UDP, length 20
09:00:00.951196 eth0  Out IP 192.168.147.2.10351 > 192.168.147.4.10351: UDP, length 20
09:00:01.023204 eth0  In  IP 192.168.147.3.10351 > 192.168.147.2.10351: UDP, length 109
09:00:01.023960 eth0  Out IP 192.168.147.2.10351 > 192.168.147.3.10351: UDP, length 20
09:00:01.950037 eth0  Out IP 192.168.147.2.10351 > 192.168.147.4.10351: UDP, length 102
09:00:01.950343 eth0  In  IP 192.168.147.4.10351 > 192.168.147.2.10351: UDP, length 20
09:00:02.950200 eth0  In  IP 192.168.147.4.10351 > 192.168.147.2.10351: UDP, length 102
09:00:02.952186 eth0  Out IP 192.168.147.2.10351 > 192.168.147.4.10351: UDP, length 20
09:00:02.952397 eth0  Out IP 192.168.147.2.10351 > 192.168.147.4.10351: UDP, length 102
09:00:02.952873 eth0  In  IP 192.168.147.4.10351 > 192.168.147.2.10351: UDP, length 20
09:00:03.022314 eth0  In  IP 192.168.147.3.10351 > 192.168.147.2.10351: UDP, length 109
09:00:03.022823 eth0  Out IP 192.168.147.2.10351 > 192.168.147.3.10351: UDP, length 20
09:00:03.085451 eth0  Out IP 192.168.147.2.47734 > 192.168.147.3.6443: Flags [P.], seq 625:665, ack 740, win 107, options [nop,nop,TS val 2319658943 ecr 2850030100], length 40
09:00:03.085508 eth0  In  IP 192.168.147.3.6443 > 192.168.147.2.47734: Flags [.], ack 665, win 73, options [nop,nop,TS val 2850036979 ecr 2319658943], length 0
09:00:03.085940 eth0  Out IP 192.168.147.2.47734 > 192.168.147.3.6443: Flags [P.], seq 665:1214, ack 740, win 107, options [nop,nop,TS val 2319658944 ecr 2850036979], length 549
09:00:03.085988 eth0  In  IP 192.168.147.3.6443 > 192.168.147.2.47734: Flags [.], ack 1214, win 73, options [nop,nop,TS val 2850036980 ecr 2319658944], length 0
09:00:03.096170 eth0  In  IP 192.168.147.3.6443 > 192.168.147.2.47734: Flags [P.], seq 740:830, ack 1214, win 73, options [nop,nop,TS val 2850036990 ecr 2319658944], length 90
09:00:03.096268 eth0  In  IP 192.168.147.3.6443 > 192.168.147.2.47734: Flags [P.], seq 830:1379, ack 1214, win 73, options [nop,nop,TS val 2850036990 ecr 2319658944], length 549
09:00:03.096545 eth0  Out IP 192.168.147.2.47734 > 192.168.147.3.6443: Flags [.], ack 1379, win 107, options [nop,nop,TS val 2319658954 ecr 2850036990], length 0
09:00:03.403119 eth0  In  ARP, Request who-has 192.168.147.2 tell 192.168.147.4, length 28
09:00:03.403133 eth0  Out ARP, Reply 192.168.147.2 is-at 96:0a:f0:d7:6c:7d, length 28
09:00:03.949886 eth0  Out IP 192.168.147.2.10351 > 192.168.147.3.10351: UDP, length 109
09:00:03.951217 eth0  In  IP 192.168.147.3.10351 > 192.168.147.2.10351: UDP, length 20
09:00:04.022420 eth0  In  IP 192.168.147.3.10351 > 192.168.147.2.10351: UDP, length 109
09:00:04.022534 eth0  Out IP 192.168.147.2.10351 > 192.168.147.3.10351: UDP, length 20
09:00:04.950049 eth0  Out IP 192.168.147.2.10351 > 192.168.147.4.10351: UDP, length 102
09:00:04.950598 eth0  In  IP 192.168.147.4.10351 > 192.168.147.2.10351: UDP, length 20
09:00:05.950520 eth0  In  IP 192.168.147.4.10351 > 192.168.147.2.10351: UDP, length 102
09:00:05.951091 eth0  Out IP 192.168.147.2.10351 > 192.168.147.3.10351: UDP, length 109
09:00:05.951214 eth0  Out IP 192.168.147.2.10351 > 192.168.147.4.10351: UDP, length 20
09:00:05.951677 eth0  In  IP 192.168.147.3.10351 > 192.168.147.2.10351: UDP, length 20
09:00:06.022204 eth0  In  IP 192.168.147.3.10351 > 192.168.147.2.10351: UDP, length 109
09:00:06.023057 eth0  Out IP 192.168.147.2.10351 > 192.168.147.3.10351: UDP, length 20
09:00:06.636743 eth0  In  IP 192.168.147.3.6443 > 192.168.147.2.14054: Flags [P.], seq 532:668, ack 1, win 116, options [nop,nop,TS val 2850040530 ecr 2267102085], length 136
09:00:06.636841 eth0  Out IP 192.168.147.2.14054 > 192.168.147.3.6443: Flags [.], ack 668, win 151, options [nop,nop,TS val 2267110655 ecr 2850040530], length 0
09:00:06.637248 eth0  In  IP 192.168.147.3.6443 > 192.168.147.2.47734: Flags [P.], seq 1379:1515, ack 1214, win 73, options [nop,nop,TS val 2850040531 ecr 2319658954], length 136
09:00:06.678597 eth0  Out IP 192.168.147.2.47734 > 192.168.147.3.6443: Flags [.], ack 1515, win 107, options [nop,nop,TS val 2319662536 ecr 2850040531], length 0
09:00:06.951034 eth0  Out IP 192.168.147.2.10351 > 192.168.147.3.10351: UDP, length 109
09:00:06.951644 eth0  In  IP 192.168.147.3.10351 > 192.168.147.2.10351: UDP, length 20
09:00:07.313986 eth0  In  IP 192.168.147.3.6443 > 192.168.147.2.47734: Flags [P.], seq 1515:1631, ack 1214, win 73, options [nop,nop,TS val 2850041208 ecr 2319662536], length 116
09:00:07.314042 eth0  Out IP 192.168.147.2.47734 > 192.168.147.3.6443: Flags [.], ack 1631, win 107, options [nop,nop,TS val 2319663172 ecr 2850041208], length 0
09:00:07.950602 eth0  In  IP 192.168.147.4.10351 > 192.168.147.2.10351: UDP, length 102
09:00:07.950746 eth0  Out IP 192.168.147.2.10351 > 192.168.147.4.10351: UDP, length 102
09:00:07.951161 eth0  In  IP 192.168.147.4.10351 > 192.168.147.2.10351: UDP, length 20
09:00:07.951255 eth0  Out IP 192.168.147.2.10351 > 192.168.147.4.10351: UDP, length 20
09:00:08.402664 eth0  Out IP 192.168.147.2.50846 > 192.168.147.3.10351: Flags [S], seq 831904717, win 64240, options [mss 1460,sackOK,TS val 2319664260 ecr 0,nop,wscale 10], length 0
09:00:08.402679 eth0  In  IP 192.168.147.4.47418 > 192.168.147.2.10351: Flags [S], seq 3695655938, win 64240, options [mss 1460,sackOK,TS val 1356879277 ecr 0,nop,wscale 10], length 0
09:00:08.402753 eth0  Out IP 192.168.147.2.10351 > 192.168.147.4.47418: Flags [S.], seq 2545438043, ack 3695655939, win 65160, options [mss 1460,sackOK,TS val 3861026178 ecr 1356879277,nop,wscale 10], length 0
09:00:08.402818 eth0  In  IP 192.168.147.3.10351 > 192.168.147.2.50846: Flags [S.], seq 191136309, ack 831904718, win 65160, options [mss 1460,sackOK,TS val 2850042296 ecr 2319664260,nop,wscale 10], length 0
09:00:08.402839 eth0  In  IP 192.168.147.4.47418 > 192.168.147.2.10351: Flags [.], ack 1, win 63, options [nop,nop,TS val 1356879278 ecr 3861026178], length 0
09:00:08.402841 eth0  Out IP 192.168.147.2.50846 > 192.168.147.3.10351: Flags [.], ack 1, win 63, options [nop,nop,TS val 2319664261 ecr 2850042296], length 0
09:00:08.403484 eth0  In  IP 192.168.147.4.47418 > 192.168.147.2.10351: Flags [P.], seq 1:238, ack 1, win 63, options [nop,nop,TS val 1356879278 ecr 3861026178], length 237
09:00:08.403507 eth0  Out IP 192.168.147.2.10351 > 192.168.147.4.47418: Flags [.], ack 238, win 64, options [nop,nop,TS val 3861026179 ecr 1356879278], length 0
09:00:08.403742 eth0  Out IP 192.168.147.2.50846 > 192.168.147.3.10351: Flags [P.], seq 1:238, ack 1, win 63, options [nop,nop,TS val 2319664261 ecr 2850042296], length 237
09:00:08.403809 eth0  In  IP 192.168.147.3.10351 > 192.168.147.2.50846: Flags [.], ack 238, win 64, options [nop,nop,TS val 2850042298 ecr 2319664261], length 0
09:00:08.404389 eth0  Out IP 192.168.147.2.10351 > 192.168.147.4.47418: Flags [P.], seq 1:238, ack 238, win 64, options [nop,nop,TS val 3861026180 ecr 1356879278], length 237
09:00:08.404465 eth0  In  IP 192.168.147.4.47418 > 192.168.147.2.10351: Flags [.], ack 238, win 63, options [nop,nop,TS val 1356879279 ecr 3861026180], length 0
09:00:08.404499 eth0  In  IP 192.168.147.3.10351 > 192.168.147.2.50846: Flags [P.], seq 1:237, ack 238, win 64, options [nop,nop,TS val 2850042298 ecr 2319664261], length 236
09:00:08.404526 eth0  Out IP 192.168.147.2.10351 > 192.168.147.4.47418: Flags [F.], seq 238, ack 238, win 64, options [nop,nop,TS val 3861026180 ecr 1356879279], length 0
09:00:08.404531 eth0  Out IP 192.168.147.2.50846 > 192.168.147.3.10351: Flags [.], ack 237, win 63, options [nop,nop,TS val 2319664262 ecr 2850042298], length 0
09:00:08.404624 eth0  In  IP 192.168.147.3.10351 > 192.168.147.2.50846: Flags [F.], seq 237, ack 238, win 64, options [nop,nop,TS val 2850042298 ecr 2319664262], length 0
09:00:08.404802 eth0  Out IP 192.168.147.2.50846 > 192.168.147.3.10351: Flags [F.], seq 238, ack 238, win 63, options [nop,nop,TS val 2319664262 ecr 2850042298], length 0
09:00:08.404853 eth0  In  IP 192.168.147.3.10351 > 192.168.147.2.50846: Flags [.], ack 239, win 64, options [nop,nop,TS val 2850042299 ecr 2319664262], length 0
09:00:08.404951 eth0  In  IP 192.168.147.4.47418 > 192.168.147.2.10351: Flags [F.], seq 238, ack 239, win 63, options [nop,nop,TS val 1356879280 ecr 3861026180], length 0
09:00:08.404968 eth0  Out IP 192.168.147.2.10351 > 192.168.147.4.47418: Flags [.], ack 239, win 64, options [nop,nop,TS val 3861026181 ecr 1356879280], length 0
09:00:08.606550 lo    In  IP6 ::1.40948 > ::1.10350: Flags [S], seq 1401120839, win 65476, options [mss 65476,sackOK,TS val 3605940843 ecr 0,nop,wscale 10], length 0
09:00:08.606593 lo    In  IP6 ::1.10350 > ::1.40948: Flags [S.], seq 1141998218, ack 1401120840, win 65464, options [mss 65476,sackOK,TS val 3605940843 ecr 3605940843,nop,wscale 10], length 0
09:00:08.606612 lo    In  IP6 ::1.40948 > ::1.10350: Flags [.], ack 1, win 64, options [nop,nop,TS val 3605940843 ecr 3605940843], length 0
09:00:08.607329 lo    In  IP6 ::1.40948 > ::1.10350: Flags [P.], seq 1:1516, ack 1, win 64, options [nop,nop,TS val 3605940844 ecr 3605940843], length 1515
09:00:08.607350 lo    In  IP6 ::1.10350 > ::1.40948: Flags [.], ack 1516, win 72, options [nop,nop,TS val 3605940844 ecr 3605940844], length 0
09:00:08.615078 lo    In  IP6 ::1.10350 > ::1.40948: Flags [P.], seq 1:3430, ack 1516, win 72, options [nop,nop,TS val 3605940852 ecr 3605940844], length 3429
09:00:08.615121 lo    In  IP6 ::1.40948 > ::1.10350: Flags [.], ack 3430, win 93, options [nop,nop,TS val 3605940852 ecr 3605940852], length 0
09:00:08.615947 lo    In  IP6 ::1.40948 > ::1.10350: Flags [P.], seq 1516:1610, ack 3430, win 93, options [nop,nop,TS val 3605940853 ecr 3605940852], length 94
09:00:08.616186 lo    In  IP6 ::1.10350 > ::1.40948: Flags [P.], seq 3430:3491, ack 1610, win 72, options [nop,nop,TS val 3605940853 ecr 3605940853], length 61
09:00:08.616297 lo    In  IP6 ::1.40948 > ::1.10350: Flags [P.], seq 1610:1702, ack 3491, win 93, options [nop,nop,TS val 3605940853 ecr 3605940853], length 92
09:00:08.616368 lo    In  IP6 ::1.10350 > ::1.40948: Flags [P.], seq 3491:3526, ack 1702, win 72, options [nop,nop,TS val 3605940853 ecr 3605940853], length 35
09:00:08.616475 lo    In  IP6 ::1.10350 > ::1.40948: Flags [P.], seq 3526:3557, ack 1702, win 72, options [nop,nop,TS val 3605940853 ecr 3605940853], length 31
09:00:08.616641 lo    In  IP6 ::1.40948 > ::1.10350: Flags [P.], seq 1702:1773, ack 3557, win 93, options [nop,nop,TS val 3605940853 ecr 3605940853], length 71
09:00:08.616681 lo    In  IP6 ::1.40948 > ::1.10350: Flags [P.], seq 1773:1804, ack 3557, win 93, options [nop,nop,TS val 3605940853 ecr 3605940853], length 31
09:00:08.616853 lo    In  IP6 ::1.10350 > ::1.40948: Flags [.], ack 1804, win 72, options [nop,nop,TS val 3605940854 ecr 3605940853], length 0
09:00:08.617471 lo    In  IP6 ::1.10350 > ::1.40948: Flags [P.], seq 3557:3596, ack 1804, win 72, options [nop,nop,TS val 3605940854 ecr 3605940853], length 39
09:00:08.617557 lo    In  IP6 ::1.10350 > ::1.40948: Flags [P.], seq 3596:3748, ack 1804, win 72, options [nop,nop,TS val 3605940854 ecr 3605940853], length 152
09:00:08.617591 lo    In  IP6 ::1.10350 > ::1.40948: Flags [P.], seq 3748:3781, ack 1804, win 72, options [nop,nop,TS val 3605940854 ecr 3605940853], length 33
09:00:08.617601 lo    In  IP6 ::1.40948 > ::1.10350: Flags [.], ack 3781, win 94, options [nop,nop,TS val 3605940854 ecr 3605940854], length 0
09:00:08.617868 lo    In  IP6 ::1.40948 > ::1.10350: Flags [P.], seq 1804:1828, ack 3781, win 94, options [nop,nop,TS val 3605940855 ecr 3605940854], length 24
09:00:08.617941 lo    In  IP6 ::1.40948 > ::1.10350: Flags [F.], seq 1828, ack 3781, win 94, options [nop,nop,TS val 3605940855 ecr 3605940854], length 0
09:00:08.617975 lo    In  IP6 ::1.10350 > ::1.40948: Flags [P.], seq 3781:3805, ack 1829, win 72, options [nop,nop,TS val 3605940855 ecr 3605940855], length 24
09:00:08.617995 lo    In  IP6 ::1.40948 > ::1.10350: Flags [R], seq 1401122668, win 0, length 0
09:00:08.625298 lo    In  IP6 ::1.40980 > ::1.10350: Flags [S], seq 2324196118, win 65476, options [mss 65476,sackOK,TS val 3605940862 ecr 0,nop,wscale 10], length 0
09:00:08.625318 lo    In  IP6 ::1.10350 > ::1.40980: Flags [S.], seq 673476900, ack 2324196119, win 65464, options [mss 65476,sackOK,TS val 3605940862 ecr 3605940862,nop,wscale 10], length 0
09:00:08.625328 lo    In  IP6 ::1.40980 > ::1.10350: Flags [.], ack 1, win 64, options [nop,nop,TS val 3605940862 ecr 3605940862], length 0
09:00:08.625976 lo    In  IP6 ::1.40980 > ::1.10350: Flags [P.], seq 1:1516, ack 1, win 64, options [nop,nop,TS val 3605940863 ecr 3605940862], length 1515
09:00:08.625986 lo    In  IP6 ::1.10350 > ::1.40980: Flags [.], ack 1516, win 72, options [nop,nop,TS val 3605940863 ecr 3605940863], length 0
09:00:08.629072 lo    In  IP6 ::1.10350 > ::1.40980: Flags [P.], seq 1:3430, ack 1516, win 72, options [nop,nop,TS val 3605940866 ecr 3605940863], length 3429
09:00:08.629081 lo    In  IP6 ::1.40980 > ::1.10350: Flags [.], ack 3430, win 93, options [nop,nop,TS val 3605940866 ecr 3605940866], length 0
09:00:08.629523 lo    In  IP6 ::1.40980 > ::1.10350: Flags [P.], seq 1516:1610, ack 3430, win 93, options [nop,nop,TS val 3605940866 ecr 3605940866], length 94
09:00:08.629684 lo    In  IP6 ::1.10350 > ::1.40980: Flags [P.], seq 3430:3491, ack 1610, win 72, options [nop,nop,TS val 3605940866 ecr 3605940866], length 61
09:00:08.629749 lo    In  IP6 ::1.40980 > ::1.10350: Flags [P.], seq 1610:1702, ack 3491, win 93, options [nop,nop,TS val 3605940866 ecr 3605940866], length 92
09:00:08.629801 lo    In  IP6 ::1.10350 > ::1.40980: Flags [P.], seq 3491:3526, ack 1702, win 72, options [nop,nop,TS val 3605940867 ecr 3605940866], length 35
09:00:08.629833 lo    In  IP6 ::1.10350 > ::1.40980: Flags [P.], seq 3526:3557, ack 1702, win 72, options [nop,nop,TS val 3605940867 ecr 3605940866], length 31
09:00:08.630041 lo    In  IP6 ::1.40980 > ::1.10350: Flags [.], ack 3557, win 93, options [nop,nop,TS val 3605940867 ecr 3605940867], length 0
