reading from file /capture-test-traffic-pod.pcap0, link-type LINUX_SLL2 (Linux cooked v2), snapshot length 262144
Warning: interface names might be incorrect
14:36:07.303946 eth0  Out IP 172.31.130.3 > 8.8.8.8: ICMP echo request, id 11, seq 1, length 64
14:36:07.323929 eth0  In  IP 8.8.8.8 > 172.31.130.3: ICMP echo reply, id 11, seq 1, length 64
14:36:08.308819 eth0  Out IP 172.31.130.3 > 8.8.8.8: ICMP echo request, id 11, seq 2, length 64
14:36:08.332736 eth0  In  IP 8.8.8.8 > 172.31.130.3: ICMP echo reply, id 11, seq 2, length 64
14:36:08.561422 eth0  Out IP6 fe80::98c5:3eff:fef9:ec0e > ff02::2: ICMP6, router solicitation, length 16
14:36:09.309427 eth0  Out IP 172.31.130.3 > 8.8.8.8: ICMP echo request, id 11, seq 3, length 64
14:36:09.333915 eth0  In  IP 8.8.8.8 > 172.31.130.3: ICMP echo reply, id 11, seq 3, length 64
14:36:10.310400 eth0  Out IP 172.31.130.3 > 8.8.8.8: ICMP echo request, id 11, seq 4, length 64
14:36:10.329578 eth0  In  IP 8.8.8.8 > 172.31.130.3: ICMP echo reply, id 11, seq 4, length 64
14:36:11.633958 eth0  In  ARP, Request who-has 172.31.130.3 tell 172.31.130.1, length 28
14:36:11.633975 eth0  Out ARP, Reply 172.31.130.3 is-at 9a:c5:3e:f9:ec:0e, length 28
