reading from file /capture-test-traffic-pod.pcap0, link-type LINUX_SLL2 (Linux cooked v2), snapshot length 262144
Warning: interface names might be incorrect
12:32:11.869446 eth0  In  IP 192.168.147.2.10351 > 192.168.147.4.10351: UDP, length 100
12:32:11.869973 eth0  Out IP 192.168.147.4.10351 > 192.168.147.2.10351: UDP, length 18
12:32:11.934489 eth0  In  IP6 fe80::c822:8fff:fea8:da7f > fe80::5078:b3ff:fe03:7961: ICMP6, neighbor solicitation, who has fe80::5078:b3ff:fe03:7961, length 32
12:32:11.934545 eth0  Out IP6 fe80::5078:b3ff:fe03:7961 > fe80::c822:8fff:fea8:da7f: ICMP6, neighbor advertisement, tgt is fe80::5078:b3ff:fe03:7961, length 24
12:32:12.015236 test-tra-0c94c6 P   IP 172.31.129.2 > 8.8.8.8: ICMP echo request, id 11, seq 1, length 64
12:32:12.015674 antrea-gw0 In  IP 172.31.129.2 > 8.8.8.8: ICMP echo request, id 11, seq 1, length 64
12:32:12.015715 eth0  Out IP 192.168.147.4 > 8.8.8.8: ICMP echo request, id 11, seq 1, length 64
12:32:12.030545 eth0  In  IP 8.8.8.8 > 192.168.147.4: ICMP echo reply, id 11, seq 1, length 64
12:32:12.030582 antrea-gw0 Out IP 8.8.8.8 > 172.31.129.2: ICMP echo reply, id 11, seq 1, length 64
12:32:12.030615 test-tra-0c94c6 Out IP 8.8.8.8 > 172.31.129.2: ICMP echo reply, id 11, seq 1, length 64
12:32:12.367964 lo    In  IP6 ::1.38268 > ::1.10350: Flags [S], seq 1072538969, win 65476, options [mss 65476,sackOK,TS val 3617120200 ecr 0,nop,wscale 10], length 0
12:32:12.367995 lo    In  IP6 ::1.10350 > ::1.38268: Flags [S.], seq 287099060, ack 1072538970, win 65464, options [mss 65476,sackOK,TS val 3617120200 ecr 3617120200,nop,wscale 10], length 0
12:32:12.368011 lo    In  IP6 ::1.38268 > ::1.10350: Flags [.], ack 1, win 64, options [nop,nop,TS val 3617120200 ecr 3617120200], length 0
12:32:12.369169 lo    In  IP6 ::1.38268 > ::1.10350: Flags [P.], seq 1:1516, ack 1, win 64, options [nop,nop,TS val 3617120201 ecr 3617120200], length 1515
12:32:12.369202 lo    In  IP6 ::1.10350 > ::1.38268: Flags [.], ack 1516, win 72, options [nop,nop,TS val 3617120202 ecr 3617120201], length 0
12:32:12.376007 lo    In  IP6 ::1.10350 > ::1.38268: Flags [P.], seq 1:3430, ack 1516, win 72, options [nop,nop,TS val 3617120208 ecr 3617120201], length 3429
12:32:12.376054 lo    In  IP6 ::1.38268 > ::1.10350: Flags [.], ack 3430, win 93, options [nop,nop,TS val 3617120208 ecr 3617120208], length 0
12:32:12.377163 lo    In  IP6 ::1.38268 > ::1.10350: Flags [P.], seq 1516:1610, ack 3430, win 93, options [nop,nop,TS val 3617120209 ecr 3617120208], length 94
12:32:12.377766 lo    In  IP6 ::1.10350 > ::1.38268: Flags [P.], seq 3430:3491, ack 1610, win 72, options [nop,nop,TS val 3617120210 ecr 3617120209], length 61
12:32:12.378247 lo    In  IP6 ::1.38268 > ::1.10350: Flags [P.], seq 1610:1702, ack 3491, win 93, options [nop,nop,TS val 3617120211 ecr 3617120210], length 92
12:32:12.378391 lo    In  IP6 ::1.38268 > ::1.10350: Flags [P.], seq 1702:1773, ack 3491, win 93, options [nop,nop,TS val 3617120211 ecr 3617120210], length 71
12:32:12.378412 lo    In  IP6 ::1.38268 > ::1.10350: Flags [P.], seq 1773:1804, ack 3491, win 93, options [nop,nop,TS val 3617120211 ecr 3617120210], length 31
12:32:12.378450 lo    In  IP6 ::1.10350 > ::1.38268: Flags [P.], seq 3491:3526, ack 1804, win 72, options [nop,nop,TS val 3617120211 ecr 3617120211], length 35
12:32:12.378483 lo    In  IP6 ::1.10350 > ::1.38268: Flags [P.], seq 3526:3557, ack 1804, win 72, options [nop,nop,TS val 3617120211 ecr 3617120211], length 31
12:32:12.378497 lo    In  IP6 ::1.38268 > ::1.10350: Flags [.], ack 3557, win 93, options [nop,nop,TS val 3617120211 ecr 3617120211], length 0
12:32:12.379289 lo    In  IP6 ::1.10350 > ::1.38268: Flags [P.], seq 3557:3596, ack 1804, win 72, options [nop,nop,TS val 3617120212 ecr 3617120211], length 39
12:32:12.379365 lo    In  IP6 ::1.10350 > ::1.38268: Flags [P.], seq 3596:3748, ack 1804, win 72, options [nop,nop,TS val 3617120212 ecr 3617120211], length 152
12:32:12.379396 lo    In  IP6 ::1.38268 > ::1.10350: Flags [.], ack 3748, win 94, options [nop,nop,TS val 3617120212 ecr 3617120212], length 0
12:32:12.379430 lo    In  IP6 ::1.10350 > ::1.38268: Flags [P.], seq 3748:3781, ack 1804, win 72, options [nop,nop,TS val 3617120212 ecr 3617120212], length 33
12:32:12.379548 lo    In  IP6 ::1.38268 > ::1.10350: Flags [P.], seq 1804:1828, ack 3781, win 94, options [nop,nop,TS val 3617120212 ecr 3617120212], length 24
12:32:12.379586 lo    In  IP6 ::1.10350 > ::1.38268: Flags [P.], seq 3781:3805, ack 1828, win 72, options [nop,nop,TS val 3617120212 ecr 3617120212], length 24
12:32:12.379615 lo    In  IP6 ::1.10350 > ::1.38268: Flags [F.], seq 3805, ack 1828, win 72, options [nop,nop,TS val 3617120212 ecr 3617120212], length 0
12:32:12.379693 lo    In  IP6 ::1.38268 > ::1.10350: Flags [F.], seq 1828, ack 3806, win 94, options [nop,nop,TS val 3617120212 ecr 3617120212], length 0
12:32:12.379720 lo    In  IP6 ::1.10350 > ::1.38268: Flags [.], ack 1829, win 72, options [nop,nop,TS val 3617120212 ecr 3617120212], length 0
12:32:12.715370 eth0  Out IP 192.168.147.4.10351 > 192.168.147.2.10351: UDP, length 100
12:32:12.716191 eth0  In  IP 192.168.147.2.10351 > 192.168.147.4.10351: UDP, length 18
12:32:12.789669 eth0  In  IP 192.168.147.3.10351 > 192.168.147.4.10351: UDP, length 107
12:32:12.790671 eth0  Out IP 192.168.147.4.10351 > 192.168.147.3.10351: UDP, length 18
12:32:12.869501 eth0  In  IP 192.168.147.2.10351 > 192.168.147.4.10351: UDP, length 100
12:32:12.870123 eth0  Out IP 192.168.147.4.10351 > 192.168.147.2.10351: UDP, length 18
12:32:13.016061 test-tra-0c94c6 P   IP 172.31.129.2 > 8.8.8.8: ICMP echo request, id 11, seq 2, length 64
12:32:13.016081 antrea-gw0 In  IP 172.31.129.2 > 8.8.8.8: ICMP echo request, id 11, seq 2, length 64
12:32:13.016101 eth0  Out IP 192.168.147.4 > 8.8.8.8: ICMP echo request, id 11, seq 2, length 64
12:32:13.034258 eth0  In  IP 8.8.8.8 > 192.168.147.4: ICMP echo reply, id 11, seq 2, length 64
12:32:13.034278 antrea-gw0 Out IP 8.8.8.8 > 172.31.129.2: ICMP echo reply, id 11, seq 2, length 64
12:32:13.034296 test-tra-0c94c6 Out IP 8.8.8.8 > 172.31.129.2: ICMP echo reply, id 11, seq 2, length 64
12:32:13.492780 eth0  Out IP 192.168.147.4.41432 > 192.168.147.3.6443: Flags [P.], seq 2444324122:2444324162, ack 2142334055, win 90, options [nop,nop,TS val 1712763854 ecr 1884654476], length 40
12:32:13.492908 eth0  In  IP 192.168.147.3.6443 > 192.168.147.4.41432: Flags [.], ack 40, win 73, options [nop,nop,TS val 1884656213 ecr 1712763854], length 0
12:32:13.492980 eth0  Out IP 192.168.147.4.41432 > 192.168.147.3.6443: Flags [P.], seq 40:588, ack 1, win 90, options [nop,nop,TS val 1712763854 ecr 1884656213], length 548
12:32:13.493001 eth0  In  IP 192.168.147.3.6443 > 192.168.147.4.41432: Flags [.], ack 588, win 73, options [nop,nop,TS val 1884656213 ecr 1712763854], length 0
12:32:13.514206 eth0  In  IP 192.168.147.3.6443 > 192.168.147.4.41432: Flags [P.], seq 1:90, ack 588, win 73, options [nop,nop,TS val 1884656235 ecr 1712763854], length 89
12:32:13.514457 eth0  In  IP 192.168.147.3.6443 > 192.168.147.4.41432: Flags [P.], seq 90:638, ack 588, win 73, options [nop,nop,TS val 1884656235 ecr 1712763854], length 548
12:32:13.514480 eth0  Out IP 192.168.147.4.41432 > 192.168.147.3.6443: Flags [.], ack 638, win 90, options [nop,nop,TS val 1712763876 ecr 1884656235], length 0
12:32:13.514537 eth0  Out IP 192.168.147.4.41432 > 192.168.147.3.6443: Flags [P.], seq 588:623, ack 638, win 90, options [nop,nop,TS val 1712763876 ecr 1884656235], length 35
12:32:13.555395 eth0  In  IP 192.168.147.3.6443 > 192.168.147.4.41432: Flags [.], ack 623, win 73, options [nop,nop,TS val 1884656276 ecr 1712763876], length 0
12:32:13.789560 eth0  In  IP 192.168.147.3.10351 > 192.168.147.4.10351: UDP, length 107
12:32:13.790076 eth0  Out IP 192.168.147.4.10351 > 192.168.147.3.10351: UDP, length 18
12:32:14.016259 test-tra-0c94c6 P   IP 172.31.129.2 > 8.8.8.8: ICMP echo request, id 11, seq 3, length 64
12:32:14.016282 antrea-gw0 In  IP 172.31.129.2 > 8.8.8.8: ICMP echo request, id 11, seq 3, length 64
12:32:14.016301 eth0  Out IP 192.168.147.4 > 8.8.8.8: ICMP echo request, id 11, seq 3, length 64
12:32:14.031220 eth0  In  IP 8.8.8.8 > 192.168.147.4: ICMP echo reply, id 11, seq 3, length 64
12:32:14.031240 antrea-gw0 Out IP 8.8.8.8 > 172.31.129.2: ICMP echo reply, id 11, seq 3, length 64
12:32:14.031255 test-tra-0c94c6 Out IP 8.8.8.8 > 172.31.129.2: ICMP echo reply, id 11, seq 3, length 64
12:32:14.716016 eth0  Out IP 192.168.147.4.10351 > 192.168.147.3.10351: UDP, length 107
12:32:14.716397 eth0  In  IP 192.168.147.3.10351 > 192.168.147.4.10351: UDP, length 18
12:32:14.869991 eth0  In  IP 192.168.147.2.10351 > 192.168.147.4.10351: UDP, length 100
12:32:14.870494 eth0  Out IP 192.168.147.4.10351 > 192.168.147.2.10351: UDP, length 18
12:32:15.006988 eth0  Out IP6 fe80::5078:b3ff:fe03:7961 > ff02::2: ICMP6, router solicitation, length 16
12:32:15.007248 test-tra-0c94c6 M   IP6 fe80::b48f:d6ff:fe9b:d322 > ff02::2: ICMP6, router solicitation, length 16
12:32:15.007892 eth0  M   IP6 fe80::5078:b3ff:fe03:7961 > ff02::2: ICMP6, router solicitation, length 16
12:32:15.017892 test-tra-0c94c6 P   IP 172.31.129.2 > 8.8.8.8: ICMP echo request, id 11, seq 4, length 64
12:32:15.025911 antrea-gw0 In  IP 172.31.129.2 > 8.8.8.8: ICMP echo request, id 11, seq 4, length 64
12:32:15.026036 eth0  Out IP 192.168.147.4 > 8.8.8.8: ICMP echo request, id 11, seq 4, length 64
12:32:15.043735 eth0  In  IP 8.8.8.8 > 192.168.147.4: ICMP echo reply, id 11, seq 4, length 64
12:32:15.043909 antrea-gw0 Out IP 8.8.8.8 > 172.31.129.2: ICMP echo reply, id 11, seq 4, length 64
12:32:15.043985 test-tra-0c94c6 Out IP 8.8.8.8 > 172.31.129.2: ICMP echo reply, id 11, seq 4, length 64
12:32:15.532556 eth0  In  IP 192.168.147.3.48044 > 192.168.147.4.10351: Flags [S], seq 2977004139, win 64240, options [mss 1460,sackOK,TS val 1884658253 ecr 0,nop,wscale 10], length 0
12:32:15.532651 eth0  Out IP 192.168.147.4.10351 > 192.168.147.3.48044: Flags [S.], seq 3623166927, ack 2977004140, win 65160, options [mss 1460,sackOK,TS val 1712765894 ecr 1884658253,nop,wscale 10], length 0
12:32:15.532701 eth0  In  IP 192.168.147.3.48044 > 192.168.147.4.10351: Flags [.], ack 1, win 63, options [nop,nop,TS val 1884658253 ecr 1712765894], length 0
12:32:15.533315 eth0  In  IP 192.168.147.3.48044 > 192.168.147.4.10351: Flags [P.], seq 1:237, ack 1, win 63, options [nop,nop,TS val 1884658254 ecr 1712765894], length 236
12:32:15.533346 eth0  Out IP 192.168.147.4.10351 > 192.168.147.3.48044: Flags [.], ack 237, win 64, options [nop,nop,TS val 1712765895 ecr 1884658254], length 0
12:32:15.534051 eth0  Out IP 192.168.147.4.10351 > 192.168.147.3.48044: Flags [P.], seq 1:237, ack 237, win 64, options [nop,nop,TS val 1712765895 ecr 1884658254], length 236
12:32:15.534111 eth0  In  IP 192.168.147.3.48044 > 192.168.147.4.10351: Flags [.], ack 237, win 63, options [nop,nop,TS val 1884658254 ecr 1712765895], length 0
12:32:15.534207 eth0  Out IP 192.168.147.4.10351 > 192.168.147.3.48044: Flags [F.], seq 237, ack 237, win 64, options [nop,nop,TS val 1712765896 ecr 1884658254], length 0
12:32:15.534469 eth0  In  IP 192.168.147.3.48044 > 192.168.147.4.10351: Flags [F.], seq 237, ack 238, win 63, options [nop,nop,TS val 1884658255 ecr 1712765896], length 0
12:32:15.534485 eth0  Out IP 192.168.147.4.10351 > 192.168.147.3.48044: Flags [.], ack 238, win 64, options [nop,nop,TS val 1712765896 ecr 1884658255], length 0
12:32:15.716126 eth0  Out IP 192.168.147.4.10351 > 192.168.147.2.10351: UDP, length 100
12:32:15.716947 eth0  In  IP 192.168.147.2.10351 > 192.168.147.4.10351: UDP, length 18
12:32:15.790109 eth0  In  IP 192.168.147.3.10351 > 192.168.147.4.10351: UDP, length 107
12:32:15.790513 eth0  Out IP 192.168.147.4.10351 > 192.168.147.3.10351: UDP, length 18
12:32:16.027124 test-tra-0c94c6 P   IP 172.31.129.2 > 8.8.8.8: ICMP echo request, id 11, seq 5, length 64
12:32:16.027199 antrea-gw0 In  IP 172.31.129.2 > 8.8.8.8: ICMP echo request, id 11, seq 5, length 64
12:32:16.027358 eth0  Out IP 192.168.147.4 > 8.8.8.8: ICMP echo request, id 11, seq 5, length 64
12:32:16.059898 eth0  In  IP 8.8.8.8 > 192.168.147.4: ICMP echo reply, id 11, seq 5, length 64
12:32:16.059911 antrea-gw0 Out IP 8.8.8.8 > 172.31.129.2: ICMP echo reply, id 11, seq 5, length 64
12:32:16.059931 test-tra-0c94c6 Out IP 8.8.8.8 > 172.31.129.2: ICMP echo reply, id 11, seq 5, length 64
12:32:16.398678 lo    In  IP6 ::1.38292 > ::1.10350: Flags [S], seq 589564509, win 65476, options [mss 65476,sackOK,TS val 3617124231 ecr 0,nop,wscale 10], length 0
12:32:16.398787 lo    In  IP6 ::1.10350 > ::1.38292: Flags [S.], seq 1277072005, ack 589564510, win 65464, options [mss 65476,sackOK,TS val 3617124231 ecr 3617124231,nop,wscale 10], length 0
12:32:16.398804 lo    In  IP6 ::1.38292 > ::1.10350: Flags [.], ack 1, win 64, options [nop,nop,TS val 3617124231 ecr 3617124231], length 0
12:32:16.399554 lo    In  IP6 ::1.38292 > ::1.10350: Flags [P.], seq 1:1516, ack 1, win 64, options [nop,nop,TS val 3617124232 ecr 3617124231], length 1515
12:32:16.399591 lo    In  IP6 ::1.10350 > ::1.38292: Flags [.], ack 1516, win 72, options [nop,nop,TS val 3617124232 ecr 3617124232], length 0
12:32:16.405785 lo    In  IP6 ::1.10350 > ::1.38292: Flags [P.], seq 1:3430, ack 1516, win 72, options [nop,nop,TS val 3617124238 ecr 3617124232], length 3429
12:32:16.405817 lo    In  IP6 ::1.38292 > ::1.10350: Flags [.], ack 3430, win 93, options [nop,nop,TS val 3617124238 ecr 3617124238], length 0
12:32:16.407569 lo    In  IP6 ::1.38292 > ::1.10350: Flags [P.], seq 1516:1610, ack 3430, win 93, options [nop,nop,TS val 3617124240 ecr 3617124238], length 94
12:32:16.408083 lo    In  IP6 ::1.10350 > ::1.38292: Flags [P.], seq 3430:3491, ack 1610, win 72, options [nop,nop,TS val 3617124240 ecr 3617124240], length 61
12:32:16.408197 lo    In  IP6 ::1.38292 > ::1.10350: Flags [P.], seq 1610:1702, ack 3491, win 93, options [nop,nop,TS val 3617124241 ecr 3617124240], length 92
12:32:16.408308 lo    In  IP6 ::1.10350 > ::1.38292: Flags [P.], seq 3491:3526, ack 1702, win 72, options [nop,nop,TS val 3617124241 ecr 3617124241], length 35
12:32:16.408378 lo    In  IP6 ::1.10350 > ::1.38292: Flags [P.], seq 3526:3557, ack 1702, win 72, options [nop,nop,TS val 3617124241 ecr 3617124241], length 31
12:32:16.408496 lo    In  IP6 ::1.38292 > ::1.10350: Flags [.], ack 3557, win 93, options [nop,nop,TS val 3617124241 ecr 3617124241], length 0
12:32:16.408542 lo    In  IP6 ::1.38292 > ::1.10350: Flags [P.], seq 1702:1774, ack 3557, win 93, options [nop,nop,TS val 3617124241 ecr 3617124241], length 72
12:32:16.409339 lo    In  IP6 ::1.38292 > ::1.10350: Flags [P.], seq 1774:1805, ack 3557, win 93, options [nop,nop,TS val 3617124242 ecr 3617124241], length 31
12:32:16.409363 lo    In  IP6 ::1.10350 > ::1.38292: Flags [P.], seq 3557:3596, ack 1805, win 72, options [nop,nop,TS val 3617124242 ecr 3617124241], length 39
12:32:16.409543 lo    In  IP6 ::1.10350 > ::1.38292: Flags [P.], seq 3596:3748, ack 1805, win 72, options [nop,nop,TS val 3617124242 ecr 3617124241], length 152
12:32:16.409622 lo    In  IP6 ::1.10350 > ::1.38292: Flags [P.], seq 3748:3781, ack 1805, win 72, options [nop,nop,TS val 3617124242 ecr 3617124241], length 33
12:32:16.409679 lo    In  IP6 ::1.38292 > ::1.10350: Flags [.], ack 3781, win 95, options [nop,nop,TS val 3617124242 ecr 3617124242], length 0
12:32:16.409834 lo    In  IP6 ::1.38292 > ::1.10350: Flags [P.], seq 1805:1829, ack 3781, win 95, options [nop,nop,TS val 3617124242 ecr 3617124242], length 24
12:32:16.409877 lo    In  IP6 ::1.38292 > ::1.10350: Flags [F.], seq 1829, ack 3781, win 95, options [nop,nop,TS val 3617124242 ecr 3617124242], length 0
12:32:16.409905 lo    In  IP6 ::1.10350 > ::1.38292: Flags [P.], seq 3781:3805, ack 1830, win 72, options [nop,nop,TS val 3617124242 ecr 3617124242], length 24
12:32:16.409934 lo    In  IP6 ::1.38292 > ::1.10350: Flags [R], seq 589566339, win 0, length 0
12:32:16.542175 antrea-gw0 Out ARP, Request who-has 172.31.129.2 tell 172.31.129.1, length 28
12:32:16.542379 test-tra-0c94c6 Out ARP, Request who-has 172.31.129.2 tell 172.31.129.1, length 28
12:32:16.542397 test-tra-0c94c6 P   ARP, Reply 172.31.129.2 is-at b6:8f:d6:9b:d3:22, length 28
12:32:16.542486 antrea-gw0 In  ARP, Reply 172.31.129.2 is-at b6:8f:d6:9b:d3:22, length 28
12:32:16.633410 eth0  In  IP 192.168.147.3.6443 > 192.168.147.4.45888: Flags [P.], seq 1085227568:1085227720, ack 2347670048, win 72, options [nop,nop,TS val 1884659354 ecr 2875393217], length 152
12:32:16.633742 eth0  Out IP 192.168.147.4.45888 > 192.168.147.3.6443: Flags [P.], seq 1:36, ack 152, win 149, options [nop,nop,TS val 2875398095 ecr 1884659354], length 35
12:32:16.633800 eth0  In  IP 192.168.147.3.6443 > 192.168.147.4.45888: Flags [.], ack 36, win 72, options [nop,nop,TS val 1884659354 ecr 2875398095], length 0
12:32:16.716375 eth0  Out IP 192.168.147.4.10351 > 192.168.147.2.10351: UDP, length 100
12:32:16.716959 eth0  In  IP 192.168.147.2.10351 > 192.168.147.4.10351: UDP, length 18
12:32:16.835370 eth0  In  IP 192.168.147.3.6443 > 192.168.147.4.45888: Flags [P.], seq 152:249, ack 36, win 72, options [nop,nop,TS val 1884659556 ecr 2875398095], length 97
12:32:16.877181 eth0  Out IP 192.168.147.4.45888 > 192.168.147.3.6443: Flags [.], ack 249, win 149, options [nop,nop,TS val 2875398339 ecr 1884659556], length 0
12:32:16.977922 eth0  In  IP 192.168.147.3.6443 > 192.168.147.4.45888: Flags [P.], seq 249:346, ack 36, win 72, options [nop,nop,TS val 1884659698 ecr 2875398339], length 97
12:32:16.977955 eth0  Out IP 192.168.147.4.45888 > 192.168.147.3.6443: Flags [.], ack 346, win 149, options [nop,nop,TS val 2875398439 ecr 1884659698], length 0
12:32:17.054469 eth0  Out IP6 fe80::5078:b3ff:fe03:7961 > fe80::c822:8fff:fea8:da7f: ICMP6, neighbor solicitation, who has fe80::c822:8fff:fea8:da7f, length 32
12:32:17.054500 antrea-gw0 Out IP6 fe80::e8ba:a2ff:fe32:c95c > ff02::2: ICMP6, router solicitation, length 16
12:32:17.054633 eth0  In  IP6 fe80::c822:8fff:fea8:da7f > fe80::5078:b3ff:fe03:7961: ICMP6, neighbor advertisement, tgt is fe80::c822:8fff:fea8:da7f, length 24
12:32:17.093879 eth0  In  IP 192.168.147.3.60734 > 192.168.147.4.10250: Flags [S], seq 736310534, win 64240, options [mss 1460,sackOK,TS val 1884659814 ecr 0,nop,wscale 10], length 0
12:32:17.093904 eth0  Out IP 192.168.147.4.10250 > 192.168.147.3.60734: Flags [S.], seq 1810455177, ack 736310535, win 65160, options [mss 1460,sackOK,TS val 1712767455 ecr 1884659814,nop,wscale 10], length 0
12:32:17.093914 eth0  In  IP 192.168.147.3.60734 > 192.168.147.4.10250: Flags [.], ack 1, win 63, options [nop,nop,TS val 1884659814 ecr 1712767455], length 0
12:32:17.094221 eth0  In  IP 192.168.147.3.60734 > 192.168.147.4.10250: Flags [P.], seq 1:1495, ack 1, win 63, options [nop,nop,TS val 1884659815 ecr 1712767455], length 1494
12:32:17.094230 eth0  Out IP 192.168.147.4.10250 > 192.168.147.3.60734: Flags [.], ack 1495, win 67, options [nop,nop,TS val 1712767456 ecr 1884659815], length 0
12:32:17.095481 eth0  In  IP 192.168.147.3.6443 > 192.168.147.4.45888: Flags [P.], seq 346:466, ack 36, win 72, options [nop,nop,TS val 1884659816 ecr 2875398439], length 120
12:32:17.095492 eth0  Out IP 192.168.147.4.45888 > 192.168.147.3.6443: Flags [.], ack 466, win 149, options [nop,nop,TS val 2875398557 ecr 1884659816], length 0
12:32:17.095517 eth0  In  IP 192.168.147.3.6443 > 192.168.147.4.45888: Flags [P.], seq 466:586, ack 36, win 72, options [nop,nop,TS val 1884659816 ecr 2875398557], length 120
12:32:17.095522 eth0  Out IP 192.168.147.4.45888 > 192.168.147.3.6443: Flags [.], ack 586, win 149, options [nop,nop,TS val 2875398557 ecr 1884659816], length 0
12:32:17.096807 eth0  Out IP 192.168.147.4.10250 > 192.168.147.3.60734: Flags [P.], seq 1:3431, ack 1495, win 67, options [nop,nop,TS val 1712767458 ecr 1884659815], length 3430
12:32:17.096815 eth0  In  IP 192.168.147.3.60734 > 192.168.147.4.10250: Flags [.], ack 3431, win 70, options [nop,nop,TS val 1884659817 ecr 1712767458], length 0
12:32:17.098324 eth0  In  IP 192.168.147.3.60734 > 192.168.147.4.10250: Flags [P.], seq 1495:2706, ack 3431, win 70, options [nop,nop,TS val 1884659819 ecr 1712767458], length 1211
12:32:17.098392 eth0  In  IP 192.168.147.3.60734 > 192.168.147.4.10250: Flags [P.], seq 2706:3241, ack 3431, win 70, options [nop,nop,TS val 1884659819 ecr 1712767458], length 535
12:32:17.098395 eth0  Out IP 192.168.147.4.10250 > 192.168.147.3.60734: Flags [.], ack 3241, win 72, options [nop,nop,TS val 1712767460 ecr 1884659819], length 0
12:32:17.108944 eth0  In  IP 192.168.147.3.6443 > 192.168.147.4.45888: Flags [P.], seq 586:741, ack 36, win 72, options [nop,nop,TS val 1884659829 ecr 2875398557], length 155
12:32:17.109002 eth0  Out IP 192.168.147.4.45888 > 192.168.147.3.6443: Flags [.], ack 741, win 149, options [nop,nop,TS val 2875398570 ecr 1884659829], length 0
12:32:17.113991 eth0  Out IP 192.168.147.4.41432 > 192.168.147.3.6443: Flags [P.], seq 623:703, ack 638, win 90, options [nop,nop,TS val 1712767475 ecr 1884656276], length 80
12:32:17.114016 eth0  In  IP 192.168.147.3.6443 > 192.168.147.4.41432: Flags [.], ack 703, win 73, options [nop,nop,TS val 1884659834 ecr 1712767475], length 0
12:32:17.114494 eth0  Out IP 192.168.147.4.41432 > 192.168.147.3.6443: Flags [P.], seq 703:1084, ack 638, win 90, options [nop,nop,TS val 1712767476 ecr 1884659834], length 381
12:32:17.114501 eth0  In  IP 192.168.147.3.6443 > 192.168.147.4.41432: Flags [.], ack 1084, win 73, options [nop,nop,TS val 1884659835 ecr 1712767476], length 0
12:32:17.115249 eth0  In  IP 192.168.147.3.6443 > 192.168.147.4.41432: Flags [P.], seq 638:732, ack 1084, win 73, options [nop,nop,TS val 1884659836 ecr 1712767476], length 94
12:32:17.115334 eth0  In  IP 192.168.147.3.6443 > 192.168.147.4.41432: Flags [P.], seq 732:1527, ack 1084, win 73, options [nop,nop,TS val 1884659836 ecr 1712767476], length 795
12:32:17.115339 eth0  Out IP 192.168.147.4.41432 > 192.168.147.3.6443: Flags [.], ack 1527, win 90, options [nop,nop,TS val 1712767477 ecr 1884659836], length 0
12:32:17.117201 lo    In  IP 127.0.0.1.48540 > 127.0.0.1.35461: Flags [S], seq 1305656850, win 65495, options [mss 65495,sackOK,TS val 252012520 ecr 0,nop,wscale 10], length 0
12:32:17.117209 lo    In  IP 127.0.0.1.35461 > 127.0.0.1.48540: Flags [S.], seq 3993720034, ack 1305656851, win 65483, options [mss 65495,sackOK,TS val 252012520 ecr 252012520,nop,wscale 10], length 0
12:32:17.117213 lo    In  IP 127.0.0.1.48540 > 127.0.0.1.35461: Flags [.], ack 1, win 64, options [nop,nop,TS val 252012520 ecr 252012520], length 0
12:32:17.117315 lo    In  IP 127.0.0.1.48540 > 127.0.0.1.35461: Flags [P.], seq 1:410, ack 1, win 64, options [nop,nop,TS val 252012520 ecr 252012520], length 409
12:32:17.117318 lo    In  IP 127.0.0.1.35461 > 127.0.0.1.48540: Flags [.], ack 410, win 64, options [nop,nop,TS val 252012520 ecr 252012520], length 0
12:32:17.117616 lo    In  IP 127.0.0.1.35461 > 127.0.0.1.48540: Flags [P.], seq 1:160, ack 410, win 64, options [nop,nop,TS val 252012520 ecr 252012520], length 159
12:32:17.117625 lo    In  IP 127.0.0.1.48540 > 127.0.0.1.35461: Flags [.], ack 160, win 64, options [nop,nop,TS val 252012520 ecr 252012520], length 0
12:32:17.117683 eth0  Out IP 192.168.147.4.10250 > 192.168.147.3.60734: Flags [P.], seq 3431:3612, ack 3241, win 72, options [nop,nop,TS val 1712767479 ecr 1884659819], length 181
12:32:17.118252 eth0  In  IP 192.168.147.3.60734 > 192.168.147.4.10250: Flags [P.], seq 3241:3265, ack 3612, win 73, options [nop,nop,TS val 1884659839 ecr 1712767479], length 24
12:32:17.118263 eth0  In  IP 192.168.147.3.60734 > 192.168.147.4.10250: Flags [P.], seq 3265:3289, ack 3612, win 73, options [nop,nop,TS val 1884659839 ecr 1712767479], length 24
12:32:17.118266 eth0  In  IP 192.168.147.3.60734 > 192.168.147.4.10250: Flags [P.], seq 3289:3315, ack 3612, win 73, options [nop,nop,TS val 1884659839 ecr 1712767479], length 26
12:32:17.118272 eth0  In  IP 192.168.147.3.60734 > 192.168.147.4.10250: Flags [P.], seq 3315:3341, ack 3612, win 73, options [nop,nop,TS val 1884659839 ecr 1712767479], length 26
12:32:17.118274 eth0  In  IP 192.168.147.3.60734 > 192.168.147.4.10250: Flags [P.], seq 3341:3367, ack 3612, win 73, options [nop,nop,TS val 1884659839 ecr 1712767479], length 26
12:32:17.118278 eth0  In  IP 192.168.147.3.60734 > 192.168.147.4.10250: Flags [P.], seq 3367:3390, ack 3612, win 73, options [nop,nop,TS val 1884659839 ecr 1712767479], length 23
12:32:17.118281 eth0  In  IP 192.168.147.3.60734 > 192.168.147.4.10250: Flags [P.], seq 3390:3413, ack 3612, win 73, options [nop,nop,TS val 1884659839 ecr 1712767479], length 23
12:32:17.118286 eth0  In  IP 192.168.147.3.60734 > 192.168.147.4.10250: Flags [P.], seq 3413:3466, ack 3612, win 73, options [nop,nop,TS val 1884659839 ecr 1712767479], length 53
12:32:17.118351 eth0  Out IP 192.168.147.4.10250 > 192.168.147.3.60734: Flags [.], ack 3466, win 72, options [nop,nop,TS val 1712767480 ecr 1884659839], length 0
12:32:17.118361 lo    In  IP 127.0.0.1.48540 > 127.0.0.1.35461: Flags [P.], seq 410:412, ack 160, win 64, options [nop,nop,TS val 252012521 ecr 252012520], length 2
12:32:17.118368 lo    In  IP 127.0.0.1.48540 > 127.0.0.1.35461: Flags [P.], seq 412:414, ack 160, win 64, options [nop,nop,TS val 252012521 ecr 252012520], length 2
12:32:17.118370 lo    In  IP 127.0.0.1.48540 > 127.0.0.1.35461: Flags [P.], seq 414:418, ack 160, win 64, options [nop,nop,TS val 252012521 ecr 252012520], length 4
12:32:17.118371 lo    In  IP 127.0.0.1.48540 > 127.0.0.1.35461: Flags [P.], seq 418:422, ack 160, win 64, options [nop,nop,TS val 252012521 ecr 252012520], length 4
12:32:17.118373 lo    In  IP 127.0.0.1.48540 > 127.0.0.1.35461: Flags [P.], seq 422:426, ack 160, win 64, options [nop,nop,TS val 252012521 ecr 252012520], length 4
12:32:17.118375 lo    In  IP 127.0.0.1.48540 > 127.0.0.1.35461: Flags [P.], seq 426:427, ack 160, win 64, options [nop,nop,TS val 252012521 ecr 252012520], length 1
12:32:17.118378 lo    In  IP 127.0.0.1.48540 > 127.0.0.1.35461: Flags [P.], seq 427:428, ack 160, win 64, options [nop,nop,TS val 252012521 ecr 252012520], length 1
12:32:17.118379 lo    In  IP 127.0.0.1.35461 > 127.0.0.1.48540: Flags [.], ack 426, win 64, options [nop,nop,TS val 252012521 ecr 252012521], length 0
12:32:17.118380 lo    In  IP 127.0.0.1.48540 > 127.0.0.1.35461: Flags [P.], seq 428:459, ack 160, win 64, options [nop,nop,TS val 252012521 ecr 252012520], length 31
12:32:17.118406 lo    In  IP 127.0.0.1.35461 > 127.0.0.1.48540: Flags [.], ack 459, win 64, options [nop,nop,TS val 252012521 ecr 252012521], length 0
12:32:17.121169 lo    In  IP 127.0.0.1.35461 > 127.0.0.1.48540: Flags [P.], seq 160:162, ack 459, win 64, options [nop,nop,TS val 252012524 ecr 252012521], length 2
12:32:17.121195 eth0  Out IP 192.168.147.4.10250 > 192.168.147.3.60734: Flags [P.], seq 3612:3636, ack 3466, win 72, options [nop,nop,TS val 1712767483 ecr 1884659839], length 24
12:32:17.121232 lo    In  IP 127.0.0.1.35461 > 127.0.0.1.48540: Flags [P.], seq 162:164, ack 459, win 64, options [nop,nop,TS val 252012524 ecr 252012521], length 2
12:32:17.121237 lo    In  IP 127.0.0.1.35461 > 127.0.0.1.48540: Flags [P.], seq 164:168, ack 459, win 64, options [nop,nop,TS val 252012524 ecr 252012521], length 4
12:32:17.121240 lo    In  IP 127.0.0.1.35461 > 127.0.0.1.48540: Flags [P.], seq 168:172, ack 459, win 64, options [nop,nop,TS val 252012524 ecr 252012521], length 4
12:32:17.121241 lo    In  IP 127.0.0.1.35461 > 127.0.0.1.48540: Flags [P.], seq 172:188, ack 459, win 64, options [nop,nop,TS val 252012524 ecr 252012521], length 16
12:32:17.121892 lo    In  IP 127.0.0.1.48540 > 127.0.0.1.35461: Flags [.], ack 188, win 64, options [nop,nop,TS val 252012524 ecr 252012524], length 0
12:32:17.121900 eth0  Out IP 192.168.147.4.10250 > 192.168.147.3.60734: Flags [P.], seq 3636:3684, ack 3466, win 72, options [nop,nop,TS val 1712767483 ecr 1884659839], length 48
12:32:17.121924 eth0  In  IP 192.168.147.3.60734 > 192.168.147.4.10250: Flags [.], ack 3684, win 73, options [nop,nop,TS val 1884659842 ecr 1712767483], length 0
12:32:17.122085 eth0  In  IP 192.168.147.3.60734 > 192.168.147.4.10250: Flags [P.], seq 3466:3490, ack 3684, win 73, options [nop,nop,TS val 1884659842 ecr 1712767483], length 24
12:32:17.122104 lo    In  IP 127.0.0.1.48540 > 127.0.0.1.35461: Flags [P.], seq 459:461, ack 188, win 64, options [nop,nop,TS val 252012524 ecr 252012524], length 2
12:32:17.122148 eth0  In  IP 192.168.147.3.60734 > 192.168.147.4.10250: Flags [P.], seq 3490:3514, ack 3684, win 73, options [nop,nop,TS val 1884659843 ecr 1712767483], length 24
12:32:17.122152 eth0  Out IP 192.168.147.4.10250 > 192.168.147.3.60734: Flags [.], ack 3514, win 72, options [nop,nop,TS val 1712767484 ecr 1884659842], length 0
12:32:17.122156 lo    In  IP 127.0.0.1.48540 > 127.0.0.1.35461: Flags [P.], seq 461:463, ack 188, win 64, options [nop,nop,TS val 252012525 ecr 252012524], length 2
12:32:17.122162 eth0  In  IP 192.168.147.3.60734 > 192.168.147.4.10250: Flags [P.], seq 3514:3540, ack 3684, win 73, options [nop,nop,TS val 1884659843 ecr 1712767484], length 26
12:32:17.122166 lo    In  IP 127.0.0.1.48540 > 127.0.0.1.35461: Flags [P.], seq 463:467, ack 188, win 64, options [nop,nop,TS val 252012525 ecr 252012524], length 4
12:32:17.122171 eth0  In  IP 192.168.147.3.60734 > 192.168.147.4.10250: Flags [P.], seq 3540:3566, ack 3684, win 73, options [nop,nop,TS val 1884659843 ecr 1712767484], length 26
12:32:17.122173 eth0  Out IP 192.168.147.4.10250 > 192.168.147.3.60734: Flags [.], ack 3566, win 72, options [nop,nop,TS val 1712767484 ecr 1884659843], length 0
12:32:17.122176 lo    In  IP 127.0.0.1.48540 > 127.0.0.1.35461: Flags [P.], seq 467:471, ack 188, win 64, options [nop,nop,TS val 252012525 ecr 252012524], length 4
12:32:17.122180 eth0  In  IP 192.168.147.3.60734 > 192.168.147.4.10250: Flags [P.], seq 3566:3592, ack 3684, win 73, options [nop,nop,TS val 1884659843 ecr 1712767484], length 26
12:32:17.122183 lo    In  IP 127.0.0.1.48540 > 127.0.0.1.35461: Flags [P.], seq 471:475, ack 188, win 64, options [nop,nop,TS val 252012525 ecr 252012524], length 4
12:32:17.122185 lo    In  IP 127.0.0.1.35461 > 127.0.0.1.48540: Flags [.], ack 471, win 64, options [nop,nop,TS val 252012525 ecr 252012524], length 0
12:32:17.122188 eth0  In  IP 192.168.147.3.60734 > 192.168.147.4.10250: Flags [P.], seq 3592:3615, ack 3684, win 73, options [nop,nop,TS val 1884659843 ecr 1712767484], length 23
12:32:17.122190 eth0  Out IP 192.168.147.4.10250 > 192.168.147.3.60734: Flags [.], ack 3615, win 72, options [nop,nop,TS val 1712767484 ecr 1884659843], length 0
12:32:17.122193 lo    In  IP 127.0.0.1.48540 > 127.0.0.1.35461: Flags [P.], seq 475:476, ack 188, win 64, options [nop,nop,TS val 252012525 ecr 252012525], length 1
12:32:17.122194 lo    In  IP 127.0.0.1.35461 > 127.0.0.1.48540: Flags [.], ack 476, win 64, options [nop,nop,TS val 252012525 ecr 252012525], length 0
12:32:17.122197 eth0  In  IP 192.168.147.3.60734 > 192.168.147.4.10250: Flags [P.], seq 3615:3638, ack 3684, win 73, options [nop,nop,TS val 1884659843 ecr 1712767484], length 23
12:32:17.122200 eth0  In  IP 192.168.147.3.60734 > 192.168.147.4.10250: Flags [P.], seq 3638:3675, ack 3684, win 73, options [nop,nop,TS val 1884659843 ecr 1712767484], length 37
12:32:17.122244 eth0  Out IP 192.168.147.4.10250 > 192.168.147.3.60734: Flags [.], ack 3675, win 72, options [nop,nop,TS val 1712767484 ecr 1884659843], length 0
12:32:17.122250 lo    In  IP 127.0.0.1.48540 > 127.0.0.1.35461: Flags [P.], seq 476:477, ack 188, win 64, options [nop,nop,TS val 252012525 ecr 252012525], length 1
12:32:17.122268 lo    In  IP 127.0.0.1.48540 > 127.0.0.1.35461: Flags [P.], seq 477:492, ack 188, win 64, options [nop,nop,TS val 252012525 ecr 252012525], length 15
12:32:17.122279 lo    In  IP 127.0.0.1.35461 > 127.0.0.1.48540: Flags [.], ack 492, win 64, options [nop,nop,TS val 252012525 ecr 252012525], length 0
12:32:17.122309 lo    In  IP 127.0.0.1.35461 > 127.0.0.1.48540: Flags [P.], seq 188:190, ack 492, win 64, options [nop,nop,TS val 252012525 ecr 252012525], length 2
12:32:17.122314 lo    In  IP 127.0.0.1.35461 > 127.0.0.1.48540: Flags [P.], seq 190:192, ack 492, win 64, options [nop,nop,TS val 252012525 ecr 252012525], length 2
12:32:17.122316 lo    In  IP 127.0.0.1.35461 > 127.0.0.1.48540: Flags [P.], seq 192:196, ack 492, win 64, options [nop,nop,TS val 252012525 ecr 252012525], length 4
12:32:17.122317 lo    In  IP 127.0.0.1.35461 > 127.0.0.1.48540: Flags [P.], seq 196:200, ack 492, win 64, options [nop,nop,TS val 252012525 ecr 252012525], length 4
12:32:17.122319 lo    In  IP 127.0.0.1.35461 > 127.0.0.1.48540: Flags [P.], seq 200:208, ack 492, win 64, options [nop,nop,TS val 252012525 ecr 252012525], length 8
12:32:17.122335 lo    In  IP 127.0.0.1.48540 > 127.0.0.1.35461: Flags [.], ack 208, win 64, options [nop,nop,TS val 252012525 ecr 252012525], length 0
12:32:17.122339 eth0  Out IP 192.168.147.4.10250 > 192.168.147.3.60734: Flags [P.], seq 3684:3726, ack 3675, win 72, options [nop,nop,TS val 1712767484 ecr 1884659843], length 42
12:32:17.122374 eth0  In  IP 192.168.147.3.60734 > 192.168.147.4.10250: Flags [P.], seq 3675:3699, ack 3726, win 73, options [nop,nop,TS val 1884659843 ecr 1712767484], length 24
12:32:17.122377 eth0  In  IP 192.168.147.3.60734 > 192.168.147.4.10250: Flags [P.], seq 3699:3723, ack 3726, win 73, options [nop,nop,TS val 1884659843 ecr 1712767484], length 24
12:32:17.122381 eth0  In  IP 192.168.147.3.60734 > 192.168.147.4.10250: Flags [P.], seq 3723:3749, ack 3726, win 73, options [nop,nop,TS val 1884659843 ecr 1712767484], length 26
12:32:17.122388 eth0  In  IP 192.168.147.3.60734 > 192.168.147.4.10250: Flags [P.], seq 3749:3775, ack 3726, win 73, options [nop,nop,TS val 1884659843 ecr 1712767484], length 26
12:32:17.122390 eth0  In  IP 192.168.147.3.60734 > 192.168.147.4.10250: Flags [P.], seq 3775:3801, ack 3726, win 73, options [nop,nop,TS val 1884659843 ecr 1712767484], length 26
12:32:17.122392 eth0  In  IP 192.168.147.3.60734 > 192.168.147.4.10250: Flags [P.], seq 3801:3824, ack 3726, win 73, options [nop,nop,TS val 1884659843 ecr 1712767484], length 23
12:32:17.122394 eth0  In  IP 192.168.147.3.60734 > 192.168.147.4.10250: Flags [P.], seq 3824:3847, ack 3726, win 73, options [nop,nop,TS val 1884659843 ecr 1712767484], length 23
12:32:17.122396 eth0  In  IP 192.168.147.3.60734 > 192.168.147.4.10250: Flags [P.], seq 3847:3880, ack 3726, win 73, options [nop,nop,TS val 1884659843 ecr 1712767484], length 33
12:32:17.122408 eth0  Out IP 192.168.147.4.10250 > 192.168.147.3.60734: Flags [.], ack 3880, win 72, options [nop,nop,TS val 1712767484 ecr 1884659843], length 0
12:32:17.122413 lo    In  IP 127.0.0.1.48540 > 127.0.0.1.35461: Flags [P.], seq 492:494, ack 208, win 64, options [nop,nop,TS val 252012525 ecr 252012525], length 2
12:32:17.122416 lo    In  IP 127.0.0.1.48540 > 127.0.0.1.35461: Flags [P.], seq 494:496, ack 208, win 64, options [nop,nop,TS val 252012525 ecr 252012525], length 2
12:32:17.122418 lo    In  IP 127.0.0.1.48540 > 127.0.0.1.35461: Flags [P.], seq 496:500, ack 208, win 64, options [nop,nop,TS val 252012525 ecr 252012525], length 4
12:32:17.122419 lo    In  IP 127.0.0.1.48540 > 127.0.0.1.35461: Flags [P.], seq 500:504, ack 208, win 64, options [nop,nop,TS val 252012525 ecr 252012525], length 4
12:32:17.122420 lo    In  IP 127.0.0.1.48540 > 127.0.0.1.35461: Flags [P.], seq 504:508, ack 208, win 64, options [nop,nop,TS val 252012525 ecr 252012525], length 4
12:32:17.122422 lo    In  IP 127.0.0.1.48540 > 127.0.0.1.35461: Flags [P.], seq 508:509, ack 208, win 64, options [nop,nop,TS val 252012525 ecr 252012525], length 1
12:32:17.122423 lo    In  IP 127.0.0.1.48540 > 127.0.0.1.35461: Flags [P.], seq 509:510, ack 208, win 64, options [nop,nop,TS val 252012525 ecr 252012525], length 1
12:32:17.122424 lo    In  IP 127.0.0.1.48540 > 127.0.0.1.35461: Flags [P.], seq 510:521, ack 208, win 64, options [nop,nop,TS val 252012525 ecr 252012525], length 11
12:32:17.122430 lo    In  IP 127.0.0.1.35461 > 127.0.0.1.48540: Flags [.], ack 521, win 64, options [nop,nop,TS val 252012525 ecr 252012525], length 0
12:32:17.122440 lo    In  IP 127.0.0.1.35461 > 127.0.0.1.48540: Flags [P.], seq 208:210, ack 521, win 64, options [nop,nop,TS val 252012525 ecr 252012525], length 2
12:32:17.122443 lo    In  IP 127.0.0.1.35461 > 127.0.0.1.48540: Flags [P.], seq 210:212, ack 521, win 64, options [nop,nop,TS val 252012525 ecr 252012525], length 2
12:32:17.122444 lo    In  IP 127.0.0.1.35461 > 127.0.0.1.48540: Flags [P.], seq 212:216, ack 521, win 64, options [nop,nop,TS val 252012525 ecr 252012525], length 4
12:32:17.122445 lo    In  IP 127.0.0.1.35461 > 127.0.0.1.48540: Flags [P.], seq 216:220, ack 521, win 64, options [nop,nop,TS val 252012525 ecr 252012525], length 4
12:32:17.122446 lo    In  IP 127.0.0.1.35461 > 127.0.0.1.48540: Flags [P.], seq 220:228, ack 521, win 64, options [nop,nop,TS val 252012525 ecr 252012525], length 8
12:32:17.122750 lo    In  IP 127.0.0.1.48540 > 127.0.0.1.35461: Flags [.], ack 228, win 64, options [nop,nop,TS val 252012525 ecr 252012525], length 0
12:32:17.122756 eth0  Out IP 192.168.147.4.10250 > 192.168.147.3.60734: Flags [P.], seq 3726:3768, ack 3880, win 72, options [nop,nop,TS val 1712767484 ecr 1884659843], length 42
12:32:17.132695 lo    In  IP 127.0.0.1.35461 > 127.0.0.1.48540: Flags [P.], seq 228:232, ack 521, win 64, options [nop,nop,TS val 252012535 ecr 252012525], length 4
12:32:17.132707 lo    In  IP 127.0.0.1.35461 > 127.0.0.1.48540: Flags [P.], seq 232:236, ack 521, win 64, options [nop,nop,TS val 252012535 ecr 252012525], length 4
12:32:17.132709 lo    In  IP 127.0.0.1.35461 > 127.0.0.1.48540: Flags [P.], seq 236:310, ack 521, win 64, options [nop,nop,TS val 252012535 ecr 252012525], length 74
12:32:17.132729 lo    In  IP 127.0.0.1.48540 > 127.0.0.1.35461: Flags [.], ack 310, win 64, options [nop,nop,TS val 252012535 ecr 252012535], length 0
12:32:17.132746 eth0  Out IP 192.168.147.4.10250 > 192.168.147.3.60734: Flags [P.], seq 3768:3872, ack 3880, win 72, options [nop,nop,TS val 1712767494 ecr 1884659843], length 104
12:32:17.132786 eth0  In  IP 192.168.147.3.60734 > 192.168.147.4.10250: Flags [.], ack 3872, win 73, options [nop,nop,TS val 1884659853 ecr 1712767484], length 0
12:32:17.133015 lo    In  IP 127.0.0.1.35461 > 127.0.0.1.48540: Flags [P.], seq 310:314, ack 521, win 64, options [nop,nop,TS val 252012535 ecr 252012535], length 4
12:32:17.133025 eth0  Out IP 192.168.147.4.10250 > 192.168.147.3.60734: Flags [P.], seq 3872:3898, ack 3880, win 72, options [nop,nop,TS val 1712767494 ecr 1884659853], length 26
12:32:17.133054 lo    In  IP 127.0.0.1.35461 > 127.0.0.1.48540: Flags [P.], seq 314:318, ack 521, win 64, options [nop,nop,TS val 252012535 ecr 252012535], length 4
12:32:17.133062 lo    In  IP 127.0.0.1.48540 > 127.0.0.1.35461: Flags [.], ack 318, win 64, options [nop,nop,TS val 252012535 ecr 252012535], length 0
12:32:17.133064 eth0  Out IP 192.168.147.4.10250 > 192.168.147.3.60734: Flags [P.], seq 3898:3924, ack 3880, win 72, options [nop,nop,TS val 1712767494 ecr 1884659853], length 26
12:32:17.133070 eth0  In  IP 192.168.147.3.60734 > 192.168.147.4.10250: Flags [.], ack 3924, win 73, options [nop,nop,TS val 1884659853 ecr 1712767494], length 0
12:32:17.133111 lo    In  IP 127.0.0.1.35461 > 127.0.0.1.48540: Flags [P.], seq 318:322, ack 521, win 64, options [nop,nop,TS val 252012535 ecr 252012535], length 4
12:32:17.133118 eth0  Out IP 192.168.147.4.10250 > 192.168.147.3.60734: Flags [P.], seq 3924:3950, ack 3880, win 72, options [nop,nop,TS val 1712767494 ecr 1884659853], length 26
12:32:17.133128 lo    In  IP 127.0.0.1.35461 > 127.0.0.1.48540: Flags [P.], seq 322:326, ack 521, win 64, options [nop,nop,TS val 252012535 ecr 252012535], length 4
