12:10:52.688616 eth0  Out IP 172.31.130.3 > 8.8.8.8: ICMP echo request, id 11, seq 1, length 64
12:10:52.722654 eth0  In  IP 8.8.8.8 > 172.31.130.3: ICMP echo reply, id 11, seq 1, length 64
12:10:53.676646 eth0  Out IP6 fe80::9cea:1aff:fef9:c0a0 > ff02::2: ICMP6, router solicitation, length 16
12:10:53.689028 eth0  Out IP 172.31.130.3 > 8.8.8.8: ICMP echo request, id 11, seq 2, length 64
12:10:53.720595 eth0  In  IP 8.8.8.8 > 172.31.130.3: ICMP echo reply, id 11, seq 2, length 64
12:10:54.689799 eth0  Out IP 172.31.130.3 > 8.8.8.8: ICMP echo request, id 11, seq 3, length 64
12:10:54.723941 eth0  In  IP 8.8.8.8 > 172.31.130.3: ICMP echo reply, id 11, seq 3, length 64
12:10:55.690132 eth0  Out IP 172.31.130.3 > 8.8.8.8: ICMP echo request, id 11, seq 4, length 64
12:10:55.721979 eth0  In  IP 8.8.8.8 > 172.31.130.3: ICMP echo reply, id 11, seq 4, length 64
12:10:56.690630 eth0  Out IP 172.31.130.3 > 8.8.8.8: ICMP echo request, id 11, seq 5, length 64
12:10:56.726057 eth0  In  IP 8.8.8.8 > 172.31.130.3: ICMP echo reply, id 11, seq 5, length 64
12:10:56.749075 eth0  In  ARP, Request who-has 172.31.130.3 tell 172.31.130.1, length 28
12:10:56.749094 eth0  Out ARP, Reply 172.31.130.3 is-at 9e:ea:1a:f9:c0:a0, length 28
reading from file /capture-test-traffic-pod.pcap0, link-type LINUX_SLL2 (Linux cooked v2), snapshot length 262144
Warning: interface names might be incorrect
