reading from file /capture-test-traffic-pod.pcap0, link-type LINUX_SLL2 (Linux cooked v2), snapshot length 262144
Warning: interface names might be incorrect
12:10:36.843700 eth0  In  IP 192.168.147.3.6443 > 192.168.147.2.37374: Flags [.], ack 1573880261, win 73, options [nop,nop,TS val 2859926333 ecr 2329548256], length 0
12:10:36.905034 eth0  In  IP 192.168.147.3.10351 > 192.168.147.2.10351: UDP, length 106
12:10:36.905474 eth0  Out IP 192.168.147.2.10351 > 192.168.147.3.10351: UDP, length 18
12:10:37.086822 eth0  In  IP6 fe80::c822:8fff:fea8:da7f > fe80::843e:6ff:fe6f:ff30: ICMP6, neighbor solicitation, who has fe80::843e:6ff:fe6f:ff30, length 32
12:10:37.086881 eth0  Out IP6 fe80::843e:6ff:fe6f:ff30 > fe80::c822:8fff:fea8:da7f: ICMP6, neighbor advertisement, tgt is fe80::843e:6ff:fe6f:ff30, length 24
12:10:37.229558 test-tra-53ebf1 P   IP 172.31.130.2 > 8.8.8.8: ICMP echo request, id 11, seq 1, length 64
12:10:37.230443 antrea-gw0 In  IP 172.31.130.2 > 8.8.8.8: ICMP echo request, id 11, seq 1, length 64
12:10:37.230499 eth0  Out IP 192.168.147.2 > 8.8.8.8: ICMP echo request, id 11, seq 1, length 64
12:10:37.246894 eth0  In  IP 8.8.8.8 > 192.168.147.2: ICMP echo reply, id 11, seq 1, length 64
12:10:37.246929 antrea-gw0 Out IP 8.8.8.8 > 172.31.130.2: ICMP echo reply, id 11, seq 1, length 64
12:10:37.246962 test-tra-53ebf1 Out IP 8.8.8.8 > 172.31.130.2: ICMP echo reply, id 11, seq 1, length 64
12:10:37.727503 eth0  In  IP 192.168.147.4.10351 > 192.168.147.2.10351: UDP, length 100
12:10:37.728389 eth0  Out IP 192.168.147.2.10351 > 192.168.147.4.10351: UDP, length 18
12:10:37.810029 eth0  Out IP 192.168.147.2.10351 > 192.168.147.4.10351: UDP, length 100
12:10:37.811010 eth0  In  IP 192.168.147.4.10351 > 192.168.147.2.10351: UDP, length 18
12:10:37.903612 eth0  In  IP 192.168.147.3.10351 > 192.168.147.2.10351: UDP, length 106
12:10:37.905115 eth0  Out IP 192.168.147.2.10351 > 192.168.147.3.10351: UDP, length 18
12:10:38.230862 test-tra-53ebf1 P   IP 172.31.130.2 > 8.8.8.8: ICMP echo request, id 11, seq 2, length 64
12:10:38.230900 antrea-gw0 In  IP 172.31.130.2 > 8.8.8.8: ICMP echo request, id 11, seq 2, length 64
12:10:38.230945 eth0  Out IP 192.168.147.2 > 8.8.8.8: ICMP echo request, id 11, seq 2, length 64
12:10:38.245122 eth0  In  IP 8.8.8.8 > 192.168.147.2: ICMP echo reply, id 11, seq 2, length 64
12:10:38.245155 antrea-gw0 Out IP 8.8.8.8 > 172.31.130.2: ICMP echo reply, id 11, seq 2, length 64
12:10:38.245182 test-tra-53ebf1 Out IP 8.8.8.8 > 172.31.130.2: ICMP echo reply, id 11, seq 2, length 64
12:10:38.522278 eth0  Out IP 192.168.147.2.37374 > 192.168.147.3.6443: Flags [P.], seq 1:41, ack 0, win 90, options [nop,nop,TS val 2329549976 ecr 2859926333], length 40
12:10:38.522400 eth0  In  IP 192.168.147.3.6443 > 192.168.147.2.37374: Flags [.], ack 41, win 73, options [nop,nop,TS val 2859928012 ecr 2329549976], length 0
12:10:38.523246 eth0  Out IP 192.168.147.2.37374 > 192.168.147.3.6443: Flags [P.], seq 41:586, ack 0, win 90, options [nop,nop,TS val 2329549977 ecr 2859928012], length 545
12:10:38.523332 eth0  In  IP 192.168.147.3.6443 > 192.168.147.2.37374: Flags [.], ack 586, win 73, options [nop,nop,TS val 2859928013 ecr 2329549977], length 0
12:10:38.556402 eth0  In  IP 192.168.147.3.6443 > 192.168.147.2.37374: Flags [P.], seq 0:94, ack 586, win 73, options [nop,nop,TS val 2859928046 ecr 2329549977], length 94
12:10:38.556752 eth0  In  IP 192.168.147.3.6443 > 192.168.147.2.37374: Flags [P.], seq 94:639, ack 586, win 73, options [nop,nop,TS val 2859928046 ecr 2329549977], length 545
12:10:38.556822 eth0  Out IP 192.168.147.2.37374 > 192.168.147.3.6443: Flags [.], ack 639, win 90, options [nop,nop,TS val 2329550010 ecr 2859928046], length 0
12:10:38.809702 eth0  Out IP 192.168.147.2.10351 > 192.168.147.3.10351: UDP, length 106
12:10:38.810294 eth0  In  IP 192.168.147.3.10351 > 192.168.147.2.10351: UDP, length 18
12:10:39.134389 genev_sys_6081 Out IP6 fe80::d482:39ff:fecb:dc2d > ff02::2: ICMP6, router solicitation, length 16
12:10:39.231467 test-tra-53ebf1 P   IP 172.31.130.2 > 8.8.8.8: ICMP echo request, id 11, seq 3, length 64
12:10:39.231492 antrea-gw0 In  IP 172.31.130.2 > 8.8.8.8: ICMP echo request, id 11, seq 3, length 64
12:10:39.231525 eth0  Out IP 192.168.147.2 > 8.8.8.8: ICMP echo request, id 11, seq 3, length 64
12:10:39.247717 eth0  In  IP 8.8.8.8 > 192.168.147.2: ICMP echo reply, id 11, seq 3, length 64
12:10:39.247743 antrea-gw0 Out IP 8.8.8.8 > 172.31.130.2: ICMP echo reply, id 11, seq 3, length 64
12:10:39.247764 test-tra-53ebf1 Out IP 8.8.8.8 > 172.31.130.2: ICMP echo reply, id 11, seq 3, length 64
12:10:39.809172 eth0  Out IP 192.168.147.2.10351 > 192.168.147.3.10351: UDP, length 106
12:10:39.809360 eth0  In  IP 192.168.147.3.10351 > 192.168.147.2.10351: UDP, length 18
12:10:39.904647 eth0  In  IP 192.168.147.3.10351 > 192.168.147.2.10351: UDP, length 106
12:10:39.904858 eth0  Out IP 192.168.147.2.10351 > 192.168.147.3.10351: UDP, length 18
12:10:40.169256 lo    In  IP6 ::1.54702 > ::1.10350: Flags [S], seq 2458058808, win 65476, options [mss 65476,sackOK,TS val 3615828002 ecr 0,nop,wscale 10], length 0
12:10:40.169292 lo    In  IP6 ::1.10350 > ::1.54702: Flags [S.], seq 2152601787, ack 2458058809, win 65464, options [mss 65476,sackOK,TS val 3615828002 ecr 3615828002,nop,wscale 10], length 0
12:10:40.169309 lo    In  IP6 ::1.54702 > ::1.10350: Flags [.], ack 1, win 64, options [nop,nop,TS val 3615828002 ecr 3615828002], length 0
12:10:40.170574 lo    In  IP6 ::1.54702 > ::1.10350: Flags [P.], seq 1:1516, ack 1, win 64, options [nop,nop,TS val 3615828003 ecr 3615828002], length 1515
12:10:40.170601 lo    In  IP6 ::1.10350 > ::1.54702: Flags [.], ack 1516, win 72, options [nop,nop,TS val 3615828003 ecr 3615828003], length 0
12:10:40.183254 lo    In  IP6 ::1.10350 > ::1.54702: Flags [P.], seq 1:3430, ack 1516, win 72, options [nop,nop,TS val 3615828016 ecr 3615828003], length 3429
12:10:40.183296 lo    In  IP6 ::1.54702 > ::1.10350: Flags [.], ack 3430, win 93, options [nop,nop,TS val 3615828016 ecr 3615828016], length 0
12:10:40.187304 lo    In  IP6 ::1.54702 > ::1.10350: Flags [P.], seq 1516:1610, ack 3430, win 93, options [nop,nop,TS val 3615828020 ecr 3615828016], length 94
12:10:40.187688 lo    In  IP6 ::1.10350 > ::1.54702: Flags [P.], seq 3430:3491, ack 1610, win 72, options [nop,nop,TS val 3615828020 ecr 3615828020], length 61
12:10:40.187781 lo    In  IP6 ::1.54702 > ::1.10350: Flags [P.], seq 1610:1702, ack 3491, win 93, options [nop,nop,TS val 3615828020 ecr 3615828020], length 92
12:10:40.187879 lo    In  IP6 ::1.54702 > ::1.10350: Flags [P.], seq 1702:1773, ack 3491, win 93, options [nop,nop,TS val 3615828020 ecr 3615828020], length 71
12:10:40.187896 lo    In  IP6 ::1.10350 > ::1.54702: Flags [.], ack 1773, win 72, options [nop,nop,TS val 3615828020 ecr 3615828020], length 0
12:10:40.187899 lo    In  IP6 ::1.54702 > ::1.10350: Flags [P.], seq 1773:1804, ack 3491, win 93, options [nop,nop,TS val 3615828020 ecr 3615828020], length 31
12:10:40.187934 lo    In  IP6 ::1.10350 > ::1.54702: Flags [P.], seq 3491:3535, ack 1804, win 72, options [nop,nop,TS val 3615828020 ecr 3615828020], length 44
12:10:40.188878 lo    In  IP6 ::1.10350 > ::1.54702: Flags [P.], seq 3535:3574, ack 1804, win 72, options [nop,nop,TS val 3615828021 ecr 3615828020], length 39
12:10:40.188911 lo    In  IP6 ::1.54702 > ::1.10350: Flags [.], ack 3574, win 93, options [nop,nop,TS val 3615828021 ecr 3615828020], length 0
12:10:40.188975 lo    In  IP6 ::1.10350 > ::1.54702: Flags [P.], seq 3574:3726, ack 1804, win 72, options [nop,nop,TS val 3615828021 ecr 3615828021], length 152
12:10:40.189027 lo    In  IP6 ::1.10350 > ::1.54702: Flags [P.], seq 3726:3759, ack 1804, win 72, options [nop,nop,TS val 3615828021 ecr 3615828021], length 33
12:10:40.189034 lo    In  IP6 ::1.54702 > ::1.10350: Flags [.], ack 3759, win 95, options [nop,nop,TS val 3615828021 ecr 3615828021], length 0
12:10:40.189150 lo    In  IP6 ::1.54702 > ::1.10350: Flags [P.], seq 1804:1828, ack 3759, win 95, options [nop,nop,TS val 3615828022 ecr 3615828021], length 24
12:10:40.189190 lo    In  IP6 ::1.54702 > ::1.10350: Flags [F.], seq 1828, ack 3759, win 95, options [nop,nop,TS val 3615828022 ecr 3615828021], length 0
12:10:40.189191 lo    In  IP6 ::1.10350 > ::1.54702: Flags [P.], seq 3759:3783, ack 1828, win 72, options [nop,nop,TS val 3615828022 ecr 3615828022], length 24
12:10:40.189211 lo    In  IP6 ::1.54702 > ::1.10350: Flags [R], seq 2458060636, win 0, length 0
12:10:40.189214 lo    In  IP6 ::1.10350 > ::1.54702: Flags [F.], seq 3783, ack 1829, win 72, options [nop,nop,TS val 3615828022 ecr 3615828022], length 0
12:10:40.189223 lo    In  IP6 ::1.54702 > ::1.10350: Flags [R], seq 2458060637, win 0, length 0
12:10:40.233518 test-tra-53ebf1 P   IP 172.31.130.2 > 8.8.8.8: ICMP echo request, id 11, seq 4, length 64
12:10:40.233555 antrea-gw0 In  IP 172.31.130.2 > 8.8.8.8: ICMP echo request, id 11, seq 4, length 64
12:10:40.233673 eth0  Out IP 192.168.147.2 > 8.8.8.8: ICMP echo request, id 11, seq 4, length 64
12:10:40.248623 eth0  In  IP 8.8.8.8 > 192.168.147.2: ICMP echo reply, id 11, seq 4, length 64
12:10:40.248684 antrea-gw0 Out IP 8.8.8.8 > 172.31.130.2: ICMP echo reply, id 11, seq 4, length 64
12:10:40.248718 test-tra-53ebf1 Out IP 8.8.8.8 > 172.31.130.2: ICMP echo reply, id 11, seq 4, length 64
12:10:40.670531 eth0  M   IP6 fe80::8cdb:35ff:feb1:3caa > ff02::2: ICMP6, router solicitation, length 16
12:10:40.726887 eth0  In  IP 192.168.147.4.10351 > 192.168.147.2.10351: UDP, length 100
12:10:40.727506 eth0  Out IP 192.168.147.2.10351 > 192.168.147.4.10351: UDP, length 18
12:10:40.809099 eth0  Out IP 192.168.147.2.10351 > 192.168.147.4.10351: UDP, length 100
12:10:40.809808 eth0  In  IP 192.168.147.4.10351 > 192.168.147.2.10351: UDP, length 18
12:10:40.955821 eth0  In  IP 192.168.147.3.6443 > 192.168.147.2.44920: Flags [P.], seq 260945271:260945423, ack 3338603591, win 72, options [nop,nop,TS val 2859930445 ecr 2276996416], length 152
12:10:40.956506 eth0  Out IP 192.168.147.2.44920 > 192.168.147.3.6443: Flags [P.], seq 1:36, ack 152, win 100, options [nop,nop,TS val 2277000570 ecr 2859930445], length 35
12:10:40.956579 eth0  In  IP 192.168.147.3.6443 > 192.168.147.2.44920: Flags [.], ack 36, win 72, options [nop,nop,TS val 2859930446 ecr 2277000570], length 0
12:10:41.182441 test-tra-53ebf1 M   IP6 fe80::40f3:a0ff:fec5:1655 > ff02::2: ICMP6, router solicitation, length 16
12:10:41.234252 test-tra-53ebf1 P   IP 172.31.130.2 > 8.8.8.8: ICMP echo request, id 11, seq 5, length 64
12:10:41.234288 antrea-gw0 In  IP 172.31.130.2 > 8.8.8.8: ICMP echo request, id 11, seq 5, length 64
12:10:41.234331 eth0  Out IP 192.168.147.2 > 8.8.8.8: ICMP echo request, id 11, seq 5, length 64
12:10:41.250698 eth0  In  IP 8.8.8.8 > 192.168.147.2: ICMP echo reply, id 11, seq 5, length 64
12:10:41.250724 antrea-gw0 Out IP 8.8.8.8 > 172.31.130.2: ICMP echo reply, id 11, seq 5, length 64
12:10:41.250747 test-tra-53ebf1 Out IP 8.8.8.8 > 172.31.130.2: ICMP echo reply, id 11, seq 5, length 64
12:10:41.370978 lo    In  IP6 ::1.54718 > ::1.10350: Flags [S], seq 3521856841, win 65476, options [mss 65476,sackOK,TS val 3615829203 ecr 0,nop,wscale 10], length 0
12:10:41.371017 lo    In  IP6 ::1.10350 > ::1.54718: Flags [S.], seq 2369450146, ack 3521856842, win 65464, options [mss 65476,sackOK,TS val 3615829203 ecr 3615829203,nop,wscale 10], length 0
12:10:41.371036 lo    In  IP6 ::1.54718 > ::1.10350: Flags [.], ack 1, win 64, options [nop,nop,TS val 3615829203 ecr 3615829203], length 0
12:10:41.372598 lo    In  IP6 ::1.54718 > ::1.10350: Flags [P.], seq 1:1516, ack 1, win 64, options [nop,nop,TS val 3615829205 ecr 3615829203], length 1515
12:10:41.372625 lo    In  IP6 ::1.10350 > ::1.54718: Flags [.], ack 1516, win 72, options [nop,nop,TS val 3615829205 ecr 3615829205], length 0
12:10:41.377413 lo    In  IP6 ::1.10350 > ::1.54718: Flags [P.], seq 1:3430, ack 1516, win 72, options [nop,nop,TS val 3615829210 ecr 3615829205], length 3429
12:10:41.377434 lo    In  IP6 ::1.54718 > ::1.10350: Flags [.], ack 3430, win 93, options [nop,nop,TS val 3615829210 ecr 3615829210], length 0
12:10:41.378294 lo    In  IP6 ::1.54718 > ::1.10350: Flags [P.], seq 1516:1610, ack 3430, win 93, options [nop,nop,TS val 3615829211 ecr 3615829210], length 94
12:10:41.378522 lo    In  IP6 ::1.10350 > ::1.54718: Flags [P.], seq 3430:3491, ack 1610, win 72, options [nop,nop,TS val 3615829211 ecr 3615829211], length 61
12:10:41.378682 lo    In  IP6 ::1.54718 > ::1.10350: Flags [P.], seq 1610:1702, ack 3491, win 93, options [nop,nop,TS val 3615829211 ecr 3615829211], length 92
12:10:41.378780 lo    In  IP6 ::1.10350 > ::1.54718: Flags [P.], seq 3491:3526, ack 1702, win 72, options [nop,nop,TS val 3615829211 ecr 3615829211], length 35
12:10:41.378909 lo    In  IP6 ::1.10350 > ::1.54718: Flags [P.], seq 3526:3557, ack 1702, win 72, options [nop,nop,TS val 3615829211 ecr 3615829211], length 31
12:10:41.379036 lo    In  IP6 ::1.54718 > ::1.10350: Flags [.], ack 3557, win 93, options [nop,nop,TS val 3615829211 ecr 3615829211], length 0
12:10:41.379051 lo    In  IP6 ::1.54718 > ::1.10350: Flags [P.], seq 1702:1774, ack 3557, win 93, options [nop,nop,TS val 3615829211 ecr 3615829211], length 72
12:10:41.379763 lo    In  IP6 ::1.54718 > ::1.10350: Flags [P.], seq 1774:1805, ack 3557, win 93, options [nop,nop,TS val 3615829212 ecr 3615829211], length 31
12:10:41.379898 lo    In  IP6 ::1.10350 > ::1.54718: Flags [.], ack 1805, win 72, options [nop,nop,TS val 3615829212 ecr 3615829211], length 0
12:10:41.379998 lo    In  IP6 ::1.10350 > ::1.54718: Flags [P.], seq 3557:3596, ack 1805, win 72, options [nop,nop,TS val 3615829212 ecr 3615829211], length 39
12:10:41.380169 lo    In  IP6 ::1.10350 > ::1.54718: Flags [P.], seq 3596:3748, ack 1805, win 72, options [nop,nop,TS val 3615829213 ecr 3615829211], length 152
12:10:41.380188 lo    In  IP6 ::1.54718 > ::1.10350: Flags [.], ack 3748, win 95, options [nop,nop,TS val 3615829213 ecr 3615829212], length 0
12:10:41.380371 lo    In  IP6 ::1.10350 > ::1.54718: Flags [P.], seq 3748:3781, ack 1805, win 72, options [nop,nop,TS val 3615829213 ecr 3615829213], length 33
12:10:41.380443 lo    In  IP6 ::1.54718 > ::1.10350: Flags [P.], seq 1805:1829, ack 3781, win 95, options [nop,nop,TS val 3615829213 ecr 3615829213], length 24
12:10:41.380498 lo    In  IP6 ::1.10350 > ::1.54718: Flags [P.], seq 3781:3805, ack 1829, win 72, options [nop,nop,TS val 3615829213 ecr 3615829213], length 24
12:10:41.380529 lo    In  IP6 ::1.10350 > ::1.54718: Flags [F.], seq 3805, ack 1829, win 72, options [nop,nop,TS val 3615829213 ecr 3615829213], length 0
12:10:41.380618 lo    In  IP6 ::1.54718 > ::1.10350: Flags [F.], seq 1829, ack 3806, win 95, options [nop,nop,TS val 3615829213 ecr 3615829213], length 0
12:10:41.380642 lo    In  IP6 ::1.10350 > ::1.54718: Flags [.], ack 1830, win 72, options [nop,nop,TS val 3615829213 ecr 3615829213], length 0
12:10:41.617070 eth0  In  IP 192.168.147.3.6443 > 192.168.147.2.44920: Flags [P.], seq 152:312, ack 36, win 72, options [nop,nop,TS val 2859931106 ecr 2277000570], length 160
12:10:41.658479 eth0  Out IP 192.168.147.2.44920 > 192.168.147.3.6443: Flags [.], ack 312, win 100, options [nop,nop,TS val 2277001272 ecr 2859931106], length 0
12:10:41.694180 antrea-gw0 Out ARP, Request who-has 172.31.130.2 tell 172.31.130.1, length 28
12:10:41.694644 test-tra-53ebf1 Out ARP, Request who-has 172.31.130.2 tell 172.31.130.1, length 28
12:10:41.694665 test-tra-53ebf1 P   ARP, Reply 172.31.130.2 is-at 42:f3:a0:c5:16:55, length 28
12:10:41.695181 antrea-gw0 In  ARP, Reply 172.31.130.2 is-at 42:f3:a0:c5:16:55, length 28
12:10:41.726751 eth0  In  IP 192.168.147.4.10351 > 192.168.147.2.10351: UDP, length 100
12:10:41.727346 eth0  Out IP 192.168.147.2.10351 > 192.168.147.4.10351: UDP, length 18
12:10:41.746120 eth0  In  IP 192.168.147.3.6443 > 192.168.147.2.44920: Flags [P.], seq 312:446, ack 36, win 72, options [nop,nop,TS val 2859931235 ecr 2277001272], length 134
12:10:41.746239 eth0  Out IP 192.168.147.2.44920 > 192.168.147.3.6443: Flags [.], ack 446, win 100, options [nop,nop,TS val 2277001360 ecr 2859931235], length 0
12:10:41.746358 eth0  In  IP 192.168.147.3.6443 > 192.168.147.2.44920: Flags [P.], seq 446:580, ack 36, win 72, options [nop,nop,TS val 2859931236 ecr 2277001360], length 134
12:10:41.746412 eth0  Out IP 192.168.147.2.44920 > 192.168.147.3.6443: Flags [.], ack 580, win 100, options [nop,nop,TS val 2277001360 ecr 2859931236], length 0
12:10:41.810515 eth0  Out IP 192.168.147.2.10351 > 192.168.147.3.10351: UDP, length 106
12:10:41.811164 eth0  In  IP 192.168.147.3.10351 > 192.168.147.2.10351: UDP, length 18
12:10:41.985352 eth0  In  IP 192.168.147.3.6443 > 192.168.147.2.44920: Flags [P.], seq 580:735, ack 36, win 72, options [nop,nop,TS val 2859931475 ecr 2277001360], length 155
12:10:41.985403 eth0  Out IP 192.168.147.2.44920 > 192.168.147.3.6443: Flags [.], ack 735, win 100, options [nop,nop,TS val 2277001599 ecr 2859931475], length 0
12:10:42.101809 eth0  In  IP 192.168.147.3.6443 > 192.168.147.2.44920: Flags [P.], seq 735:832, ack 36, win 72, options [nop,nop,TS val 2859931591 ecr 2277001599], length 97
12:10:42.101961 eth0  Out IP 192.168.147.2.44920 > 192.168.147.3.6443: Flags [.], ack 832, win 100, options [nop,nop,TS val 2277001715 ecr 2859931591], length 0
12:10:42.207009 eth0  Out IP6 fe80::843e:6ff:fe6f:ff30 > fe80::c822:8fff:fea8:da7f: ICMP6, neighbor solicitation, who has fe80::c822:8fff:fea8:da7f, length 32
12:10:42.207081 eth0  In  IP6 fe80::c822:8fff:fea8:da7f > fe80::843e:6ff:fe6f:ff30: ICMP6, neighbor advertisement, tgt is fe80::c822:8fff:fea8:da7f, length 24
12:10:42.290945 eth0  In  IP 192.168.147.3.6443 > 192.168.147.2.44920: Flags [P.], seq 832:949, ack 36, win 72, options [nop,nop,TS val 2859931780 ecr 2277001715], length 117
12:10:42.290982 eth0  Out IP 192.168.147.2.44920 > 192.168.147.3.6443: Flags [.], ack 949, win 100, options [nop,nop,TS val 2277001904 ecr 2859931780], length 0
12:10:42.291118 eth0  In  IP 192.168.147.3.6443 > 192.168.147.2.44920: Flags [P.], seq 949:1066, ack 36, win 72, options [nop,nop,TS val 2859931780 ecr 2277001904], length 117
12:10:42.291124 eth0  Out IP 192.168.147.2.44920 > 192.168.147.3.6443: Flags [.], ack 1066, win 100, options [nop,nop,TS val 2277001904 ecr 2859931780], length 0
12:10:42.423464 eth0  In  IP 192.168.147.3.46810 > 192.168.147.2.10250: Flags [S], seq 613579434, win 64240, options [mss 1460,sackOK,TS val 2859931913 ecr 0,nop,wscale 10], length 0
12:10:42.423531 eth0  Out IP 192.168.147.2.10250 > 192.168.147.3.46810: Flags [S.], seq 1436470435, ack 613579435, win 65160, options [mss 1460,sackOK,TS val 2329553877 ecr 2859931913,nop,wscale 10], length 0
12:10:42.423548 eth0  In  IP 192.168.147.3.46810 > 192.168.147.2.10250: Flags [.], ack 1, win 63, options [nop,nop,TS val 2859931913 ecr 2329553877], length 0
12:10:42.424146 eth0  In  IP 192.168.147.3.46810 > 192.168.147.2.10250: Flags [P.], seq 1:1495, ack 1, win 63, options [nop,nop,TS val 2859931913 ecr 2329553877], length 1494
12:10:42.424187 eth0  Out IP 192.168.147.2.10250 > 192.168.147.3.46810: Flags [.], ack 1495, win 67, options [nop,nop,TS val 2329553878 ecr 2859931913], length 0
12:10:42.426405 eth0  Out IP 192.168.147.2.10250 > 192.168.147.3.46810: Flags [P.], seq 1:3426, ack 1495, win 67, options [nop,nop,TS val 2329553880 ecr 2859931913], length 3425
12:10:42.426431 eth0  In  IP 192.168.147.3.46810 > 192.168.147.2.10250: Flags [.], ack 3426, win 70, options [nop,nop,TS val 2859931916 ecr 2329553880], length 0
12:10:42.428858 eth0  In  IP 192.168.147.3.46810 > 192.168.147.2.10250: Flags [P.], seq 1495:2706, ack 3426, win 70, options [nop,nop,TS val 2859931918 ecr 2329553880], length 1211
12:10:42.429274 eth0  In  IP 192.168.147.3.46810 > 192.168.147.2.10250: Flags [P.], seq 2706:3241, ack 3426, win 70, options [nop,nop,TS val 2859931919 ecr 2329553880], length 535
12:10:42.429283 eth0  Out IP 192.168.147.2.10250 > 192.168.147.3.46810: Flags [.], ack 3241, win 72, options [nop,nop,TS val 2329553883 ecr 2859931918], length 0
12:10:42.431108 eth0  Out IP 192.168.147.2.37374 > 192.168.147.3.6443: Flags [P.], seq 586:666, ack 639, win 90, options [nop,nop,TS val 2329553884 ecr 2859928046], length 80
12:10:42.431304 eth0  Out IP 192.168.147.2.37374 > 192.168.147.3.6443: Flags [P.], seq 666:1046, ack 639, win 90, options [nop,nop,TS val 2329553885 ecr 2859928046], length 380
12:10:42.431328 eth0  In  IP 192.168.147.3.6443 > 192.168.147.2.37374: Flags [.], ack 1046, win 73, options [nop,nop,TS val 2859931921 ecr 2329553884], length 0
12:10:42.432722 eth0  In  IP 192.168.147.3.6443 > 192.168.147.2.37374: Flags [P.], seq 639:733, ack 1046, win 73, options [nop,nop,TS val 2859931922 ecr 2329553884], length 94
12:10:42.433042 eth0  In  IP 192.168.147.3.6443 > 192.168.147.2.37374: Flags [P.], seq 733:1527, ack 1046, win 73, options [nop,nop,TS val 2859931922 ecr 2329553884], length 794
12:10:42.433057 eth0  Out IP 192.168.147.2.37374 > 192.168.147.3.6443: Flags [.], ack 1527, win 90, options [nop,nop,TS val 2329553886 ecr 2859931922], length 0
12:10:42.435389 lo    In  IP 127.0.0.1.39216 > 127.0.0.1.43923: Flags [S], seq 3043393517, win 65495, options [mss 65495,sackOK,TS val 250717838 ecr 0,nop,wscale 10], length 0
12:10:42.435398 lo    In  IP 127.0.0.1.43923 > 127.0.0.1.39216: Flags [S.], seq 636608927, ack 3043393518, win 65483, options [mss 65495,sackOK,TS val 250717838 ecr 250717838,nop,wscale 10], length 0
12:10:42.435406 lo    In  IP 127.0.0.1.39216 > 127.0.0.1.43923: Flags [.], ack 1, win 64, options [nop,nop,TS val 250717838 ecr 250717838], length 0
12:10:42.435554 lo    In  IP 127.0.0.1.39216 > 127.0.0.1.43923: Flags [P.], seq 1:410, ack 1, win 64, options [nop,nop,TS val 250717838 ecr 250717838], length 409
12:10:42.435556 lo    In  IP 127.0.0.1.43923 > 127.0.0.1.39216: Flags [.], ack 410, win 64, options [nop,nop,TS val 250717838 ecr 250717838], length 0
12:10:42.436783 lo    In  IP 127.0.0.1.43923 > 127.0.0.1.39216: Flags [P.], seq 1:160, ack 410, win 64, options [nop,nop,TS val 250717839 ecr 250717838], length 159
12:10:42.436790 lo    In  IP 127.0.0.1.39216 > 127.0.0.1.43923: Flags [.], ack 160, win 64, options [nop,nop,TS val 250717839 ecr 250717839], length 0
12:10:42.436919 eth0  Out IP 192.168.147.2.10250 > 192.168.147.3.46810: Flags [P.], seq 3426:3607, ack 3241, win 72, options [nop,nop,TS val 2329553890 ecr 2859931918], length 181
12:10:42.438809 eth0  In  IP 192.168.147.3.46810 > 192.168.147.2.10250: Flags [P.], seq 3241:3265, ack 3607, win 73, options [nop,nop,TS val 2859931928 ecr 2329553890], length 24
12:10:42.438830 eth0  In  IP 192.168.147.3.46810 > 192.168.147.2.10250: Flags [P.], seq 3265:3289, ack 3607, win 73, options [nop,nop,TS val 2859931928 ecr 2329553890], length 24
12:10:42.438837 eth0  In  IP 192.168.147.3.46810 > 192.168.147.2.10250: Flags [P.], seq 3289:3315, ack 3607, win 73, options [nop,nop,TS val 2859931928 ecr 2329553890], length 26
12:10:42.438842 eth0  In  IP 192.168.147.3.46810 > 192.168.147.2.10250: Flags [P.], seq 3315:3341, ack 3607, win 73, options [nop,nop,TS val 2859931928 ecr 2329553890], length 26
12:10:42.438846 eth0  In  IP 192.168.147.3.46810 > 192.168.147.2.10250: Flags [P.], seq 3341:3367, ack 3607, win 73, options [nop,nop,TS val 2859931928 ecr 2329553890], length 26
12:10:42.438851 eth0  In  IP 192.168.147.3.46810 > 192.168.147.2.10250: Flags [P.], seq 3367:3390, ack 3607, win 73, options [nop,nop,TS val 2859931928 ecr 2329553890], length 23
12:10:42.438856 eth0  In  IP 192.168.147.3.46810 > 192.168.147.2.10250: Flags [P.], seq 3390:3413, ack 3607, win 73, options [nop,nop,TS val 2859931928 ecr 2329553890], length 23
12:10:42.438860 eth0  In  IP 192.168.147.3.46810 > 192.168.147.2.10250: Flags [P.], seq 3413:3466, ack 3607, win 73, options [nop,nop,TS val 2859931928 ecr 2329553890], length 53
12:10:42.440721 eth0  Out IP 192.168.147.2.10250 > 192.168.147.3.46810: Flags [.], ack 3466, win 72, options [nop,nop,TS val 2329553894 ecr 2859931928], length 0
12:10:42.440744 lo    In  IP 127.0.0.1.39216 > 127.0.0.1.43923: Flags [P.], seq 410:412, ack 160, win 64, options [nop,nop,TS val 250717843 ecr 250717839], length 2
12:10:42.440753 lo    In  IP 127.0.0.1.39216 > 127.0.0.1.43923: Flags [P.], seq 412:414, ack 160, win 64, options [nop,nop,TS val 250717843 ecr 250717839], length 2
12:10:42.440755 lo    In  IP 127.0.0.1.39216 > 127.0.0.1.43923: Flags [P.], seq 414:418, ack 160, win 64, options [nop,nop,TS val 250717843 ecr 250717839], length 4
12:10:42.440757 lo    In  IP 127.0.0.1.39216 > 127.0.0.1.43923: Flags [P.], seq 418:422, ack 160, win 64, options [nop,nop,TS val 250717843 ecr 250717839], length 4
12:10:42.440759 lo    In  IP 127.0.0.1.39216 > 127.0.0.1.43923: Flags [P.], seq 422:426, ack 160, win 64, options [nop,nop,TS val 250717843 ecr 250717839], length 4
12:10:42.440760 lo    In  IP 127.0.0.1.39216 > 127.0.0.1.43923: Flags [P.], seq 426:427, ack 160, win 64, options [nop,nop,TS val 250717843 ecr 250717839], length 1
12:10:42.440762 lo    In  IP 127.0.0.1.39216 > 127.0.0.1.43923: Flags [P.], seq 427:428, ack 160, win 64, options [nop,nop,TS val 250717843 ecr 250717839], length 1
12:10:42.440763 lo    In  IP 127.0.0.1.39216 > 127.0.0.1.43923: Flags [P.], seq 428:459, ack 160, win 64, options [nop,nop,TS val 250717843 ecr 250717839], length 31
12:10:42.440776 lo    In  IP 127.0.0.1.43923 > 127.0.0.1.39216: Flags [.], ack 459, win 64, options [nop,nop,TS val 250717843 ecr 250717843], length 0
12:10:42.442698 lo    In  IP 127.0.0.1.43923 > 127.0.0.1.39216: Flags [P.], seq 160:162, ack 459, win 64, options [nop,nop,TS val 250717845 ecr 250717843], length 2
12:10:42.442729 eth0  Out IP 192.168.147.2.10250 > 192.168.147.3.46810: Flags [P.], seq 3607:3631, ack 3466, win 72, options [nop,nop,TS val 2329553896 ecr 2859931928], length 24
12:10:42.442781 lo    In  IP 127.0.0.1.43923 > 127.0.0.1.39216: Flags [P.], seq 162:164, ack 459, win 64, options [nop,nop,TS val 250717845 ecr 250717843], length 2
12:10:42.442784 lo    In  IP 127.0.0.1.39216 > 127.0.0.1.43923: Flags [.], ack 164, win 64, options [nop,nop,TS val 250717845 ecr 250717845], length 0
12:10:42.442787 eth0  Out IP 192.168.147.2.10250 > 192.168.147.3.46810: Flags [P.], seq 3631:3655, ack 3466, win 72, options [nop,nop,TS val 2329553896 ecr 2859931928], length 24
12:10:42.442795 eth0  In  IP 192.168.147.3.46810 > 192.168.147.2.10250: Flags [.], ack 3655, win 73, options [nop,nop,TS val 2859931932 ecr 2329553896], length 0
12:10:42.442807 lo    In  IP 127.0.0.1.43923 > 127.0.0.1.39216: Flags [P.], seq 164:168, ack 459, win 64, options [nop,nop,TS val 250717845 ecr 250717845], length 4
12:10:42.442811 eth0  Out IP 192.168.147.2.10250 > 192.168.147.3.46810: Flags [P.], seq 3655:3681, ack 3466, win 72, options [nop,nop,TS val 2329553896 ecr 2859931932], length 26
12:10:42.442816 lo    In  IP 127.0.0.1.43923 > 127.0.0.1.39216: Flags [P.], seq 168:172, ack 459, win 64, options [nop,nop,TS val 250717845 ecr 250717845], length 4
12:10:42.442819 lo    In  IP 127.0.0.1.39216 > 127.0.0.1.43923: Flags [.], ack 172, win 64, options [nop,nop,TS val 250717845 ecr 250717845], length 0
12:10:42.442820 eth0  Out IP 192.168.147.2.10250 > 192.168.147.3.46810: Flags [P.], seq 3681:3707, ack 3466, win 72, options [nop,nop,TS val 2329553896 ecr 2859931932], length 26
12:10:42.442825 eth0  In  IP 192.168.147.3.46810 > 192.168.147.2.10250: Flags [.], ack 3707, win 73, options [nop,nop,TS val 2859931932 ecr 2329553896], length 0
12:10:42.442884 lo    In  IP 127.0.0.1.43923 > 127.0.0.1.39216: Flags [P.], seq 172:188, ack 459, win 64, options [nop,nop,TS val 250717845 ecr 250717845], length 16
12:10:42.442891 eth0  Out IP 192.168.147.2.10250 > 192.168.147.3.46810: Flags [P.], seq 3707:3745, ack 3466, win 72, options [nop,nop,TS val 2329553896 ecr 2859931932], length 38
12:10:42.443123 eth0  In  IP 192.168.147.3.46810 > 192.168.147.2.10250: Flags [P.], seq 3466:3490, ack 3745, win 73, options [nop,nop,TS val 2859931932 ecr 2329553896], length 24
12:10:42.443144 lo    In  IP 127.0.0.1.39216 > 127.0.0.1.43923: Flags [P.], seq 459:461, ack 188, win 64, options [nop,nop,TS val 250717846 ecr 250717845], length 2
12:10:42.443156 eth0  In  IP 192.168.147.3.46810 > 192.168.147.2.10250: Flags [P.], seq 3490:3514, ack 3745, win 73, options [nop,nop,TS val 2859931933 ecr 2329553896], length 24
12:10:42.443159 eth0  Out IP 192.168.147.2.10250 > 192.168.147.3.46810: Flags [.], ack 3514, win 72, options [nop,nop,TS val 2329553897 ecr 2859931932], length 0
12:10:42.443163 lo    In  IP 127.0.0.1.39216 > 127.0.0.1.43923: Flags [P.], seq 461:463, ack 188, win 64, options [nop,nop,TS val 250717846 ecr 250717845], length 2
12:10:42.443167 eth0  In  IP 192.168.147.3.46810 > 192.168.147.2.10250: Flags [P.], seq 3514:3540, ack 3745, win 73, options [nop,nop,TS val 2859931933 ecr 2329553897], length 26
12:10:42.443171 lo    In  IP 127.0.0.1.39216 > 127.0.0.1.43923: Flags [P.], seq 463:467, ack 188, win 64, options [nop,nop,TS val 250717846 ecr 250717845], length 4
12:10:42.443175 eth0  In  IP 192.168.147.3.46810 > 192.168.147.2.10250: Flags [P.], seq 3540:3566, ack 3745, win 73, options [nop,nop,TS val 2859931933 ecr 2329553897], length 26
12:10:42.443178 eth0  Out IP 192.168.147.2.10250 > 192.168.147.3.46810: Flags [.], ack 3566, win 72, options [nop,nop,TS val 2329553897 ecr 2859931933], length 0
12:10:42.443180 lo    In  IP 127.0.0.1.39216 > 127.0.0.1.43923: Flags [P.], seq 467:471, ack 188, win 64, options [nop,nop,TS val 250717846 ecr 250717845], length 4
12:10:42.443185 eth0  In  IP 192.168.147.3.46810 > 192.168.147.2.10250: Flags [P.], seq 3566:3592, ack 3745, win 73, options [nop,nop,TS val 2859931933 ecr 2329553897], length 26
12:10:42.443186 lo    In  IP 127.0.0.1.43923 > 127.0.0.1.39216: Flags [.], ack 471, win 64, options [nop,nop,TS val 250717846 ecr 250717846], length 0
12:10:42.443189 lo    In  IP 127.0.0.1.39216 > 127.0.0.1.43923: Flags [P.], seq 471:475, ack 188, win 64, options [nop,nop,TS val 250717846 ecr 250717846], length 4
12:10:42.443193 eth0  In  IP 192.168.147.3.46810 > 192.168.147.2.10250: Flags [P.], seq 3592:3615, ack 3745, win 73, options [nop,nop,TS val 2859931933 ecr 2329553897], length 23
12:10:42.443196 eth0  Out IP 192.168.147.2.10250 > 192.168.147.3.46810: Flags [.], ack 3615, win 72, options [nop,nop,TS val 2329553897 ecr 2859931933], length 0
12:10:42.443198 lo    In  IP 127.0.0.1.39216 > 127.0.0.1.43923: Flags [P.], seq 475:476, ack 188, win 64, options [nop,nop,TS val 250717846 ecr 250717846], length 1
12:10:42.443205 eth0  In  IP 192.168.147.3.46810 > 192.168.147.2.10250: Flags [P.], seq 3615:3638, ack 3745, win 73, options [nop,nop,TS val 2859931933 ecr 2329553897], length 23
12:10:42.443206 lo    In  IP 127.0.0.1.43923 > 127.0.0.1.39216: Flags [.], ack 476, win 64, options [nop,nop,TS val 250717846 ecr 250717846], length 0
12:10:42.443209 lo    In  IP 127.0.0.1.39216 > 127.0.0.1.43923: Flags [P.], seq 476:477, ack 188, win 64, options [nop,nop,TS val 250717846 ecr 250717846], length 1
12:10:42.443216 eth0  In  IP 192.168.147.3.46810 > 192.168.147.2.10250: Flags [P.], seq 3638:3675, ack 3745, win 73, options [nop,nop,TS val 2859931933 ecr 2329553897], length 37
12:10:42.443218 eth0  Out IP 192.168.147.2.10250 > 192.168.147.3.46810: Flags [.], ack 3675, win 72, options [nop,nop,TS val 2329553897 ecr 2859931933], length 0
12:10:42.443221 lo    In  IP 127.0.0.1.39216 > 127.0.0.1.43923: Flags [P.], seq 477:492, ack 188, win 64, options [nop,nop,TS val 250717846 ecr 250717846], length 15
12:10:42.443223 lo    In  IP 127.0.0.1.43923 > 127.0.0.1.39216: Flags [.], ack 492, win 64, options [nop,nop,TS val 250717846 ecr 250717846], length 0
12:10:42.443306 lo    In  IP 127.0.0.1.43923 > 127.0.0.1.39216: Flags [P.], seq 188:190, ack 492, win 64, options [nop,nop,TS val 250717846 ecr 250717846], length 2
12:10:42.443315 eth0  Out IP 192.168.147.2.10250 > 192.168.147.3.46810: Flags [P.], seq 3745:3769, ack 3675, win 72, options [nop,nop,TS val 2329553897 ecr 2859931933], length 24
12:10:42.443326 lo    In  IP 127.0.0.1.43923 > 127.0.0.1.39216: Flags [P.], seq 190:192, ack 492, win 64, options [nop,nop,TS val 250717846 ecr 250717846], length 2
12:10:42.443329 lo    In  IP 127.0.0.1.43923 > 127.0.0.1.39216: Flags [P.], seq 192:196, ack 492, win 64, options [nop,nop,TS val 250717846 ecr 250717846], length 4
12:10:42.443331 lo    In  IP 127.0.0.1.43923 > 127.0.0.1.39216: Flags [P.], seq 196:200, ack 492, win 64, options [nop,nop,TS val 250717846 ecr 250717846], length 4
12:10:42.443332 lo    In  IP 127.0.0.1.43923 > 127.0.0.1.39216: Flags [P.], seq 200:208, ack 492, win 64, options [nop,nop,TS val 250717846 ecr 250717846], length 8
12:10:42.443342 lo    In  IP 127.0.0.1.39216 > 127.0.0.1.43923: Flags [.], ack 208, win 64, options [nop,nop,TS val 250717846 ecr 250717846], length 0
12:10:42.443345 eth0  Out IP 192.168.147.2.10250 > 192.168.147.3.46810: Flags [P.], seq 3769:3809, ack 3675, win 72, options [nop,nop,TS val 2329553897 ecr 2859931933], length 40
12:10:42.443361 eth0  In  IP 192.168.147.3.46810 > 192.168.147.2.10250: Flags [.], ack 3809, win 73, options [nop,nop,TS val 2859931933 ecr 2329553897], length 0
12:10:42.443405 eth0  In  IP 192.168.147.3.46810 > 192.168.147.2.10250: Flags [P.], seq 3675:3699, ack 3809, win 73, options [nop,nop,TS val 2859931933 ecr 2329553897], length 24
12:10:42.443421 lo    In  IP 127.0.0.1.39216 > 127.0.0.1.43923: Flags [P.], seq 492:494, ack 208, win 64, options [nop,nop,TS val 250717846 ecr 250717846], length 2
12:10:42.443435 eth0  In  IP 192.168.147.3.46810 > 192.168.147.2.10250: Flags [P.], seq 3699:3723, ack 3809, win 73, options [nop,nop,TS val 2859931933 ecr 2329553897], length 24
12:10:42.443438 eth0  Out IP 192.168.147.2.10250 > 192.168.147.3.46810: Flags [.], ack 3723, win 72, options [nop,nop,TS val 2329553897 ecr 2859931933], length 0
12:10:42.443442 lo    In  IP 127.0.0.1.39216 > 127.0.0.1.43923: Flags [P.], seq 494:496, ack 208, win 64, options [nop,nop,TS val 250717846 ecr 250717846], length 2
12:10:42.443446 lo    In  IP 127.0.0.1.43923 > 127.0.0.1.39216: Flags [.], ack 496, win 64, options [nop,nop,TS val 250717846 ecr 250717846], length 0
12:10:42.443452 eth0  In  IP 192.168.147.3.46810 > 192.168.147.2.10250: Flags [P.], seq 3723:3749, ack 3809, win 73, options [nop,nop,TS val 2859931933 ecr 2329553897], length 26
12:10:42.443455 lo    In  IP 127.0.0.1.39216 > 127.0.0.1.43923: Flags [P.], seq 496:500, ack 208, win 64, options [nop,nop,TS val 250717846 ecr 250717846], length 4
12:10:42.443463 eth0  In  IP 192.168.147.3.46810 > 192.168.147.2.10250: Flags [P.], seq 3749:3775, ack 3809, win 73, options [nop,nop,TS val 2859931933 ecr 2329553897], length 26
12:10:42.443466 eth0  Out IP 192.168.147.2.10250 > 192.168.147.3.46810: Flags [.], ack 3775, win 72, options [nop,nop,TS val 2329553897 ecr 2859931933], length 0
12:10:42.443468 lo    In  IP 127.0.0.1.39216 > 127.0.0.1.43923: Flags [P.], seq 500:504, ack 208, win 64, options [nop,nop,TS val 250717846 ecr 250717846], length 4
12:10:42.443472 lo    In  IP 127.0.0.1.43923 > 127.0.0.1.39216: Flags [.], ack 504, win 64, options [nop,nop,TS val 250717846 ecr 250717846], length 0
12:10:42.443476 eth0  In  IP 192.168.147.3.46810 > 192.168.147.2.10250: Flags [P.], seq 3775:3801, ack 3809, win 73, options [nop,nop,TS val 2859931933 ecr 2329553897], length 26
12:10:42.443479 lo    In  IP 127.0.0.1.39216 > 127.0.0.1.43923: Flags [P.], seq 504:508, ack 208, win 64, options [nop,nop,TS val 250717846 ecr 250717846], length 4
12:10:42.443491 eth0  In  IP 192.168.147.3.46810 > 192.168.147.2.10250: Flags [P.], seq 3801:3824, ack 3809, win 73, options [nop,nop,TS val 2859931933 ecr 2329553897], length 23
12:10:42.443497 eth0  Out IP 192.168.147.2.10250 > 192.168.147.3.46810: Flags [.], ack 3824, win 72, options [nop,nop,TS val 2329553897 ecr 2859931933], length 0
12:10:42.443500 lo    In  IP 127.0.0.1.39216 > 127.0.0.1.43923: Flags [P.], seq 508:509, ack 208, win 64, options [nop,nop,TS val 250717846 ecr 250717846], length 1
12:10:42.443503 lo    In  IP 127.0.0.1.43923 > 127.0.0.1.39216: Flags [.], ack 509, win 64, options [nop,nop,TS val 250717846 ecr 250717846], length 0
12:10:42.443512 eth0  In  IP 192.168.147.3.46810 > 192.168.147.2.10250: Flags [P.], seq 3824:3847, ack 3809, win 73, options [nop,nop,TS val 2859931933 ecr 2329553897], length 23
12:10:42.443515 lo    In  IP 127.0.0.1.39216 > 127.0.0.1.43923: Flags [P.], seq 509:510, ack 208, win 64, options [nop,nop,TS val 250717846 ecr 250717846], length 1
12:10:42.443522 eth0  In  IP 192.168.147.3.46810 > 192.168.147.2.10250: Flags [P.], seq 3847:3880, ack 3809, win 73, options [nop,nop,TS val 2859931933 ecr 2329553897], length 33
12:10:42.443525 eth0  Out IP 192.168.147.2.10250 > 192.168.147.3.46810: Flags [.], ack 3880, win 72, options [nop,nop,TS val 2329553897 ecr 2859931933], length 0
12:10:42.443527 lo    In  IP 127.0.0.1.39216 > 127.0.0.1.43923: Flags [P.], seq 510:521, ack 208, win 64, options [nop,nop,TS val 250717846 ecr 250717846], length 11
12:10:42.443530 lo    In  IP 127.0.0.1.43923 > 127.0.0.1.39216: Flags [.], ack 521, win 64, options [nop,nop,TS val 250717846 ecr 250717846], length 0
12:10:42.443543 lo    In  IP 127.0.0.1.43923 > 127.0.0.1.39216: Flags [P.], seq 208:210, ack 521, win 64, options [nop,nop,TS val 250717846 ecr 250717846], length 2
12:10:42.443546 eth0  Out IP 192.168.147.2.10250 > 192.168.147.3.46810: Flags [P.], seq 3809:3833, ack 3880, win 72, options [nop,nop,TS val 2329553897 ecr 2859931933], length 24
12:10:42.443551 lo    In  IP 127.0.0.1.43923 > 127.0.0.1.39216: Flags [P.], seq 210:212, ack 521, win 64, options [nop,nop,TS val 250717846 ecr 250717846], length 2
12:10:42.443553 lo    In  IP 127.0.0.1.43923 > 127.0.0.1.39216: Flags [P.], seq 212:216, ack 521, win 64, options [nop,nop,TS val 250717846 ecr 250717846], length 4
12:10:42.443554 lo    In  IP 127.0.0.1.43923 > 127.0.0.1.39216: Flags [P.], seq 216:220, ack 521, win 64, options [nop,nop,TS val 250717846 ecr 250717846], length 4
12:10:42.443555 lo    In  IP 127.0.0.1.43923 > 127.0.0.1.39216: Flags [P.], seq 220:228, ack 521, win 64, options [nop,nop,TS val 250717846 ecr 250717846], length 8
12:10:42.443586 lo    In  IP 127.0.0.1.39216 > 127.0.0.1.43923: Flags [.], ack 228, win 64, options [nop,nop,TS val 250717846 ecr 250717846], length 0
12:10:42.443589 eth0  Out IP 192.168.147.2.10250 > 192.168.147.3.46810: Flags [P.], seq 3833:3873, ack 3880, win 72, options [nop,nop,TS val 2329553897 ecr 2859931933], length 40
12:10:42.444049 eth0  In  IP 192.168.147.3.46810 > 192.168.147.2.10250: Flags [.], ack 3873, win 73, options [nop,nop,TS val 2859931933 ecr 2329553897], length 0
12:10:42.469377 eth0  In  IP 192.168.147.3.6443 > 192.168.147.2.44920: Flags [P.], seq 1066:1163, ack 36, win 72, options [nop,nop,TS val 2859931959 ecr 2277001904], length 97
12:10:42.469400 eth0  Out IP 192.168.147.2.44920 > 192.168.147.3.6443: Flags [.], ack 1163, win 100, options [nop,nop,TS val 2277002083 ecr 2859931959], length 0
12:10:42.472770 lo    In  IP 127.0.0.1.43923 > 127.0.0.1.39216: Flags [P.], seq 228:232, ack 521, win 64, options [nop,nop,TS val 250717875 ecr 250717846], length 4
12:10:42.472805 eth0  Out IP 192.168.147.2.10250 > 192.168.147.3.46810: Flags [P.], seq 3873:3899, ack 3880, win 72, options [nop,nop,TS val 2329553926 ecr 2859931933], length 26
12:10:42.472833 lo    In  IP 127.0.0.1.43923 > 127.0.0.1.39216: Flags [P.], seq 232:236, ack 521, win 64, options [nop,nop,TS val 250717875 ecr 250717846], length 4
12:10:42.472836 lo    In  IP 127.0.0.1.43923 > 127.0.0.1.39216: Flags [P.], seq 236:310, ack 521, win 64, options [nop,nop,TS val 250717875 ecr 250717846], length 74
12:10:42.472858 lo    In  IP 127.0.0.1.43923 > 127.0.0.1.39216: Flags [P.], seq 310:314, ack 521, win 64, options [nop,nop,TS val 250717875 ecr 250717846], length 4
