13:25:15.314015 eth0  In  IP 192.168.147.4.54248 > 192.168.147.2.10351: Flags [S], seq 473072659, win 64240, options [mss 1460,sackOK,TS val 1371241784 ecr 0,nop,wscale 10], length 0
13:25:15.314236 eth0  Out IP 192.168.147.2.10351 > 192.168.147.4.54248: Flags [S.], seq 767446008, ack 473072660, win 65160, options [mss 1460,sackOK,TS val 3875388685 ecr 1371241784,nop,wscale 10], length 0
13:25:15.314280 eth0  In  IP 192.168.147.4.54248 > 192.168.147.2.10351: Flags [.], ack 1, win 63, options [nop,nop,TS val 1371241785 ecr 3875388685], length 0
13:25:15.316176 eth0  In  IP 192.168.147.4.54248 > 192.168.147.2.10351: Flags [P.], seq 1:238, ack 1, win 63, options [nop,nop,TS val 1371241787 ecr 3875388685], length 237
13:25:15.316186 eth0  Out IP 192.168.147.2.10351 > 192.168.147.4.54248: Flags [.], ack 238, win 64, options [nop,nop,TS val 3875388688 ecr 1371241787], length 0
13:25:15.485211 test-tra-0082c9 P   IP 172.31.130.2 > 8.8.8.8: ICMP echo request, id 11, seq 1, length 64
13:25:15.488749 antrea-gw0 In  IP 172.31.130.2 > 8.8.8.8: ICMP echo request, id 11, seq 1, length 64
13:25:15.488794 eth0  Out IP 192.168.147.2 > 8.8.8.8: ICMP echo request, id 11, seq 1, length 64
13:25:15.507142 eth0  In  IP 8.8.8.8 > 192.168.147.2: ICMP echo reply, id 11, seq 1, length 64
13:25:15.507163 antrea-gw0 Out IP 8.8.8.8 > 172.31.130.2: ICMP echo reply, id 11, seq 1, length 64
13:25:15.507239 test-tra-0082c9 Out IP 8.8.8.8 > 172.31.130.2: ICMP echo reply, id 11, seq 1, length 64
13:25:15.547258 eth0  Out IP 192.168.147.2.10351 > 192.168.147.3.10351: UDP, length 100
13:25:15.569660 eth0  Out IP 192.168.147.2.10351 > 192.168.147.4.54248: Flags [P.], seq 1:237, ack 238, win 64, options [nop,nop,TS val 3875388941 ecr 1371241787], length 236
13:25:15.569724 eth0  In  IP 192.168.147.4.54248 > 192.168.147.2.10351: Flags [.], ack 237, win 63, options [nop,nop,TS val 1371242040 ecr 3875388941], length 0
13:25:15.569900 eth0  Out IP 192.168.147.2.10351 > 192.168.147.4.54248: Flags [F.], seq 237, ack 238, win 64, options [nop,nop,TS val 3875388941 ecr 1371242040], length 0
13:25:15.574935 eth0  In  IP 192.168.147.3.10351 > 192.168.147.2.10351: UDP, length 18
13:25:15.599705 eth0  In  IP 192.168.147.4.54248 > 192.168.147.2.10351: Flags [F.], seq 238, ack 238, win 63, options [nop,nop,TS val 1371242070 ecr 3875388941], length 0
13:25:15.599721 eth0  Out IP 192.168.147.2.10351 > 192.168.147.4.54248: Flags [.], ack 239, win 64, options [nop,nop,TS val 3875388971 ecr 1371242070], length 0
13:25:15.767072 eth0  Out IP 192.168.147.2.44710 > 192.168.147.3.10351: Flags [S], seq 3852874018, win 64240, options [mss 1460,sackOK,TS val 2334027220 ecr 0,nop,wscale 10], length 0
13:25:15.767162 eth0  In  IP 192.168.147.3.10351 > 192.168.147.2.44710: Flags [S.], seq 1739900049, ack 3852874019, win 65160, options [mss 1460,sackOK,TS val 2864405257 ecr 2334027220,nop,wscale 10], length 0
13:25:15.767182 eth0  Out IP 192.168.147.2.44710 > 192.168.147.3.10351: Flags [.], ack 1, win 63, options [nop,nop,TS val 2334027221 ecr 2864405257], length 0
13:25:15.771937 eth0  Out IP 192.168.147.2.44710 > 192.168.147.3.10351: Flags [P.], seq 1:237, ack 1, win 63, options [nop,nop,TS val 2334027225 ecr 2864405257], length 236
13:25:15.771971 eth0  In  IP 192.168.147.3.10351 > 192.168.147.2.44710: Flags [.], ack 237, win 64, options [nop,nop,TS val 2864405261 ecr 2334027225], length 0
13:25:15.777354 eth0  In  IP 192.168.147.3.10351 > 192.168.147.2.44710: Flags [P.], seq 1:238, ack 237, win 64, options [nop,nop,TS val 2864405267 ecr 2334027225], length 237
13:25:15.777376 eth0  Out IP 192.168.147.2.44710 > 192.168.147.3.10351: Flags [.], ack 238, win 63, options [nop,nop,TS val 2334027231 ecr 2864405267], length 0
13:25:15.777419 eth0  In  IP 192.168.147.3.10351 > 192.168.147.2.44710: Flags [F.], seq 238, ack 237, win 64, options [nop,nop,TS val 2864405267 ecr 2334027231], length 0
13:25:15.777550 eth0  Out IP 192.168.147.2.44710 > 192.168.147.3.10351: Flags [F.], seq 237, ack 239, win 63, options [nop,nop,TS val 2334027231 ecr 2864405267], length 0
13:25:15.777568 eth0  In  IP 192.168.147.3.10351 > 192.168.147.2.44710: Flags [.], ack 238, win 64, options [nop,nop,TS val 2864405267 ecr 2334027231], length 0
13:25:16.486224 test-tra-0082c9 P   IP 172.31.130.2 > 8.8.8.8: ICMP echo request, id 11, seq 2, length 64
13:25:16.486278 antrea-gw0 In  IP 172.31.130.2 > 8.8.8.8: ICMP echo request, id 11, seq 2, length 64
13:25:16.486319 eth0  Out IP 192.168.147.2 > 8.8.8.8: ICMP echo request, id 11, seq 2, length 64
13:25:16.492812 eth0  In  IP 192.168.147.4.10351 > 192.168.147.2.10351: UDP, length 106
13:25:16.493660 eth0  Out IP 192.168.147.2.10351 > 192.168.147.4.10351: UDP, length 18
13:25:16.503358 eth0  Out IP 192.168.147.2.10351 > 192.168.147.4.10351: UDP, length 106
13:25:16.505066 eth0  In  IP 192.168.147.4.10351 > 192.168.147.2.10351: UDP, length 18
13:25:16.505427 eth0  In  IP 8.8.8.8 > 192.168.147.2: ICMP echo reply, id 11, seq 2, length 64
13:25:16.505443 antrea-gw0 Out IP 8.8.8.8 > 172.31.130.2: ICMP echo reply, id 11, seq 2, length 64
13:25:16.505456 test-tra-0082c9 Out IP 8.8.8.8 > 172.31.130.2: ICMP echo reply, id 11, seq 2, length 64
13:25:17.137458 eth0  In  IP 192.168.147.3.10351 > 192.168.147.2.10351: UDP, length 100
13:25:17.138414 eth0  Out IP 192.168.147.2.10351 > 192.168.147.3.10351: UDP, length 18
13:25:17.487720 test-tra-0082c9 P   IP 172.31.130.2 > 8.8.8.8: ICMP echo request, id 11, seq 3, length 64
13:25:17.487769 antrea-gw0 In  IP 172.31.130.2 > 8.8.8.8: ICMP echo request, id 11, seq 3, length 64
13:25:17.487845 eth0  Out IP 192.168.147.2 > 8.8.8.8: ICMP echo request, id 11, seq 3, length 64
13:25:17.503951 eth0  Out IP 192.168.147.2.10351 > 192.168.147.3.10351: UDP, length 100
13:25:17.504656 eth0  In  IP 192.168.147.3.10351 > 192.168.147.2.10351: UDP, length 18
13:25:17.511742 eth0  In  IP 8.8.8.8 > 192.168.147.2: ICMP echo reply, id 11, seq 3, length 64
13:25:17.511762 antrea-gw0 Out IP 8.8.8.8 > 172.31.130.2: ICMP echo reply, id 11, seq 3, length 64
13:25:17.511785 test-tra-0082c9 Out IP 8.8.8.8 > 172.31.130.2: ICMP echo reply, id 11, seq 3, length 64
13:25:17.598860 eth0  M   IP6 fe80::78dc:cdff:fe08:6ac9 > ff02::2: ICMP6, router solicitation, length 16
13:25:17.699399 lo    In  IP6 ::1.40096 > ::1.10350: Flags [S], seq 2067308268, win 65476, options [mss 65476,sackOK,TS val 3620305532 ecr 0,nop,wscale 10], length 0
13:25:17.699461 lo    In  IP6 ::1.10350 > ::1.40096: Flags [S.], seq 1395642475, ack 2067308269, win 65464, options [mss 65476,sackOK,TS val 3620305532 ecr 3620305532,nop,wscale 10], length 0
13:25:17.699486 lo    In  IP6 ::1.40096 > ::1.10350: Flags [.], ack 1, win 64, options [nop,nop,TS val 3620305532 ecr 3620305532], length 0
13:25:17.700888 lo    In  IP6 ::1.40096 > ::1.10350: Flags [P.], seq 1:1516, ack 1, win 64, options [nop,nop,TS val 3620305533 ecr 3620305532], length 1515
13:25:17.700909 lo    In  IP6 ::1.10350 > ::1.40096: Flags [.], ack 1516, win 72, options [nop,nop,TS val 3620305533 ecr 3620305533], length 0
13:25:17.707129 lo    In  IP6 ::1.10350 > ::1.40096: Flags [P.], seq 1:3430, ack 1516, win 72, options [nop,nop,TS val 3620305539 ecr 3620305533], length 3429
13:25:17.707151 lo    In  IP6 ::1.40096 > ::1.10350: Flags [.], ack 3430, win 93, options [nop,nop,TS val 3620305540 ecr 3620305539], length 0
13:25:17.707570 lo    In  IP6 ::1.40096 > ::1.10350: Flags [P.], seq 1516:1610, ack 3430, win 93, options [nop,nop,TS val 3620305540 ecr 3620305539], length 94
13:25:17.708079 lo    In  IP6 ::1.10350 > ::1.40096: Flags [P.], seq 3430:3491, ack 1610, win 72, options [nop,nop,TS val 3620305540 ecr 3620305540], length 61
13:25:17.708108 lo    In  IP6 ::1.40096 > ::1.10350: Flags [P.], seq 1610:1702, ack 3491, win 93, options [nop,nop,TS val 3620305540 ecr 3620305540], length 92
13:25:17.708161 lo    In  IP6 ::1.40096 > ::1.10350: Flags [P.], seq 1702:1733, ack 3491, win 93, options [nop,nop,TS val 3620305541 ecr 3620305540], length 31
13:25:17.708206 lo    In  IP6 ::1.40096 > ::1.10350: Flags [P.], seq 1733:1807, ack 3491, win 93, options [nop,nop,TS val 3620305541 ecr 3620305540], length 74
13:25:17.708218 lo    In  IP6 ::1.10350 > ::1.40096: Flags [.], ack 1807, win 72, options [nop,nop,TS val 3620305541 ecr 3620305540], length 0
13:25:17.708289 lo    In  IP6 ::1.10350 > ::1.40096: Flags [P.], seq 3491:3526, ack 1807, win 72, options [nop,nop,TS val 3620305541 ecr 3620305540], length 35
13:25:17.708384 lo    In  IP6 ::1.10350 > ::1.40096: Flags [P.], seq 3526:3557, ack 1807, win 72, options [nop,nop,TS val 3620305541 ecr 3620305540], length 31
13:25:17.708422 lo    In  IP6 ::1.40096 > ::1.10350: Flags [.], ack 3557, win 93, options [nop,nop,TS val 3620305541 ecr 3620305541], length 0
13:25:17.742869 lo    In  IP6 ::1.10350 > ::1.40096: Flags [P.], seq 3557:3596, ack 1807, win 72, options [nop,nop,TS val 3620305575 ecr 3620305541], length 39
13:25:17.743076 lo    In  IP6 ::1.10350 > ::1.40096: Flags [P.], seq 3596:3748, ack 1807, win 72, options [nop,nop,TS val 3620305575 ecr 3620305541], length 152
13:25:17.743098 lo    In  IP6 ::1.40096 > ::1.10350: Flags [.], ack 3748, win 95, options [nop,nop,TS val 3620305575 ecr 3620305575], length 0
13:25:17.743229 lo    In  IP6 ::1.10350 > ::1.40096: Flags [P.], seq 3748:3781, ack 1807, win 72, options [nop,nop,TS val 3620305576 ecr 3620305575], length 33
13:25:17.743286 lo    In  IP6 ::1.40096 > ::1.10350: Flags [P.], seq 1807:1831, ack 3781, win 95, options [nop,nop,TS val 3620305576 ecr 3620305576], length 24
13:25:17.743329 lo    In  IP6 ::1.10350 > ::1.40096: Flags [P.], seq 3781:3805, ack 1831, win 72, options [nop,nop,TS val 3620305576 ecr 3620305576], length 24
13:25:17.743354 lo    In  IP6 ::1.10350 > ::1.40096: Flags [F.], seq 3805, ack 1831, win 72, options [nop,nop,TS val 3620305576 ecr 3620305576], length 0
13:25:17.743420 lo    In  IP6 ::1.40096 > ::1.10350: Flags [F.], seq 1831, ack 3806, win 95, options [nop,nop,TS val 3620305576 ecr 3620305576], length 0
13:25:17.743433 lo    In  IP6 ::1.10350 > ::1.40096: Flags [.], ack 1832, win 72, options [nop,nop,TS val 3620305576 ecr 3620305576], length 0
13:25:18.110332 test-tra-0082c9 M   IP6 fe80::8078:15ff:feec:5931 > ff02::2: ICMP6, router solicitation, length 16
13:25:18.137202 eth0  In  IP 192.168.147.3.10351 > 192.168.147.2.10351: UDP, length 100
13:25:18.137709 eth0  Out IP 192.168.147.2.10351 > 192.168.147.3.10351: UDP, length 18
13:25:18.488363 test-tra-0082c9 P   IP 172.31.130.2 > 8.8.8.8: ICMP echo request, id 11, seq 4, length 64
13:25:18.488460 antrea-gw0 In  IP 172.31.130.2 > 8.8.8.8: ICMP echo request, id 11, seq 4, length 64
13:25:18.488615 eth0  Out IP 192.168.147.2 > 8.8.8.8: ICMP echo request, id 11, seq 4, length 64
13:25:18.492608 eth0  In  IP 192.168.147.4.10351 > 192.168.147.2.10351: UDP, length 106
13:25:18.494474 eth0  Out IP 192.168.147.2.10351 > 192.168.147.4.10351: UDP, length 18
13:25:18.506820 eth0  Out IP 192.168.147.2.10351 > 192.168.147.4.10351: UDP, length 106
13:25:18.507052 eth0  In  IP 8.8.8.8 > 192.168.147.2: ICMP echo reply, id 11, seq 4, length 64
13:25:18.507073 antrea-gw0 Out IP 8.8.8.8 > 172.31.130.2: ICMP echo reply, id 11, seq 4, length 64
13:25:18.507096 test-tra-0082c9 Out IP 8.8.8.8 > 172.31.130.2: ICMP echo reply, id 11, seq 4, length 64
13:25:18.507912 eth0  In  IP 192.168.147.4.10351 > 192.168.147.2.10351: UDP, length 18
13:25:18.622454 eth0  Out IP6 fe80::4e1:37ff:feb1:8e58 > fe80::c822:8fff:fea8:da7f: ICMP6, neighbor solicitation, who has fe80::c822:8fff:fea8:da7f, length 32
13:25:18.622706 eth0  In  IP6 fe80::c822:8fff:fea8:da7f > fe80::4e1:37ff:feb1:8e58: ICMP6, neighbor advertisement, tgt is fe80::c822:8fff:fea8:da7f, length 24
13:25:19.085646 lo    In  IP6 ::1.40116 > ::1.10350: Flags [S], seq 1075356787, win 65476, options [mss 65476,sackOK,TS val 3620306918 ecr 0,nop,wscale 10], length 0
13:25:19.085675 lo    In  IP6 ::1.10350 > ::1.40116: Flags [S.], seq 1339149191, ack 1075356788, win 65464, options [mss 65476,sackOK,TS val 3620306918 ecr 3620306918,nop,wscale 10], length 0
13:25:19.085686 lo    In  IP6 ::1.40116 > ::1.10350: Flags [.], ack 1, win 64, options [nop,nop,TS val 3620306918 ecr 3620306918], length 0
13:25:19.086695 lo    In  IP6 ::1.40116 > ::1.10350: Flags [P.], seq 1:1516, ack 1, win 64reading from file /capture-test-traffic-pod.pcap0, link-type LINUX_SLL2 (Linux cooked v2), snapshot length 262144
Warning: interface names might be incorrect
, options [nop,nop,TS val 3620306919 ecr 3620306918], length 1515
13:25:19.086705 lo    In  IP6 ::1.10350 > ::1.40116: Flags [.], ack 1516, win 72, options [nop,nop,TS val 3620306919 ecr 3620306919], length 0
13:25:19.089912 lo    In  IP6 ::1.10350 > ::1.40116: Flags [P.], seq 1:3430, ack 1516, win 72, options [nop,nop,TS val 3620306922 ecr 3620306919], length 3429
13:25:19.089919 lo    In  IP6 ::1.40116 > ::1.10350: Flags [.], ack 3430, win 93, options [nop,nop,TS val 3620306922 ecr 3620306922], length 0
13:25:19.090526 lo    In  IP6 ::1.40116 > ::1.10350: Flags [P.], seq 1516:1610, ack 3430, win 93, options [nop,nop,TS val 3620306923 ecr 3620306922], length 94
13:25:19.090798 lo    In  IP6 ::1.10350 > ::1.40116: Flags [P.], seq 3430:3491, ack 1610, win 72, options [nop,nop,TS val 3620306923 ecr 3620306923], length 61
13:25:19.090912 lo    In  IP6 ::1.40116 > ::1.10350: Flags [P.], seq 1610:1702, ack 3491, win 93, options [nop,nop,TS val 3620306923 ecr 3620306923], length 92
13:25:19.090967 lo    In  IP6 ::1.10350 > ::1.40116: Flags [P.], seq 3491:3526, ack 1702, win 72, options [nop,nop,TS val 3620306923 ecr 3620306923], length 35
13:25:19.091068 lo    In  IP6 ::1.40116 > ::1.10350: Flags [P.], seq 1702:1733, ack 3526, win 93, options [nop,nop,TS val 3620306923 ecr 3620306923], length 31
13:25:19.091099 lo    In  IP6 ::1.10350 > ::1.40116: Flags [P.], seq 3526:3557, ack 1733, win 72, options [nop,nop,TS val 3620306923 ecr 3620306923], length 31
13:25:19.091162 lo    In  IP6 ::1.40116 > ::1.10350: Flags [P.], seq 1733:1808, ack 3557, win 93, options [nop,nop,TS val 3620306924 ecr 3620306923], length 75
13:25:19.092675 lo    In  IP6 ::1.10350 > ::1.40116: Flags [P.], seq 3557:3596, ack 1808, win 72, options [nop,nop,TS val 3620306925 ecr 3620306924], length 39
13:25:19.092764 lo    In  IP6 ::1.10350 > ::1.40116: Flags [P.], seq 3596:3748, ack 1808, win 72, options [nop,nop,TS val 3620306925 ecr 3620306924], length 152
13:25:19.092776 lo    In  IP6 ::1.40116 > ::1.10350: Flags [.], ack 3748, win 95, options [nop,nop,TS val 3620306925 ecr 3620306925], length 0
13:25:19.092861 lo    In  IP6 ::1.10350 > ::1.40116: Flags [P.], seq 3748:3781, ack 1808, win 72, options [nop,nop,TS val 3620306925 ecr 3620306925], length 33
13:25:19.092918 lo    In  IP6 ::1.40116 > ::1.10350: Flags [P.], seq 1808:1832, ack 3781, win 95, options [nop,nop,TS val 3620306925 ecr 3620306925], length 24
13:25:19.092935 lo    In  IP6 ::1.40116 > ::1.10350: Flags [F.], seq 1832, ack 3781, win 95, options [nop,nop,TS val 3620306925 ecr 3620306925], length 0
13:25:19.092963 lo    In  IP6 ::1.10350 > ::1.40116: Flags [P.], seq 3781:3805, ack 1833, win 72, options [nop,nop,TS val 3620306925 ecr 3620306925], length 24
13:25:19.092976 lo    In  IP6 ::1.40116 > ::1.10350: Flags [R], seq 1075358620, win 0, length 0
13:25:19.503676 eth0  Out IP 192.168.147.2.10351 > 192.168.147.3.10351: UDP, length 100
13:25:19.504125 eth0  In  IP 192.168.147.3.10351 > 192.168.147.2.10351: UDP, length 18
13:25:19.646205 antrea-gw0 Out ARP, Request who-has 172.31.130.2 tell 172.31.130.1, length 28
13:25:19.646657 test-tra-0082c9 Out ARP, Request who-has 172.31.130.2 tell 172.31.130.1, length 28
13:25:19.646670 test-tra-0082c9 P   ARP, Reply 172.31.130.2 is-at 82:78:15:ec:59:31, length 28
13:25:19.646897 antrea-gw0 In  ARP, Reply 172.31.130.2 is-at 82:78:15:ec:59:31, length 28
13:25:19.933429 eth0  In  IP 192.168.147.4.48672 > 192.168.147.2.10250: Flags [S], seq 2473803639, win 64240, options [mss 1460,sackOK,TS val 1371246404 ecr 0,nop,wscale 10], length 0
13:25:19.933448 eth0  Out IP 192.168.147.2.10250 > 192.168.147.4.48672: Flags [S.], seq 745630390, ack 2473803640, win 65160, options [mss 1460,sackOK,TS val 3875393305 ecr 1371246404,nop,wscale 10], length 0
13:25:19.933456 eth0  In  IP 192.168.147.4.48672 > 192.168.147.2.10250: Flags [.], ack 1, win 63, options [nop,nop,TS val 1371246404 ecr 3875393305], length 0
13:25:19.933806 eth0  In  IP 192.168.147.4.48672 > 192.168.147.2.10250: Flags [P.], seq 1:1495, ack 1, win 63, options [nop,nop,TS val 1371246404 ecr 3875393305], length 1494
13:25:19.933808 eth0  Out IP 192.168.147.2.10250 > 192.168.147.4.48672: Flags [.], ack 1495, win 67, options [nop,nop,TS val 3875393305 ecr 1371246404], length 0
13:25:19.986365 eth0  Out IP 192.168.147.2.10250 > 192.168.147.4.48672: Flags [P.], seq 1:3426, ack 1495, win 67, options [nop,nop,TS val 3875393358 ecr 1371246404], length 3425
13:25:19.986402 eth0  In  IP 192.168.147.4.48672 > 192.168.147.2.10250: Flags [.], ack 3426, win 70, options [nop,nop,TS val 1371246457 ecr 3875393358], length 0
13:25:19.988331 eth0  In  IP 192.168.147.4.48672 > 192.168.147.2.10250: Flags [P.], seq 1495:2706, ack 3426, win 70, options [nop,nop,TS val 1371246459 ecr 3875393358], length 1211
13:25:19.988338 eth0  Out IP 192.168.147.2.10250 > 192.168.147.4.48672: Flags [.], ack 2706, win 70, options [nop,nop,TS val 3875393360 ecr 1371246459], length 0
13:25:19.989478 eth0  In  IP 192.168.147.4.48672 > 192.168.147.2.10250: Flags [P.], seq 2706:3241, ack 3426, win 70, options [nop,nop,TS val 1371246460 ecr 3875393360], length 535
13:25:19.989483 eth0  Out IP 192.168.147.2.10250 > 192.168.147.4.48672: Flags [.], ack 3241, win 72, options [nop,nop,TS val 3875393361 ecr 1371246460], length 0
13:25:20.024654 eth0  Out IP 192.168.147.2.52924 > 192.168.147.4.6443: Flags [P.], seq 3858802670:3858802750, ack 1512734229, win 90, options [nop,nop,TS val 3875393396 ecr 1371241021], length 80
13:25:20.024745 eth0  In  IP 192.168.147.4.6443 > 192.168.147.2.52924: Flags [.], ack 80, win 78, options [nop,nop,TS val 1371246495 ecr 3875393396], length 0
13:25:20.025224 eth0  Out IP 192.168.147.2.52924 > 192.168.147.4.6443: Flags [P.], seq 80:460, ack 1, win 90, options [nop,nop,TS val 3875393397 ecr 1371246495], length 380
13:25:20.025399 eth0  In  IP 192.168.147.4.6443 > 192.168.147.2.52924: Flags [.], ack 460, win 78, options [nop,nop,TS val 1371246496 ecr 3875393397], length 0
13:25:20.035224 eth0  In  IP 192.168.147.4.6443 > 192.168.147.2.52924: Flags [P.], seq 1:96, ack 460, win 78, options [nop,nop,TS val 1371246506 ecr 3875393397], length 95
13:25:20.035340 eth0  In  IP 192.168.147.4.6443 > 192.168.147.2.52924: Flags [P.], seq 96:890, ack 460, win 78, options [nop,nop,TS val 1371246506 ecr 3875393397], length 794
13:25:20.035459 eth0  Out IP 192.168.147.2.52924 > 192.168.147.4.6443: Flags [.], ack 890, win 90, options [nop,nop,TS val 3875393407 ecr 1371246506], length 0
13:25:20.035525 eth0  Out IP 192.168.147.2.52924 > 192.168.147.4.6443: Flags [P.], seq 460:495, ack 890, win 90, options [nop,nop,TS val 3875393407 ecr 1371246506], length 35
13:25:20.048002 lo    In  IP 127.0.0.1.45468 > 127.0.0.1.43529: Flags [S], seq 55044791, win 65495, options [mss 65495,sackOK,TS val 255195450 ecr 0,nop,wscale 10], length 0
13:25:20.048023 lo    In  IP 127.0.0.1.43529 > 127.0.0.1.45468: Flags [S.], seq 1864380537, ack 55044792, win 65483, options [mss 65495,sackOK,TS val 255195450 ecr 255195450,nop,wscale 10], length 0
13:25:20.048029 lo    In  IP 127.0.0.1.45468 > 127.0.0.1.43529: Flags [.], ack 1, win 64, options [nop,nop,TS val 255195450 ecr 255195450], length 0
13:25:20.048167 lo    In  IP 127.0.0.1.45468 > 127.0.0.1.43529: Flags [P.], seq 1:410, ack 1, win 64, options [nop,nop,TS val 255195451 ecr 255195450], length 409
13:25:20.048172 lo    In  IP 127.0.0.1.43529 > 127.0.0.1.45468: Flags [.], ack 410, win 64, options [nop,nop,TS val 255195451 ecr 255195451], length 0
13:25:20.077875 eth0  In  IP 192.168.147.4.6443 > 192.168.147.2.52924: Flags [.], ack 495, win 78, options [nop,nop,TS val 1371246548 ecr 3875393407], length 0
13:25:20.078091 lo    In  IP 127.0.0.1.43529 > 127.0.0.1.45468: Flags [P.], seq 1:160, ack 410, win 64, options [nop,nop,TS val 255195480 ecr 255195451], length 159
13:25:20.078100 lo    In  IP 127.0.0.1.45468 > 127.0.0.1.43529: Flags [.], ack 160, win 64, options [nop,nop,TS val 255195480 ecr 255195480], length 0
13:25:20.078352 eth0  Out IP 192.168.147.2.10250 > 192.168.147.4.48672: Flags [P.], seq 3426:3607, ack 3241, win 72, options [nop,nop,TS val 3875393450 ecr 1371246460], length 181
13:25:20.085505 eth0  In  IP 192.168.147.4.48672 > 192.168.147.2.10250: Flags [P.], seq 3241:3265, ack 3607, win 73, options [nop,nop,TS val 1371246556 ecr 3875393450], length 24
13:25:20.085533 eth0  Out IP 192.168.147.2.10250 > 192.168.147.4.48672: Flags [.], ack 3265, win 72, options [nop,nop,TS val 3875393457 ecr 1371246556], length 0
13:25:20.085594 lo    In  IP 127.0.0.1.45468 > 127.0.0.1.43529: Flags [P.], seq 410:412, ack 160, win 64, options [nop,nop,TS val 255195488 ecr 255195480], length 2
13:25:20.085637 eth0  In  IP 192.168.147.4.48672 > 192.168.147.2.10250: Flags [P.], seq 3265:3289, ack 3607, win 73, options [nop,nop,TS val 1371246556 ecr 3875393457], length 24
13:25:20.085641 eth0  Out IP 192.168.147.2.10250 > 192.168.147.4.48672: Flags [.], ack 3289, win 72, options [nop,nop,TS val 3875393457 ecr 1371246556], length 0
13:25:20.085648 lo    In  IP 127.0.0.1.45468 > 127.0.0.1.43529: Flags [P.], seq 412:414, ack 160, win 64, options [nop,nop,TS val 255195488 ecr 255195480], length 2
13:25:20.085664 eth0  In  IP 192.168.147.4.48672 > 192.168.147.2.10250: Flags [P.], seq 3289:3315, ack 3607, win 73, options [nop,nop,TS val 1371246556 ecr 3875393457], length 26
13:25:20.085665 lo    In  IP 127.0.0.1.43529 > 127.0.0.1.45468: Flags [.], ack 414, win 64, options [nop,nop,TS val 255195488 ecr 255195488], length 0
13:25:20.085666 eth0  Out IP 192.168.147.2.10250 > 192.168.147.4.48672: Flags [.], ack 3315, win 72, options [nop,nop,TS val 3875393457 ecr 1371246556], length 0
13:25:20.085676 lo    In  IP 127.0.0.1.45468 > 127.0.0.1.43529: Flags [P.], seq 414:418, ack 160, win 64, options [nop,nop,TS val 255195488 ecr 255195488], length 4
13:25:20.085687 eth0  In  IP 192.168.147.4.48672 > 192.168.147.2.10250: Flags [P.], seq 3315:3341, ack 3607, win 73, options [nop,nop,TS val 1371246556 ecr 3875393457], length 26
13:25:20.085688 eth0  Out IP 192.168.147.2.10250 > 192.168.147.4.48672: Flags [.], ack 3341, win 72, options [nop,nop,TS val 3875393457 ecr 1371246556], length 0
13:25:20.085693 lo    In  IP 127.0.0.1.45468 > 127.0.0.1.43529: Flags [P.], seq 418:422, ack 160, win 64, options [nop,nop,TS val 255195488 ecr 255195488], length 4
13:25:20.085698 eth0  In  IP 192.168.147.4.48672 > 192.168.147.2.10250: Flags [P.], seq 3341:3367, ack 3607, win 73, options [nop,nop,TS val 1371246556 ecr 3875393457], length 26
13:25:20.085699 eth0  Out IP 192.168.147.2.10250 > 192.168.147.4.48672: Flags [.], ack 3367, win 72, options [nop,nop,TS val 3875393457 ecr 1371246556], length 0
13:25:20.085701 lo    In  IP 127.0.0.1.43529 > 127.0.0.1.45468: Flags [.], ack 422, win 64, options [nop,nop,TS val 255195488 ecr 255195488], length 0
13:25:20.085703 lo    In  IP 127.0.0.1.45468 > 127.0.0.1.43529: Flags [P.], seq 422:426, ack 160, win 64, options [nop,nop,TS val 255195488 ecr 255195488], length 4
13:25:20.085708 eth0  In  IP 192.168.147.4.48672 > 192.168.147.2.10250: Flags [P.], seq 3367:3390, ack 3607, win 73, options [nop,nop,TS val 1371246556 ecr 3875393457], length 23
13:25:20.085710 eth0  Out IP 192.168.147.2.10250 > 192.168.147.4.48672: Flags [.], ack 3390, win 72, options [nop,nop,TS val 3875393457 ecr 1371246556], length 0
13:25:20.085713 lo    In  IP 127.0.0.1.45468 > 127.0.0.1.43529: Flags [P.], seq 426:427, ack 160, win 64, options [nop,nop,TS val 255195488 ecr 255195488], length 1
13:25:20.085717 eth0  In  IP 192.168.147.4.48672 > 192.168.147.2.10250: Flags [P.], seq 3390:3413, ack 3607, win 73, options [nop,nop,TS val 1371246556 ecr 3875393457], length 23
13:25:20.085719 eth0  Out IP 192.168.147.2.10250 > 192.168.147.4.48672: Flags [.], ack 3413, win 72, options [nop,nop,TS val 3875393457 ecr 1371246556], length 0
13:25:20.085722 lo    In  IP 127.0.0.1.45468 > 127.0.0.1.43529: Flags [P.], seq 427:428, ack 160, win 64, options [nop,nop,TS val 255195488 ecr 255195488], length 1
13:25:20.085726 eth0  In  IP 192.168.147.4.48672 > 192.168.147.2.10250: Flags [P.], seq 3413:3466, ack 3607, win 73, options [nop,nop,TS val 1371246556 ecr 3875393457], length 53
13:25:20.085727 eth0  Out IP 192.168.147.2.10250 > 192.168.147.4.48672: Flags [.], ack 3466, win 72, options [nop,nop,TS val 3875393457 ecr 1371246556], length 0
13:25:20.085730 lo    In  IP 127.0.0.1.45468 > 127.0.0.1.43529: Flags [P.], seq 428:459, ack 160, win 64, options [nop,nop,TS val 255195488 ecr 255195488], length 31
13:25:20.085739 lo    In  IP 127.0.0.1.43529 > 127.0.0.1.45468: Flags [.], ack 459, win 64, options [nop,nop,TS val 255195488 ecr 255195488], length 0
13:25:20.086633 lo    In  IP 127.0.0.1.43529 > 127.0.0.1.45468: Flags [P.], seq 160:162, ack 459, win 64, options [nop,nop,TS val 255195489 ecr 255195488], length 2
13:25:20.086666 eth0  Out IP 192.168.147.2.10250 > 192.168.147.4.48672: Flags [P.], seq 3607:3631, ack 3466, win 72, options [nop,nop,TS val 3875393458 ecr 1371246556], length 24
13:25:20.086711 lo    In  IP 127.0.0.1.43529 > 127.0.0.1.45468: Flags [P.], seq 162:164, ack 459, win 64, options [nop,nop,TS val 255195489 ecr 255195488], length 2
13:25:20.086715 lo    In  IP 127.0.0.1.45468 > 127.0.0.1.43529: Flags [.], ack 164, win 64, options [nop,nop,TS val 255195489 ecr 255195489], length 0
13:25:20.086720 eth0  Out IP 192.168.147.2.10250 > 192.168.147.4.48672: Flags [P.], seq 3631:3655, ack 3466, win 72, options [nop,nop,TS val 3875393458 ecr 1371246556], length 24
13:25:20.086727 lo    In  IP 127.0.0.1.43529 > 127.0.0.1.45468: Flags [P.], seq 164:168, ack 459, win 64, options [nop,nop,TS val 255195489 ecr 255195489], length 4
13:25:20.086731 eth0  Out IP 192.168.147.2.10250 > 192.168.147.4.48672: Flags [P.], seq 3655:3681, ack 3466, win 72, options [nop,nop,TS val 3875393458 ecr 1371246556], length 26
13:25:20.086736 lo    In  IP 127.0.0.1.43529 > 127.0.0.1.45468: Flags [P.], seq 168:172, ack 459, win 64, options [nop,nop,TS val 255195489 ecr 255195489], length 4
13:25:20.086739 lo    In  IP 127.0.0.1.43529 > 127.0.0.1.45468: Flags [P.], seq 172:188, ack 459, win 64, options [nop,nop,TS val 255195489 ecr 255195489], length 16
13:25:20.086744 eth0  In  IP 192.168.147.4.48672 > 192.168.147.2.10250: Flags [.], ack 3681, win 73, options [nop,nop,TS val 1371246557 ecr 3875393458], length 0
13:25:20.086750 lo    In  IP 127.0.0.1.45468 > 127.0.0.1.43529: Flags [.], ack 188, win 64, options [nop,nop,TS val 255195489 ecr 255195489], length 0
13:25:20.086753 eth0  Out IP 192.168.147.2.10250 > 192.168.147.4.48672: Flags [P.], seq 3681:3723, ack 3466, win 72, options [nop,nop,TS val 3875393458 ecr 1371246557], length 42
13:25:20.086950 eth0  In  IP 192.168.147.4.48672 > 192.168.147.2.10250: Flags [P.], seq 3466:3490, ack 3723, win 73, options [nop,nop,TS val 1371246557 ecr 3875393458], length 24
13:25:20.086970 lo    In  IP 127.0.0.1.45468 > 127.0.0.1.43529: Flags [P.], seq 459:461, ack 188, win 64, options [nop,nop,TS val 255195489 ecr 255195489], length 2
13:25:20.086988 eth0  In  IP 192.168.147.4.48672 > 192.168.147.2.10250: Flags [P.], seq 3490:3514, ack 3723, win 73, options [nop,nop,TS val 1371246557 ecr 3875393458], length 24
13:25:20.086991 eth0  In  IP 192.168.147.4.48672 > 192.168.147.2.10250: Flags [P.], seq 3514:3540, ack 3723, win 73, options [nop,nop,TS val 1371246557 ecr 3875393458], length 26
13:25:20.086994 eth0  In  IP 192.168.147.4.48672 > 192.168.147.2.10250: Flags [P.], seq 3540:3566, ack 3723, win 73, options [nop,nop,TS val 1371246557 ecr 3875393458], length 26
13:25:20.086996 eth0  In  IP 192.168.147.4.48672 > 192.168.147.2.10250: Flags [P.], seq 3566:3592, ack 3723, win 73, options [nop,nop,TS val 1371246557 ecr 3875393458], length 26
13:25:20.086998 eth0  In  IP 192.168.147.4.48672 > 192.168.147.2.10250: Flags [P.], seq 3592:3615, ack 3723, win 73, options [nop,nop,TS val 1371246557 ecr 3875393458], length 23
13:25:20.087001 eth0  In  IP 192.168.147.4.48672 > 192.168.147.2.10250: Flags [P.], seq 3615:3638, ack 3723, win 73, options [nop,nop,TS val 1371246557 ecr 3875393458], length 23
13:25:20.087003 eth0  In  IP 192.168.147.4.48672 > 192.168.147.2.10250: Flags [P.], seq 3638:3675, ack 3723, win 73, options [nop,nop,TS val 1371246557 ecr 3875393458], length 37
13:25:20.087016 eth0  Out IP 192.168.147.2.10250 > 192.168.147.4.48672: Flags [.], ack 3675, win 72, options [nop,nop,TS val 3875393458 ecr 1371246557], length 0
13:25:20.087021 lo    In  IP 127.0.0.1.45468 > 127.0.0.1.43529: Flags [P.], seq 461:463, ack 188, win 64, options [nop,nop,TS val 255195489 ecr 255195489], length 2
13:25:20.087025 lo    In  IP 127.0.0.1.45468 > 127.0.0.1.43529: Flags [P.], seq 463:467, ack 188, win 64, options [nop,nop,TS val 255195489 ecr 255195489], length 4
13:25:20.087026 lo    In  IP 127.0.0.1.45468 > 127.0.0.1.43529: Flags [P.], seq 467:471, ack 188, win 64, options [nop,nop,TS val 255195489 ecr 255195489], length 4
13:25:20.087027 lo    In  IP 127.0.0.1.45468 > 127.0.0.1.43529: Flags [P.], seq 471:475, ack 188, win 64, options [nop,nop,TS val 255195489 ecr 255195489], length 4
13:25:20.087029 lo    In  IP 127.0.0.1.45468 > 127.0.0.1.43529: Flags [P.], seq 475:476, ack 188, win 64, options [nop,nop,TS val 255195489 ecr 255195489], length 1
13:25:20.087030 lo    In  IP 127.0.0.1.45468 > 127.0.0.1.43529: Flags [P.], seq 476:477, ack 188, win 64, options [nop,nop,TS val 255195489 ecr 255195489], length 1
13:25:20.087032 lo    In  IP 127.0.0.1.45468 > 127.0.0.1.43529: Flags [P.], seq 477:492, ack 188, win 64, options [nop,nop,TS val 255195489 ecr 255195489], length 15
13:25:20.087037 lo    In  IP 127.0.0.1.43529 > 127.0.0.1.45468: Flags [.], ack 492, win 64, options [nop,nop,TS val 255195489 ecr 255195489], length 0
13:25:20.087101 lo    In  IP 127.0.0.1.43529 > 127.0.0.1.45468: Flags [P.], seq 188:190, ack 492, win 64, options [nop,nop,TS val 255195489 ecr 255195489], length 2
13:25:20.087104 lo    In  IP 127.0.0.1.43529 > 127.0.0.1.45468: Flags [P.], seq 190:192, ack 492, win 64, options [nop,nop,TS val 255195489 ecr 255195489], length 2
13:25:20.087105 lo    In  IP 127.0.0.1.43529 > 127.0.0.1.45468: Flags [P.], seq 192:196, ack 492, win 64, options [nop,nop,TS val 255195489 ecr 255195489], length 4
13:25:20.087106 lo    In  IP 127.0.0.1.43529 > 127.0.0.1.45468: Flags [P.], seq 196:200, ack 492, win 64, options [nop,nop,TS val 255195489 ecr 255195489], length 4
13:25:20.087108 lo    In  IP 127.0.0.1.43529 > 127.0.0.1.45468: Flags [P.], seq 200:208, ack 492, win 64, options [nop,nop,TS val 255195489 ecr 255195489], length 8
13:25:20.087117 lo    In  IP 127.0.0.1.45468 > 127.0.0.1.43529: Flags [.], ack 208, win 64, options [nop,nop,TS val 255195489 ecr 255195489], length 0
13:25:20.087120 eth0  Out IP 192.168.147.2.10250 > 192.168.147.4.48672: Flags [P.], seq 3723:3765, ack 3675, win 72, options [nop,nop,TS val 3875393458 ecr 1371246557], length 42
13:25:20.087162 eth0  In  IP 192.168.147.4.48672 > 192.168.147.2.10250: Flags [P.], seq 3675:3699, ack 3765, win 73, options [nop,nop,TS val 1371246558 ecr 3875393458], length 24
13:25:20.087167 eth0  In  IP 192.168.147.4.48672 > 192.168.147.2.10250: Flags [P.], seq 3699:3723, ack 3765, win 73, options [nop,nop,TS val 1371246558 ecr 3875393458], length 24
13:25:20.087169 eth0  In  IP 192.168.147.4.48672 > 192.168.147.2.10250: Flags [P.], seq 3723:3749, ack 3765, win 73, options [nop,nop,TS val 1371246558 ecr 3875393458], length 26
13:25:20.087171 eth0  In  IP 192.168.147.4.48672 > 192.168.147.2.10250: Flags [P.], seq 3749:3775, ack 3765, win 73, options [nop,nop,TS val 1371246558 ecr 3875393458], length 26
13:25:20.087173 eth0  In  IP 192.168.147.4.48672 > 192.168.147.2.10250: Flags [P.], seq 3775:3801, ack 3765, win 73, options [nop,nop,TS val 1371246558 ecr 3875393458], length 26
13:25:20.087175 eth0  In  IP 192.168.147.4.48672 > 192.168.147.2.10250: Flags [P.], seq 3801:3824, ack 3765, win 73, options [nop,nop,TS val 1371246558 ecr 3875393458], length 23
13:25:20.087176 eth0  In  IP 192.168.147.4.48672 > 192.168.147.2.10250: Flags [P.], seq 3824:3847, ack 3765, win 73, options [nop,nop,TS val 1371246558 ecr 3875393458], length 23
13:25:20.087182 eth0  In  IP 192.168.147.4.48672 > 192.168.147.2.10250: Flags [P.], seq 3847:3880, ack 3765, win 73, options [nop,nop,TS val 1371246558 ecr 3875393458], length 33
13:25:20.087199 eth0  Out IP 192.168.147.2.10250 > 192.168.147.4.48672: Flags [.], ack 3880, win 72, options [nop,nop,TS val 3875393459 ecr 1371246558], length 0
13:25:20.087204 lo    In  IP 127.0.0.1.45468 > 127.0.0.1.43529: Flags [P.], seq 492:494, ack 208, win 64, options [nop,nop,TS val 255195490 ecr 255195489], length 2
13:25:20.087215 lo    In  IP 127.0.0.1.45468 > 127.0.0.1.43529: Flags [P.], seq 494:496, ack 208, win 64, options [nop,nop,TS val 255195490 ecr 255195489], length 2
13:25:20.087217 lo    In  IP 127.0.0.1.43529 > 127.0.0.1.45468: Flags [.], ack 496, win 64, options [nop,nop,TS val 255195490 ecr 255195490], length 0
13:25:20.087222 lo    In  IP 127.0.0.1.45468 > 127.0.0.1.43529: Flags [P.], seq 496:500, ack 208, win 64, options [nop,nop,TS val 255195490 ecr 255195490], length 4
13:25:20.087228 lo    In  IP 127.0.0.1.45468 > 127.0.0.1.43529: Flags [P.], seq 500:504, ack 208, win 64, options [nop,nop,TS val 255195490 ecr 255195490], length 4
13:25:20.087230 lo    In  IP 127.0.0.1.43529 > 127.0.0.1.45468: Flags [.], ack 504, win 64, options [nop,nop,TS val 255195490 ecr 255195490], length 0
13:25:20.087234 lo    In  IP 127.0.0.1.45468 > 127.0.0.1.43529: Flags [P.], seq 504:508, ack 208, win 64, options [nop,nop,TS val 255195490 ecr 255195490], length 4
13:25:20.087242 lo    In  IP 127.0.0.1.45468 > 127.0.0.1.43529: Flags [P.], seq 508:509, ack 208, win 64, options [nop,nop,TS val 255195490 ecr 255195490], length 1
13:25:20.087247 lo    In  IP 127.0.0.1.43529 > 127.0.0.1.45468: Flags [.], ack 509, win 64, options [nop,nop,TS val 255195490 ecr 255195490], length 0
13:25:20.087251 lo    In  IP 127.0.0.1.45468 > 127.0.0.1.43529: Flags [P.], seq 509:510, ack 208, win 64, options [nop,nop,TS val 255195490 ecr 255195490], length 1
13:25:20.087253 lo    In  IP 127.0.0.1.45468 > 127.0.0.1.43529: Flags [P.], seq 510:521, ack 208, win 64, options [nop,nop,TS val 255195490 ecr 255195490], length 11
13:25:20.087257 lo    In  IP 127.0.0.1.43529 > 127.0.0.1.45468: Flags [.], ack 521, win 64, options [nop,nop,TS val 255195490 ecr 255195490], length 0
13:25:20.087323 lo    In  IP 127.0.0.1.43529 > 127.0.0.1.45468: Flags [P.], seq 208:210, ack 521, win 64, options [nop,nop,TS val 255195490 ecr 255195490], length 2
13:25:20.087331 eth0  Out IP 192.168.147.2.10250 > 192.168.147.4.48672: Flags [P.], seq 3765:3789, ack 3880, win 72, options [nop,nop,TS val 3875393459 ecr 1371246558], length 24
13:25:20.087347 lo    In  IP 127.0.0.1.43529 > 127.0.0.1.45468: Flags [P.], seq 210:212, ack 521, win 64, options [nop,nop,TS val 255195490 ecr 255195490], length 2
13:25:20.087349 lo    In  IP 127.0.0.1.45468 > 127.0.0.1.43529: Flags [.], ack 212, win 64, options [nop,nop,TS val 255195490 ecr 255195490], length 0
13:25:20.087351 eth0  Out IP 192.168.147.2.10250 > 192.168.147.4.48672: Flags [P.], seq 3789:3813, ack 3880, win 72, options [nop,nop,TS val 3875393459 ecr 1371246558], length 24
13:25:20.087356 eth0  In  IP 192.168.147.4.48672 > 192.168.147.2.10250: Flags [.], ack 3813, win 73, options [nop,nop,TS val 1371246558 ecr 3875393459], length 0
13:25:20.087363 lo    In  IP 127.0.0.1.43529 > 127.0.0.1.45468: Flags [P.], seq 212:216, ack 521, win 64, options [nop,nop,TS val 255195490 ecr 255195490], length 4
13:25:20.087366 eth0  Out IP 192.168.147.2.10250 > 192.168.147.4.48672: Flags [P.], seq 3813:3839, ack 3880, win 72, options [nop,nop,TS val 3875393459 ecr 1371246558], length 26
13:25:20.087375 lo    In  IP 127.0.0.1.43529 > 127.0.0.1.45468: Flags [P.], seq 216:220, ack 521, win 64, options [nop,nop,TS val 255195490 ecr 255195490], length 4
13:25:20.087378 lo    In  IP 127.0.0.1.45468 > 127.0.0.1.43529: Flags [.], ack 220, win 64, options [nop,nop,TS val 255195490 ecr 255195490], length 0
13:25:20.087380 eth0  Out IP 192.168.147.2.10250 > 192.168.147.4.48672: Flags [P.], seq 3839:3865, ack 3880, win 72, options [nop,nop,TS val 3875393459 ecr 1371246558], length 26
13:25:20.087384 eth0  In  IP 192.168.147.4.48672 > 192.168.147.2.10250: Flags [.], ack 3865, win 73, options [nop,nop,TS val 1371246558 ecr 3875393459], length 0
13:25:20.087511 lo    In  IP 127.0.0.1.43529 > 127.0.0.1.45468: Flags [P.], seq 220:228, ack 521, win 64, options [nop,nop,TS val 255195490 ecr 255195490], length 8
13:25:20.087517 eth0  Out IP 192.168.147.2.10250 > 192.168.147.4.48672: Flags [P.], seq 3865:3895, ack 3880, win 72, options [nop,nop,TS val 3875393459 ecr 1371246558], length 30
13:25:20.130209 lo    In  IP 127.0.0.1.45468 > 127.0.0.1.43529: Flags [.], ack 228, win 64, options [nop,nop,TS val 255195533 ecr 255195490], length 0
13:25:20.130224 eth0  In  IP 192.168.147.4.48672 > 192.168.147.2.10250: Flags [.], ack 3895, win 73, options [nop,nop,TS val 1371246601 ecr 3875393459], length 0
13:25:20.138399 eth0  In  IP 192.168.147.3.10351 > 192.168.147.2.10351: UDP, length 100
13:25:20.139021 eth0  Out IP 192.168.147.2.10351 > 192.168.147.3.10351: UDP, length 18
13:25:20.149693 lo    In  IP 127.0.0.1.43529 > 127.0.0.1.45468: Flags [P.], seq 228:232, ack 521, win 64, options [nop,nop,TS val 255195552 ecr 255195533], length 4
13:25:20.149713 lo    In  IP 127.0.0.1.45468 > 127.0.0.1.43529: Flags [.], ack 232, win 64, options [nop,nop,TS val 255195552 ecr 255195552], length 0
13:25:20.149723 lo    In  IP 127.0.0.1.43529 > 127.0.0.1.45468: Flags [P.], seq 232:236, ack 521, win 64, options [nop,nop,TS val 255195552 ecr 255195552], length 4
13:25:20.149724 lo    In  IP 127.0.0.1.45468 > 127.0.0.1.43529: Flags [.], ack 236, win 64, options [nop,nop,TS val 255195552 ecr 255195552], length 0
13:25:20.149726 lo    In  IP 127.0.0.1.43529 > 127.0.0.1.45468: Flags [P.], seq 236:310, ack 521, win 64, options [nop,nop,TS val 255195552 ecr 255195552], length 74
13:25:20.149727 lo    In  IP 127.0.0.1.45468 > 127.0.0.1.43529: Flags [.], ack 310, win 64, options [nop,nop,TS val 255195552 ecr 255195552], length 0
13:25:20.149817 eth0  Out IP 192.168.147.2.10250 > 192.168.147.4.48672: Flags [P.], seq 3895:3999, ack 3880, win 72, options [nop,nop,TS val 3875393521 ecr 1371246601], length 104
13:25:20.149887 eth0  In  IP 192.168.147.4.48672 > 192.168.147.2.10250: Flags [.], ack 3999, win 73, options [nop,nop,TS val 1371246620 ecr 3875393521], length 0
13:25:20.149989 lo    In  IP 127.0.0.1.43529 > 127.0.0.1.45468: Flags [P.], seq 310:314, ack 521, win 64, options [nop,nop,TS val 255195552 ecr 255195552], length 4
13:25:20.149993 lo    In  IP 127.0.0.1.45468 > 127.0.0.1.43529: Flags [.], ack 314, win 64, options [nop,nop,TS val 255195552 ecr 255195552], length 0
13:25:20.149996 lo    In  IP 127.0.0.1.43529 > 127.0.0.1.45468: Flags [P.], seq 314:318, ack 521, win 64, options [nop,nop,TS val 255195552 ecr 255195552], length 4
13:25:20.149997 lo    In  IP 127.0.0.1.45468 > 127.0.0.1.43529: Flags [.], ack 318, win 64, options [nop,nop,TS val 255195552 ecr 255195552], length 0
13:25:20.150049 lo    In  IP 127.0.0.1.43529 > 127.0.0.1.45468: Flags [P.], seq 318:322, ack 521, win 64, options [nop,nop,TS val 255195552 ecr 255195552], length 4
13:25:20.150057 lo    In  IP 127.0.0.1.45468 > 127.0.0.1.43529: Flags [.], ack 322, win 64, options [nop,nop,TS val 255195552 ecr 255195552], length 0
