reading from file /capture-test-traffic-pod.pcap0, link-type LINUX_SLL2 (Linux cooked v2), snapshot length 262144
Warning: interface names might be incorrect
13:04:45.650622 eth0  In  IP 192.168.147.2.10351 > 192.168.147.3.10351: UDP, length 100
13:04:45.654331 eth0  Out IP 192.168.147.3.10351 > 192.168.147.2.10351: UDP, length 18
13:04:45.728026 eth0  In  IP6 fe80::c822:8fff:fea8:da7f > fe80::90b4:dcff:fe7e:2b3b: ICMP6, neighbor solicitation, who has fe80::90b4:dcff:fe7e:2b3b, length 32
13:04:45.728082 eth0  Out IP6 fe80::90b4:dcff:fe7e:2b3b > fe80::c822:8fff:fea8:da7f: ICMP6, neighbor advertisement, tgt is fe80::90b4:dcff:fe7e:2b3b, length 24
13:04:45.780325 eth0  In  IP 192.168.147.4.10351 > 192.168.147.3.10351: UDP, length 107
13:04:45.781023 eth0  Out IP 192.168.147.3.10351 > 192.168.147.4.10351: UDP, length 18
13:04:45.881656 eth0  Out IP 192.168.147.3.10351 > 192.168.147.4.10351: UDP, length 107
13:04:45.882332 eth0  In  IP 192.168.147.4.10351 > 192.168.147.3.10351: UDP, length 18
13:04:45.893966 test-tra-2ddc69 P   IP 172.31.129.2 > 8.8.8.8: ICMP echo request, id 11, seq 1, length 64
13:04:45.894970 antrea-gw0 In  IP 172.31.129.2 > 8.8.8.8: ICMP echo request, id 11, seq 1, length 64
13:04:45.895023 eth0  Out IP 192.168.147.3 > 8.8.8.8: ICMP echo request, id 11, seq 1, length 64
13:04:45.917109 eth0  In  IP 8.8.8.8 > 192.168.147.3: ICMP echo reply, id 11, seq 1, length 64
13:04:45.917217 antrea-gw0 Out IP 8.8.8.8 > 172.31.129.2: ICMP echo reply, id 11, seq 1, length 64
13:04:45.917254 test-tra-2ddc69 Out IP 8.8.8.8 > 172.31.129.2: ICMP echo reply, id 11, seq 1, length 64
13:04:46.175361 eth0  Out IP 192.168.147.3.53400 > 192.168.147.2.10351: Flags [S], seq 349848159, win 64240, options [mss 1460,sackOK,TS val 2863175665 ecr 0,nop,wscale 10], length 0
13:04:46.175612 eth0  In  IP 192.168.147.2.10351 > 192.168.147.3.53400: Flags [S.], seq 3616623338, ack 349848160, win 65160, options [mss 1460,sackOK,TS val 2332797629 ecr 2863175665,nop,wscale 10], length 0
13:04:46.175642 eth0  Out IP 192.168.147.3.53400 > 192.168.147.2.10351: Flags [.], ack 1, win 63, options [nop,nop,TS val 2863175665 ecr 2332797629], length 0
13:04:46.190445 eth0  Out IP 192.168.147.3.53400 > 192.168.147.2.10351: Flags [P.], seq 1:238, ack 1, win 63, options [nop,nop,TS val 2863175680 ecr 2332797629], length 237
13:04:46.194288 eth0  In  IP 192.168.147.2.10351 > 192.168.147.3.53400: Flags [.], ack 238, win 64, options [nop,nop,TS val 2332797648 ecr 2863175680], length 0
13:04:46.223312 eth0  In  IP 192.168.147.2.10351 > 192.168.147.3.53400: Flags [P.], seq 1:238, ack 238, win 64, options [nop,nop,TS val 2332797677 ecr 2863175680], length 237
13:04:46.223380 eth0  Out IP 192.168.147.3.53400 > 192.168.147.2.10351: Flags [.], ack 238, win 63, options [nop,nop,TS val 2863175713 ecr 2332797677], length 0
13:04:46.223473 eth0  In  IP 192.168.147.2.10351 > 192.168.147.3.53400: Flags [F.], seq 238, ack 238, win 64, options [nop,nop,TS val 2332797677 ecr 2863175713], length 0
13:04:46.223686 eth0  Out IP 192.168.147.3.53400 > 192.168.147.2.10351: Flags [F.], seq 238, ack 239, win 63, options [nop,nop,TS val 2863175713 ecr 2332797677], length 0
13:04:46.223736 eth0  In  IP 192.168.147.2.10351 > 192.168.147.3.53400: Flags [.], ack 239, win 64, options [nop,nop,TS val 2332797677 ecr 2863175713], length 0
13:04:46.649861 eth0  In  IP 192.168.147.2.10351 > 192.168.147.3.10351: UDP, length 100
13:04:46.650214 eth0  Out IP 192.168.147.3.10351 > 192.168.147.2.10351: UDP, length 18
13:04:46.896271 test-tra-2ddc69 P   IP 172.31.129.2 > 8.8.8.8: ICMP echo request, id 11, seq 2, length 64
13:04:46.896325 antrea-gw0 In  IP 172.31.129.2 > 8.8.8.8: ICMP echo request, id 11, seq 2, length 64
13:04:46.896375 eth0  Out IP 192.168.147.3 > 8.8.8.8: ICMP echo request, id 11, seq 2, length 64
13:04:46.911204 eth0  In  IP 8.8.8.8 > 192.168.147.3: ICMP echo reply, id 11, seq 2, length 64
13:04:46.911221 antrea-gw0 Out IP 8.8.8.8 > 172.31.129.2: ICMP echo reply, id 11, seq 2, length 64
13:04:46.911238 test-tra-2ddc69 Out IP 8.8.8.8 > 172.31.129.2: ICMP echo reply, id 11, seq 2, length 64
13:04:47.881874 eth0  Out IP 192.168.147.3.10351 > 192.168.147.2.10351: UDP, length 100
13:04:47.883028 eth0  In  IP 192.168.147.2.10351 > 192.168.147.3.10351: UDP, length 18
13:04:47.898117 test-tra-2ddc69 P   IP 172.31.129.2 > 8.8.8.8: ICMP echo request, id 11, seq 3, length 64
13:04:47.898162 antrea-gw0 In  IP 172.31.129.2 > 8.8.8.8: ICMP echo request, id 11, seq 3, length 64
13:04:47.898183 eth0  Out IP 192.168.147.3 > 8.8.8.8: ICMP echo request, id 11, seq 3, length 64
13:04:47.913894 eth0  In  IP 8.8.8.8 > 192.168.147.3: ICMP echo reply, id 11, seq 3, length 64
13:04:47.913917 antrea-gw0 Out IP 8.8.8.8 > 172.31.129.2: ICMP echo reply, id 11, seq 3, length 64
13:04:47.913933 test-tra-2ddc69 Out IP 8.8.8.8 > 172.31.129.2: ICMP echo reply, id 11, seq 3, length 64
13:04:48.038399 eth0  Out IP 192.168.147.3.32972 > 192.168.147.4.6443: Flags [P.], seq 3547768408:3547768448, ack 679370321, win 141, options [nop,nop,TS val 1886610759 ecr 1714715560], length 40
13:04:48.038567 eth0  In  IP 192.168.147.4.6443 > 192.168.147.3.32972: Flags [.], ack 40, win 73, options [nop,nop,TS val 1714718400 ecr 1886610759], length 0
13:04:48.039207 eth0  Out IP 192.168.147.3.32972 > 192.168.147.4.6443: Flags [P.], seq 40:587, ack 1, win 141, options [nop,nop,TS val 1886610760 ecr 1714718400], length 547
13:04:48.039218 eth0  In  IP 192.168.147.4.6443 > 192.168.147.3.32972: Flags [.], ack 587, win 73, options [nop,nop,TS val 1714718401 ecr 1886610760], length 0
13:04:48.057414 eth0  In  IP 192.168.147.4.6443 > 192.168.147.3.32972: Flags [P.], seq 1:95, ack 587, win 73, options [nop,nop,TS val 1714718419 ecr 1886610760], length 94
13:04:48.058422 eth0  In  IP 192.168.147.4.6443 > 192.168.147.3.32972: Flags [P.], seq 95:642, ack 587, win 73, options [nop,nop,TS val 1714718420 ecr 1886610760], length 547
13:04:48.058449 eth0  Out IP 192.168.147.3.32972 > 192.168.147.4.6443: Flags [.], ack 642, win 141, options [nop,nop,TS val 1886610779 ecr 1714718419], length 0
13:04:48.105658 eth0  Out IP 192.168.147.3.41982 > 192.168.147.4.10349: Flags [P.], seq 4154333587:4154333626, ack 2783226043, win 73, options [nop,nop,TS val 1886610826 ecr 1714688465], length 39
13:04:48.106111 eth0  In  IP 192.168.147.4.10349 > 192.168.147.3.41982: Flags [P.], seq 1:40, ack 39, win 70, options [nop,nop,TS val 1714718467 ecr 1886610826], length 39
13:04:48.106146 eth0  Out IP 192.168.147.3.41982 > 192.168.147.4.10349: Flags [.], ack 40, win 73, options [nop,nop,TS val 1886610826 ecr 1714718467], length 0
13:04:48.202268 lo    In  IP6 ::1.32802 > ::1.10350: Flags [S], seq 2374853967, win 65476, options [mss 65476,sackOK,TS val 3619076035 ecr 0,nop,wscale 10], length 0
13:04:48.202316 lo    In  IP6 ::1.10350 > ::1.32802: Flags [S.], seq 3116090327, ack 2374853968, win 65464, options [mss 65476,sackOK,TS val 3619076035 ecr 3619076035,nop,wscale 10], length 0
13:04:48.202336 lo    In  IP6 ::1.32802 > ::1.10350: Flags [.], ack 1, win 64, options [nop,nop,TS val 3619076035 ecr 3619076035], length 0
13:04:48.203790 lo    In  IP6 ::1.32802 > ::1.10350: Flags [P.], seq 1:1516, ack 1, win 64, options [nop,nop,TS val 3619076036 ecr 3619076035], length 1515
13:04:48.203815 lo    In  IP6 ::1.10350 > ::1.32802: Flags [.], ack 1516, win 72, options [nop,nop,TS val 3619076036 ecr 3619076036], length 0
13:04:48.209902 lo    In  IP6 ::1.10350 > ::1.32802: Flags [P.], seq 1:3430, ack 1516, win 72, options [nop,nop,TS val 3619076042 ecr 3619076036], length 3429
13:04:48.209931 lo    In  IP6 ::1.32802 > ::1.10350: Flags [.], ack 3430, win 93, options [nop,nop,TS val 3619076042 ecr 3619076042], length 0
13:04:48.210667 lo    In  IP6 ::1.32802 > ::1.10350: Flags [P.], seq 1516:1610, ack 3430, win 93, options [nop,nop,TS val 3619076043 ecr 3619076042], length 94
13:04:48.211331 lo    In  IP6 ::1.10350 > ::1.32802: Flags [P.], seq 3430:3491, ack 1610, win 72, options [nop,nop,TS val 3619076044 ecr 3619076043], length 61
13:04:48.211526 lo    In  IP6 ::1.32802 > ::1.10350: Flags [P.], seq 1610:1702, ack 3491, win 93, options [nop,nop,TS val 3619076044 ecr 3619076044], length 92
13:04:48.211595 lo    In  IP6 ::1.10350 > ::1.32802: Flags [P.], seq 3491:3526, ack 1702, win 72, options [nop,nop,TS val 3619076044 ecr 3619076044], length 35
13:04:48.211742 lo    In  IP6 ::1.10350 > ::1.32802: Flags [P.], seq 3526:3557, ack 1702, win 72, options [nop,nop,TS val 3619076044 ecr 3619076044], length 31
13:04:48.211826 lo    In  IP6 ::1.32802 > ::1.10350: Flags [.], ack 3557, win 93, options [nop,nop,TS val 3619076044 ecr 3619076044], length 0
13:04:48.211867 lo    In  IP6 ::1.32802 > ::1.10350: Flags [P.], seq 1702:1733, ack 3557, win 93, options [nop,nop,TS val 3619076044 ecr 3619076044], length 31
13:04:48.211974 lo    In  IP6 ::1.32802 > ::1.10350: Flags [P.], seq 1733:1808, ack 3557, win 93, options [nop,nop,TS val 3619076044 ecr 3619076044], length 75
13:04:48.211994 lo    In  IP6 ::1.10350 > ::1.32802: Flags [.], ack 1808, win 72, options [nop,nop,TS val 3619076044 ecr 3619076044], length 0
13:04:48.216849 lo    In  IP6 ::1.10350 > ::1.32802: Flags [P.], seq 3557:3596, ack 1808, win 72, options [nop,nop,TS val 3619076049 ecr 3619076044], length 39
13:04:48.217100 lo    In  IP6 ::1.10350 > ::1.32802: Flags [P.], seq 3596:3748, ack 1808, win 72, options [nop,nop,TS val 3619076049 ecr 3619076044], length 152
13:04:48.217119 lo    In  IP6 ::1.32802 > ::1.10350: Flags [.], ack 3748, win 95, options [nop,nop,TS val 3619076049 ecr 3619076049], length 0
13:04:48.217334 lo    In  IP6 ::1.10350 > ::1.32802: Flags [P.], seq 3748:3781, ack 1808, win 72, options [nop,nop,TS val 3619076050 ecr 3619076049], length 33
13:04:48.217485 lo    In  IP6 ::1.32802 > ::1.10350: Flags [P.], seq 1808:1832, ack 3781, win 95, options [nop,nop,TS val 3619076050 ecr 3619076050], length 24
13:04:48.217532 lo    In  IP6 ::1.32802 > ::1.10350: Flags [F.], seq 1832, ack 3781, win 95, options [nop,nop,TS val 3619076050 ecr 3619076050], length 0
13:04:48.217607 lo    In  IP6 ::1.10350 > ::1.32802: Flags [P.], seq 3781:3805, ack 1833, win 72, options [nop,nop,TS val 3619076050 ecr 3619076050], length 24
13:04:48.217633 lo    In  IP6 ::1.32802 > ::1.10350: Flags [R], seq 2374855800, win 0, length 0
13:04:48.790398 eth0  In  IP 192.168.147.4.10351 > 192.168.147.3.10351: UDP, length 107
13:04:48.794129 eth0  Out IP 192.168.147.3.10351 > 192.168.147.4.10351: UDP, length 18
13:04:48.884848 eth0  Out IP 192.168.147.3.10351 > 192.168.147.4.10351: UDP, length 107
13:04:48.885218 eth0  In  IP 192.168.147.4.10351 > 192.168.147.3.10351: UDP, length 18
13:04:48.885335 lo    In  IP6 ::1.32814 > ::1.10350: Flags [S], seq 1765773964, win 65476, options [mss 65476,sackOK,TS val 3619076718 ecr 0,nop,wscale 10], length 0
13:04:48.885369 lo    In  IP6 ::1.10350 > ::1.32814: Flags [S.], seq 3352667937, ack 1765773965, win 65464, options [mss 65476,sackOK,TS val 3619076718 ecr 3619076718,nop,wscale 10], length 0
13:04:48.885374 lo    In  IP6 ::1.32814 > ::1.10350: Flags [.], ack 1, win 64, options [nop,nop,TS val 3619076718 ecr 3619076718], length 0
13:04:48.885684 lo    In  IP6 ::1.32814 > ::1.10350: Flags [P.], seq 1:1516, ack 1, win 64, options [nop,nop,TS val 3619076718 ecr 3619076718], length 1515
13:04:48.885687 lo    In  IP6 ::1.10350 > ::1.32814: Flags [.], ack 1516, win 72, options [nop,nop,TS val 3619076718 ecr 3619076718], length 0
13:04:48.887266 lo    In  IP6 ::1.10350 > ::1.32814: Flags [P.], seq 1:3430, ack 1516, win 72, options [nop,nop,TS val 3619076720 ecr 3619076718], length 3429
13:04:48.887272 lo    In  IP6 ::1.32814 > ::1.10350: Flags [.], ack 3430, win 93, options [nop,nop,TS val 3619076720 ecr 3619076720], length 0
13:04:48.887618 lo    In  IP6 ::1.32814 > ::1.10350: Flags [P.], seq 1516:1610, ack 3430, win 93, options [nop,nop,TS val 3619076720 ecr 3619076720], length 94
13:04:48.887770 lo    In  IP6 ::1.10350 > ::1.32814: Flags [P.], seq 3430:3491, ack 1610, win 72, options [nop,nop,TS val 3619076720 ecr 3619076720], length 61
13:04:48.887802 lo    In  IP6 ::1.32814 > ::1.10350: Flags [P.], seq 1610:1702, ack 3491, win 93, options [nop,nop,TS val 3619076720 ecr 3619076720], length 92
13:04:48.887847 lo    In  IP6 ::1.10350 > ::1.32814: Flags [P.], seq 3491:3526, ack 1702, win 72, options [nop,nop,TS val 3619076720 ecr 3619076720], length 35
13:04:48.887880 lo    In  IP6 ::1.10350 > ::1.32814: Flags [P.], seq 3526:3557, ack 1702, win 72, options [nop,nop,TS val 3619076720 ecr 3619076720], length 31
13:04:48.887903 lo    In  IP6 ::1.32814 > ::1.10350: Flags [.], ack 3557, win 93, options [nop,nop,TS val 3619076720 ecr 3619076720], length 0
13:04:48.887921 lo    In  IP6 ::1.32814 > ::1.10350: Flags [P.], seq 1702:1733, ack 3557, win 93, options [nop,nop,TS val 3619076720 ecr 3619076720], length 31
13:04:48.887979 lo    In  IP6 ::1.32814 > ::1.10350: Flags [P.], seq 1733:1807, ack 3557, win 93, options [nop,nop,TS val 3619076720 ecr 3619076720], length 74
13:04:48.887985 lo    In  IP6 ::1.10350 > ::1.32814: Flags [.], ack 1807, win 72, options [nop,nop,TS val 3619076720 ecr 3619076720], length 0
13:04:48.888467 lo    In  IP6 ::1.10350 > ::1.32814: Flags [P.], seq 3557:3596, ack 1807, win 72, options [nop,nop,TS val 3619076721 ecr 3619076720], length 39
13:04:48.888499 lo    In  IP6 ::1.10350 > ::1.32814: Flags [P.], seq 3596:3747, ack 1807, win 72, options [nop,nop,TS val 3619076721 ecr 3619076720], length 151
13:04:48.888507 lo    In  IP6 ::1.32814 > ::1.10350: Flags [.], ack 3747, win 95, options [nop,nop,TS val 3619076721 ecr 3619076721], length 0
13:04:48.888576 lo    In  IP6 ::1.10350 > ::1.32814: Flags [P.], seq 3747:3780, ack 1807, win 72, options [nop,nop,TS val 3619076721 ecr 3619076721], length 33
13:04:48.888597 lo    In  IP6 ::1.32814 > ::1.10350: Flags [P.], seq 1807:1831, ack 3780, win 95, options [nop,nop,TS val 3619076721 ecr 3619076721], length 24
13:04:48.888607 lo    In  IP6 ::1.10350 > ::1.32814: Flags [P.], seq 3780:3804, ack 1831, win 72, options [nop,nop,TS val 3619076721 ecr 3619076721], length 24
13:04:48.888616 lo    In  IP6 ::1.10350 > ::1.32814: Flags [F.], seq 3804, ack 1831, win 72, options [nop,nop,TS val 3619076721 ecr 3619076721], length 0
13:04:48.888636 lo    In  IP6 ::1.32814 > ::1.10350: Flags [R.], seq 1831, ack 3805, win 95, options [nop,nop,TS val 3619076721 ecr 3619076721], length 0
13:04:48.898804 test-tra-2ddc69 P   IP 172.31.129.2 > 8.8.8.8: ICMP echo request, id 11, seq 4, length 64
13:04:48.898820 antrea-gw0 In  IP 172.31.129.2 > 8.8.8.8: ICMP echo request, id 11, seq 4, length 64
13:04:48.898850 eth0  Out IP 192.168.147.3 > 8.8.8.8: ICMP echo request, id 11, seq 4, length 64
13:04:48.912700 eth0  In  IP 8.8.8.8 > 192.168.147.3: ICMP echo reply, id 11, seq 4, length 64
13:04:48.912709 antrea-gw0 Out IP 8.8.8.8 > 172.31.129.2: ICMP echo reply, id 11, seq 4, length 64
13:04:48.912718 test-tra-2ddc69 Out IP 8.8.8.8 > 172.31.129.2: ICMP echo reply, id 11, seq 4, length 64
13:04:49.311451 test-tra-2ddc69 M   IP6 fe80::7031:68ff:fe6f:a21c > ff02::2: ICMP6, router solicitation, length 16
13:04:49.649582 eth0  In  IP 192.168.147.2.10351 > 192.168.147.3.10351: UDP, length 100
13:04:49.650044 eth0  Out IP 192.168.147.3.10351 > 192.168.147.2.10351: UDP, length 18
13:04:49.882016 eth0  Out IP 192.168.147.3.10351 > 192.168.147.4.10351: UDP, length 107
13:04:49.883208 eth0  In  IP 192.168.147.4.10351 > 192.168.147.3.10351: UDP, length 18
13:04:49.899483 test-tra-2ddc69 P   IP 172.31.129.2 > 8.8.8.8: ICMP echo request, id 11, seq 5, length 64
13:04:49.899523 antrea-gw0 In  IP 172.31.129.2 > 8.8.8.8: ICMP echo request, id 11, seq 5, length 64
13:04:49.899563 eth0  Out IP 192.168.147.3 > 8.8.8.8: ICMP echo request, id 11, seq 5, length 64
13:04:49.921018 eth0  In  IP 8.8.8.8 > 192.168.147.3: ICMP echo reply, id 11, seq 5, length 64
13:04:49.921055 antrea-gw0 Out IP 8.8.8.8 > 172.31.129.2: ICMP echo reply, id 11, seq 5, length 64
13:04:49.921079 test-tra-2ddc69 Out IP 8.8.8.8 > 172.31.129.2: ICMP echo reply, id 11, seq 5, length 64
13:04:50.334382 antrea-gw0 Out ARP, Request who-has 172.31.129.2 tell 172.31.129.1, length 28
13:04:50.334820 test-tra-2ddc69 Out ARP, Request who-has 172.31.129.2 tell 172.31.129.1, length 28
13:04:50.334832 test-tra-2ddc69 P   ARP, Reply 172.31.129.2 is-at 72:31:68:6f:a2:1c, length 28
13:04:50.334927 antrea-gw0 In  ARP, Reply 172.31.129.2 is-at 72:31:68:6f:a2:1c, length 28
13:04:50.649583 eth0  In  IP 192.168.147.2.10351 > 192.168.147.3.10351: UDP, length 100
13:04:50.650048 eth0  Out IP 192.168.147.3.10351 > 192.168.147.2.10351: UDP, length 18
13:04:50.653730 eth0  In  IP 192.168.147.4.45382 > 192.168.147.3.10250: Flags [S], seq 4004378520, win 64240, options [mss 1460,sackOK,TS val 1714721015 ecr 0,nop,wscale 10], length 0
13:04:50.653778 eth0  Out IP 192.168.147.3.10250 > 192.168.147.4.45382: Flags [S.], seq 3737646326, ack 4004378521, win 65160, options [mss 1460,sackOK,TS val 1886613374 ecr 1714721015,nop,wscale 10], length 0
13:04:50.653798 eth0  In  IP 192.168.147.4.45382 > 192.168.147.3.10250: Flags [.], ack 1, win 63, options [nop,nop,TS val 1714721015 ecr 1886613374], length 0
13:04:50.654307 eth0  In  IP 192.168.147.4.45382 > 192.168.147.3.10250: Flags [P.], seq 1:1495, ack 1, win 63, options [nop,nop,TS val 1714721016 ecr 1886613374], length 1494
13:04:50.654316 eth0  Out IP 192.168.147.3.10250 > 192.168.147.4.45382: Flags [.], ack 1495, win 67, options [nop,nop,TS val 1886613375 ecr 1714721016], length 0
13:04:50.655897 eth0  Out IP 192.168.147.3.10250 > 192.168.147.4.45382: Flags [P.], seq 1:3431, ack 1495, win 67, options [nop,nop,TS val 1886613376 ecr 1714721016], length 3430
13:04:50.655909 eth0  In  IP 192.168.147.4.45382 > 192.168.147.3.10250: Flags [.], ack 3431, win 70, options [nop,nop,TS val 1714721017 ecr 1886613376], length 0
13:04:50.658994 eth0  In  IP 192.168.147.4.45382 > 192.168.147.3.10250: Flags [P.], seq 1495:2706, ack 3431, win 70, options [nop,nop,TS val 1714721020 ecr 1886613376], length 1211
13:04:50.659394 eth0  In  IP 192.168.147.4.45382 > 192.168.147.3.10250: Flags [P.], seq 2706:3241, ack 3431, win 70, options [nop,nop,TS val 1714721021 ecr 1886613376], length 535
13:04:50.659401 eth0  Out IP 192.168.147.3.10250 > 192.168.147.4.45382: Flags [.], ack 3241, win 72, options [nop,nop,TS val 1886613380 ecr 1714721020], length 0
13:04:50.661057 eth0  Out IP 192.168.147.3.32972 > 192.168.147.4.6443: Flags [P.], seq 587:667, ack 642, win 141, options [nop,nop,TS val 1886613381 ecr 1714718419], length 80
13:04:50.661760 eth0  Out IP 192.168.147.3.32972 > 192.168.147.4.6443: Flags [P.], seq 667:1048, ack 642, win 141, options [nop,nop,TS val 1886613382 ecr 1714718419], length 381
13:04:50.661784 eth0  In  IP 192.168.147.4.6443 > 192.168.147.3.32972: Flags [.], ack 1048, win 73, options [nop,nop,TS val 1714721023 ecr 1886613381], length 0
13:04:50.663572 eth0  In  IP 192.168.147.4.6443 > 192.168.147.3.32972: Flags [P.], seq 642:736, ack 1048, win 73, options [nop,nop,TS val 1714721025 ecr 1886613381], length 94
13:04:50.663769 eth0  In  IP 192.168.147.4.6443 > 192.168.147.3.32972: Flags [P.], seq 736:1531, ack 1048, win 73, options [nop,nop,TS val 1714721025 ecr 1886613381], length 795
13:04:50.663776 eth0  Out IP 192.168.147.3.32972 > 192.168.147.4.6443: Flags [.], ack 1531, win 141, options [nop,nop,TS val 1886613384 ecr 1714721025], length 0
13:04:50.666263 lo    In  IP 127.0.0.1.36754 > 127.0.0.1.36481: Flags [S], seq 2378362999, win 65495, options [mss 65495,sackOK,TS val 253966069 ecr 0,nop,wscale 10], length 0
13:04:50.666275 lo    In  IP 127.0.0.1.36481 > 127.0.0.1.36754: Flags [S.], seq 1334973770, ack 2378363000, win 65483, options [mss 65495,sackOK,TS val 253966069 ecr 253966069,nop,wscale 10], length 0
13:04:50.666283 lo    In  IP 127.0.0.1.36754 > 127.0.0.1.36481: Flags [.], ack 1, win 64, options [nop,nop,TS val 253966069 ecr 253966069], length 0
13:04:50.670408 lo    In  IP 127.0.0.1.36754 > 127.0.0.1.36481: Flags [P.], seq 1:410, ack 1, win 64, options [nop,nop,TS val 253966073 ecr 253966069], length 409
13:04:50.670419 lo    In  IP 127.0.0.1.36481 > 127.0.0.1.36754: Flags [.], ack 410, win 64, options [nop,nop,TS val 253966073 ecr 253966073], length 0
13:04:50.671325 lo    In  IP 127.0.0.1.36481 > 127.0.0.1.36754: Flags [P.], seq 1:160, ack 410, win 64, options [nop,nop,TS val 253966074 ecr 253966073], length 159
13:04:50.671332 lo    In  IP 127.0.0.1.36754 > 127.0.0.1.36481: Flags [.], ack 160, win 64, options [nop,nop,TS val 253966074 ecr 253966074], length 0
13:04:50.671780 eth0  Out IP 192.168.147.3.10250 > 192.168.147.4.45382: Flags [P.], seq 3431:3612, ack 3241, win 72, options [nop,nop,TS val 1886613392 ecr 1714721020], length 181
13:04:50.673421 eth0  In  IP 192.168.147.4.45382 > 192.168.147.3.10250: Flags [P.], seq 3241:3265, ack 3612, win 73, options [nop,nop,TS val 1714721035 ecr 1886613392], length 24
13:04:50.673438 eth0  In  IP 192.168.147.4.45382 > 192.168.147.3.10250: Flags [P.], seq 3265:3289, ack 3612, win 73, options [nop,nop,TS val 1714721035 ecr 1886613392], length 24
13:04:50.673441 eth0  In  IP 192.168.147.4.45382 > 192.168.147.3.10250: Flags [P.], seq 3289:3315, ack 3612, win 73, options [nop,nop,TS val 1714721035 ecr 1886613392], length 26
13:04:50.673444 eth0  In  IP 192.168.147.4.45382 > 192.168.147.3.10250: Flags [P.], seq 3315:3341, ack 3612, win 73, options [nop,nop,TS val 1714721035 ecr 1886613392], length 26
13:04:50.673446 eth0  In  IP 192.168.147.4.45382 > 192.168.147.3.10250: Flags [P.], seq 3341:3367, ack 3612, win 73, options [nop,nop,TS val 1714721035 ecr 1886613392], length 26
13:04:50.673449 eth0  In  IP 192.168.147.4.45382 > 192.168.147.3.10250: Flags [P.], seq 3367:3390, ack 3612, win 73, options [nop,nop,TS val 1714721035 ecr 1886613392], length 23
13:04:50.673454 eth0  In  IP 192.168.147.4.45382 > 192.168.147.3.10250: Flags [P.], seq 3390:3413, ack 3612, win 73, options [nop,nop,TS val 1714721035 ecr 1886613392], length 23
13:04:50.673457 eth0  In  IP 192.168.147.4.45382 > 192.168.147.3.10250: Flags [P.], seq 3413:3466, ack 3612, win 73, options [nop,nop,TS val 1714721035 ecr 1886613392], length 53
13:04:50.673474 eth0  Out IP 192.168.147.3.10250 > 192.168.147.4.45382: Flags [.], ack 3466, win 72, options [nop,nop,TS val 1886613394 ecr 1714721035], length 0
13:04:50.673488 lo    In  IP 127.0.0.1.36754 > 127.0.0.1.36481: Flags [P.], seq 410:412, ack 160, win 64, options [nop,nop,TS val 253966076 ecr 253966074], length 2
13:04:50.673497 lo    In  IP 127.0.0.1.36754 > 127.0.0.1.36481: Flags [P.], seq 412:414, ack 160, win 64, options [nop,nop,TS val 253966076 ecr 253966074], length 2
13:04:50.673499 lo    In  IP 127.0.0.1.36754 > 127.0.0.1.36481: Flags [P.], seq 414:418, ack 160, win 64, options [nop,nop,TS val 253966076 ecr 253966074], length 4
13:04:50.673501 lo    In  IP 127.0.0.1.36754 > 127.0.0.1.36481: Flags [P.], seq 418:422, ack 160, win 64, options [nop,nop,TS val 253966076 ecr 253966074], length 4
13:04:50.673502 lo    In  IP 127.0.0.1.36754 > 127.0.0.1.36481: Flags [P.], seq 422:426, ack 160, win 64, options [nop,nop,TS val 253966076 ecr 253966074], length 4
13:04:50.673504 lo    In  IP 127.0.0.1.36754 > 127.0.0.1.36481: Flags [P.], seq 426:427, ack 160, win 64, options [nop,nop,TS val 253966076 ecr 253966074], length 1
13:04:50.673505 lo    In  IP 127.0.0.1.36754 > 127.0.0.1.36481: Flags [P.], seq 427:428, ack 160, win 64, options [nop,nop,TS val 253966076 ecr 253966074], length 1
13:04:50.673507 lo    In  IP 127.0.0.1.36754 > 127.0.0.1.36481: Flags [P.], seq 428:459, ack 160, win 64, options [nop,nop,TS val 253966076 ecr 253966074], length 31
13:04:50.673525 lo    In  IP 127.0.0.1.36481 > 127.0.0.1.36754: Flags [.], ack 459, win 64, options [nop,nop,TS val 253966076 ecr 253966076], length 0
13:04:50.674459 lo    In  IP 127.0.0.1.36481 > 127.0.0.1.36754: Flags [P.], seq 160:162, ack 459, win 64, options [nop,nop,TS val 253966077 ecr 253966076], length 2
13:04:50.674465 lo    In  IP 127.0.0.1.36481 > 127.0.0.1.36754: Flags [P.], seq 162:164, ack 459, win 64, options [nop,nop,TS val 253966077 ecr 253966076], length 2
13:04:50.674466 lo    In  IP 127.0.0.1.36481 > 127.0.0.1.36754: Flags [P.], seq 164:168, ack 459, win 64, options [nop,nop,TS val 253966077 ecr 253966076], length 4
13:04:50.674468 lo    In  IP 127.0.0.1.36481 > 127.0.0.1.36754: Flags [P.], seq 168:172, ack 459, win 64, options [nop,nop,TS val 253966077 ecr 253966076], length 4
13:04:50.674469 lo    In  IP 127.0.0.1.36481 > 127.0.0.1.36754: Flags [P.], seq 172:188, ack 459, win 64, options [nop,nop,TS val 253966077 ecr 253966076], length 16
13:04:50.674524 lo    In  IP 127.0.0.1.36754 > 127.0.0.1.36481: Flags [.], ack 188, win 64, options [nop,nop,TS val 253966077 ecr 253966077], length 0
13:04:50.674533 eth0  Out IP 192.168.147.3.10250 > 192.168.147.4.45382: Flags [P.], seq 3612:3662, ack 3466, win 72, options [nop,nop,TS val 1886613395 ecr 1714721035], length 50
13:04:50.674757 eth0  In  IP 192.168.147.4.45382 > 192.168.147.3.10250: Flags [P.], seq 3466:3490, ack 3662, win 73, options [nop,nop,TS val 1714721036 ecr 1886613395], length 24
13:04:50.674770 lo    In  IP 127.0.0.1.36754 > 127.0.0.1.36481: Flags [P.], seq 459:461, ack 188, win 64, options [nop,nop,TS val 253966077 ecr 253966077], length 2
13:04:50.674786 eth0  In  IP 192.168.147.4.45382 > 192.168.147.3.10250: Flags [P.], seq 3490:3514, ack 3662, win 73, options [nop,nop,TS val 1714721036 ecr 1886613395], length 24
13:04:50.674789 eth0  Out IP 192.168.147.3.10250 > 192.168.147.4.45382: Flags [.], ack 3514, win 72, options [nop,nop,TS val 1886613395 ecr 1714721036], length 0
13:04:50.674793 lo    In  IP 127.0.0.1.36754 > 127.0.0.1.36481: Flags [P.], seq 461:463, ack 188, win 64, options [nop,nop,TS val 253966077 ecr 253966077], length 2
13:04:50.674797 lo    In  IP 127.0.0.1.36481 > 127.0.0.1.36754: Flags [.], ack 463, win 64, options [nop,nop,TS val 253966077 ecr 253966077], length 0
13:04:50.674803 eth0  In  IP 192.168.147.4.45382 > 192.168.147.3.10250: Flags [P.], seq 3514:3540, ack 3662, win 73, options [nop,nop,TS val 1714721036 ecr 1886613395], length 26
13:04:50.674806 lo    In  IP 127.0.0.1.36754 > 127.0.0.1.36481: Flags [P.], seq 463:467, ack 188, win 64, options [nop,nop,TS val 253966077 ecr 253966077], length 4
13:04:50.674815 eth0  In  IP 192.168.147.4.45382 > 192.168.147.3.10250: Flags [P.], seq 3540:3566, ack 3662, win 73, options [nop,nop,TS val 1714721036 ecr 1886613395], length 26
13:04:50.674818 eth0  Out IP 192.168.147.3.10250 > 192.168.147.4.45382: Flags [.], ack 3566, win 72, options [nop,nop,TS val 1886613395 ecr 1714721036], length 0
13:04:50.674820 lo    In  IP 127.0.0.1.36754 > 127.0.0.1.36481: Flags [P.], seq 467:471, ack 188, win 64, options [nop,nop,TS val 253966077 ecr 253966077], length 4
13:04:50.674824 lo    In  IP 127.0.0.1.36481 > 127.0.0.1.36754: Flags [.], ack 471, win 64, options [nop,nop,TS val 253966077 ecr 253966077], length 0
13:04:50.674828 eth0  In  IP 192.168.147.4.45382 > 192.168.147.3.10250: Flags [P.], seq 3566:3592, ack 3662, win 73, options [nop,nop,TS val 1714721036 ecr 1886613395], length 26
13:04:50.674831 lo    In  IP 127.0.0.1.36754 > 127.0.0.1.36481: Flags [P.], seq 471:475, ack 188, win 64, options [nop,nop,TS val 253966077 ecr 253966077], length 4
13:04:50.674838 eth0  In  IP 192.168.147.4.45382 > 192.168.147.3.10250: Flags [P.], seq 3592:3615, ack 3662, win 73, options [nop,nop,TS val 1714721036 ecr 1886613395], length 23
13:04:50.674841 eth0  Out IP 192.168.147.3.10250 > 192.168.147.4.45382: Flags [.], ack 3615, win 72, options [nop,nop,TS val 1886613395 ecr 1714721036], length 0
13:04:50.674843 lo    In  IP 127.0.0.1.36754 > 127.0.0.1.36481: Flags [P.], seq 475:476, ack 188, win 64, options [nop,nop,TS val 253966077 ecr 253966077], length 1
13:04:50.674847 lo    In  IP 127.0.0.1.36481 > 127.0.0.1.36754: Flags [.], ack 476, win 64, options [nop,nop,TS val 253966077 ecr 253966077], length 0
13:04:50.674851 eth0  In  IP 192.168.147.4.45382 > 192.168.147.3.10250: Flags [P.], seq 3615:3638, ack 3662, win 73, options [nop,nop,TS val 1714721036 ecr 1886613395], length 23
13:04:50.674854 lo    In  IP 127.0.0.1.36754 > 127.0.0.1.36481: Flags [P.], seq 476:477, ack 188, win 64, options [nop,nop,TS val 253966077 ecr 253966077], length 1
13:04:50.674862 eth0  In  IP 192.168.147.4.45382 > 192.168.147.3.10250: Flags [P.], seq 3638:3675, ack 3662, win 73, options [nop,nop,TS val 1714721036 ecr 1886613395], length 37
13:04:50.674864 eth0  Out IP 192.168.147.3.10250 > 192.168.147.4.45382: Flags [.], ack 3675, win 72, options [nop,nop,TS val 1886613395 ecr 1714721036], length 0
13:04:50.674866 lo    In  IP 127.0.0.1.36754 > 127.0.0.1.36481: Flags [P.], seq 477:492, ack 188, win 64, options [nop,nop,TS val 253966077 ecr 253966077], length 15
13:04:50.674870 lo    In  IP 127.0.0.1.36481 > 127.0.0.1.36754: Flags [.], ack 492, win 64, options [nop,nop,TS val 253966077 ecr 253966077], length 0
13:04:50.674903 lo    In  IP 127.0.0.1.36481 > 127.0.0.1.36754: Flags [P.], seq 188:190, ack 492, win 64, options [nop,nop,TS val 253966077 ecr 253966077], length 2
13:04:50.674910 eth0  Out IP 192.168.147.3.10250 > 192.168.147.4.45382: Flags [P.], seq 3662:3686, ack 3675, win 72, options [nop,nop,TS val 1886613395 ecr 1714721036], length 24
13:04:50.674918 lo    In  IP 127.0.0.1.36481 > 127.0.0.1.36754: Flags [P.], seq 190:192, ack 492, win 64, options [nop,nop,TS val 253966077 ecr 253966077], length 2
13:04:50.674921 lo    In  IP 127.0.0.1.36754 > 127.0.0.1.36481: Flags [.], ack 192, win 64, options [nop,nop,TS val 253966077 ecr 253966077], length 0
13:04:50.674923 eth0  Out IP 192.168.147.3.10250 > 192.168.147.4.45382: Flags [P.], seq 3686:3710, ack 3675, win 72, options [nop,nop,TS val 1886613395 ecr 1714721036], length 24
13:04:50.674927 lo    In  IP 127.0.0.1.36481 > 127.0.0.1.36754: Flags [P.], seq 192:196, ack 492, win 64, options [nop,nop,TS val 253966077 ecr 253966077], length 4
13:04:50.674930 eth0  Out IP 192.168.147.3.10250 > 192.168.147.4.45382: Flags [P.], seq 3710:3736, ack 3675, win 72, options [nop,nop,TS val 1886613395 ecr 1714721036], length 26
13:04:50.674932 eth0  In  IP 192.168.147.4.45382 > 192.168.147.3.10250: Flags [.], ack 3710, win 73, options [nop,nop,TS val 1714721036 ecr 1886613395], length 0
13:04:50.674935 lo    In  IP 127.0.0.1.36481 > 127.0.0.1.36754: Flags [P.], seq 196:200, ack 492, win 64, options [nop,nop,TS val 253966077 ecr 253966077], length 4
13:04:50.674941 lo    In  IP 127.0.0.1.36754 > 127.0.0.1.36481: Flags [.], ack 200, win 64, options [nop,nop,TS val 253966077 ecr 253966077], length 0
13:04:50.674944 eth0  Out IP 192.168.147.3.10250 > 192.168.147.4.45382: Flags [P.], seq 3736:3762, ack 3675, win 72, options [nop,nop,TS val 1886613395 ecr 1714721036], length 26
13:04:50.674960 lo    In  IP 127.0.0.1.36481 > 127.0.0.1.36754: Flags [P.], seq 200:208, ack 492, win 64, options [nop,nop,TS val 253966077 ecr 253966077], length 8
13:04:50.674962 eth0  In  IP 192.168.147.4.45382 > 192.168.147.3.10250: Flags [.], ack 3762, win 73, options [nop,nop,TS val 1714721036 ecr 1886613395], length 0
13:04:50.674972 eth0  Out IP 192.168.147.3.10250 > 192.168.147.4.45382: Flags [P.], seq 3762:3792, ack 3675, win 72, options [nop,nop,TS val 1886613395 ecr 1714721036], length 30
13:04:50.675077 eth0  In  IP 192.168.147.4.45382 > 192.168.147.3.10250: Flags [P.], seq 3675:3699, ack 3792, win 73, options [nop,nop,TS val 1714721036 ecr 1886613395], length 24
13:04:50.675087 lo    In  IP 127.0.0.1.36754 > 127.0.0.1.36481: Flags [P.], seq 492:494, ack 208, win 64, options [nop,nop,TS val 253966077 ecr 253966077], length 2
13:04:50.675103 eth0  In  IP 192.168.147.4.45382 > 192.168.147.3.10250: Flags [P.], seq 3699:3723, ack 3792, win 73, options [nop,nop,TS val 1714721036 ecr 1886613395], length 24
13:04:50.675107 eth0  Out IP 192.168.147.3.10250 > 192.168.147.4.45382: Flags [.], ack 3723, win 72, options [nop,nop,TS val 1886613395 ecr 1714721036], length 0
13:04:50.675117 lo    In  IP 127.0.0.1.36754 > 127.0.0.1.36481: Flags [P.], seq 494:496, ack 208, win 64, options [nop,nop,TS val 253966077 ecr 253966077], length 2
13:04:50.675129 lo    In  IP 127.0.0.1.36481 > 127.0.0.1.36754: Flags [.], ack 496, win 64, options [nop,nop,TS val 253966077 ecr 253966077], length 0
13:04:50.675152 eth0  In  IP 192.168.147.4.45382 > 192.168.147.3.10250: Flags [P.], seq 3723:3749, ack 3792, win 73, options [nop,nop,TS val 1714721037 ecr 1886613395], length 26
13:04:50.675155 eth0  In  IP 192.168.147.4.45382 > 192.168.147.3.10250: Flags [P.], seq 3749:3775, ack 3792, win 73, options [nop,nop,TS val 1714721037 ecr 1886613395], length 26
13:04:50.675157 eth0  In  IP 192.168.147.4.45382 > 192.168.147.3.10250: Flags [P.], seq 3775:3801, ack 3792, win 73, options [nop,nop,TS val 1714721037 ecr 1886613395], length 26
13:04:50.675160 eth0  In  IP 192.168.147.4.45382 > 192.168.147.3.10250: Flags [P.], seq 3801:3824, ack 3792, win 73, options [nop,nop,TS val 1714721037 ecr 1886613395], length 23
13:04:50.675162 eth0  In  IP 192.168.147.4.45382 > 192.168.147.3.10250: Flags [P.], seq 3824:3847, ack 3792, win 73, options [nop,nop,TS val 1714721037 ecr 1886613395], length 23
13:04:50.675163 eth0  Out IP 192.168.147.3.10250 > 192.168.147.4.45382: Flags [.], ack 3801, win 72, options [nop,nop,TS val 1886613396 ecr 1714721037], length 0
13:04:50.675165 eth0  In  IP 192.168.147.4.45382 > 192.168.147.3.10250: Flags [P.], seq 3847:3880, ack 3792, win 73, options [nop,nop,TS val 1714721037 ecr 1886613395], length 33
13:04:50.675174 lo    In  IP 127.0.0.1.36754 > 127.0.0.1.36481: Flags [P.], seq 496:500, ack 208, win 64, options [nop,nop,TS val 253966078 ecr 253966077], length 4
13:04:50.675188 lo    In  IP 127.0.0.1.36754 > 127.0.0.1.36481: Flags [P.], seq 500:504, ack 208, win 64, options [nop,nop,TS val 253966078 ecr 253966077], length 4
13:04:50.675191 lo    In  IP 127.0.0.1.36481 > 127.0.0.1.36754: Flags [.], ack 504, win 64, options [nop,nop,TS val 253966078 ecr 253966078], length 0
13:04:50.675196 lo    In  IP 127.0.0.1.36754 > 127.0.0.1.36481: Flags [P.], seq 504:508, ack 208, win 64, options [nop,nop,TS val 253966078 ecr 253966078], length 4
13:04:50.675201 eth0  Out IP 192.168.147.3.10250 > 192.168.147.4.45382: Flags [.], ack 3880, win 72, options [nop,nop,TS val 1886613396 ecr 1714721037], length 0
13:04:50.675204 lo    In  IP 127.0.0.1.36754 > 127.0.0.1.36481: Flags [P.], seq 508:509, ack 208, win 64, options [nop,nop,TS val 253966078 ecr 253966078], length 1
13:04:50.675207 lo    In  IP 127.0.0.1.36481 > 127.0.0.1.36754: Flags [.], ack 509, win 64, options [nop,nop,TS val 253966078 ecr 253966078], length 0
13:04:50.675211 lo    In  IP 127.0.0.1.36754 > 127.0.0.1.36481: Flags [P.], seq 509:510, ack 208, win 64, options [nop,nop,TS val 253966078 ecr 253966078], length 1
13:04:50.675216 lo    In  IP 127.0.0.1.36754 > 127.0.0.1.36481: Flags [P.], seq 510:521, ack 208, win 64, options [nop,nop,TS val 253966078 ecr 253966078], length 11
13:04:50.675218 lo    In  IP 127.0.0.1.36481 > 127.0.0.1.36754: Flags [.], ack 521, win 64, options [nop,nop,TS val 253966078 ecr 253966078], length 0
13:04:50.675247 lo    In  IP 127.0.0.1.36481 > 127.0.0.1.36754: Flags [P.], seq 208:210, ack 521, win 64, options [nop,nop,TS val 253966078 ecr 253966078], length 2
13:04:50.675251 lo    In  IP 127.0.0.1.36481 > 127.0.0.1.36754: Flags [P.], seq 210:212, ack 521, win 64, options [nop,nop,TS val 253966078 ecr 253966078], length 2
13:04:50.675253 lo    In  IP 127.0.0.1.36481 > 127.0.0.1.36754: Flags [P.], seq 212:216, ack 521, win 64, options [nop,nop,TS val 253966078 ecr 253966078], length 4
13:04:50.675255 lo    In  IP 127.0.0.1.36481 > 127.0.0.1.36754: Flags [P.], seq 216:220, ack 521, win 64, options [nop,nop,TS val 253966078 ecr 253966078], length 4
13:04:50.675256 lo    In  IP 127.0.0.1.36481 > 127.0.0.1.36754: Flags [P.], seq 220:228, ack 521, win 64, options [nop,nop,TS val 253966078 ecr 253966078], length 8
13:04:50.675730 lo    In  IP 127.0.0.1.36754 > 127.0.0.1.36481: Flags [.], ack 228, win 64, options [nop,nop,TS val 253966078 ecr 253966078], length 0
13:04:50.675737 eth0  Out IP 192.168.147.3.10250 > 192.168.147.4.45382: Flags [P.], seq 3792:3834, ack 3880, win 72, options [nop,nop,TS val 1886613396 ecr 1714721037], length 42
13:04:50.696117 lo    In  IP 127.0.0.1.36481 > 127.0.0.1.36754: Flags [P.], seq 228:232, ack 521, win 64, options [nop,nop,TS val 253966098 ecr 253966078], length 4
13:04:50.696130 lo    In  IP 127.0.0.1.36481 > 127.0.0.1.36754: Flags [P.], seq 232:236, ack 521, win 64, options [nop,nop,TS val 253966098 ecr 253966078], length 4
13:04:50.696143 lo    In  IP 127.0.0.1.36481 > 127.0.0.1.36754: Flags [P.], seq 236:310, ack 521, win 64, options [nop,nop,TS val 253966099 ecr 253966078], length 74
13:04:50.696159 lo    In  IP 127.0.0.1.36754 > 127.0.0.1.36481: Flags [.], ack 310, win 64, options [nop,nop,TS val 253966099 ecr 253966098], length 0
13:04:50.696187 eth0  Out IP 192.168.147.3.10250 > 192.168.147.4.45382: Flags [P.], seq 3834:3938, ack 3880, win 72, options [nop,nop,TS val 1886613417 ecr 1714721037], length 104
13:04:50.696245 eth0  In  IP 192.168.147.4.45382 > 192.168.147.3.10250: Flags [.], ack 3938, win 73, options [nop,nop,TS val 1714721058 ecr 1886613396], length 0
13:04:50.696270 lo    In  IP 127.0.0.1.36481 > 127.0.0.1.36754: Flags [P.], seq 310:314, ack 521, win 64, options [nop,nop,TS val 253966099 ecr 253966099], length 4
13:04:50.696272 lo    In  IP 127.0.0.1.36481 > 127.0.0.1.36754: Flags [P.], seq 314:318, ack 521, win 64, options [nop,nop,TS val 253966099 ecr 253966099], length 4
13:04:50.696302 lo    In  IP 127.0.0.1.36481 > 127.0.0.1.36754: Flags [P.], seq 318:322, ack 521, win 64, options [nop,nop,TS val 253966099 ecr 253966099], length 4
13:04:50.696309 lo    In  IP 127.0.0.1.36481 > 127.0.0.1.36754: Flags [P.], seq 322:326, ack 521, win 64, options [nop,nop,TS val 253966099 ecr 253966099], length 4
13:04:50.696381 lo    In  IP 127.0.0.1.36754 > 127.0.0.1.36481: Flags [.], ack 326, win 64, options [nop,nop,TS val 253966099 ecr 253966099], length 0
13:04:50.696392 eth0  Out IP 192.168.147.3.10250 > 192.168.147.4.45382: Flags [P.], seq 3938:3976, ack 3880, win 72, options [nop,nop,TS val 1886613417 ecr 1714721058], length 38
13:04:50.697616 lo    In  IP 127.0.0.1.36481 > 127.0.0.1.36754: Flags [P.], seq 326:330, ack 521, win 64, options [nop,nop,TS val 253966100 ecr 253966099], length 4
13:04:50.697622 lo    In  IP 127.0.0.1.36481 > 127.0.0.1.36754: Flags [P.], seq 330:334, ack 521, win 64, options [nop,nop,TS val 253966100 ecr 253966099], length 4
13:04:50.697624 lo    In  IP 127.0.0.1.36481 > 127.0.0.1.36754: Flags [P.], seq 334:368, ack 521, win 64, options [nop,nop,TS val 253966100 ecr 253966099], length 34
13:04:50.697631 lo    In  IP 127.0.0.1.36481 > 127.0.0.1.36754: Flags [P.], seq 368:370, ack 521, win 64, options [nop,nop,TS val 253966100 ecr 253966099], length 2
13:04:50.697633 lo    In  IP 127.0.0.1.36481 > 127.0.0.1.36754: Flags [P.], seq 370:372, ack 521, win 64, options [nop,nop,TS val 253966100 ecr 253966099], length 2
13:04:50.697634 lo    In  IP 127.0.0.1.36481 > 127.0.0.1.36754: Flags [P.], seq 372:376, ack 521, win 64, options [nop,nop,TS val 253966100 ecr 253966099], length 4
13:04:50.697636 lo    In  IP 127.0.0.1.36481 > 127.0.0.1.36754: Flags [P.], seq 376:380, ack 521, win 64, options [nop,nop,TS val 253966100 ecr 253966099], length 4
13:04:50.697637 lo    In  IP 127.0.0.1.36481 > 127.0.0.1.36754: Flags [P.], seq 380:384, ack 521, win 64, options [nop,nop,TS val 253966100 ecr 253966099], length 4
13:04:50.697647 lo    In  IP 127.0.0.1.36481 > 127.0.0.1.36754: Flags [P.], seq 384:386, ack 521, win 64, options [nop,nop,TS val 253966100 ecr 253966099], length 2
13:04:50.697648 lo    In  IP 127.0.0.1.36481 > 127.0.0.1.36754: Flags [P.], seq 386:388, ack 521, win 64, options [nop,nop,TS val 253966100 ecr 253966099], length 2
13:04:50.697702 lo    In  IP 127.0.0.1.36754 > 127.0.0.1.36481: Flags [.], ack 388, win 64, options [nop,nop,TS val 253966100 ecr 253966100], length 0
13:04:50.697705 lo    In  IP 127.0.0.1.36481 > 127.0.0.1.36754: Flags [FP.], seq 388:400, ack 521, win 64, options [nop,nop,TS val 253966100 ecr 253966100], length 12
13:04:50.697711 eth0  Out IP 192.168.147.3.10250 > 192.168.147.4.45382: Flags [P.], seq 3976:4060, ack 3880, win 72, options [nop,nop,TS val 1886613418 ecr 1714721058], length 84
13:04:50.697722 eth0  Out IP 192.168.147.3.10250 > 192.168.147.4.45382: Flags [P.], seq 4060:4094, ack 3880, win 72, options [nop,nop,TS val 1886613418 ecr 1714721058], length 34
13:04:50.697736 eth0  In  IP 192.168.147.4.45382 > 192.168.147.3.10250: Flags [.], ack 4094, win 73, options [nop,nop,TS val 1714721059 ecr 1886613417], length 0
13:04:50.697746 eth0  Out IP 192.168.147.3.10250 > 192.168.147.4.45382: Flags [P.], seq 4094:4118, ack 3880, win 72, options [nop,nop,TS val 1886613418 ecr 1714721059], length 24
13:04:50.697769 eth0  Out IP 192.168.147.3.10250 > 192.168.147.4.45382: Flags [F.], seq 4118, ack 3880, win 72, options [nop,nop,TS val 1886613418 ecr 1714721059], length 0
13:04:50.697792 eth0  In  IP 192.168.147.4.45382 > 192.168.147.3.10250: Flags [P.], seq 3880:3904, ack 4119, win 73, options [nop,nop,TS val 1714721059 ecr 1886613418], length 24
13:04:50.697808 lo    In  IP 127.0.0.1.36754 > 127.0.0.1.36481: Flags [F.], seq 521, ack 401, win 64, options [nop,nop,TS val 253966100 ecr 253966100], length 0
13:04:50.697812 eth0  Out IP 192.168.147.3.10250 > 192.168.147.4.45382: Flags [R], seq 3737650445, win 0, length 0
13:04:50.697814 lo    In  IP 127.0.0.1.36481 > 127.0.0.1.36754: Flags [.], ack 522, win 64, options [nop,nop,TS val 253966100 ecr 253966100], length 0
13:04:50.832727 eth0  In  IP 192.168.147.4.45388 > 192.168.147.3.10250: Flags [S], seq 117857937, win 64240, options [mss 1460,sackOK,TS val 1714721194 ecr 0,nop,wscale 10], length 0
13:04:50.832767 eth0  Out IP 192.168.147.3.10250 > 192.168.147.4.45388: Flags [S.], seq 1540401985, ack 117857938, win 65160, options [mss 1460,sackOK,TS val 1886613553 ecr 1714721194,nop,wscale 10], length 0
13:04:50.832776 eth0  In  IP 192.168.147.4.45388 > 192.168.147.3.10250: Flags [.], ack 1, win 63, options [nop,nop,TS val 1714721194 ecr 1886613553], length 0
13:04:50.833315 eth0  In  IP 192.168.147.4.45388 > 192.168.147.3.10250: Flags [P.], seq 1:1495, ack 1, win 63, options [nop,nop,TS val 1714721195 ecr 1886613553], length 1494
13:04:50.833324 eth0  Out IP 192.168.147.3.10250 > 192.168.147.4.45388: Flags [.], ack 1495, win 67, options [nop,nop,TS val 1886613554 ecr 1714721195], length 0
13:04:50.834572 eth0  Out IP 192.168.147.3.10250 > 192.168.147.4.45388: Flags [P.], seq 1:3431, ack 1495, win 67, options [nop,nop,TS val 1886613555 ecr 1714721195], length 3430
13:04:50.834584 eth0  In  IP 192.168.147.4.45388 > 192.168.147.3.10250: Flags [.], ack 3431, win 70, options [nop,nop,TS val 1714721196 ecr 1886613555], length 0
13:04:50.836093 eth0  In  IP 192.168.147.4.45388 > 192.168.147.3.10250: Flags [P.], seq 1495:2706, ack 3431, win 70, options [nop,nop,TS val 1714721197 ecr 1886613555], length 1211
13:04:50.836301 eth0  In  IP 192.168.147.4.45388 > 192.168.147.3.10250: Flags [P.], seq 2706:3250, ack 3431, win 70, options [nop,nop,TS val 1714721198 ecr 1886613555], length 544
13:04:50.836304 eth0  Out IP 192.168.147.3.10250 > 192.168.147.4.45388: Flags [.], ack 3250, win 72, options [nop,nop,TS val 1886613557 ecr 1714721197], length 0
13:04:50.837953 lo    In  IP 127.0.0.1.36760 > 127.0.0.1.36481: Flags [S], seq 3541455861, win 65495, options [mss 65495,sackOK,TS val 253966240 ecr 0,nop,wscale 10], length 0
13:04:50.837967 lo    In  IP 127.0.0.1.36481 > 127.0.0.1.36760: Flags [S.], seq 3278084795, ack 3541455862, win 65483, options [mss 65495,sackOK,TS val 253966240 ecr 253966240,nop,wscale 10], length 0
13:04:50.837974 lo    In  IP 127.0.0.1.36760 > 127.0.0.1.36481: Flags [.], ack 1, win 64, options [nop,nop,TS val 253966240 ecr 253966240], length 0
13:04:50.838071 lo    In  IP 127.0.0.1.36760 > 127.0.0.1.36481: Flags [P.], seq 1:410, ack 1, win 64, options [nop,nop,TS val 253966240 ecr 253966240], length 409
13:04:50.838075 lo    In  IP 127.0.0.1.36481 > 127.0.0.1.36760: Flags [.], ack 410, win 64, options [nop,nop,TS val 253966240 ecr 253966240], length 0
13:04:50.838176 lo    In  IP 127.0.0.1.36481 > 127.0.0.1.36760: Flags [P.], seq 1:160, ack 410, win 64, options [nop,nop,TS val 253966241 ecr 253966240], length 159
13:04:50.838180 lo    In  IP 127.0.0.1.36760 > 127.0.0.1.36481: Flags [.], ack 160, win 64, options [nop,nop,TS val 253966241 ecr 253966241], length 0
13:04:50.838227 eth0  Out IP 192.168.147.3.10250 > 192.168.147.4.45388: Flags [P.], seq 3431:3612, ack 3250, win 72, options [nop,nop,TS val 1886613559 ecr 1714721197], length 181
13:04:50.838700 eth0  In  IP 192.168.147.4.45388 > 192.168.147.3.10250: Flags [P.], seq 3250:3274, ack 3612, win 73, options [nop,nop,TS val 1714721200 ecr 1886613559], length 24
13:04:50.838738 lo    In  IP 127.0.0.1.36760 > 127.0.0.1.36481: Flags [P.], seq 410:412, ack 160, win 64, options [nop,nop,TS val 253966241 ecr 253966241], length 2
13:04:50.838749 eth0  In  IP 192.168.147.4.45388 > 192.168.147.3.10250: Flags [P.], seq 3274:3298, ack 3612, win 73, options [nop,nop,TS val 1714721200 ecr 1886613559], length 24
13:04:50.838753 eth0  Out IP 192.168.147.3.10250 > 192.168.147.4.45388: Flags [.], ack 3298, win 72, options [nop,nop,TS val 1886613559 ecr 1714721200], length 0
13:04:50.838758 lo    In  IP 127.0.0.1.36760 > 127.0.0.1.36481: Flags [P.], seq 412:414, ack 160, win 64, options [nop,nop,TS val 253966241 ecr 253966241], length 2
13:04:50.838776 lo    In  IP 127.0.0.1.36481 > 127.0.0.1.36760: Flags [.], ack 414, win 64, options [nop,nop,TS val 253966241 ecr 253966241], length 0
13:04:50.838781 eth0  In  IP 192.168.147.4.45388 > 192.168.147.3.10250: Flags [P.], seq 3298:3324, ack 3612, win 73, options [nop,nop,TS val 1714721200 ecr 1886613559], length 26
13:04:50.838789 lo    In  IP 127.0.0.1.36760 > 127.0.0.1.36481: Flags [P.], seq 414:418, ack 160, win 64, options [nop,nop,TS val 253966241 ecr 253966241], length 4
13:04:50.838800 eth0  In  IP 192.168.147.4.45388 > 192.168.147.3.10250: Flags [P.], seq 3324:3350, ack 3612, win 73, options [nop,nop,TS val 1714721200 ecr 1886613559], length 26
13:04:50.838803 eth0  Out IP 192.168.147.3.10250 > 192.168.147.4.45388: Flags [.], ack 3350, win 72, options [nop,nop,TS val 1886613559 ecr 1714721200], length 0
13:04:50.838807 lo    In  IP 127.0.0.1.36760 > 127.0.0.1.36481: Flags [P.], seq 418:422, ack 160, win 64, options [nop,nop,TS val 253966241 ecr 253966241], length 4
13:04:50.838811 lo    In  IP 127.0.0.1.36481 > 127.0.0.1.36760: Flags [.], ack 422, win 64, options [nop,nop,TS val 253966241 ecr 253966241], length 0
13:04:50.838812 eth0  In  IP 192.168.147.4.45388 > 192.168.147.3.10250: Flags [P.], seq 3350:3376, ack 3612, win 73, options [nop,nop,TS val 1714721200 ecr 1886613559], length 26
13:04:50.838816 lo    In  IP 127.0.0.1.36760 > 127.0.0.1.36481: Flags [P.], seq 422:426, ack 160, win 64, options [nop,nop,TS val 253966241 ecr 253966241], length 4
13:04:50.838823 eth0  In  IP 192.168.147.4.45388 > 192.168.147.3.10250: Flags [P.], seq 3376:3399, ack 3612, win 73, options [nop,nop,TS val 1714721200 ecr 1886613559], length 23
13:04:50.838825 eth0  Out IP 192.168.147.3.10250 > 192.168.147.4.45388: Flags [.], ack 3399, win 72, options [nop,nop,TS val 1886613559 ecr 1714721200], length 0
13:04:50.838828 lo    In  IP 127.0.0.1.36760 > 127.0.0.1.36481: Flags [P.], seq 426:427, ack 160, win 64, options [nop,nop,TS val 253966241 ecr 253966241], length 1
13:04:50.838835 eth0  In  IP 192.168.147.4.45388 > 192.168.147.3.10250: Flags [P.], seq 3399:3422, ack 3612, win 73, options [nop,nop,TS val 1714721200 ecr 1886613559], length 23
13:04:50.838842 lo    In  IP 127.0.0.1.36760 > 127.0.0.1.36481: Flags [P.], seq 427:428, ack 160, win 64, options [nop,nop,TS val 253966241 ecr 253966241], length 1
13:04:50.838843 lo    In  IP 127.0.0.1.36481 > 127.0.0.1.36760: Flags [.], ack 427, win 64, options [nop,nop,TS val 253966241 ecr 253966241], length 0
13:04:50.838848 eth0  In  IP 192.168.147.4.45388 > 192.168.147.3.10250: Flags [P.], seq 3422:3475, ack 3612, win 73, options [nop,nop,TS val 1714721200 ecr 1886613559], length 53
13:04:50.838850 eth0  Out IP 192.168.147.3.10250 > 192.168.147.4.45388: Flags [.], ack 3475, win 72, options [nop,nop,TS val 1886613559 ecr 1714721200], length 0
13:04:50.838853 lo    In  IP 127.0.0.1.36760 > 127.0.0.1.36481: Flags [P.], seq 428:459, ack 160, win 64, options [nop,nop,TS val 253966241 ecr 253966241], length 31
13:04:50.838856 lo    In  IP 127.0.0.1.36481 > 127.0.0.1.36760: Flags [.], ack 459, win 64, options [nop,nop,TS val 253966241 ecr 253966241], length 0
13:04:50.839187 lo    In  IP 127.0.0.1.36481 > 127.0.0.1.36760: Flags [P.], seq 160:162, ack 459, win 64, options [nop,nop,TS val 253966242 ecr 253966241], length 2
13:04:50.839192 lo    In  IP 127.0.0.1.36481 > 127.0.0.1.36760: Flags [P.], seq 162:164, ack 459, win 64, options [nop,nop,TS val 253966242 ecr 253966241], length 2
13:04:50.839193 lo    In  IP 127.0.0.1.36481 > 127.0.0.1.36760: Flags [P.], seq 164:168, ack 459, win 64, options [nop,nop,TS val 253966242 ecr 253966241], length 4
13:04:50.839195 lo    In  IP 127.0.0.1.36481 > 127.0.0.1.36760: Flags [P.], seq 168:172, ack 459, win 64, options [nop,nop,TS val 253966242 ecr 253966241], length 4
13:04:50.839196 lo    In  IP 127.0.0.1.36481 > 127.0.0.1.36760: Flags [P.], seq 172:188, ack 459, win 64, options [nop,nop,TS val 253966242 ecr 253966241], length 16
13:04:50.839201 lo    In  IP 127.0.0.1.36760 > 127.0.0.1.36481: Flags [.], ack 188, win 64, options [nop,nop,TS val 253966242 ecr 253966242], length 0
13:04:50.839205 eth0  Out IP 192.168.147.3.10250 > 192.168.147.4.45388: Flags [P.], seq 3612:3662, ack 3475, win 72, options [nop,nop,TS val 1886613560 ecr 1714721200], length 50
13:04:50.839289 eth0  In  IP 192.168.147.4.45388 > 192.168.147.3.10250: Flags [P.], seq 3475:3499, ack 3662, win 73, options [nop,nop,TS val 1714721201 ecr 1886613560], length 24
13:04:50.839296 eth0  In  IP 192.168.147.4.45388 > 192.168.147.3.10250: Flags [P.], seq 3499:3523, ack 3662, win 73, options [nop,nop,TS val 1714721201 ecr 1886613560], length 24
13:04:50.839298 eth0  In  IP 192.168.147.4.45388 > 192.168.147.3.10250: Flags [P.], seq 3523:3549, ack 3662, win 73, options [nop,nop,TS val 1714721201 ecr 1886613560], length 26
13:04:50.839300 eth0  In  IP 192.168.147.4.45388 > 192.168.147.3.10250: Flags [P.], seq 3549:3575, ack 3662, win 73, options [nop,nop,TS val 1714721201 ecr 1886613560], length 26
13:04:50.839301 eth0  Out IP 192.168.147.3.10250 > 192.168.147.4.45388: Flags [.], ack 3549, win 72, options [nop,nop,TS val 1886613560 ecr 1714721201], length 0
13:04:50.839302 eth0  In  IP 192.168.147.4.45388 > 192.168.147.3.10250: Flags [P.], seq 3575:3601, ack 3662, win 73, options [nop,nop,TS val 1714721201 ecr 1886613560], length 26
13:04:50.839305 eth0  In  IP 192.168.147.4.45388 > 192.168.147.3.10250: Flags [P.], seq 3601:3624, ack 3662, win 73, options [nop,nop,TS val 1714721201 ecr 1886613560], length 23
13:04:50.839308 lo    In  IP 127.0.0.1.36760 > 127.0.0.1.36481: Flags [P.], seq 459:461, ack 188, win 64, options [nop,nop,TS val 253966242 ecr 253966242], length 2
13:04:50.839308 eth0  In  IP 192.168.147.4.45388 > 192.168.147.3.10250: Flags [P.], seq 3624:3647, ack 3662, win 73, options [nop,nop,TS val 1714721201 ecr 1886613560], length 23
13:04:50.839310 eth0  In  IP 192.168.147.4.45388 > 192.168.147.3.10250: Flags [P.], seq 3647:3684, ack 3662, win 73, options [nop,nop,TS val 1714721201 ecr 1886613560], length 37
13:04:50.839312 lo    In  IP 127.0.0.1.36760 > 127.0.0.1.36481: Flags [P.], seq 461:463, ack 188, win 64, options [nop,nop,TS val 253966242 ecr 253966242], length 2
13:04:50.839314 lo    In  IP 127.0.0.1.36760 > 127.0.0.1.36481: Flags [P.], seq 463:467, ack 188, win 64, options [nop,nop,TS val 253966242 ecr 253966242], length 4
13:04:50.839316 eth0  Out IP 192.168.147.3.10250 > 192.168.147.4.45388: Flags [.], ack 3684, win 72, options [nop,nop,TS val 1886613560 ecr 1714721201], length 0
13:04:50.839319 lo    In  IP 127.0.0.1.36760 > 127.0.0.1.36481: Flags [P.], seq 467:471, ack 188, win 64, options [nop,nop,TS val 253966242 ecr 253966242], length 4
13:04:50.839321 lo    In  IP 127.0.0.1.36760 > 127.0.0.1.36481: Flags [P.], seq 471:475, ack 188, win 64, options [nop,nop,TS val 253966242 ecr 253966242], length 4
13:04:50.839322 lo    In  IP 127.0.0.1.36760 > 127.0.0.1.36481: Flags [P.], seq 475:476, ack 188, win 64, options [nop,nop,TS val 253966242 ecr 253966242], length 1
13:04:50.839324 lo    In  IP 127.0.0.1.36760 > 127.0.0.1.36481: Flags [P.], seq 476:477, ack 188, win 64, options [nop,nop,TS val 253966242 ecr 253966242], length 1
13:04:50.839325 lo    In  IP 127.0.0.1.36760 > 127.0.0.1.36481: Flags [P.], seq 477:492, ack 188, win 64, options [nop,nop,TS val 253966242 ecr 253966242], length 15
13:04:50.839331 lo    In  IP 127.0.0.1.36481 > 127.0.0.1.36760: Flags [.], ack 492, win 64, options [nop,nop,TS val 253966242 ecr 253966242], length 0
13:04:50.839351 lo    In  IP 127.0.0.1.36481 > 127.0.0.1.36760: Flags [P.], seq 188:190, ack 492, win 64, options [nop,nop,TS val 253966242 ecr 253966242], length 2
13:04:50.839355 eth0  Out IP 192.168.147.3.10250 > 192.168.147.4.45388: Flags [P.], seq 3662:3686, ack 3684, win 72, options [nop,nop,TS val 1886613560 ecr 1714721201], length 24
13:04:50.839379 lo    In  IP 127.0.0.1.36481 > 127.0.0.1.36760: Flags [P.], seq 190:192, ack 492, win 64, options [nop,nop,TS val 253966242 ecr 253966242], length 2
13:04:50.839381 lo    In  IP 127.0.0.1.36481 > 127.0.0.1.36760: Flags [P.], seq 192:196, ack 492, win 64, options [nop,nop,TS val 253966242 ecr 253966242], length 4
13:04:50.839383 lo    In  IP 127.0.0.1.36481 > 127.0.0.1.36760: Flags [P.], seq 196:200, ack 492, win 64, options [nop,nop,TS val 253966242 ecr 253966242], length 4
13:04:50.839384 lo    In  IP 127.0.0.1.36481 > 127.0.0.1.36760: Flags [P.], seq 200:208, ack 492, win 64, options [nop,nop,TS val 253966242 ecr 253966242], length 8
13:04:50.839389 lo    In  IP 127.0.0.1.36760 > 127.0.0.1.36481: Flags [.], ack 208, win 64, options [nop,nop,TS val 253966242 ecr 253966242], length 0
13:04:50.839395 eth0  Out IP 192.168.147.3.10250 > 192.168.147.4.45388: Flags [P.], seq 3686:3726, ack 3684, win 72, options [nop,nop,TS val 1886613560 ecr 1714721201], length 40
13:04:50.839408 eth0  In  IP 192.168.147.4.45388 > 192.168.147.3.10250: Flags [.], ack 3726, win 73, options [nop,nop,TS val 1714721201 ecr 1886613560], length 0
13:04:50.839454 eth0  In  IP 192.168.147.4.45388 > 192.168.147.3.10250: Flags [P.], seq 3684:3708, ack 3726, win 73, options [nop,nop,TS val 1714721201 ecr 1886613560], length 24
13:04:50.839466 eth0  In  IP 192.168.147.4.45388 > 192.168.147.3.10250: Flags [P.], seq 3708:3732, ack 3726, win 73, options [nop,nop,TS val 1714721201 ecr 1886613560], length 24
13:04:50.839469 eth0  In  IP 192.168.147.4.45388 > 192.168.147.3.10250: Flags [P.], seq 3732:3758, ack 3726, win 73, options [nop,nop,TS val 1714721201 ecr 1886613560], length 26
13:04:50.839472 eth0  In  IP 192.168.147.4.45388 > 192.168.147.3.10250: Flags [P.], seq 3758:3784, ack 3726, win 73, options [nop,nop,TS val 1714721201 ecr 1886613560], length 26
13:04:50.839474 eth0  In  IP 192.168.147.4.45388 > 192.168.147.3.10250: Flags [P.], seq 3784:3810, ack 3726, win 73, options [nop,nop,TS val 1714721201 ecr 1886613560], length 26
13:04:50.839476 eth0  In  IP 192.168.147.4.45388 > 192.168.147.3.10250: Flags [P.], seq 3810:3833, ack 3726, win 73, options [nop,nop,TS val 1714721201 ecr 1886613560], length 23
13:04:50.839478 eth0  In  IP 192.168.147.4.45388 > 192.168.147.3.10250: Flags [P.], seq 3833:3856, ack 3726, win 73, options [nop,nop,TS val 1714721201 ecr 1886613560], length 23
13:04:50.839480 eth0  In  IP 192.168.147.4.45388 > 192.168.147.3.10250: Flags [P.], seq 3856:3889, ack 3726, win 73, options [nop,nop,TS val 1714721201 ecr 1886613560], length 33
13:04:50.839495 eth0  Out IP 192.168.147.3.10250 > 192.168.147.4.45388: Flags [.], ack 3889, win 72, options [nop,nop,TS val 1886613560 ecr 1714721201], length 0
13:04:50.839501 lo    In  IP 127.0.0.1.36760 > 127.0.0.1.36481: Flags [P.], seq 492:494, ack 208, win 64, options [nop,nop,TS val 253966242 ecr 253966242], length 2
13:04:50.839509 lo    In  IP 127.0.0.1.36760 > 127.0.0.1.36481: Flags [P.], seq 494:496, ack 208, win 64, options [nop,nop,TS val 253966242 ecr 253966242], length 2
13:04:50.839511 lo    In  IP 127.0.0.1.36760 > 127.0.0.1.36481: Flags [P.], seq 496:500, ack 208, win 64, options [nop,nop,TS val 253966242 ecr 253966242], length 4
13:04:50.839512 lo    In  IP 127.0.0.1.36760 > 127.0.0.1.36481: Flags [P.], seq 500:504, ack 208, win 64, options [nop,nop,TS val 253966242 ecr 253966242], length 4
13:04:50.839514 lo    In  IP 127.0.0.1.36760 > 127.0.0.1.36481: Flags [P.], seq 504:508, ack 208, win 64, options [nop,nop,TS val 253966242 ecr 253966242], length 4
13:04:50.839515 lo    In  IP 127.0.0.1.36760 > 127.0.0.1.36481: Flags [P.], seq 508:509, ack 208, win 64, options [nop,nop,TS val 253966242 ecr 253966242], length 1
13:04:50.839517 lo    In  IP 127.0.0.1.36760 > 127.0.0.1.36481: Flags [P.], seq 509:510, ack 208, win 64, options [nop,nop,TS val 253966242 ecr 253966242], length 1
13:04:50.839519 lo    In  IP 127.0.0.1.36760 > 127.0.0.1.36481: Flags [P.], seq 510:521, ack 208, win 64, options [nop,nop,TS val 253966242 ecr 253966242], length 11
13:04:50.839525 lo    In  IP 127.0.0.1.36481 > 127.0.0.1.36760: Flags [.], ack 521, win 64, options [nop,nop,TS val 253966242 ecr 253966242], length 0
13:04:50.839541 lo    In  IP 127.0.0.1.36481 > 127.0.0.1.36760: Flags [P.], seq 208:210, ack 521, win 64, options [nop,nop,TS val 253966242 ecr 253966242], length 2
13:04:50.839544 lo    In  IP 127.0.0.1.36481 > 127.0.0.1.36760: Flags [P.], seq 210:212, ack 521, win 64, options [nop,nop,TS val 253966242 ecr 253966242], length 2
13:04:50.839546 lo    In  IP 127.0.0.1.36481 > 127.0.0.1.36760: Flags [P.], seq 212:216, ack 521, win 64, options [nop,nop,TS val 253966242 ecr 253966242], length 4
13:04:50.839551 lo    In  IP 127.0.0.1.36481 > 127.0.0.1.36760: Flags [P.], seq 216:220, ack 521, win 64, options [nop,nop,TS val 253966242 ecr 253966242], length 4
13:04:50.839552 lo    In  IP 127.0.0.1.36481 > 127.0.0.1.36760: Flags [P.], seq 220:228, ack 521, win 64, options [nop,nop,TS val 253966242 ecr 253966242], length 8
13:04:50.839593 lo    In  IP 127.0.0.1.36760 > 127.0.0.1.36481: Flags [.], ack 228, win 64, options [nop,nop,TS val 253966242 ecr 253966242], length 0
13:04:50.839596 eth0  Out IP 192.168.147.3.10250 > 192.168.147.4.45388: Flags [P.], seq 3726:3768, ack 3889, win 72, options [nop,nop,TS val 1886613560 ecr 1714721201], length 42
13:04:50.846662 eth0  Out IP6 fe80::90b4:dcff:fe7e:2b3b > fe80::c822:8fff:fea8:da7f: ICMP6, neighbor solicitation, who has fe80::c822:8fff:fea8:da7f, length 32
13:04:50.846871 eth0  In  IP6 fe80::c822:8fff:fea8:da7f > fe80::90b4:dcff:fe7e:2b3b: ICMP6, neighbor advertisement, tgt is fe80::c822:8fff:fea8:da7f, length 24
13:04:50.852614 lo    In  IP 127.0.0.1.36481 > 127.0.0.1.36760: Flags [P.], seq 228:232, ack 521, win 64, options [nop,nop,TS val 253966255 ecr 253966242], length 4
13:04:50.852628 lo    In  IP 127.0.0.1.36481 > 127.0.0.1.36760: Flags [P.], seq 232:236, ack 521, win 64, options [nop,nop,TS val 253966255 ecr 253966242], length 4
13:04:50.852630 lo    In  IP 127.0.0.1.36481 > 127.0.0.1.36760: Flags [P.], seq 236:268, ack 521, win 64, options [nop,nop,TS val 253966255 ecr 253966242], length 32
13:04:50.852648 lo    In  IP 127.0.0.1.36760 > 127.0.0.1.36481: Flags [.], ack 268, win 64, options [nop,nop,TS val 253966255 ecr 253966255], length 0
13:04:50.852665 eth0  Out IP 192.168.147.3.10250 > 192.168.147.4.45388: Flags [P.], seq 3768:3830, ack 3889, win 72, options [nop,nop,TS val 1886613573 ecr 1714721201], length 62
13:04:50.852706 eth0  In  IP 192.168.147.4.45388 > 192.168.147.3.10250: Flags [.], ack 3830, win 73, options [nop,nop,TS val 1714721214 ecr 1886613560], length 0
13:04:50.852761 lo    In  IP 127.0.0.1.36481 > 127.0.0.1.36760: Flags [P.], seq 268:272, ack 521, win 64, options [nop,nop,TS val 253966255 ecr 253966255], length 4
13:04:50.852763 lo    In  IP 127.0.0.1.36481 > 127.0.0.1.36760: Flags [P.], seq 272:276, ack 521, win 64, options [nop,nop,TS val 253966255 ecr 253966255], length 4
13:04:50.852767 lo    In  IP 127.0.0.1.36481 > 127.0.0.1.36760: Flags [P.], seq 276:280, ack 521, win 64, options [nop,nop,TS val 253966255 ecr 253966255], length 4
13:04:50.852769 lo    In  IP 127.0.0.1.36481 > 127.0.0.1.36760: Flags [P.], seq 280:284, ack 521, win 64, options [nop,nop,TS val 253966255 ecr 253966255], length 4
13:04:50.853029 lo    In  IP 127.0.0.1.36760 > 127.0.0.1.36481: Flags [.], ack 284, win 64, options [nop,nop,TS val 253966255 ecr 253966255], length 0
13:04:50.853034 eth0  Out IP 192.168.147.3.10250 > 192.168.147.4.45388: Flags [P.], seq 3830:3868, ack 3889, win 72, options [nop,nop,TS val 1886613573 ecr 1714721214], length 38
13:04:50.854059 lo    In  IP 127.0.0.1.36481 > 127.0.0.1.36760: Flags [P.], seq 284:288, ack 521, win 64, options [nop,nop,TS val 253966256 ecr 253966255], length 4
13:04:50.854065 lo    In  IP 127.0.0.1.36481 > 127.0.0.1.36760: Flags [P.], seq 288:292, ack 521, win 64, options [nop,nop,TS val 253966256 ecr 253966255], length 4
13:04:50.854067 lo    In  IP 127.0.0.1.36481 > 127.0.0.1.36760: Flags [P.], seq 292:326, ack 521, win 64, options [nop,nop,TS val 253966256 ecr 253966255], length 34
13:04:50.854079 lo    In  IP 127.0.0.1.36760 > 127.0.0.1.36481: Flags [.], ack 326, win 64, options [nop,nop,TS val 253966256 ecr 253966256], length 0
13:04:50.854085 eth0  Out IP 192.168.147.3.10250 > 192.168.147.4.45388: Flags [P.], seq 3868:3932, ack 3889, win 72, options [nop,nop,TS val 1886613574 ecr 1714721214], length 64
13:04:50.854110 eth0  In  IP 192.168.147.4.45388 > 192.168.147.3.10250: Flags [.], ack 3932, win 73, options [nop,nop,TS val 1714721215 ecr 1886613573], length 0
13:04:50.854110 lo    In  IP 127.0.0.1.36481 > 127.0.0.1.36760: Flags [P.], seq 326:328, ack 521, win 64, options [nop,nop,TS val 253966256 ecr 253966256], length 2
13:04:50.854113 lo    In  IP 127.0.0.1.36481 > 127.0.0.1.36760: Flags [P.], seq 328:330, ack 521, win 64, options [nop,nop,TS val 253966256 ecr 253966256], length 2
13:04:50.854114 lo    In  IP 127.0.0.1.36481 > 127.0.0.1.36760: Flags [P.], seq 330:334, ack 521, win 64, options [nop,nop,TS val 253966256 ecr 253966256], length 4
13:04:50.854116 lo    In  IP 127.0.0.1.36481 > 127.0.0.1.36760: Flags [P.], seq 334:338, ack 521, win 64, options [nop,nop,TS val 253966256 ecr 253966256], length 4
13:04:50.854117 lo    In  IP 127.0.0.1.36481 > 127.0.0.1.36760: Flags [P.], seq 338:342, ack 521, win 64, options [nop,nop,TS val 253966256 ecr 253966256], length 4
13:04:50.854119 lo    In  IP 127.0.0.1.36481 > 127.0.0.1.36760: Flags [P.], seq 342:344, ack 521, win 64, options [nop,nop,TS val 253966256 ecr 253966256], length 2
13:04:50.854121 lo    In  IP 127.0.0.1.36481 > 127.0.0.1.36760: Flags [P.], seq 344:346, ack 521, win 64, options [nop,nop,TS val 253966256 ecr 253966256], length 2
13:04:50.854122 lo    In  IP 127.0.0.1.36481 > 127.0.0.1.36760: Flags [P.], seq 346:350, ack 521, win 64, options [nop,nop,TS val 253966256 ecr 253966256], length 4
13:04:50.854123 lo    In  IP 127.0.0.1.36481 > 127.0.0.1.36760: Flags [P.], seq 350:354, ack 521, win 64, options [nop,nop,TS val 253966256 ecr 253966256], length 4
13:04:50.854125 lo    In  IP 127.0.0.1.36481 > 127.0.0.1.36760: Flags [P.], seq 354:358, ack 521, win 64, options [nop,nop,TS val 253966256 ecr 253966256], length 4
13:04:50.854142 lo    In  IP 127.0.0.1.36760 > 127.0.0.1.36481: Flags [.], ack 358, win 64, options [nop,nop,TS val 253966257 ecr 253966256], length 0
13:04:50.854145 eth0  Out IP 192.168.147.3.10250 > 192.168.147.4.45388: Flags [P.], seq 3932:3986, ack 3889, win 72, options [nop,nop,TS val 1886613575 ecr 1714721215], length 54
13:04:50.854167 lo    In  IP 127.0.0.1.36481 > 127.0.0.1.36760: Flags [F.], seq 358, ack 521, win 64, options [nop,nop,TS val 253966257 ecr 253966257], length 0
13:04:50.854206 eth0  Out IP 192.168.147.3.10250 > 192.168.147.4.45388: Flags [P.], seq 3986:4010, ack 3889, win 72, options [nop,nop,TS val 1886613575 ecr 1714721215], length 24
13:04:50.854278 eth0  Out IP 192.168.147.3.10250 > 192.168.147.4.45388: Flags [F.], seq 4010, ack 3889, win 72, options [nop,nop,TS val 1886613575 ecr 1714721215], length 0
13:04:50.854282 eth0  In  IP 192.168.147.4.45388 > 192.168.147.3.10250: Flags [P.], seq 3889:3913, ack 4010, win 73, options [nop,nop,TS val 1714721216 ecr 1886613575], length 24
13:04:50.854297 eth0  In  IP 192.168.147.4.45388 > 192.168.147.3.10250: Flags [R.], seq 3913, ack 4010, win 73, options [nop,nop,TS val 1714721216 ecr 1886613575], length 0
13:04:50.854341 eth0  In  IP 192.168.147.4.45388 > 192.168.147.3.10250: Flags [R], seq 117861826, win 0, length 0
13:04:50.854360 eth0  Out IP 192.168.147.3.10250 > 192.168.147.4.45388: Flags [R], seq 1540405995, win 0, length 0
13:04:50.854490 lo    In  IP 127.0.0.1.36760 > 127.0.0.1.36481: Flags [F.], seq 521, ack 359, win 64, options [nop,nop,TS val 253966257 ecr 253966257], length 0
13:04:50.854506 lo    In  IP 127.0.0.1.36481 > 127.0.0.1.36760: Flags [.], ack 522, win 64, options [nop,nop,TS val 253966257 ecr 253966257], length 0
13:04:50.880690 eth0  Out IP 192.168.147.3.10351 > 192.168.147.2.10351: UDP, length 100
13:04:50.880977 eth0  In  IP 192.168.147.2.10351 > 192.168.147.3.10351: UDP, length 18
13:04:50.917344 eth0  In  IP 192.168.147.4.45392 > 192.168.147.3.10250: Flags [S], seq 2046679394, win 64240, options [mss 1460,sackOK,TS val 1714721279 ecr 0,nop,wscale 10], length 0
13:04:50.917378 eth0  Out IP 192.168.147.3.10250 > 192.168.147.4.45392: Flags [S.], seq 1563670802, ack 2046679395, win 65160, options [mss 1460,sackOK,TS val 1886613638 ecr 1714721279,nop,wscale 10], length 0
13:04:50.917385 eth0  In  IP 192.168.147.4.45392 > 192.168.147.3.10250: Flags [.], ack 1, win 63, options [nop,nop,TS val 1714721279 ecr 1886613638], length 0
13:04:50.917595 eth0  In  IP 192.168.147.4.45392 > 192.168.147.3.10250: Flags [P.], seq 1:1495, ack 1, win 63, options [nop,nop,TS val 1714721279 ecr 1886613638], length 1494
13:04:50.917631 eth0  Out IP 192.168.147.3.10250 > 192.168.147.4.45392: Flags [.], ack 1495, win 67, options [nop,nop,TS val 1886613638 ecr 1714721279], length 0
13:04:50.918776 eth0  Out IP 192.168.147.3.10250 > 192.168.147.4.45392: Flags [P.], seq 1:3431, ack 1495, win 67, options [nop,nop,TS val 1886613639 ecr 1714721279], length 3430
13:04:50.918789 eth0  In  IP 192.168.147.4.45392 > 192.168.147.3.10250: Flags [.], ack 3431, win 70, options [nop,nop,TS val 1714721280 ecr 1886613639], length 0
13:04:50.919870 eth0  In  IP 192.168.147.4.45392 > 192.168.147.3.10250: Flags [P.], seq 1495:2706, ack 3431, win 70, options [nop,nop,TS val 1714721281 ecr 1886613639], length 1211
13:04:50.919990 eth0  In  IP 192.168.147.4.45392 > 192.168.147.3.10250: Flags [P.], seq 2706:3239, ack 3431, win 70, options [nop,nop,TS val 1714721281 ecr 1886613639], length 533
13:04:50.919994 eth0  Out IP 192.168.147.3.10250 > 192.168.147.4.45392: Flags [.], ack 3239, win 72, options [nop,nop,TS val 1886613640 ecr 1714721281], length 0
13:04:50.920848 lo    In  IP 127.0.0.1.36764 > 127.0.0.1.36481: Flags [S], seq 4275335678, win 65495, options [mss 65495,sackOK,TS val 253966323 ecr 0,nop,wscale 10], length 0
13:04:50.920854 lo    In  IP 127.0.0.1.36481 > 127.0.0.1.36764: Flags [S.], seq 1278914321, ack 4275335679, win 65483, options [mss 65495,sackOK,TS val 253966323 ecr 253966323,nop,wscale 10], length 0
13:04:50.920857 lo    In  IP 127.0.0.1.36764 > 127.0.0.1.36481: Flags [.], ack 1, win 64, options [nop,nop,TS val 253966323 ecr 253966323], length 0
13:04:50.920904 lo    In  IP 127.0.0.1.36764 > 127.0.0.1.36481: Flags [P.], seq 1:410, ack 1, win 64, options [nop,nop,TS val 253966323 ecr 253966323], length 409
13:04:50.920906 lo    In  IP 127.0.0.1.36481 > 127.0.0.1.36764: Flags [.], ack 410, win 64, options [nop,nop,TS val 253966323 ecr 253966323], length 0
13:04:50.921033 lo    In  IP 127.0.0.1.36481 > 127.0.0.1.36764: Flags [P.], seq 1:160, ack 410, win 64, options [nop,nop,TS val 253966323 ecr 253966323], length 159
13:04:50.921035 lo    In  IP 127.0.0.1.36764 > 127.0.0.1.36481: Flags [.], ack 160, win 64, options [nop,nop,TS val 253966323 ecr 253966323], length 0
13:04:50.921125 eth0  Out IP 192.168.147.3.10250 > 192.168.147.4.45392: Flags [P.], seq 3431:3612, ack 3239, win 72, options [nop,nop,TS val 1886613641 ecr 1714721281], length 181
13:04:50.921397 eth0  In  IP 192.168.147.4.45392 > 192.168.147.3.10250: Flags [P.], seq 3239:3263, ack 3612, win 73, options [nop,nop,TS val 1714721283 ecr 1886613641], length 24
13:04:50.921440 lo    In  IP 127.0.0.1.36764 > 127.0.0.1.36481: Flags [P.], seq 410:412, ack 160, win 64, options [nop,nop,TS val 253966324 ecr 253966323], length 2
13:04:50.921458 eth0  In  IP 192.168.147.4.45392 > 192.168.147.3.10250: Flags [P.], seq 3263:3287, ack 3612, win 73, options [nop,nop,TS val 1714721283 ecr 1886613641], length 24
13:04:50.921462 eth0  Out IP 192.168.147.3.10250 > 192.168.147.4.45392: Flags [.], ack 3287, win 72, options [nop,nop,TS val 1886613642 ecr 1714721283], length 0
13:04:50.921466 lo    In  IP 127.0.0.1.36764 > 127.0.0.1.36481: Flags [P.], seq 412:414, ack 160, win 64, options [nop,nop,TS val 253966324 ecr 253966323], length 2
13:04:50.921469 lo    In  IP 127.0.0.1.36481 > 127.0.0.1.36764: Flags [.], ack 414, win 64, options [nop,nop,TS val 253966324 ecr 253966324], length 0
13:04:50.921478 eth0  In  IP 192.168.147.4.45392 > 192.168.147.3.10250: Flags [P.], seq 3287:3313, ack 3612, win 73, options [nop,nop,TS val 1714721283 ecr 1886613642], length 26
13:04:50.921482 lo    In  IP 127.0.0.1.36764 > 127.0.0.1.36481: Flags [P.], seq 414:418, ack 160, win 64, options [nop,nop,TS val 253966324 ecr 253966324], length 4
13:04:50.921492 eth0  In  IP 192.168.147.4.45392 > 192.168.147.3.10250: Flags [P.], seq 3313:3339, ack 3612, win 73, options [nop,nop,TS val 1714721283 ecr 1886613642], length 26
13:04:50.921495 eth0  Out IP 192.168.147.3.10250 > 192.168.147.4.45392: Flags [.], ack 3339, win 72, options [nop,nop,TS val 1886613642 ecr 1714721283], length 0
13:04:50.921497 lo    In  IP 127.0.0.1.36764 > 127.0.0.1.36481: Flags [P.], seq 418:422, ack 160, win 64, options [nop,nop,TS val 253966324 ecr 253966324], length 4
13:04:50.921500 lo    In  IP 127.0.0.1.36481 > 127.0.0.1.36764: Flags [.], ack 422, win 64, options [nop,nop,TS val 253966324 ecr 253966324], length 0
13:04:50.921507 eth0  In  IP 192.168.147.4.45392 > 192.168.147.3.10250: Flags [P.], seq 3339:3365, ack 3612, win 73, options [nop,nop,TS val 1714721283 ecr 1886613642], length 26
13:04:50.921510 lo    In  IP 127.0.0.1.36764 > 127.0.0.1.36481: Flags [P.], seq 422:426, ack 160, win 64, options [nop,nop,TS val 253966324 ecr 253966324], length 4
13:04:50.921518 eth0  In  IP 192.168.147.4.45392 > 192.168.147.3.10250: Flags [P.], seq 3365:3388, ack 3612, win 73, options [nop,nop,TS val 1714721283 ecr 1886613642], length 23
13:04:50.921520 eth0  Out IP 192.168.147.3.10250 > 192.168.147.4.45392: Flags [.], ack 3388, win 72, options [nop,nop,TS val 1886613642 ecr 1714721283], length 0
13:04:50.921523 lo    In  IP 127.0.0.1.36764 > 127.0.0.1.36481: Flags [P.], seq 426:427, ack 160, win 64, options [nop,nop,TS val 253966324 ecr 253966324], length 1
13:04:50.921525 lo    In  IP 127.0.0.1.36481 > 127.0.0.1.36764: Flags [.], ack 427, win 64, options [nop,nop,TS val 253966324 ecr 253966324], length 0
13:04:50.921532 eth0  In  IP 192.168.147.4.45392 > 192.168.147.3.10250: Flags [P.], seq 3388:3411, ack 3612, win 73, options [nop,nop,TS val 1714721283 ecr 1886613642], length 23
13:04:50.921535 lo    In  IP 127.0.0.1.36764 > 127.0.0.1.36481: Flags [P.], seq 427:428, ack 160, win 64, options [nop,nop,TS val 253966324 ecr 253966324], length 1
13:04:50.921545 eth0  In  IP 192.168.147.4.45392 > 192.168.147.3.10250: Flags [P.], seq 3411:3464, ack 3612, win 73, options [nop,nop,TS val 1714721283 ecr 1886613642], length 53
13:04:50.921547 eth0  Out IP 192.168.147.3.10250 > 192.168.147.4.45392: Flags [.], ack 3464, win 72, options [nop,nop,TS val 1886613642 ecr 1714721283], length 0
13:04:50.921550 lo    In  IP 127.0.0.1.36764 > 127.0.0.1.36481: Flags [P.], seq 428:459, ack 160, win 64, options [nop,nop,TS val 253966324 ecr 253966324], length 31
13:04:50.921552 lo    In  IP 127.0.0.1.36481 > 127.0.0.1.36764: Flags [.], ack 459, win 64, options [nop,nop,TS val 253966324 ecr 253966324], length 0
13:04:50.921735 lo    In  IP 127.0.0.1.36481 > 127.0.0.1.36764: Flags [P.], seq 160:162, ack 459, win 64, options [nop,nop,TS val 253966324 ecr 253966324], length 2
13:04:50.921738 lo    In  IP 127.0.0.1.36481 > 127.0.0.1.36764: Flags [P.], seq 162:164, ack 459, win 64, options [nop,nop,TS val 253966324 ecr 253966324], length 2
13:04:50.921740 lo    In  IP 127.0.0.1.36481 > 127.0.0.1.36764: Flags [P.], seq 164:168, ack 459, win 64, options [nop,nop,TS val 253966324 ecr 253966324], length 4
13:04:50.921741 lo    In  IP 127.0.0.1.36481 > 127.0.0.1.36764: Flags [P.], seq 168:172, ack 459, win 64, options [nop,nop,TS val 253966324 ecr 253966324], length 4
13:04:50.921743 lo    In  IP 127.0.0.1.36481 > 127.0.0.1.36764: Flags [P.], seq 172:188, ack 459, win 64, options [nop,nop,TS val 253966324 ecr 253966324], length 16
13:04:50.921757 lo    In  IP 127.0.0.1.36764 > 127.0.0.1.36481: Flags [.], ack 188, win 64, options [nop,nop,TS val 253966324 ecr 253966324], length 0
13:04:50.921760 eth0  Out IP 192.168.147.3.10250 > 192.168.147.4.45392: Flags [P.], seq 3612:3662, ack 3464, win 72, options [nop,nop,TS val 1886613642 ecr 1714721283], length 50
13:04:50.921824 eth0  In  IP 192.168.147.4.45392 > 192.168.147.3.10250: Flags [P.], seq 3464:3488, ack 3662, win 73, options [nop,nop,TS val 1714721283 ecr 1886613642], length 24
13:04:50.921838 lo    In  IP 127.0.0.1.36764 > 127.0.0.1.36481: Flags [P.], seq 459:461, ack 188, win 64, options [nop,nop,TS val 253966324 ecr 253966324], length 2
13:04:50.921858 eth0  In  IP 192.168.147.4.45392 > 192.168.147.3.10250: Flags [P.], seq 3488:3512, ack 3662, win 73, options [nop,nop,TS val 1714721283 ecr 1886613642], length 24
13:04:50.921865 eth0  Out IP 192.168.147.3.10250 > 192.168.147.4.45392: Flags [.], ack 3512, win 72, options [nop,nop,TS val 1886613642 ecr 1714721283], length 0
13:04:50.921872 lo    In  IP 127.0.0.1.36764 > 127.0.0.1.36481: Flags [P.], seq 461:463, ack 188, win 64, options [nop,nop,TS val 253966324 ecr 253966324], length 2
13:04:50.921881 lo    In  IP 127.0.0.1.36481 > 127.0.0.1.36764: Flags [.], ack 463, win 64, options [nop,nop,TS val 253966324 ecr 253966324], length 0
13:04:50.921892 eth0  In  IP 192.168.147.4.45392 > 192.168.147.3.10250: Flags [P.], seq 3512:3538, ack 3662, win 73, options [nop,nop,TS val 1714721283 ecr 1886613642], length 26
13:04:50.921900 lo    In  IP 127.0.0.1.36764 > 127.0.0.1.36481: Flags [P.], seq 463:467, ack 188, win 64, options [nop,nop,TS val 253966324 ecr 253966324], length 4
13:04:50.921916 eth0  In  IP 192.168.147.4.45392 > 192.168.147.3.10250: Flags [P.], seq 3538:3564, ack 3662, win 73, options [nop,nop,TS val 1714721283 ecr 1886613642], length 26
13:04:50.921920 eth0  Out IP 192.168.147.3.10250 > 192.168.147.4.45392: Flags [.], ack 3564, win 72, options [nop,nop,TS val 1886613642 ecr 1714721283], length 0
13:04:50.921927 lo    In  IP 127.0.0.1.36764 > 127.0.0.1.36481: Flags [P.], seq 467:471, ack 188, win 64, options [nop,nop,TS val 253966324 ecr 253966324], length 4
13:04:50.921933 lo    In  IP 127.0.0.1.36481 > 127.0.0.1.36764: Flags [.], ack 471, win 64, options [nop,nop,TS val 253966324 ecr 253966324], length 0
13:04:50.921951 eth0  In  IP 192.168.147.4.45392 > 192.168.147.3.10250: Flags [P.], seq 3564:3590, ack 3662, win 73, options [nop,nop,TS val 1714721283 ecr 1886613642], length 26
13:04:50.921962 lo    In  IP 127.0.0.1.36764 > 127.0.0.1.36481: Flags [P.], seq 471:475, ack 188, win 64, options [nop,nop,TS val 253966324 ecr 253966324], length 4
13:04:50.921977 eth0  In  IP 192.168.147.4.45392 > 192.168.147.3.10250: Flags [P.], seq 3590:3613, ack 3662, win 73, options [nop,nop,TS val 1714721283 ecr 1886613642], length 23
13:04:50.921984 eth0  Out IP 192.168.147.3.10250 > 192.168.147.4.45392: Flags [.], ack 3613, win 72, options [nop,nop,TS val 1886613642 ecr 1714721283], length 0
13:04:50.921989 lo    In  IP 127.0.0.1.36764 > 127.0.0.1.36481: Flags [P.], seq 475:476, ack 188, win 64, options [nop,nop,TS val 253966324 ecr 253966324], length 1
13:04:50.921997 lo    In  IP 127.0.0.1.36481 > 127.0.0.1.36764: Flags [.], ack 476, win 64, options [nop,nop,TS val 253966324 ecr 253966324], length 0
13:04:50.922008 eth0  In  IP 192.168.147.4.45392 > 192.168.147.3.10250: Flags [P.], seq 3613:3636, ack 3662, win 73, options [nop,nop,TS val 1714721283 ecr 1886613642], length 23
13:04:50.922018 lo    In  IP 127.0.0.1.36764 > 127.0.0.1.36481: Flags [P.], seq 476:477, ack 188, win 64, options [nop,nop,TS val 253966324 ecr 253966324], length 1
13:04:50.922035 eth0  In  IP 192.168.147.4.45392 > 192.168.147.3.10250: Flags [P.], seq 3636:3673, ack 3662, win 73, options [nop,nop,TS val 1714721283 ecr 1886613642], length 37
13:04:50.922040 eth0  Out IP 192.168.147.3.10250 > 192.168.147.4.45392: Flags [.], ack 3673, win 72, options [nop,nop,TS val 1886613642 ecr 1714721283], length 0
13:04:50.922045 lo    In  IP 127.0.0.1.36764 > 127.0.0.1.36481: Flags [P.], seq 477:492, ack 188, win 64, options [nop,nop,TS val 253966324 ecr 253966324], length 15
13:04:50.922050 lo    In  IP 127.0.0.1.36481 > 127.0.0.1.36764: Flags [.], ack 492, tcpdump: pcap_loop: truncated dump file; tried to read 98 captured bytes, only got 53
win 64, options [nop,nop,TS val 253966324 ecr 253966324], length 0
13:04:50.922086 lo    In  IP 127.0.0.1.36481 > 127.0.0.1.36764: Flags [P.], seq 188:190, ack 492, win 64, options [nop,nop,TS val 253966324 ecr 253966324], length 2
13:04:50.922095 eth0  Out IP 192.168.147.3.10250 > 192.168.147.4.45392: Flags [P.], seq 3662:3686, ack 3673, win 72, options [nop,nop,TS val 1886613642 ecr 1714721283], length 24
13:04:50.922123 lo    In  IP 127.0.0.1.36481 > 127.0.0.1.36764: Flags [P.], seq 190:192, ack 492, win 64, options [nop,nop,TS val 253966324 ecr 253966324], length 2
13:04:50.922127 lo    In  IP 127.0.0.1.36481 > 127.0.0.1.36764: Flags [P.], seq 192:196, ack 492, win 64, options [nop,nop,TS val 253966324 ecr 253966324], length 4
13:04:50.922128 lo    In  IP 127.0.0.1.36481 > 127.0.0.1.36764: Flags [P.], seq 196:200, ack 492, win 64, options [nop,nop,TS val 253966324 ecr 253966324], length 4
13:04:50.922130 lo    In  IP 127.0.0.1.36481 > 127.0.0.1.36764: Flags [P.], seq 200:208, ack 492, win 64, options [nop,nop,TS val 253966324 ecr 253966324], length 8
13:04:50.922145 lo    In  IP 127.0.0.1.36764 > 127.0.0.1.36481: Flags [.], ack 208, win 64, options [nop,nop,TS val 253966325 ecr 253966324], length 0
13:04:50.922148 eth0  Out IP 192.168.147.3.10250 > 192.168.147.4.45392: Flags [P.], seq 3686:3726, ack 3673, win 72, options [nop,nop,TS val 1886613643 ecr 1714721283], length 40
13:04:50.922174 eth0  In  IP 192.168.147.4.45392 > 192.168.147.3.10250: Flags [.], ack 3726, win 73, options [nop,nop,TS val 1714721284 ecr 1886613642], length 0
13:04:50.922190 eth0  In  IP 192.168.147.4.45392 > 192.168.147.3.10250: Flags [P.], seq 3673:3697, ack 3726, win 73, options [nop,nop,TS val 1714721284 ecr 1886613642], length 24
13:04:50.922195 lo    In  IP 127.0.0.1.36764 > 127.0.0.1.36481: Flags [P.], seq 492:494, ack 208, win 64, options [nop,nop,TS val 253966325 ecr 253966324], length 2
13:04:50.922234 eth0  In  IP 192.168.147.4.45392 > 192.168.147.3.10250: Flags [P.], seq 3697:3721, ack 3726, win 73, options [nop,nop,TS val 1714721284 ecr 1886613642], length 24
13:04:50.922239 eth0  Out IP 192.168.147.3.10250 > 192.168.147.4.45392: Flags [.], ack 3721, win 72, options [nop,nop,TS val 1886613643 ecr 1714721284], length 0
13:04:50.922243 lo    In  IP 127.0.0.1.36764 > 127.0.0.1.36481: Flags [P.], seq 494:496, ack 208, win 64, options [nop,nop,TS val 253966325 ecr 253966324], length 2
13:04:50.922246 lo    In  IP 127.0.0.1.36481 > 127.0.0.1.36764: Flags [.], ack 496, win 64, options [nop,nop,TS val 253966325 ecr 253966325], length 0
13:04:50.922255 eth0  In  IP 192.168.147.4.45392 > 192.168.147.3.10250: Flags [P.], seq 3721:3747, ack 3726, win 73, options [nop,nop,TS val 1714721284 ecr 1886613643], length 26
13:04:50.922258 lo    In  IP 127.0.0.1.36764 > 127.0.0.1.36481: Flags [P.], seq 496:500, ack 208, win 64, options [nop,nop,TS val 253966325 ecr 253966325], length 4
13:04:50.922267 eth0  In  IP 192.168.147.4.45392 > 192.168.147.3.10250: Flags [P.], seq 3747:3773, ack 3726, win 73, options [nop,nop,TS val 1714721284 ecr 1886613643], length 26
13:04:50.922269 eth0  Out IP 192.168.147.3.10250 > 192.168.147.4.45392: Flags [.], ack 3773, win 72, options [nop,nop,TS val 1886613643 ecr 1714721284], length 0
13:04:50.922272 lo    In  IP 127.0.0.1.36764 > 127.0.0.1.36481: Flags [P.], seq 500:504, ack 208, win 64, options [nop,nop,TS val 253966325 ecr 253966325], length 4
13:04:50.922274 lo    In  IP 127.0.0.1.36481 > 127.0.0.1.36764: Flags [.], ack 504, win 64, options [nop,nop,TS val 253966325 ecr 253966325], length 0
13:04:50.922280 eth0  In  IP 192.168.147.4.45392 > 192.168.147.3.10250: Flags [P.], seq 3773:3799, ack 3726, win 73, options [nop,nop,TS val 1714721284 ecr 1886613643], length 26
13:04:50.922283 lo    In  IP 127.0.0.1.36764 > 127.0.0.1.36481: Flags [P.], seq 504:508, ack 208, win 64, options [nop,nop,TS val 253966325 ecr 253966325], length 4
13:04:50.922296 eth0  In  IP 192.168.147.4.45392 > 192.168.147.3.10250: Flags [P.], seq 3799:3822, ack 3726, win 73, options [nop,nop,TS val 1714721284 ecr 1886613643], length 23
13:04:50.922299 eth0  Out IP 192.168.147.3.10250 > 192.168.147.4.45392: Flags [.], ack 3822, win 72, options [nop,nop,TS val 1886613643 ecr 1714721284], length 0
13:04:50.922301 lo    In  IP 127.0.0.1.36764 > 127.0.0.1.36481: Flags [P.], seq 508:509, ack 208, win 64, options [nop,nop,TS val 253966325 ecr 253966325], length 1
13:04:50.922305 lo    In  IP 127.0.0.1.36481 > 127.0.0.1.36764: Flags [.], ack 509, win 64, options [nop,nop,TS val 253966325 ecr 253966325], length 0
13:04:50.922310 eth0  In  IP 192.168.147.4.45392 > 192.168.147.3.10250: Flags [P.], seq 3822:3845, ack 3726, win 73, options [nop,nop,TS val 1714721284 ecr 1886613643], length 23
13:04:50.922313 lo    In  IP 127.0.0.1.36764 > 127.0.0.1.36481: Flags [P.], seq 509:510, ack 208, win 64, options [nop,nop,TS val 253966325 ecr 253966325], length 1
13:04:50.922320 eth0  In  IP 192.168.147.4.45392 > 192.168.147.3.10250: Flags [P.], seq 3845:3878, ack 3726, win 73, options [nop,nop,TS val 1714721284 ecr 1886613643], length 33
13:04:50.922323 eth0  Out IP 192.168.147.3.10250 > 192.168.147.4.45392: Flags [.], ack 3878, win 72, options [nop,nop,TS val 1886613643 ecr 1714721284], length 0
13:04:50.922325 lo    In  IP 127.0.0.1.36764 > 127.0.0.1.36481: Flags [P.], seq 510:521, ack 208, win 64, options [nop,nop,TS val 253966325 ecr 253966325], length 11
13:04:50.922329 lo    In  IP 127.0.0.1.36481 > 127.0.0.1.36764: Flags [.], ack 521, win 64, options [nop,nop,TS val 253966325 ecr 253966325], length 0
13:04:50.922343 lo    In  IP 127.0.0.1.36481 > 127.0.0.1.36764: Flags [P.], seq 208:210, ack 521, win 64, options [nop,nop,TS val 253966325 ecr 253966325], length 2
13:04:50.922347 eth0  Out IP 192.168.147.3.10250 > 192.168.147.4.45392: Flags [P.], seq 3726:3750, ack 3878, win 72, options [nop,nop,TS val 1886613643 ecr 1714721284], length 24
13:04:50.922355 lo    In  IP 127.0.0.1.36481 > 127.0.0.1.36764: Flags [P.], seq 210:212, ack 521, win 64, options [nop,nop,TS val 253966325 ecr 253966325], length 2
13:04:50.922357 lo    In  IP 127.0.0.1.36481 > 127.0.0.1.36764: Flags [P.], seq 212:216, ack 521, win 64, options [nop,nop,TS val 253966325 ecr 253966325], length 4
13:04:50.922359 lo    In  IP 127.0.0.1.36481 > 127.0.0.1.36764: Flags [P.], seq 216:220, ack 521, win 64, options [nop,nop,TS val 253966325 ecr 253966325], length 4
13:04:50.922368 lo    In  IP 127.0.0.1.36764 > 127.0.0.1.36481: Flags [.], ack 220, win 64, options [nop,nop,TS val 253966325 ecr 253966325], length 0
13:04:50.922370 eth0  Out IP 192.168.147.3.10250 > 192.168.147.4.45392: Flags [P.], seq 3750:3782, ack 3878, win 72, options [nop,nop,TS val 1886613643 ecr 1714721284], length 32
13:04:50.922381 eth0  In  IP 192.168.147.4.45392 > 192.168.147.3.10250: Flags [.], ack 3782, win 73, options [nop,nop,TS val 1714721284 ecr 1886613643], length 0
13:04:50.922385 lo    In  IP 127.0.0.1.36481 > 127.0.0.1.36764: Flags [P.], seq 220:228, ack 521, win 64, options [nop,nop,TS val 253966325 ecr 253966325], length 8
13:04:50.922452 eth0  Out IP 192.168.147.3.10250 > 192.168.147.4.45392: Flags [P.], seq 3782:3812, ack 3878, win 72, options [nop,nop,TS val 1886613643 ecr 1714721284], length 30
13:04:50.937895 lo    In  IP 127.0.0.1.36481 > 127.0.0.1.36764: Flags [P.], seq 228:232, ack 521, win 64, options [nop,nop,TS val 253966340 ecr 253966325], length 4
13:04:50.937918 lo    In  IP 127.0.0.1.36764 > 127.0.0.1.36481: Flags [.], ack 232, win 64, options [nop,nop,TS val 253966340 ecr 253966325], length 0
13:04:50.937954 lo    In  IP 127.0.0.1.36481 > 127.0.0.1.36764: Flags [P.], seq 232:236, ack 521, win 64, options [nop,nop,TS val 253966340 ecr 253966340], length 4
13:04:50.937956 lo    In  IP 127.0.0.1.36481 > 127.0.0.1.36764: Flags [P.], seq 236:280, ack 521, win 64, options [nop,nop,TS val 253966340 ecr 253966340], length 44
13:04:50.937969 eth0  Out IP 192.168.147.3.10250 > 192.168.147.4.45392: Flags [P.], seq 3812:3838, ack 3878, win 72, options [nop,nop,TS val 1886613658 ecr 1714721284], length 26
13:04:50.938027 eth0  In  IP 192.168.147.4.45392 > 192.168.147.3.10250: Flags [.], ack 3838, win 73, options [nop,nop,TS val 1714721299 ecr 1886613643], length 0
13:04:50.938054 lo    In  IP 127.0.0.1.36764 > 127.0.0.1.36481: Flags [.], ack 280, win 64, options [nop,nop,TS val 253966340 ecr 253966340], length 0
13:04:50.938056 eth0  Out IP 192.168.147.3.10250 > 192.168.147.4.45392: Flags [P.], seq 3838:3908, ack 3878, win 72, options [nop,nop,TS val 1886613658 ecr 1714721299], length 70
13:04:50.938265 lo    In  IP 127.0.0.1.36481 > 127.0.0.1.36764: Flags [P.], seq 280:284, ack 521, win 64, options [nop,nop,TS val 253966341 ecr 253966340], length 4
13:04:50.938280 eth0  Out IP 192.168.147.3.10250 > 192.168.147.4.45392: Flags [P.], seq 3908:3934, ack 3878, win 72, options [nop,nop,TS val 1886613659 ecr 1714721299], length 26
13:04:50.938296 lo    In  IP 127.0.0.1.36481 > 127.0.0.1.36764: Flags [P.], seq 284:288, ack 521, win 64, options [nop,nop,TS val 253966341 ecr 253966340], length 4
13:04:50.938300 lo    In  IP 127.0.0.1.36764 > 127.0.0.1.36481: Flags [.], ack 288, win 64, options [nop,nop,TS val 253966341 ecr 253966341], length 0
13:04:50.938302 eth0  Out IP 192.168.147.3.10250 > 192.168.147.4.45392: Flags [P.], seq 3934:3960, ack 3878, win 72, options [nop,nop,TS val 1886613659 ecr 1714721299], length 26
13:04:50.938303 eth0  In  IP 192.168.147.4.45392 > 192.168.147.3.10250: Flags [.], ack 3934, win 73, options [nop,nop,TS val 1714721300 ecr 1886613658], length 0
13:04:50.938313 lo    In  IP 127.0.0.1.36481 > 127.0.0.1.36764: Flags [P.], seq 288:10528, ack 521, win 64, options [nop,nop,TS val 253966341 ecr 253966341], length 10240
13:04:50.938331 eth0  Out IP 192.168.147.3.10250 > 192.168.147.4.45392: Flags [P.], seq 3960:11200, ack 3878, win 72, options [nop,nop,TS val 1886613659 ecr 1714721300], length 7240
13:04:50.938336 eth0  In  IP 192.168.147.4.45392 > 192.168.147.3.10250: Flags [.], ack 11200, win 87, options [nop,nop,TS val 1714721300 ecr 1886613659], length 0
13:04:50.938337 eth0  Out IP 192.168.147.3.10250 > 192.168.147.4.45392: Flags [P.], seq 11200:14222, ack 3878, win 72, options [nop,nop,TS val 1886613659 ecr 1714721300], length 3022
13:04:50.938339 eth0  In  IP 192.168.147.4.45392 > 192.168.147.3.10250: Flags [.], ack 14222, win 87, options [nop,nop,TS val 1714721300 ecr 1886613659], length 0
13:04:50.938358 lo    In  IP 127.0.0.1.36481 > 127.0.0.1.36764: Flags [P.], seq 10528:10532, ack 521, win 64, options [nop,nop,TS val 253966341 ecr 253966341], length 4
13:04:50.938362 lo    In  IP 127.0.0.1.36764 > 127.0.0.1.36481: Flags [.], ack 10532, win 106, options [nop,nop,TS val 253966341 ecr 253966341], length 0
13:04:50.938368 lo    In  IP 127.0.0.1.36481 > 127.0.0.1.36764: Flags [P.], seq 10532:10536, ack 521, win 64, options [nop,nop,TS val 253966341 ecr 253966341], length 4
13:04:50.938379 lo    In  IP 127.0.0.1.36481 > 127.0.0.1.36764: Flags [P.], seq 10536:31016, ack 521, win 64, options [nop,nop,TS val 253966341 ecr 253966341], length 20480
13:04:50.938386 lo    In  IP 127.0.0.1.36481 > 127.0.0.1.36764: Flags [P.], seq 31016:31020, ack 521, win 64, options [nop,nop,TS val 253966341 ecr 253966341], length 4
13:04:50.938388 lo    In  IP 127.0.0.1.36481 > 127.0.0.1.36764: Flags [P.], seq 31020:31024, ack 521, win 64, options [nop,nop,TS val 253966341 ecr 253966341], length 4
13:04:50.938398 lo    In  IP 127.0.0.1.36764 > 127.0.0.1.36481: Flags [.], ack 31024, win 106, options [nop,nop,TS val 253966341 ecr 253966341], length 0
13:04:50.938406 lo    In  IP 127.0.0.1.36481 > 127.0.0.1.36764: Flags [P.], seq 31024:31028, ack 521, win 64, options [nop,nop,TS val 253966341 ecr 253966341], length 4
13:04:50.938409 lo    In  IP 127.0.0.1.36481 > 127.0.0.1.36764: Flags [P.], seq 31028:31032, ack 521, win 64, options [nop,nop,TS val 253966341 ecr 253966341], length 4
13:04:50.938418 eth0  Out IP 192.168.147.3.10250 > 192.168.147.4.45392: Flags [P.], seq 14222:27254, ack 3878, win 72, options [nop,nop,TS val 1886613659 ecr 1714721300], length 13032
13:04:50.938424 eth0  Out IP 192.168.147.3.10250 > 192.168.147.4.45392: Flags [P.], seq 27254:29662, ack 3878, win 72, options [nop,nop,TS val 1886613659 ecr 1714721300], length 2408
13:04:50.938432 eth0  Out IP 192.168.147.3.10250 > 192.168.147.4.45392: Flags [P.], seq 29662:34762, ack 3878, win 72, options [nop,nop,TS val 1886613659 ecr 1714721300], length 5100
13:04:50.938439 lo    In  IP 127.0.0.1.36764 > 127.0.0.1.36481: Flags [.], ack 31032, win 106, options [nop,nop,TS val 253966341 ecr 253966341], length 0
13:04:50.938445 eth0  In  IP 192.168.147.4.45392 > 192.168.147.3.10250: Flags [.], ack 34762, win 79, options [nop,nop,TS val 1714721300 ecr 1886613659], length 0
13:04:50.938497 eth0  Out IP 192.168.147.3.10250 > 192.168.147.4.45392: Flags [P.], seq 34762:34792, ack 3878, win 72, options [nop,nop,TS val 1886613659 ecr 1714721300], length 30
13:04:50.939022 lo    In  IP 127.0.0.1.36481 > 127.0.0.1.36764: Flags [P.], seq 31032:31036, ack 521, win 64, options [nop,nop,TS val 253966341 ecr 253966341], length 4
13:04:50.939034 eth0  Out IP 192.168.147.3.10250 > 192.168.147.4.45392: Flags [P.], seq 34792:34818, ack 3878, win 72, options [nop,nop,TS val 1886613659 ecr 1714721300], length 26
13:04:50.939045 lo    In  IP 127.0.0.1.36481 > 127.0.0.1.36764: Flags [P.], seq 31036:31040, ack 521, win 64, options [nop,nop,TS val 253966341 ecr 253966341], length 4
13:04:50.939048 lo    In  IP 127.0.0.1.36481 > 127.0.0.1.36764: Flags [P.], seq 31040:31074, ack 521, win 64, options [nop,nop,TS val 253966341 ecr 253966341], length 34
13:04:50.939048 eth0  In  IP 192.168.147.4.45392 > 192.168.147.3.10250: Flags [.], ack 34818, win 87, options [nop,nop,TS val 1714721300 ecr 1886613659], length 0
13:04:50.939052 lo    In  IP 127.0.0.1.36481 > 127.0.0.1.36764: Flags [P.], seq 31074:31076, ack 521, win 64, options [nop,nop,TS val 253966341 ecr 253966341], length 2
13:04:50.939054 lo    In  IP 127.0.0.1.36481 > 127.0.0.1.36764: Flags [P.], seq 31076:31078, ack 521, win 64, options [nop,nop,TS val 253966341 ecr 253966341], length 2
13:04:50.939055 lo    In  IP 127.0.0.1.36481 > 127.0.0.1.36764: Flags [P.], seq 31078:31082, ack 521, win 64, options [nop,nop,TS val 253966341 ecr 253966341], length 4
13:04:50.939057 lo    In  IP 127.0.0.1.36481 > 127.0.0.1.36764: Flags [P.], seq 31082:31086, ack 521, win 64, options [nop,nop,TS val 253966341 ecr 253966341], length 4
13:04:50.939058 lo    In  IP 127.0.0.1.36481 > 127.0.0.1.36764: Flags [P.], seq 31086:31090, ack 521, win 64, options [nop,nop,TS val 253966341 ecr 253966341], length 4
13:04:50.939060 lo    In  IP 127.0.0.1.36481 > 127.0.0.1.36764: Flags [P.], seq 31090:31092, ack 521, win 64, options [nop,nop,TS val 253966341 ecr 253966341], length 2
13:04:50.939062 lo    In  IP 127.0.0.1.36481 > 127.0.0.1.36764: Flags [P.], seq 31092:31094, ack 521, win 64, options [nop,nop,TS val 253966341 ecr 253966341], length 2
13:04:50.939089 lo    In  IP 127.0.0.1.36764 > 127.0.0.1.36481: Flags [.], ack 31094, win 106, options [nop,nop,TS val 253966341 ecr 253966341], length 0
13:04:50.939091 lo    In  IP 127.0.0.1.36481 > 127.0.0.1.36764: Flags [FP.], seq 31094:31106, ack 521, win 64, options [nop,nop,TS val 253966341 ecr 253966341], length 12
13:04:50.939093 eth0  Out IP 192.168.147.3.10250 > 192.168.147.4.45392: Flags [P.], seq 34818:34898, ack 3878, win 72, options [nop,nop,TS val 1886613659 ecr 1714721300], length 80
13:04:50.939144 eth0  In  IP 192.168.147.4.45392 > 192.168.147.3.10250: Flags [P.], seq 3878:3902, ack 34898, win 87, options [nop,nop,TS val 1714721301 ecr 1886613659], length 24
13:04:50.939149 eth0  In  IP 192.168.147.4.45392 > 192.168.147.3.10250: Flags [P.], seq 3902:3926, ack 34898, win 87, options [nop,nop,TS val 1714721301 ecr 1886613659], length 24
13:04:50.939151 eth0  In  IP 192.168.147.4.45392 > 192.168.147.3.10250: Flags [P.], seq 3926:3952, ack 34898, win 87, options [nop,nop,TS val 1714721301 ecr 1886613659], length 26
13:04:50.939153 eth0  In  IP 192.168.147.4.45392 > 192.168.147.3.10250: Flags [P.], seq 3952:3978, ack 34898, win 87, options [nop,nop,TS val 1714721301 ecr 1886613659], length 26
13:04:50.939155 eth0  In  IP 192.168.147.4.45392 > 192.168.147.3.10250: Flags [P.], seq 3978:4004, ack 34898, win 87, options [nop,nop,TS val 1714721301 ecr 1886613659], length 26
13:04:50.939158 eth0  In  IP 192.168.147.4.45392 > 192.168.147.3.10250: Flags [P.], seq 4004:4028, ack 34898, win 87, options [nop,nop,TS val 1714721301 ecr 1886613659], length 24
13:04:50.939160 eth0  In  IP 192.168.147.4.45392 > 192.168.147.3.10250: Flags [P.], seq 4028:4052, ack 34898, win 87, options [nop,nop,TS val 1714721301 ecr 1886613659], length 24
13:04:50.939161 eth0  In  IP 192.168.147.4.45392 > 192.168.147.3.10250: Flags [P.], seq 4052:4078, ack 34898, win 87, options [nop,nop,TS val 1714721301 ecr 1886613659], length 26
13:04:50.939163 eth0  In  IP 192.168.147.4.45392 > 192.168.147.3.10250: Flags [P.], seq 4078:4104, ack 34898, win 87, options [nop,nop,TS val 1714721301 ecr 1886613659], length 26
13:04:50.939165 eth0  In  IP 192.168.147.4.45392 > 192.168.147.3.10250: Flags [P.], seq 4104:4130, ack 34898, win 87, options [nop,nop,TS val 1714721301 ecr 1886613659], length 26
13:04:50.939293 eth0  Out IP 192.168.147.3.10250 > 192.168.147.4.45392: Flags [P.], seq 34898:34932, ack 4130, win 72, options [nop,nop,TS val 1886613660 ecr 1714721301], length 34
13:04:50.939307 eth0  In  IP 192.168.147.4.45392 > 192.168.147.3.10250: Flags [R], seq 2046683524, win 0, length 0
13:04:50.939370 lo    In  IP 127.0.0.1.36764 > 127.0.0.1.36481: Flags [F.], seq 521, ack 31107, win 106, options [nop,nop,TS val 253966342 ecr 253966341], length 0
13:04:50.939374 lo    In  IP 127.0.0.1.36481 > 127.0.0.1.36764: Flags [.], ack 522, win 64, options [nop,nop,TS val 253966342 ecr 253966342], length 0
13:04:50.976141 eth0  In  IP 192.168.147.4.45396 > 192.168.147.3.10250: Flags [S], seq 946342322, win 64240, options [mss 1460,sackOK,TS val 1714721337 ecr 0,nop,wscale 10], length 0
13:04:50.976170 eth0  Out IP 192.168.147.3.10250 > 192.168.147.4.45396: Flags [S.], seq 1430063920, ack 946342323, win 65160, options [mss 1460,sackOK,TS val 1886613697 ecr 1714721337,nop,wscale 10], length 0
13:04:50.976188 eth0  In  IP 192.168.147.4.45396 > 192.168.147.3.10250: Flags [.], ack 1, win 63, options [nop,nop,TS val 1714721338 ecr 1886613697], length 0
13:04:50.976368 eth0  In  IP 192.168.147.4.45396 > 192.168.147.3.10250: Flags [P.], seq 1:1495, ack 1, win 63, options [nop,nop,TS val 1714721338 ecr 1886613697], length 1494
13:04:50.976374 eth0  Out IP 192.168.147.3.10250 > 192.168.147.4.45396: Flags [.], ack 1495, win 67, options [nop,nop,TS val 1886613697 ecr 1714721338], length 0
13:04:50.977545 eth0  Out IP 192.168.147.3.10250 > 192.168.147.4.45396: Flags [P.], seq 1:3431, ack 1495, win 67, options [nop,nop,TS val 1886613698 ecr 1714721338], length 3430
13:04:50.977554 eth0  In  IP 192.168.147.4.45396 > 192.168.147.3.10250: Flags [.], ack 3431, win 70, options [nop,nop,TS val 1714721339 ecr 1886613698], length 0
13:04:50.978686 eth0  In  IP 192.168.147.4.45396 > 192.168.147.3.10250: Flags [P.], seq 1495:2706, ack 3431, win 70, options [nop,nop,TS val 1714721340 ecr 1886613698], length 1211
13:04:50.978797 eth0  In  IP 192.168.147.4.45396 > 192.168.147.3.10250: Flags [P.], seq 2706:3244, ack 3431, win 70, options [nop,nop,TS val 1714721340 ecr 1886613698], length 538
13:04:50.978800 eth0  Out IP 192.168.147.3.10250 > 192.168.147.4.45396: Flags [.], ack 3244, win 72, options [nop,nop,TS val 1886613699 ecr 1714721340], length 0
13:04:50.979752 lo    In  IP 127.0.0.1.36766 > 127.0.0.1.36481: Flags [S], seq 3635269640, win 65495, options [mss 65495,sackOK,TS val 253966382 ecr 0,nop,wscale 10], length 0
13:04:50.979760 lo    In  IP 127.0.0.1.36481 > 127.0.0.1.36766: Flags [S.], seq 3207706622, ack 3635269641, win 65483, options [mss 65495,sackOK,TS val 253966382 ecr 253966382,nop,wscale 10], length 0
13:04:50.979763 lo    In  IP 127.0.0.1.36766 > 127.0.0.1.36481: Flags [.], ack 1, win 64, options [nop,nop,TS val 253966382 ecr 253966382], length 0
13:04:50.979815 lo    In  IP 127.0.0.1.36766 > 127.0.0.1.36481: Flags [P.], seq 1:410, ack 1, win 64, options [nop,nop,TS val 253966382 ecr 253966382], length 409
13:04:50.979817 lo    In  IP 127.0.0.1.36481 > 127.0.0.1.36766: Flags [.], ack 410, win 64, options [nop,nop,TS val 253966382 ecr 253966382], length 0
13:04:50.979937 lo    In  IP 127.0.0.1.36481 > 127.0.0.1.36766: Flags [P.], seq 1:160, ack 410, win 64, options [nop,nop,TS val 253966382 ecr 253966382], length 159
13:04:50.979939 lo    In  IP 127.0.0.1.36766 > 127.0.0.1.36481: Flags [.], ack 160, win 64, options [nop,nop,TS val 253966382 ecr 253966382], length 0
13:04:50.980013 eth0  Out IP 192.168.147.3.10250 > 192.168.147.4.45396: Flags [P.], seq 3431:3612, ack 3244, win 72, options [nop,nop,TS val 1886613700 ecr 1714721340], length 181
13:04:50.983359 eth0  In  IP 192.168.147.4.45396 > 192.168.147.3.10250: Flags [P.], seq 3244:3268, ack 3612, win 73, options [nop,nop,TS val 1714721345 ecr 1886613700], length 24
13:04:50.983383 lo    In  IP 127.0.0.1.36766 > 127.0.0.1.36481: Flags [P.], seq 410:412, ack 160, win 64, options [nop,nop,TS val 253966386 ecr 253966382], length 2
13:04:50.983396 eth0  In  IP 192.168.147.4.45396 > 192.168.147.3.10250: Flags [P.], seq 3268:3292, ack 3612, win 73, options [nop,nop,TS val 1714721345 ecr 1886613700], length 24
13:04:50.983400 eth0  Out IP 192.168.147.3.10250 > 192.168.147.4.45396: Flags [.], ack 3292, win 72, options [nop,nop,TS val 1886613704 ecr 1714721345], length 0
13:04:50.983404 lo    In  IP 127.0.0.1.36766 > 127.0.0.1.36481: Flags [P.], seq 412:414, ack 160, win 64, options [nop,nop,TS val 253966386 ecr 253966382], length 2
command terminated with exit code 1
