reading from file /captures/capture-test-traffic-pod.pcap0, link-type LINUX_SLL2 (Linux cooked v2), snapshot length 262144
Warning: interface names might be incorrect
11:15:21.886316 test-tra-281010 M   IP6 fe80::3406:c8ff:fe5d:fa7 > ff02::2: ICMP6, router solicitation, length 16
11:15:22.128963 test-tra-281010 P   IP 172.31.130.2 > 8.8.8.8: ICMP echo request, id 12, seq 1, length 64
11:15:22.129326 antrea-gw0 In  IP 172.31.130.2 > 8.8.8.8: ICMP echo request, id 12, seq 1, length 64
11:15:22.129414 eth0  Out IP 192.168.147.3 > 8.8.8.8: ICMP echo request, id 12, seq 1, length 64
11:15:22.148126 eth0  In  IP 8.8.8.8 > 192.168.147.3: ICMP echo reply, id 12, seq 1, length 64
11:15:22.148158 antrea-gw0 Out IP 8.8.8.8 > 172.31.130.2: ICMP echo reply, id 12, seq 1, length 64
11:15:22.148192 test-tra-281010 Out IP 8.8.8.8 > 172.31.130.2: ICMP echo reply, id 12, seq 1, length 64
11:15:22.391739 lo    In  IP6 ::1.58768 > ::1.10350: Flags [S], seq 1144332318, win 65476, options [mss 65476,sackOK,TS val 3612510224 ecr 0,nop,wscale 10], length 0
11:15:22.391780 lo    In  IP6 ::1.10350 > ::1.58768: Flags [S.], seq 3052078942, ack 1144332319, win 65464, options [mss 65476,sackOK,TS val 3612510224 ecr 3612510224,nop,wscale 10], length 0
11:15:22.391804 lo    In  IP6 ::1.58768 > ::1.10350: Flags [.], ack 1, win 64, options [nop,nop,TS val 3612510224 ecr 3612510224], length 0
11:15:22.392605 lo    In  IP6 ::1.58768 > ::1.10350: Flags [P.], seq 1:1516, ack 1, win 64, options [nop,nop,TS val 3612510225 ecr 3612510224], length 1515
11:15:22.392624 lo    In  IP6 ::1.10350 > ::1.58768: Flags [.], ack 1516, win 72, options [nop,nop,TS val 3612510225 ecr 3612510225], length 0
11:15:22.396460 lo    In  IP6 ::1.10350 > ::1.58768: Flags [P.], seq 1:3430, ack 1516, win 72, options [nop,nop,TS val 3612510229 ecr 3612510225], length 3429
11:15:22.396481 lo    In  IP6 ::1.58768 > ::1.10350: Flags [.], ack 3430, win 93, options [nop,nop,TS val 3612510229 ecr 3612510229], length 0
11:15:22.397198 lo    In  IP6 ::1.58768 > ::1.10350: Flags [P.], seq 1516:1610, ack 3430, win 93, options [nop,nop,TS val 3612510230 ecr 3612510229], length 94
11:15:22.397309 lo    In  IP6 ::1.58768 > ::1.10350: Flags [P.], seq 1610:1702, ack 3430, win 93, options [nop,nop,TS val 3612510230 ecr 3612510229], length 92
11:15:22.397396 lo    In  IP6 ::1.58768 > ::1.10350: Flags [P.], seq 1702:1773, ack 3430, win 93, options [nop,nop,TS val 3612510230 ecr 3612510229], length 71
11:15:22.397614 lo    In  IP6 ::1.10350 > ::1.58768: Flags [P.], seq 3430:3491, ack 1773, win 72, options [nop,nop,TS val 3612510230 ecr 3612510230], length 61
11:15:22.397727 lo    In  IP6 ::1.10350 > ::1.58768: Flags [P.], seq 3491:3526, ack 1773, win 72, options [nop,nop,TS val 3612510230 ecr 3612510230], length 35
11:15:22.397915 eth0  Out IP 192.168.147.3.52772 > 192.168.147.4.10351: Flags [S], seq 27425553, win 64240, options [mss 1460,sackOK,TS val 1880045118 ecr 0,nop,wscale 10], length 0
11:15:22.398023 lo    In  IP6 ::1.10350 > ::1.58768: Flags [P.], seq 3526:3557, ack 1773, win 72, options [nop,nop,TS val 3612510230 ecr 3612510230], length 31
11:15:22.398034 eth0  In  IP 192.168.147.4.10351 > 192.168.147.3.52772: Flags [S.], seq 1815366481, ack 27425554, win 65160, options [mss 1460,sackOK,TS val 1708152759 ecr 1880045118,nop,wscale 10], length 0
11:15:22.398051 eth0  Out IP 192.168.147.3.52772 > 192.168.147.4.10351: Flags [.], ack 1, win 63, options [nop,nop,TS val 1880045118 ecr 1708152759], length 0
11:15:22.398176 lo    In  IP6 ::1.58768 > ::1.10350: Flags [.], ack 3557, win 93, options [nop,nop,TS val 3612510231 ecr 3612510230], length 0
11:15:22.398213 lo    In  IP6 ::1.58768 > ::1.10350: Flags [P.], seq 1773:1804, ack 3557, win 93, options [nop,nop,TS val 3612510231 ecr 3612510230], length 31
11:15:22.398676 eth0  Out IP 192.168.147.3.52772 > 192.168.147.4.10351: Flags [P.], seq 1:238, ack 1, win 63, options [nop,nop,TS val 1880045119 ecr 1708152759], length 237
11:15:22.398709 eth0  In  IP 192.168.147.4.10351 > 192.168.147.3.52772: Flags [.], ack 238, win 64, options [nop,nop,TS val 1708152760 ecr 1880045119], length 0
11:15:22.399251 lo    In  IP6 ::1.10350 > ::1.58768: Flags [P.], seq 3557:3596, ack 1804, win 72, options [nop,nop,TS val 3612510232 ecr 3612510231], length 39
11:15:22.399343 eth0  In  IP 192.168.147.4.10351 > 192.168.147.3.52772: Flags [P.], seq 1:238, ack 238, win 64, options [nop,nop,TS val 1708152761 ecr 1880045119], length 237
11:15:22.399356 eth0  Out IP 192.168.147.3.52772 > 192.168.147.4.10351: Flags [.], ack 238, win 63, options [nop,nop,TS val 1880045120 ecr 1708152761], length 0
11:15:22.399434 lo    In  IP6 ::1.10350 > ::1.58768: Flags [P.], seq 3596:3747, ack 1804, win 72, options [nop,nop,TS val 3612510232 ecr 3612510231], length 151
11:15:22.399451 lo    In  IP6 ::1.58768 > ::1.10350: Flags [.], ack 3747, win 95, options [nop,nop,TS val 3612510232 ecr 3612510232], length 0
11:15:22.399497 eth0  Out IP 192.168.147.3.52772 > 192.168.147.4.10351: Flags [F.], seq 238, ack 238, win 63, options [nop,nop,TS val 1880045120 ecr 1708152761], length 0
11:15:22.399555 lo    In  IP6 ::1.10350 > ::1.58768: Flags [P.], seq 3747:3780, ack 1804, win 72, options [nop,nop,TS val 3612510232 ecr 3612510232], length 33
11:15:22.399569 eth0  In  IP 192.168.147.4.10351 > 192.168.147.3.52772: Flags [F.], seq 238, ack 239, win 64, options [nop,nop,TS val 1708152761 ecr 1880045120], length 0
11:15:22.399581 eth0  Out IP 192.168.147.3.52772 > 192.168.147.4.10351: Flags [.], ack 239, win 63, options [nop,nop,TS val 1880045120 ecr 1708152761], length 0
11:15:22.399611 lo    In  IP6 ::1.58768 > ::1.10350: Flags [P.], seq 1804:1828, ack 3780, win 95, options [nop,nop,TS val 3612510232 ecr 3612510232], length 24
11:15:22.399651 lo    In  IP6 ::1.10350 > ::1.58768: Flags [P.], seq 3780:3804, ack 1828, win 72, options [nop,nop,TS val 3612510232 ecr 3612510232], length 24
11:15:22.399670 lo    In  IP6 ::1.10350 > ::1.58768: Flags [F.], seq 3804, ack 1828, win 72, options [nop,nop,TS val 3612510232 ecr 3612510232], length 0
11:15:22.399729 lo    In  IP6 ::1.58768 > ::1.10350: Flags [F.], seq 1828, ack 3805, win 95, options [nop,nop,TS val 3612510232 ecr 3612510232], length 0
11:15:22.399739 lo    In  IP6 ::1.10350 > ::1.58768: Flags [.], ack 1829, win 72, options [nop,nop,TS val 3612510232 ecr 3612510232], length 0
11:15:22.542206 eth0  Out IP 192.168.147.3.10351 > 192.168.147.2.10351: UDP, length 100
11:15:22.543296 eth0  In  IP 192.168.147.2.10351 > 192.168.147.3.10351: UDP, length 18
11:15:22.910400 genev_sys_6081 Out IP6 fe80::5c38:47ff:fed3:a2ef > ff02::2: ICMP6, router solicitation, length 16
11:15:23.119908 lo    In  IP6 ::1.58782 > ::1.10350: Flags [S], seq 180956310, win 65476, options [mss 65476,sackOK,TS val 3612510952 ecr 0,nop,wscale 10], length 0
11:15:23.119954 lo    In  IP6 ::1.10350 > ::1.58782: Flags [S.], seq 3762551100, ack 180956311, win 65464, options [mss 65476,sackOK,TS val 3612510952 ecr 3612510952,nop,wscale 10], length 0
11:15:23.119975 lo    In  IP6 ::1.58782 > ::1.10350: Flags [.], ack 1, win 64, options [nop,nop,TS val 3612510952 ecr 3612510952], length 0
11:15:23.121636 lo    In  IP6 ::1.58782 > ::1.10350: Flags [P.], seq 1:1516, ack 1, win 64, options [nop,nop,TS val 3612510954 ecr 3612510952], length 1515
11:15:23.121668 lo    In  IP6 ::1.10350 > ::1.58782: Flags [.], ack 1516, win 72, options [nop,nop,TS val 3612510954 ecr 3612510954], length 0
11:15:23.128529 lo    In  IP6 ::1.10350 > ::1.58782: Flags [P.], seq 1:3430, ack 1516, win 72, options [nop,nop,TS val 3612510961 ecr 3612510954], length 3429
11:15:23.128549 lo    In  IP6 ::1.58782 > ::1.10350: Flags [.], ack 3430, win 93, options [nop,nop,TS val 3612510961 ecr 3612510961], length 0
11:15:23.129346 test-tra-281010 P   IP 172.31.130.2 > 8.8.8.8: ICMP echo request, id 12, seq 2, length 64
11:15:23.129378 antrea-gw0 In  IP 172.31.130.2 > 8.8.8.8: ICMP echo request, id 12, seq 2, length 64
11:15:23.129407 eth0  Out IP 192.168.147.3 > 8.8.8.8: ICMP echo request, id 12, seq 2, length 64
11:15:23.129444 lo    In  IP6 ::1.58782 > ::1.10350: Flags [P.], seq 1516:1610, ack 3430, win 93, options [nop,nop,TS val 3612510962 ecr 3612510961], length 94
11:15:23.129696 lo    In  IP6 ::1.10350 > ::1.58782: Flags [P.], seq 3430:3491, ack 1610, win 72, options [nop,nop,TS val 3612510962 ecr 3612510962], length 61
11:15:23.129752 lo    In  IP6 ::1.58782 > ::1.10350: Flags [P.], seq 1610:1702, ack 3491, win 93, options [nop,nop,TS val 3612510962 ecr 3612510962], length 92
11:15:23.129840 lo    In  IP6 ::1.10350 > ::1.58782: Flags [P.], seq 3491:3526, ack 1702, win 72, options [nop,nop,TS val 3612510962 ecr 3612510962], length 35
11:15:23.129924 lo    In  IP6 ::1.10350 > ::1.58782: Flags [P.], seq 3526:3557, ack 1702, win 72, options [nop,nop,TS val 3612510962 ecr 3612510962], length 31
11:15:23.129938 lo    In  IP6 ::1.58782 > ::1.10350: Flags [.], ack 3557, win 93, options [nop,nop,TS val 3612510962 ecr 3612510962], length 0
11:15:23.129973 lo    In  IP6 ::1.58782 > ::1.10350: Flags [P.], seq 1702:1774, ack 3557, win 93, options [nop,nop,TS val 3612510962 ecr 3612510962], length 72
11:15:23.130928 lo    In  IP6 ::1.58782 > ::1.10350: Flags [P.], seq 1774:1805, ack 3557, win 93, options [nop,nop,TS val 3612510963 ecr 3612510962], length 31
11:15:23.130950 lo    In  IP6 ::1.10350 > ::1.58782: Flags [.], ack 1805, win 72, options [nop,nop,TS val 3612510963 ecr 3612510962], length 0
11:15:23.130994 lo    In  IP6 ::1.10350 > ::1.58782: Flags [P.], seq 3557:3596, ack 1805, win 72, options [nop,nop,TS val 3612510963 ecr 3612510962], length 39
11:15:23.131097 lo    In  IP6 ::1.10350 > ::1.58782: Flags [P.], seq 3596:3748, ack 1805, win 72, options [nop,nop,TS val 3612510963 ecr 3612510962], length 152
11:15:23.131128 lo    In  IP6 ::1.10350 > ::1.58782: Flags [P.], seq 3748:3781, ack 1805, win 72, options [nop,nop,TS val 3612510963 ecr 3612510962], length 33
11:15:23.131175 lo    In  IP6 ::1.58782 > ::1.10350: Flags [.], ack 3781, win 95, options [nop,nop,TS val 3612510964 ecr 3612510963], length 0
11:15:23.131291 lo    In  IP6 ::1.58782 > ::1.10350: Flags [P.], seq 1805:1829, ack 3781, win 95, options [nop,nop,TS val 3612510964 ecr 3612510963], length 24
11:15:23.131419 lo    In  IP6 ::1.10350 > ::1.58782: Flags [P.], seq 3781:3805, ack 1829, win 72, options [nop,nop,TS val 3612510964 ecr 3612510964], length 24
11:15:23.131467 lo    In  IP6 ::1.10350 > ::1.58782: Flags [F.], seq 3805, ack 1829, win 72, options [nop,nop,TS val 3612510964 ecr 3612510964], length 0
11:15:23.131548 lo    In  IP6 ::1.58782 > ::1.10350: Flags [F.], seq 1829, ack 3806, win 95, options [nop,nop,TS val 3612510964 ecr 3612510964], length 0
11:15:23.131574 lo    In  IP6 ::1.10350 > ::1.58782: Flags [.], ack 1830, win 72, options [nop,nop,TS val 3612510964 ecr 3612510964], length 0
11:15:23.146974 eth0  In  IP 8.8.8.8 > 192.168.147.3: ICMP echo reply, id 12, seq 2, length 64
11:15:23.147153 antrea-gw0 Out IP 8.8.8.8 > 172.31.130.2: ICMP echo reply, id 12, seq 2, length 64
11:15:23.147174 test-tra-281010 Out IP 8.8.8.8 > 172.31.130.2: ICMP echo reply, id 12, seq 2, length 64
11:15:23.182628 eth0  In  IP 192.168.147.4.6443 > 192.168.147.3.48509: Flags [P.], seq 255612263:255612381, ack 3505606625, win 72, options [nop,nop,TS val 1708153544 ecr 738549114], length 118
11:15:23.182943 eth0  In  IP 192.168.147.4.6443 > 192.168.147.3.48509: Flags [P.], seq 118:236, ack 1, win 72, options [nop,nop,TS val 1708153544 ecr 738549114], length 118
11:15:23.183094 eth0  Out IP 192.168.147.3.48509 > 192.168.147.4.6443: Flags [.], ack 236, win 100, options [nop,nop,TS val 738550530 ecr 1708153544], length 0
11:15:23.518811 eth0  In  IP 192.168.147.4.6443 > 192.168.147.3.48509: Flags [P.], seq 236:371, ack 1, win 72, options [nop,nop,TS val 1708153880 ecr 738550530], length 135
11:15:23.518973 eth0  In  IP 192.168.147.4.6443 > 192.168.147.3.48509: Flags [P.], seq 371:506, ack 1, win 72, options [nop,nop,TS val 1708153880 ecr 738550530], length 135
11:15:23.519084 eth0  Out IP 192.168.147.3.48509 > 192.168.147.4.6443: Flags [.], ack 506, win 100, options [nop,nop,TS val 738550866 ecr 1708153880], length 0
11:15:23.530341 eth0  In  IP 192.168.147.4.6443 > 192.168.147.3.48509: Flags [P.], seq 506:4267, ack 1, win 72, options [nop,nop,TS val 1708153892 ecr 738550866], length 3761
11:15:23.530419 eth0  Out IP 192.168.147.3.48509 > 192.168.147.4.6443: Flags [.], ack 4267, win 100, options [nop,nop,TS val 738550878 ecr 1708153892], length 0
11:15:23.531428 eth0  Out IP 192.168.147.3.48509 > 192.168.147.4.6443: Flags [P.], seq 1:49, ack 4267, win 100, options [nop,nop,TS val 738550879 ecr 1708153892], length 48
11:15:23.531475 eth0  In  IP 192.168.147.4.6443 > 192.168.147.3.48509: Flags [.], ack 49, win 72, options [nop,nop,TS val 1708153893 ecr 738550879], length 0
11:15:23.541665 eth0  Out IP 192.168.147.3.10351 > 192.168.147.2.10351: UDP, length 100
11:15:23.543217 eth0  In  IP 192.168.147.2.10351 > 192.168.147.3.10351: UDP, length 18
11:15:23.620973 eth0  In  IP 192.168.147.2.10351 > 192.168.147.3.10351: UDP, length 100
11:15:23.621172 eth0  Out IP 192.168.147.3.10351 > 192.168.147.2.10351: UDP, length 18
11:15:23.877448 eth0  In  IP 192.168.147.4.6443 > 192.168.147.3.48509: Flags [P.], seq 4267:4423, ack 49, win 72, options [nop,nop,TS val 1708154239 ecr 738550879], length 156
11:15:23.918280 eth0  Out IP 192.168.147.3.48509 > 192.168.147.4.6443: Flags [.], ack 4423, win 100, options [nop,nop,TS val 738551266 ecr 1708154239], length 0
11:15:23.951636 eth0  In  IP 192.168.147.4.6443 > 192.168.147.3.48509: Flags [P.], seq 4423:4566, ack 49, win 72, options [nop,nop,TS val 1708154313 ecr 738551266], length 143
11:15:23.951662 eth0  Out IP 192.168.147.3.48509 > 192.168.147.4.6443: Flags [.], ack 4566, win 100, options [nop,nop,TS val 738551299 ecr 1708154313], length 0
11:15:24.026377 eth0  In  IP 192.168.147.4.6443 > 192.168.147.3.48509: Flags [P.], seq 4566:4687, ack 49, win 72, options [nop,nop,TS val 1708154388 ecr 738551299], length 121
11:15:24.026417 eth0  Out IP 192.168.147.3.48509 > 192.168.147.4.6443: Flags [.], ack 4687, win 100, options [nop,nop,TS val 738551374 ecr 1708154388], length 0
11:15:24.026622 eth0  In  IP 192.168.147.4.6443 > 192.168.147.3.48509: Flags [P.], seq 4687:4808, ack 49, win 72, options [nop,nop,TS val 1708154388 ecr 738551374], length 121
11:15:24.026643 eth0  Out IP 192.168.147.3.48509 > 192.168.147.4.6443: Flags [.], ack 4808, win 100, options [nop,nop,TS val 738551374 ecr 1708154388], length 0
11:15:24.051125 eth0  In  IP 192.168.147.4.6443 > 192.168.147.3.48509: Flags [P.], seq 4808:4969, ack 49, win 72, options [nop,nop,TS val 1708154412 ecr 738551374], length 161
11:15:24.051177 eth0  Out IP 192.168.147.3.48509 > 192.168.147.4.6443: Flags [.], ack 4969, win 100, options [nop,nop,TS val 738551399 ecr 1708154412], length 0
11:15:24.129677 test-tra-281010 P   IP 172.31.130.2 > 8.8.8.8: ICMP echo request, id 12, seq 3, length 64
11:15:24.129778 antrea-gw0 In  IP 172.31.130.2 > 8.8.8.8: ICMP echo request, id 12, seq 3, length 64
11:15:24.129830 eth0  Out IP 192.168.147.3 > 8.8.8.8: ICMP echo request, id 12, seq 3, length 64
11:15:24.150661 eth0  In  IP 8.8.8.8 > 192.168.147.3: ICMP echo reply, id 12, seq 3, length 64
11:15:24.150694 antrea-gw0 Out IP 8.8.8.8 > 172.31.130.2: ICMP echo reply, id 12, seq 3, length 64
11:15:24.150730 test-tra-281010 Out IP 8.8.8.8 > 172.31.130.2: ICMP echo reply, id 12, seq 3, length 64
11:15:24.153604 eth0  In  IP 192.168.147.4.6443 > 192.168.147.3.48509: Flags [P.], seq 4969:5122, ack 49, win 72, options [nop,nop,TS val 1708154515 ecr 738551399], length 153
11:15:24.153674 eth0  Out IP 192.168.147.3.48509 > 192.168.147.4.6443: Flags [.], ack 5122, win 100, options [nop,nop,TS val 738551501 ecr 1708154515], length 0
11:15:24.540896 eth0  Out IP 192.168.147.3.10351 > 192.168.147.4.10351: UDP, length 107
11:15:24.542315 eth0  In  IP 192.168.147.4.10351 > 192.168.147.3.10351: UDP, length 18
11:15:24.634186 eth0  In  IP 192.168.147.4.10351 > 192.168.147.3.10351: UDP, length 107
11:15:24.635100 eth0  Out IP 192.168.147.3.10351 > 192.168.147.4.10351: UDP, length 18
11:15:24.822758 eth0  In  IP 192.168.147.4.6443 > 192.168.147.3.48509: Flags [P.], seq 5122:5220, ack 49, win 72, options [nop,nop,TS val 1708155184 ecr 738551501], length 98
11:15:24.822835 eth0  Out IP 192.168.147.3.48509 > 192.168.147.4.6443: Flags [.], ack 5220, win 100, options [nop,nop,TS val 738552170 ecr 1708155184], length 0
11:15:24.968658 eth0  In  IP 192.168.147.4.6443 > 192.168.147.3.48509: Flags [P.], seq 5220:5318, ack 49, win 72, options [nop,nop,TS val 1708155330 ecr 738552170], length 98
11:15:24.968688 eth0  Out IP 192.168.147.3.48509 > 192.168.147.4.6443: Flags [.], ack 5318, win 100, options [nop,nop,TS val 738552316 ecr 1708155330], length 0
11:15:25.131049 test-tra-281010 P   IP 172.31.130.2 > 8.8.8.8: ICMP echo request, id 12, seq 4, length 64
11:15:25.131091 antrea-gw0 In  IP 172.31.130.2 > 8.8.8.8: ICMP echo request, id 12, seq 4, length 64
11:15:25.131187 eth0  Out IP 192.168.147.3 > 8.8.8.8: ICMP echo request, id 12, seq 4, length 64
11:15:25.148222 eth0  In  IP 8.8.8.8 > 192.168.147.3: ICMP echo reply, id 12, seq 4, length 64
11:15:25.148255 antrea-gw0 Out IP 8.8.8.8 > 172.31.130.2: ICMP echo reply, id 12, seq 4, length 64
11:15:25.148279 test-tra-281010 Out IP 8.8.8.8 > 172.31.130.2: ICMP echo reply, id 12, seq 4, length 64
11:15:25.337626 eth0  Out IP 192.168.147.3.59312 > 192.168.147.4.6443: Flags [P.], seq 1286569269:1286569313, ack 789637982, win 90, options [nop,nop,TS val 1880048058 ecr 1708152128], length 44
11:15:25.337708 eth0  In  IP 192.168.147.4.6443 > 192.168.147.3.59312: Flags [.], ack 44, win 73, options [nop,nop,TS val 1708155699 ecr 1880048058], length 0
11:15:25.337767 eth0  Out IP 192.168.147.3.59312 > 192.168.147.4.6443: Flags [P.], seq 44:593, ack 1, win 90, options [nop,nop,TS val 1880048058 ecr 1708155699], length 549
11:15:25.337781 eth0  In  IP 192.168.147.4.6443 > 192.168.147.3.59312: Flags [.], ack 593, win 73, options [nop,nop,TS val 1708155699 ecr 1880048058], length 0
11:15:25.348651 eth0  In  IP 192.168.147.4.6443 > 192.168.147.3.59312: Flags [P.], seq 1:95, ack 593, win 73, options [nop,nop,TS val 1708155710 ecr 1880048058], length 94
11:15:25.348737 eth0  In  IP 192.168.147.4.6443 > 192.168.147.3.59312: Flags [P.], seq 95:644, ack 593, win 73, options [nop,nop,TS val 1708155710 ecr 1880048058], length 549
11:15:25.348818 eth0  Out IP 192.168.147.3.59312 > 192.168.147.4.6443: Flags [.], ack 644, win 90, options [nop,nop,TS val 1880048069 ecr 1708155710], length 0
11:15:25.349176 eth0  Out IP 192.168.147.3.59312 > 192.168.147.4.6443: Flags [P.], seq 593:628, ack 644, win 90, options [nop,nop,TS val 1880048070 ecr 1708155710], length 35
11:15:25.390225 eth0  In  IP 192.168.147.4.6443 > 192.168.147.3.59312: Flags [.], ack 628, win 73, options [nop,nop,TS val 1708155752 ecr 1880048070], length 0
11:15:25.479092 eth0  Out IP6 fe80::787b:bff:fe3d:4598 > fe80::c822:8fff:fea8:da7f: ICMP6, neighbor solicitation, who has fe80::c822:8fff:fea8:da7f, length 32
11:15:25.479190 eth0  In  IP6 fe80::c822:8fff:fea8:da7f > fe80::787b:bff:fe3d:4598: ICMP6, neighbor advertisement, tgt is fe80::c822:8fff:fea8:da7f, length 24
11:15:25.540941 eth0  Out IP 192.168.147.3.10351 > 192.168.147.2.10351: UDP, length 100
11:15:25.543429 eth0  In  IP 192.168.147.2.10351 > 192.168.147.3.10351: UDP, length 18
11:15:25.634068 eth0  In  IP 192.168.147.4.10351 > 192.168.147.3.10351: UDP, length 107
11:15:25.634535 eth0  Out IP 192.168.147.3.10351 > 192.168.147.4.10351: UDP, length 18
11:15:26.505961 antrea-gw0 Out ARP, Request who-has 172.31.130.2 tell 172.31.130.1, length 28
11:15:26.506428 test-tra-281010 Out ARP, Request who-has 172.31.130.2 tell 172.31.130.1, length 28
11:15:26.506443 test-tra-281010 P   ARP, Reply 172.31.130.2 is-at 36:06:c8:5d:0f:a7, length 28
11:15:26.506531 antrea-gw0 In  ARP, Reply 172.31.130.2 is-at 36:06:c8:5d:0f:a7, length 28
11:15:26.541248 eth0  Out IP 192.168.147.3.10351 > 192.168.147.4.10351: UDP, length 107
11:15:26.542433 eth0  In  IP 192.168.147.4.10351 > 192.168.147.3.10351: UDP, length 18
11:15:26.622847 eth0  In  IP 192.168.147.2.10351 > 192.168.147.3.10351: UDP, length 100
11:15:26.628243 eth0  Out IP 192.168.147.3.10351 > 192.168.147.2.10351: UDP, length 18
11:15:27.577191 eth0  Out IP 192.168.147.3.10351 > 192.168.147.2.10351: UDP, length 100
11:15:27.578308 eth0  In  IP 192.168.147.2.10351 > 192.168.147.3.10351: UDP, length 18
11:15:27.621478 eth0  In  IP 192.168.147.2.10351 > 192.168.147.3.10351: UDP, length 100
11:15:27.621939 eth0  Out IP 192.168.147.3.10351 > 192.168.147.2.10351: UDP, length 18
11:15:28.303431 eth0  In  IP 192.168.147.4.6443 > 192.168.147.3.48509: Flags [P.], seq 5318:5416, ack 49, win 72, options [nop,nop,TS val 1708158665 ecr 738552316], length 98
11:15:28.303588 eth0  Out IP 192.168.147.3.48509 > 192.168.147.4.6443: Flags [.], ack 5416, win 100, options [nop,nop,TS val 738555651 ecr 1708158665], length 0
11:15:28.304363 eth0  In  IP 192.168.147.4.6443 > 192.168.147.3.48509: Flags [P.], seq 5416:5590, ack 49, win 72, options [nop,nop,TS val 1708158666 ecr 738555651], length 174
11:15:28.304385 eth0  Out IP 192.168.147.3.48509 > 192.168.147.4.6443: Flags [.], ack 5590, win 100, options [nop,nop,TS val 738555652 ecr 1708158666], length 0
11:15:28.543592 eth0  Out IP 192.168.147.3.10351 > 192.168.147.4.10351: UDP, length 107
11:15:28.544792 eth0  In  IP 192.168.147.4.10351 > 192.168.147.3.10351: UDP, length 18
11:15:28.931769 eth0  Out IP 192.168.147.3.48509 > 192.168.147.4.6443: Flags [P.], seq 49:94, ack 5590, win 100, options [nop,nop,TS val 738556279 ecr 1708158666], length 45
11:15:28.931822 eth0  In  IP 192.168.147.4.6443 > 192.168.147.3.48509: Flags [.], ack 94, win 72, options [nop,nop,TS val 1708159293 ecr 738556279], length 0
11:15:28.932204 eth0  Out IP 192.168.147.3.48509 > 192.168.147.4.6443: Flags [P.], seq 94:6058, ack 5590, win 100, options [nop,nop,TS val 738556280 ecr 1708159293], length 5964
11:15:28.932226 eth0  In  IP 192.168.147.4.6443 > 192.168.147.3.48509: Flags [.], ack 6058, win 69, options [nop,nop,TS val 1708159294 ecr 738556280], length 0
11:15:28.933477 eth0  In  IP 192.168.147.4.6443 > 192.168.147.3.48509: Flags [P.], seq 5590:5625, ack 6058, win 72, options [nop,nop,TS val 1708159295 ecr 738556280], length 35
11:15:28.933500 eth0  Out IP 192.168.147.3.48509 > 192.168.147.4.6443: Flags [.], ack 5625, win 100, options [nop,nop,TS val 738556281 ecr 1708159295], length 0
11:15:28.942436 eth0  In  IP 192.168.147.4.6443 > 192.168.147.3.48509: Flags [P.], seq 5625:5714, ack 6058, win 72, options [nop,nop,TS val 1708159304 ecr 738556281], length 89
11:15:28.942470 eth0  Out IP 192.168.147.3.48509 > 192.168.147.4.6443: Flags [.], ack 5714, win 100, options [nop,nop,TS val 738556290 ecr 1708159304], length 0
11:15:28.942517 eth0  In  IP 192.168.147.4.6443 > 192.168.147.3.48509: Flags [P.], seq 5714:11698, ack 6058, win 72, options [nop,nop,TS val 1708159304 ecr 738556290], length 5984
11:15:28.942525 eth0  Out IP 192.168.147.3.48509 > 192.168.147.4.6443: Flags [.], ack 11698, win 95, options [nop,nop,TS val 738556290 ecr 1708159304], length 0
11:15:28.942785 eth0  In  IP 192.168.147.4.6443 > 192.168.147.3.48509: Flags [P.], seq 11698:11729, ack 6058, win 72, options [nop,nop,TS val 1708159304 ecr 738556290], length 31
11:15:28.942797 eth0  Out IP 192.168.147.3.48509 > 192.168.147.4.6443: Flags [.], ack 11729, win 100, options [nop,nop,TS val 738556290 ecr 1708159304], length 0
11:15:28.942977 eth0  Out IP 192.168.147.3.48509 > 192.168.147.4.6443: Flags [P.], seq 6058:6106, ack 11729, win 100, options [nop,nop,TS val 738556290 ecr 1708159304], length 48
11:15:28.983438 eth0  In  IP 192.168.147.4.6443 > 192.168.147.3.48509: Flags [.], ack 6106, win 72, options [nop,nop,TS val 1708159345 ecr 738556290], length 0
11:15:29.541787 eth0  Out IP 192.168.147.3.10351 > 192.168.147.2.10351: UDP, length 100
11:15:29.542059 eth0  In  IP 192.168.147.2.10351 > 192.168.147.3.10351: UDP, length 18
11:15:29.634887 eth0  In  IP 192.168.147.4.10351 > 192.168.147.3.10351: UDP, length 107
11:15:29.635346 eth0  Out IP 192.168.147.3.10351 > 192.168.147.4.10351: UDP, length 18
11:15:30.541698 eth0  Out IP 192.168.147.3.10351 > 192.168.147.4.10351: UDP, length 107
11:15:30.542825 eth0  In  IP 192.168.147.4.10351 > 192.168.147.3.10351: UDP, length 18
11:15:30.621573 eth0  In  IP 192.168.147.2.10351 > 192.168.147.3.10351: UDP, length 100
11:15:30.621971 eth0  Out IP 192.168.147.3.10351 > 192.168.147.2.10351: UDP, length 18
11:15:31.541928 eth0  Out IP 192.168.147.3.10351 > 192.168.147.4.10351: UDP, length 107
11:15:31.542877 eth0  In  IP 192.168.147.4.10351 > 192.168.147.3.10351: UDP, length 18
11:15:31.621052 eth0  In  IP 192.168.147.2.10351 > 192.168.147.3.10351: UDP, length 100
11:15:31.621639 eth0  Out IP 192.168.147.3.10351 > 192.168.147.2.10351: UDP, length 18
11:15:31.633915 eth0  In  IP 192.168.147.4.10351 > 192.168.147.3.10351: UDP, length 107
11:15:31.634520 eth0  Out IP 192.168.147.3.10351 > 192.168.147.4.10351: UDP, length 18
11:15:32.389924 lo    In  IP6 ::1.59872 > ::1.10350: Flags [S], seq 3838394524, win 65476, options [mss 65476,sackOK,TS val 3612520222 ecr 0,nop,wscale 10], length 0
11:15:32.389970 lo    In  IP6 ::1.10350 > ::1.59872: Flags [S.], seq 25174743, ack 3838394525, win 65464, options [mss 65476,sackOK,TS val 3612520222 ecr 3612520222,nop,wscale 10], length 0
11:15:32.389990 lo    In  IP6 ::1.59872 > ::1.10350: Flags [.], ack 1, win 64, options [nop,nop,TS val 3612520222 ecr 3612520222], length 0
11:15:32.390653 lo    In  IP6 ::1.59872 > ::1.10350: Flags [P.], seq 1:1516, ack 1, win 64, options [nop,nop,TS val 3612520223 ecr 3612520222], length 1515
11:15:32.390678 lo    In  IP6 ::1.10350 > ::1.59872: Flags [.], ack 1516, win 72, options [nop,nop,TS val 3612520223 ecr 3612520223], length 0
11:15:32.394069 lo    In  IP6 ::1.10350 > ::1.59872: Flags [P.], seq 1:3430, ack 1516, win 72, options [nop,nop,TS val 3612520226 ecr 3612520223], length 3429
11:15:32.394083 lo    In  IP6 ::1.59872 > ::1.10350: Flags [.], ack 3430, win 93, options [nop,nop,TS val 3612520226 ecr 3612520226], length 0
11:15:32.394639 lo    In  IP6 ::1.59872 > ::1.10350: Flags [P.], seq 1516:1610, ack 3430, win 93, options [nop,nop,TS val 3612520227 ecr 3612520226], length 94
11:15:32.394718 lo    In  IP6 ::1.59872 > ::1.10350: Flags [P.], seq 1610:1702, ack 3430, win 93, options [nop,nop,TS val 3612520227 ecr 3612520226], length 92
11:15:32.394834 lo    In  IP6 ::1.59872 > ::1.10350: Flags [P.], seq 1702:1773, ack 3430, win 93, options [nop,nop,TS val 3612520227 ecr 3612520226], length 71
11:15:32.395062 lo    In  IP6 ::1.10350 > ::1.59872: Flags [.], ack 1773, win 72, options [nop,nop,TS val 3612520227 ecr 3612520227], length 0
11:15:32.395348 lo    In  IP6 ::1.10350 > ::1.59872: Flags [P.], seq 3430:3491, ack 1773, win 72, options [nop,nop,TS val 3612520228 ecr 3612520227], length 61
11:15:32.395377 lo    In  IP6 ::1.10350 > ::1.59872: Flags [P.], seq 3491:3535, ack 1773, win 72, options [nop,nop,TS val 3612520228 ecr 3612520227], length 44
11:15:32.395386 lo    In  IP6 ::1.59872 > ::1.10350: Flags [.], ack 3535, win 93, options [nop,nop,TS val 3612520228 ecr 3612520228], length 0
11:15:32.395402 lo    In  IP6 ::1.59872 > ::1.10350: Flags [P.], seq 1773:1804, ack 3535, win 93, options [nop,nop,TS val 3612520228 ecr 3612520228], length 31
11:15:32.397049 lo    In  IP6 ::1.10350 > ::1.59872: Flags [P.], seq 3535:3574, ack 1804, win 72, options [nop,nop,TS val 3612520229 ecr 3612520228], length 39
11:15:32.397126 lo    In  IP6 ::1.10350 > ::1.59872: Flags [P.], seq 3574:3726, ack 1804, win 72, options [nop,nop,TS val 3612520229 ecr 3612520228], length 152
11:15:32.397195 lo    In  IP6 ::1.10350 > ::1.59872: Flags [P.], seq 3726:3759, ack 1804, win 72, options [nop,nop,TS val 3612520230 ecr 3612520228], length 33
11:15:32.397214 lo    In  IP6 ::1.59872 > ::1.10350: Flags [.], ack 3759, win 95, options [nop,nop,TS val 3612520230 ecr 3612520229], length 0
11:15:32.397309 lo    In  IP6 ::1.59872 > ::1.10350: Flags [P.], seq 1804:1828, ack 3759, win 95, options [nop,nop,TS val 3612520230 ecr 3612520229], length 24
11:15:32.397332 lo    In  IP6 ::1.59872 > ::1.10350: Flags [F.], seq 1828, ack 3759, win 95, options [nop,nop,TS val 3612520230 ecr 3612520229], length 0
11:15:32.397351 lo    In  IP6 ::1.10350 > ::1.59872: Flags [P.], seq 3759:3783, ack 1829, win 72, options [nop,nop,TS val 3612520230 ecr 3612520230], length 24
11:15:32.397377 lo    In  IP6 ::1.59872 > ::1.10350: Flags [R], seq 3838396353, win 0, length 0
11:15:32.542687 eth0  Out IP 192.168.147.3.10351 > 192.168.147.2.10351: UDP, length 100
11:15:32.543210 eth0  In  IP 192.168.147.2.10351 > 192.168.147.3.10351: UDP, length 18
11:15:32.634973 eth0  In  IP 192.168.147.4.10351 > 192.168.147.3.10351: UDP, length 107
11:15:32.638891 eth0  Out IP 192.168.147.3.10351 > 192.168.147.4.10351: UDP, length 18
11:15:33.120105 lo    In  IP6 ::1.59876 > ::1.10350: Flags [S], seq 2808483469, win 65476, options [mss 65476,sackOK,TS val 3612520952 ecr 0,nop,wscale 10], length 0
11:15:33.120212 lo    In  IP6 ::1.10350 > ::1.59876: Flags [S.], seq 2785024525, ack 2808483470, win 65464, options [mss 65476,sackOK,TS val 3612520953 ecr 3612520952,nop,wscale 10], length 0
11:15:33.120237 lo    In  IP6 ::1.59876 > ::1.10350: Flags [.], ack 1, win 64, options [nop,nop,TS val 3612520953 ecr 3612520953], length 0
11:15:33.121244 lo    In  IP6 ::1.59876 > ::1.10350: Flags [P.], seq 1:1516, ack 1, win 64, options [nop,nop,TS val 3612520954 ecr 3612520953], length 1515
11:15:33.121274 lo    In  IP6 ::1.10350 > ::1.59876: Flags [.], ack 1516, win 72, options [nop,nop,TS val 3612520954 ecr 3612520954], length 0
11:15:33.128617 lo    In  IP6 ::1.10350 > ::1.59876: Flags [P.], seq 1:3430, ack 1516, win 72, options [nop,nop,TS val 3612520961 ecr 3612520954], length 3429
11:15:33.128643 lo    In  IP6 ::1.59876 > ::1.10350: Flags [.], ack 3430, win 93, options [nop,nop,TS val 3612520961 ecr 3612520961], length 0
11:15:33.129750 lo    In  IP6 ::1.59876 > ::1.10350: Flags [P.], seq 1516:1610, ack 3430, win 93, options [nop,nop,TS val 3612520962 ecr 3612520961], length 94
11:15:33.130269 lo    In  IP6 ::1.10350 > ::1.59876: Flags [P.], seq 3430:3491, ack 1610, win 72, options [nop,nop,TS val 3612520963 ecr 3612520962], length 61
11:15:33.130471 lo    In  IP6 ::1.59876 > ::1.10350: Flags [P.], seq 1610:1702, ack 3491, win 93, options [nop,nop,TS val 3612520963 ecr 3612520963], length 92
11:15:33.130525 lo    In  IP6 ::1.10350 > ::1.59876: Flags [P.], seq 3491:3526, ack 1702, win 72, options [nop,nop,TS val 3612520963 ecr 3612520963], length 35
11:15:33.130561 lo    In  IP6 ::1.10350 > ::1.59876: Flags [P.], seq 3526:3557, ack 1702, win 72, options [nop,nop,TS val 3612520963 ecr 3612520963], length 31
11:15:33.130640 lo    In  IP6 ::1.59876 > ::1.10350: Flags [.], ack 3557, win 93, options [nop,nop,TS val 3612520963 ecr 3612520963], length 0
11:15:33.130656 lo    In  IP6 ::1.59876 > ::1.10350: Flags [P.], seq 1702:1774, ack 3557, win 93, options [nop,nop,TS val 3612520963 ecr 3612520963], length 72
11:15:33.131204 lo    In  IP6 ::1.59876 > ::1.10350: Flags [P.], seq 1774:1805, ack 3557, win 93, options [nop,nop,TS val 3612520964 ecr 3612520963], length 31
11:15:33.131462 lo    In  IP6 ::1.10350 > ::1.59876: Flags [.], ack 1805, win 72, options [nop,nop,TS val 3612520964 ecr 3612520963], length 0
11:15:33.131577 lo    In  IP6 ::1.10350 > ::1.59876: Flags [P.], seq 3557:3596, ack 1805, win 72, options [nop,nop,TS val 3612520964 ecr 3612520963], length 39
11:15:33.131728 lo    In  IP6 ::1.10350 > ::1.59876: Flags [P.], seq 3596:3749, ack 1805, win 72, options [nop,nop,TS val 3612520964 ecr 3612520963], length 153
11:15:33.131812 lo    In  IP6 ::1.10350 > ::1.59876: Flags [P.], seq 3749:3782, ack 1805, win 72, options [nop,nop,TS val 3612520964 ecr 3612520963], length 33
11:15:33.131832 lo    In  IP6 ::1.59876 > ::1.10350: Flags [.], ack 3782, win 94, options [nop,nop,TS val 3612520964 ecr 3612520964], length 0
11:15:33.132032 lo    In  IP6 ::1.59876 > ::1.10350: Flags [P.], seq 1805:1829, ack 3782, win 94, options [nop,nop,TS val 3612520964 ecr 3612520964], length 24
11:15:33.132081 lo    In  IP6 ::1.59876 > ::1.10350: Flags [F.], seq 1829, ack 3782, win 94, options [nop,nop,TS val 3612520964 ecr 3612520964], length 0
11:15:33.132112 lo    In  IP6 ::1.10350 > ::1.59876: Flags [P.], seq 3782:3806, ack 1830, win 72, options [nop,nop,TS val 3612520964 ecr 3612520964], length 24
11:15:33.132189 lo    In  IP6 ::1.59876 > ::1.10350: Flags [R], seq 2808485299, win 0, length 0
11:15:33.434408 eth0  In  IP 192.168.147.4.6443 > 192.168.147.3.59312: Flags [P.], seq 644:759, ack 628, win 73, options [nop,nop,TS val 1708163796 ecr 1880048070], length 115
11:15:33.475348 eth0  Out IP 192.168.147.3.59312 > 192.168.147.4.6443: Flags [.], ack 759, win 90, options [nop,nop,TS val 1880056196 ecr 1708163796], length 0
11:15:33.541521 eth0  Out IP 192.168.147.3.10351 > 192.168.147.2.10351: UDP, length 100
11:15:33.542346 eth0  In  IP 192.168.147.2.10351 > 192.168.147.3.10351: UDP, length 18
11:15:33.700214 eth0  In  IP 192.168.147.4.6443 > 192.168.147.3.59312: Flags [P.], seq 759:894, ack 628, win 73, options [nop,nop,TS val 1708164061 ecr 1880056196], length 135
11:15:33.700322 eth0  Out IP 192.168.147.3.59312 > 192.168.147.4.6443: Flags [.], ack 894, win 90, options [nop,nop,TS val 1880056421 ecr 1708164061], length 0
11:15:34.091736 eth0  In  IP 192.168.147.4.45368 > 192.168.147.3.10351: Flags [S], seq 1476162008, win 64240, options [mss 1460,sackOK,TS val 1708164453 ecr 0,nop,wscale 10], length 0
11:15:34.091840 eth0  Out IP 192.168.147.3.10351 > 192.168.147.4.45368: Flags [S.], seq 4145171953, ack 1476162009, win 65160, options [mss 1460,sackOK,TS val 1880056812 ecr 1708164453,nop,wscale 10], length 0
11:15:34.091879 eth0  In  IP 192.168.147.4.45368 > 192.168.147.3.10351: Flags [.], ack 1, win 63, options [nop,nop,TS val 1708164453 ecr 1880056812], length 0
11:15:34.093045 eth0  In  IP 192.168.147.4.45368 > 192.168.147.3.10351: Flags [P.], seq 1:238, ack 1, win 63, options [nop,nop,TS val 1708164454 ecr 1880056812], length 237
11:15:34.093086 eth0  Out IP 192.168.147.3.10351 > 192.168.147.4.45368: Flags [.], ack 238, win 64, options [nop,nop,TS val 1880056813 ecr 1708164454], length 0
11:15:34.094102 eth0  Out IP 192.168.147.3.10351 > 192.168.147.4.45368: Flags [P.], seq 1:237, ack 238, win 64, options [nop,nop,TS val 1880056814 ecr 1708164454], length 236
11:15:34.094172 eth0  In  IP 192.168.147.4.45368 > 192.168.147.3.10351: Flags [.], ack 237, win 63, options [nop,nop,TS val 1708164456 ecr 1880056814], length 0
11:15:34.094262 eth0  Out IP 192.168.147.3.10351 > 192.168.147.4.45368: Flags [F.], seq 237, ack 238, win 64, options [nop,nop,TS val 1880056815 ecr 1708164456], length 0
11:15:34.094480 eth0  In  IP 192.168.147.4.45368 > 192.168.147.3.10351: Flags [F.], seq 238, ack 238, win 63, options [nop,nop,TS val 1708164456 ecr 1880056815], length 0
11:15:34.094499 eth0  Out IP 192.168.147.3.10351 > 192.168.147.4.45368: Flags [.], ack 239, win 64, options [nop,nop,TS val 1880056815 ecr 1708164456], length 0
11:15:34.311645 eth0  In  IP 192.168.147.4.6443 > 192.168.147.3.59312: Flags [P.], seq 894:1012, ack 628, win 73, options [nop,nop,TS val 1708164673 ecr 1880056421], length 118
11:15:34.311684 eth0  Out IP 192.168.147.3.59312 > 192.168.147.4.6443: Flags [.], ack 1012, win 90, options [nop,nop,TS val 1880057032 ecr 1708164673], length 0
11:15:34.312093 eth0  In  IP 192.168.147.4.6443 > 192.168.147.3.59316: Flags [P.], seq 3116147345:3116147463, ack 3170287808, win 73, options [nop,nop,TS val 1708164673 ecr 1880028663], length 118
11:15:34.312127 eth0  Out IP 192.168.147.3.59316 > 192.168.147.4.6443: Flags [.], ack 118, win 88, options [nop,nop,TS val 1880057032 ecr 1708164673], length 0
11:15:34.541366 eth0  Out IP 192.168.147.3.10351 > 192.168.147.4.10351: UDP, length 108
11:15:34.541652 eth0  In  IP 192.168.147.4.10351 > 192.168.147.3.10351: UDP, length 19
11:15:34.621332 eth0  In  IP 192.168.147.2.10351 > 192.168.147.3.10351: UDP, length 100
11:15:34.621685 eth0  Out IP 192.168.147.3.10351 > 192.168.147.2.10351: UDP, length 18
11:15:34.633599 eth0  In  IP 192.168.147.4.10351 > 192.168.147.3.10351: UDP, length 107
11:15:34.634413 eth0  Out IP 192.168.147.3.10351 > 192.168.147.4.10351: UDP, length 18
11:15:34.835637 eth0  In  IP 192.168.147.4.6443 > 192.168.147.3.59312: Flags [P.], seq 1012:1110, ack 628, win 73, options [nop,nop,TS val 1708165197 ecr 1880057032], length 98
11:15:34.835683 eth0  Out IP 192.168.147.3.59312 > 192.168.147.4.6443: Flags [.], ack 1110, win 90, options [nop,nop,TS val 1880057556 ecr 1708165197], length 0
11:15:34.836755 eth0  In  IP 192.168.147.4.6443 > 192.168.147.3.59312: Flags [P.], seq 1110:1284, ack 628, win 73, options [nop,nop,TS val 1708165198 ecr 1880057556], length 174
11:15:34.836781 eth0  Out IP 192.168.147.3.59312 > 192.168.147.4.6443: Flags [.], ack 1284, win 90, options [nop,nop,TS val 1880057557 ecr 1708165198], length 0
11:15:34.952591 eth0  In  IP 192.168.147.4.6443 > 192.168.147.3.59316: Flags [P.], seq 118:239, ack 1, win 73, options [nop,nop,TS val 1708165314 ecr 1880057032], length 121
11:15:34.952622 eth0  Out IP 192.168.147.3.59316 > 192.168.147.4.6443: Flags [.], ack 239, win 88, options [nop,nop,TS val 1880057673 ecr 1708165314], length 0
11:15:35.020774 eth0  In  IP 192.168.147.4.6443 > 192.168.147.3.59312: Flags [P.], seq 1284:1427, ack 628, win 73, options [nop,nop,TS val 1708165382 ecr 1880057557], length 143
11:15:35.020805 eth0  Out IP 192.168.147.3.59312 > 192.168.147.4.6443: Flags [.], ack 1427, win 90, options [nop,nop,TS val 1880057741 ecr 1708165382], length 0
11:15:35.095443 eth0  In  IP 192.168.147.4.6443 > 192.168.147.3.59312: Flags [P.], seq 1427:1542, ack 628, win 73, options [nop,nop,TS val 1708165457 ecr 1880057741], length 115
11:15:35.095467 eth0  Out IP 192.168.147.3.59312 > 192.168.147.4.6443: Flags [.], ack 1542, win 90, options [nop,nop,TS val 1880057816 ecr 1708165457], length 0
11:15:35.621957 eth0  In  IP 192.168.147.2.10351 > 192.168.147.3.10351: UDP, length 100
11:15:35.623495 eth0  Out IP 192.168.147.3.10351 > 192.168.147.2.10351: UDP, length 18
11:15:35.656333 eth0  Out IP 192.168.147.3.59312 > 192.168.147.4.6443: Flags [P.], seq 628:672, ack 1542, win 90, options [nop,nop,TS val 1880058377 ecr 1708165457], length 44
11:15:35.656440 eth0  In  IP 192.168.147.4.6443 > 192.168.147.3.59312: Flags [.], ack 672, win 73, options [nop,nop,TS val 1708166018 ecr 1880058377], length 0
11:15:35.656731 eth0  Out IP 192.168.147.3.59312 > 192.168.147.4.6443: Flags [P.], seq 672:2574, ack 1542, win 90, options [nop,nop,TS val 1880058377 ecr 1708166018], length 1902
11:15:35.656775 eth0  In  IP 192.168.147.4.6443 > 192.168.147.3.59312: Flags [.], ack 2574, win 72, options [nop,nop,TS val 1708166018 ecr 1880058377], length 0
11:15:35.659276 eth0  In  IP 192.168.147.4.6443 > 192.168.147.3.59312: Flags [P.], seq 1542:1577, ack 2574, win 73, options [nop,nop,TS val 1708166020 ecr 1880058377], length 35
11:15:35.659346 eth0  Out IP 192.168.147.3.59312 > 192.168.147.4.6443: Flags [.], ack 1577, win 90, options [nop,nop,TS val 1880058380 ecr 1708166020], length 0
11:15:35.670602 eth0  In  IP 192.168.147.4.6443 > 192.168.147.3.59312: Flags [P.], seq 1577:1671, ack 2574, win 73, options [nop,nop,TS val 1708166032 ecr 1880058380], length 94
11:15:35.670636 eth0  Out IP 192.168.147.3.59312 > 192.168.147.4.6443: Flags [.], ack 1671, win 90, options [nop,nop,TS val 1880058391 ecr 1708166032], length 0
11:15:35.670677 eth0  In  IP 192.168.147.4.6443 > 192.168.147.3.48509: Flags [P.], seq 11729:15242, ack 6106, win 72, options [nop,nop,TS val 1708166032 ecr 738556290], length 3513
